COURSE NUMBER,COURSE NAME,LANGUAGE OF INSTRUCTION,CREDIT LOAD,YEAR,SCHEDULE,COURSE TYPE,DEPARTMENT,GENERAL COURSE OBJECTIVES,LEARNING OBJECTIVES,CONTENT,RECOMMENDED PREREQUISITES,COURSE RESPONSIBLE
11141 , Energy and indoor environment,Danish , 5 ECTS , 2016/2017 ,E2B (Thurs 8-12)  or  August,BSc,Department of Civil Engineering,"
The course gives a basic understanding of calculation of building
energy consumption based on the indoor environment, outdoor
environment, building envelopes and technical systems, and gives a
basic understanding of typical building envelopes and technical
systems for heating, ventilation and lighting. 
","describe the function and design of building envelopes and
technical systems for heating, ventilation and lighting calculate building heat loss describe typical space requirements for technical services explain energy requirements in the building regulations describe simple methods for calculation of building energy
consumption determine the need for heating and ventilation based on legal
requirements and demands for thermal and atmospheric comfort estimate electricity consumption for pumps and fans calculate building energy consumption describe methods for benchmarking of buildings calculate moisture transport for the building
envelope","
The course goes thruogh basic methods to calculate the energy
consumption of buildings including calculation of heat loss, space
heating and electricity for technical services and lighting.
Demands for thermal indoor environment and air quality are
introduced. The course describes typical building envelopes and
technical systems. The energy requirements in the building
regulations are described. The course introduce methods for
benchmarking of buildings. 
",None,"
Toke Rammer Nielsen,
Jørn Toftum"
,,,,,,,,,,,,
11142 , Daylight and lighting,English , 5 ECTS , 2016/2017 ,E3B (Fri 13-17),MSc,Department of Civil Engineering,"
The course enables you to calculate, dimension and analyse light
conditions in rooms on a basic level.

After completing the course you will be able to use common methods
and programmes to calculate light properties for window systems,
daylight distribution in rooms, distribution of artificial light in
rooms and energy demand for lighting. You will be able to draw up
specifications for daylight and artificial light and on this basis
design facades, rooms and lighting. 
","explain physical and technical terms on light, daylight and
lighting systems draw up specifications for the visual indoor environment based
on the Danish building regulations and international standards explain methods to calculate light transmittance and light
distribution including radiosity and ray tracing methods calculate solar energy transmittance and light transmittance
for window systems with systems for solar shading and daylight
control calculate stationary daylight conditions (daylight factor,
daylight distribution and glare) in rooms analyse the effect of shades from the surroundings on the light
conditions on the façade and in rooms calculate light properties for lighting systems design lighting systems based on the need for light, glare
conditions and daylight calculate light distribution from the lighting system in
rooms analyse the results from calculations of lighting conditions
compared to requirements for the visual indoor environment know of methods to control daylight and lighting calculate the yearly energy demand for lighting","
Terminology for light, daylight and lighting systems. Design,
function and properties of components in glass facades such as
glazings and windows, solar shadings and daylight directing
systems. Demands and wishes concerning light conditions in
buildings. Methods and programmes for calculation of daylight
transmittance of window systems and glass facades. Methods and
programmes for calculation of stationary and dynamic daylight
conditions in rooms with different types of façade solutions.
Calculate the effect of shades from the surroundings on the light
conditions on the façade and in rooms. Design, function and
properties of lighting systems. Methods and programmes to calculate
light and energy performance of lighting systems. Programmes to
calculate the dynamic interaction between the lighting system,
daylight and solar shading system. Calculation of energy demand for
lighting. 
","11937,11000,11738,11141","
Toke Rammer Nielsen"
,,,,,,,,,,,,
11202 , Man and the physical environment,Danish , 5 ECTS , 2016/2017 ,E5B (Wed 13-17),BEng,Department of Civil Engineering,"
to obtain basic knowledge on the influence of the physical
environment (thermal, air quality, noise, light, electromanetic
radiation, vibration) on human health, comfort and performance 
","account in details for the impact of the thermal environment
and air quality on human health and comfort account for the impact of sound (noise), light, electromagnetic
radiadion and vibration on human health and comfort account for the impact of the physical environment on human
work performance interpret relevant legislation, standards and executive
orders account for measurement methods often used to characterize the
work environment use instruments to measure relevant parameters in one selected
work environment plan and carry out simple field investigations carry out a project in groups and present the work in a report
and in an oral presentation","
The course informs about how the physical environment like,
thermal, light, air quality, noise, electromagnetic radiation,
vibration will influnce on human health, comfort and performance.
The knowledge of these parameters are the basic for design and
dimensioning of buildings, machines, vehicles, protectiv clothing,
warning signals etc. The student will get a knowledge on which
parameters are important for a good working environmnet.

Eksisting requirements and codes, standards and guidelines will be
presented.

By this course the students get an important basic knowledge, which
they can use in further studies on the influence of environment,
buildings and machines on humans. 
",None,"
Geo Clausen,
Jørn Toftum"
,,,,,,,,,,,,
11203 , Introduction to Indoor Environment,Danish , 5 ECTS , 2016/2017 ,E5B (Wed 13-17),BSc,Department of Civil Engineering,"
to obtain basic knowledge on the influence of the physical
environment (thermal, air quality, noise, light, electromanetic
radiation, vibration) on human health, comfort and performance 
","account in details for the impact of the thermal environment
and air quality on human health and comfort account for the impact of sound (noise), light, electromagnetic
radiadion and vibration on human health and comfort account for the impact of the physical environment on human
work performance interpret relevant legislation, standards and executive
orders account for measurement methods often used to characterize the
work environment use instruments to measure relevant parameters in one selected
work environment plan and carry out simple field investigations carry out a project in groups and present the work in a report
and in an oral presentation","
The course informs about how the physical environment like,
thermal, light, air quality, noise, electromagnetic radiation,
vibration will influnce on human health, comfort and performance.
The knowledge of these parameters are the basic for design and
dimensioning of buildings, machines, vehicles, protectiv clothing,
warning signals etc. The student will get a knowledge on which
parameters are important for a good working environmnet.

Eksisting requirements and codes, standards and guidelines will be
presented.

By this course the students get an important basic knowledge, which
they can use in further studies on the influence of environment,
buildings and machines on humans. 
",None,"
Geo Clausen,
Jørn Toftum"
,,,,,,,,,,,,
11221 , Ventilation and Climatic Systems,English , 10 ECTS , 2016/2017 ,"E1 (Mon 8-12, Thurs 13-17)",MSc,Department of Civil Engineering,"
To introduce the student to the criteria and methods used for
design of ventilation- and climatic systems, to choose components
that promote low energy consumption and to determine strategies for
control and operation of such systems. To enable the student to
dimension and design indoor environments that satisfy human
requirements. Special emphasis will be put on the calculation and
measurement of airflow in spaces. 
","select a ventilation principle based on the requirements to the
operation of a building and to the indoor environment understand processes in climatic systems, including heating,
cooling, humidification, dehumidification and filtration of
ventilation air, design a ventilation and climatic system for a building with
specific requirements to the indoor environment based on current
criteria and guidelines understand the physics of and methods for calculation of
airflow in spaces and ducts carry out and evaluate the results of computer simulations of
airflow in rooms (CFD) and of the indoor environment and energy
consumption of buildings (BSim) plan and execute a larger measuring project in a full-scale
mock-up use instrumentation for the measurement of air change,
ventilation effectiveness, airflow rate, velocity and
temperature select and combine HVAC components based on criteria for their
energy efficiency analyse and determine energy-friendly operation- and control
strategies for ventilation and climatic systems document that the designed system complies with the specified
criteria based on measurements and simulations understand standards for ventilation and indoor environment as
well as relevant professional literature carry out a larger project in groups of 3-4 students and
present the work in a report and in an oral presentation","
Load calculations. Processes in climatic systems. Components and
types of system. Analysis of energy consumption. Strategies for
operation and control. PC simulation of climatic systems, indoor
environment and energy consumption. Ventilation principles and
systems. Theory and modeling of isothermal and non-isothermal
airflow in spaces. Airflow around humans. Heat transfer from
humans. CFD-modeling. Comfort ventilation. Natural ventilation.
Hybrid ventilation. Infiltration. Measurement instruments.
Measurement of airflow in spaces. Tracer gas measurements. 
","41311,41815,41814","
Arsen Krikor Melikov,
Jørn Toftum"
,,,,,,,,,,,,
11222 , Indoor Climate,English , 10 ECTS , 2016/2017 ,F5 (Wed 8-17),MSc,Department of Civil Engineering,"
The student shall by analyzing the original literature and by
exercises related to practice achieve detailed knowledge of the
parameters of the indoor climate and their effect on man's
comfort, health and work. The student will be able to calculate,
analyze and evaluate climate in practice. 
","Account for the impact of the indoor environment on human
health, comfort and performance interpret indoor environment standards and the relevant
scientific literature account for measurement methods often used to characterize the
indoor environment use instruments to measure typical indoor environmental
parameters like temperature, moisture and CO2 carry out simple laboratory investigations (including
understanding how to plan and perform an experiment) understand the physics of and perform dynamic calculations of
the concentrations of pollutants in a space plan and execute a major measurement task in a building with
indoor environment problems and provide recommendations for
improvements carry out a major project in groups and present the work in a
report and in an oral presentation","
Thermal indoor climate, conditions for comfort, instationary
conditions, draught, modelling and measuring of perceived air
quality. Identification of pollution sources and ventilation rates.
The effect on human beings of ventilation efficiency and air flow
patterns in rooms. Bioeffluents, tobacco smoke, combustion
products, off-gassing from building materials, air humidity,
microorganisms, radon, ions and electrical fields. Measuring
methods and instruments. Strategy for performing indoor climate
investigations in practice 
","11203,11202","
Geo Clausen,
Jørn Toftum"
,,,,,,,,,,,,
11305 , Computational Structural Modelling 1: The Finite Element Method,Danish , 5 ECTS , 2016/2017 ,E4A (Tues 13-17),BSc,Department of Civil Engineering,"
The scope is to introduce the Finite Element Method (FEM) as a
general method for approximate, numerical solution of the
equilibrium equations within structural engineering. The students
will be able to formulate and program FEM solutions for relevant
linear problems. Furthermore, the student is introduced to a
commercial FEM program. 
","Establish the Finite Element Method equations directly for bar
and beams. Establish the Finite Element Method equations for bars, beams,
discs, plates and shells based on the principle of virtual
work. Understand, use and derive interpolations for approximation of
field variables. Understand and apply the isoparametric method for the
development of elements. Understand different structural element types. Apply and evaluate the results obtained using different
structural element types. Perform and assess stability analysis of structures. Apply a commercial FEM program to analyze simple problems. Perform a critical evaluation of results obtained by the Finite
Element Method. Program and modify linear Finite Element programs.","
Introduction to the finite element method for structural design
purposes. Emphasis is placed on the systematic development of the
Finite Element Method based on the principle of virtual work. The
course is structured around lectures and exercises covering both
analytical approach, programming the Finite Element Method and the
use of a commercial program. 
","02631,01035,11343","
Jens Henrik Nielsen"
,,,,,,,,,,,,
11311 , Concrete Structures,Danish , 5 ECTS , 2016/2017 ,F4A (Tues 13-17) and August,BSc,Department of Civil Engineering,"
To make the student capable of designing structural elements in
simple concrete structures. 
","Describe the conditions, which form the basis for models and
estimations Carry out simple, qualitative evaluations as well as more
detailed estimations. Analyse simple structural elements. Analyse and estimate failure modes and load-carrying capacities
for beams and columns in concrete. Determine deformations and crack formation in beams, columns
and plates. Use upper and lower limits solutions in the estimations of
concrete structures. Analyse plates in ultimate limit state by using plastic
solution methods. Analyse structural elements in serviceability state","
Safety, loads, design and load carrying capacity of structural
elements. Deformations of structural elements. Beams, plates and
columns. 
","41203,41205,11342","
Per Goltermann,
Linh Cao Hoang"
,,,,,,,,,,,,
11318 , Steel Structures,Danish , 5 ECTS , 2016/2017 ,E2B (Thurs 8-12),BSc,Department of Civil Engineering,"
To make it possible for the students to analyse and design
elementary structural members and connections in steel structures. 
","Explain the material and mechanical properties which form the
basis for models and analysis. Explain the connection of plates by welding. Explain the connection of plates by bolting. Make a cross-sectional analysis of elements in steel
structures. Perform stability analysis of beams and columns. Take into account local buckling of plate parts in beams and
columns. Perform analysis and calculation of elementary bolted and
welded joints. Explain the elastic and plastic analysis of steel
structures.","
Material and mechanical properties in steel structures. Connection
of plates by welding and bolting. Cross-sectional analysis of
elements in steel structures. Stability analysis of beams and
columns. Local buckling of plate parts in beams and columns.
Analysis and calculation of elementary bolted and welded joints.
Elastic and plastic analysis of steel structures. 
","11311,11341,11342","
Michael Joachim Andreassen,
Jeppe Jönsson"
,,,,,,,,,,,,
11320 , Structural Analysis of buildings,English , 5 ECTS , 2016/2017 ,E1B (Thurs 13-17),MSc,Department of Civil Engineering,"
To qualify the student to perform overall stability analysis and
load and structural analysis of multistorey buildings. 
","Identify the primary load-bearing and bracing structural
members in ordinary buildings Outline the relevant actions on the building Describe the loadpath through the building structure Select and apply structural models for horizontal load
distribution in buildings Select and apply structural models for vertical load
distribution in buildings Perform an overall load distribution in buildings Perform structural resistance analysis of structural members
and connections in precast concrete buildings Design joints and connections i precast concrete
structures. Generate documentation of the project. in a report","
Structural systems in buildings.

Loadcarrying and bracing parts.

Actions. natural loads, live loads and gravity loads.

Combinations of actions.

Structural models of overall stability and of loaddistribution for
panelbuildings and column-plate-buildings.

Calculation of sectional forces for relevant combinations of
actions.

Precast concrete members. Connections and reinforcement.

Structural resistance.

Documentation of structural analysis and performance. 
","11309,11010,41205,11931","
Jacob Wittrup Schmidt"
,,,,,,,,,,,,
11331 , Experimental Structural Mechanics,English , 5 ECTS , 2016/2017 ,January,MSc,Department of Civil Engineering,"
To provide experience on a large variety of experimental techniques
used in civil and mechanical engineering to test material and
structural properties, simulate dynamic loading and predict overall
structural response. Interpretation of the applied techniques and
results on the background of semi-probabilistic design methods as
provided in the Eurocodes. 
","Understand the purpose of experimental investigation in civil
and mechanical engineering. Understand the choice of methods for experimental testing,
their strengths and shortcomings and the evaluation of the result
quality. Interpret the results as stochastic variables and processes and
to apply statistical methods to calculate characteristic values
from the experimentally acquired data used in semi-probabilistic
structural design. Compare experimental observations with theoretical predictions,
and provide explanations or hypotheses for deviations among
these. Demonstrate practical experience with the selected experimental
methods, performance care and accuracy and with proper and concise
documentation. Describe the purpose of specific experiments, and conclude
rationally and balanced on the results. Collaborate with others on carrying out experiments, including
contributing actively to complete the experiment in time, and with
proper outcome to all participants. Produce written experimental reports that are well structured,
complete, clear and concise, critically assessing / concluding, and
otherwise confirming to accepted standards for written presentation
in the subject area.","
Measuring elastic and mechanical material properties for different
materials with a tensile and compression testing machines. Full 3-D
strain and displacement measurements using a digital image
correlation system. Application of strain gauges, accelerometers
and displacement sensors. Measuring structural response of a steel
structure and determination of mechanical vibration
characteristics. Performance of a wind tunnel test to simulate
dynamic structural loading. Probability analysis and overload risk
assessment. 
",41205,"
Holger Koss,
Christian Berggreen"
,,,,,,,,,,,,
11341 , Structural engineering 1,Danish , 5 ECTS , 2016/2017 ,E1B (Thurs 13-17),BSc,Department of Civil Engineering,"
The objectives of the course is to develop the students basic
structural understanding and to make them capable of performing an
analysis of simple structures. 
","Determine reactions by equilibrium equations Determine member forces in statically determinate truss
structures Determine section forces in statically determinate beam
structures Use the principle of virtual work for the determination of
reactions and section forces Determine deformations truss and beam structures by the
principle of virtual work Determine moment of inertia for simple cross sections Determine normal stresses in trusses and beams Find form and forces for simple cables and arches","
- Forces and moments

- Equilibrium

- Section forces

- Stresses

- Trusses

- Beams

- Simple computer programmes

- Simplified analysis of cables and arches 
",None,"
Peter Noe Poulsen"
,,,,,,,,,,,,
11342 , Structural engineering 2,Danish , 5 ECTS , 2016/2017 ,F2A (Mon 13-17),BSc,Department of Civil Engineering,"
The objective of the course is to develop the students basic
structural understanding which will allow them to perform an
analysis of the state of stress in simple structures. 
","Determine sectional forces og deformations for statically
indeterminate beams by the force method Determine cross sectional constants for general cross
sections Determine principal moments of inertia for general cross
sections Determine normal stress distribution for beams in bending Determine shear stress distribution for beams in bending Determine shear stress distribution for beams in torsion Analyse special states of stress and strain Decide if a state of stress is critical to a given
material","
- Section forces in statically indeterminate beam structures

- The finite element method for beam structures

- Normal stresses in beams in bending

- Shear stresses in beams in bending and in torsion

- Special states of strain and stress

- Principal stresses and Mohr's circle

- Stress invariants

- Mechanical properties of materials

- Simple failure conditions 
",11341,"
John Forbes Olesen"
,,,,,,,,,,,,
11343 , Structural engineering 3: Frame and Plate Structures,Danish , 5 ECTS , 2016/2017 ,E2A (Mon 13-17),BSc,Department of Civil Engineering,"
To teach the participants modelling and analysis of structures made
of frames and plates. 
","Apply the deformation method to determine deformations,
reaction forces and section forces for simple frame
structures. Perform a stability analysis for simple frame structures and
determine the buckling load. Determine the critical load for plastic collapse of simple
frame structures by upper limit methods. Determine the critical load for plastic collapse of simple
frame structures by lower limit methods. Perform manual calculations of plates Calculate the stability of plates Perform hand calculations of load carrying capacity in plate
bending plasticity based on the yield line method Perform simple manual calculations of thinwalled
beams","
The deformation method for two-dimensional elastic frames including
stability. Plastic analysis of frame structures using lower and
upper bound methods.

Basic plate theory including moments, shear forces, corner forces
and virtual work.

Stability analysis of plates.

Calculation of load carrying capacity in plate bending plasticity
based on the yield line method. Introductory theory for thinwalled
beams. 
","11921,41203,41205,11342","
Peter Noe Poulsen"
,,,,,,,,,,,,
11346 , Computational Structural Modelling 2: Non,English , 5 ECTS , 2016/2017 ,E5B (Wed 13-17),MSc,Department of Civil Engineering,"
The scope is to introduce finite element models for non-linear FEM
problems within structural mechanics, including geometric
non-linearity, dynamic behaviour and ideal plastic optimization of
collaps load. 
","Establish non-linear models for simple truss systems. Understand and apply non-linear solution methods. Understand and apply relevant error measures for iteration
control. Establish the Finite Element Method equations for geometrical
non-linear trusses. Establish the Finite Element Method equations for geometrical
non-linear shells. Establish the Finite Element Method equations for dynamic
systems with damping. Understand and apply solution methods for dynamic
problems. Perform a critical evaluation of quality of dynamic calculation
results. Establish the Finite Element Method equations for ideal plastic
optimization of collaps load. Understand and apply solution methods for optimization of
collaps load. Programme and modify non-linear FEM-programs.","
Introduction to the fundamental theoretical basis for the
formulation of geometrical non-linear and dynamic behaviour, as
well as optimization of collaps load, and description of the
corresponding FEM formulation. Presentation of classic solution
strategies and their numerical implementation. The course is
structured around lectures and exercises covering both analytical
approach, developing own code and the use of a commercial program. 
","11305,02631","
John Forbes Olesen"
,,,,,,,,,,,,
