COURSE NUMBER,COURSE NAME,LANGUAGE OF INSTRUCTION,CREDIT LOAD,YEAR,SCHEDULE,COURSE TYPE,DEPARTMENT,GENERAL COURSE OBJECTIVES,LEARNING OBJECTIVES,CONTENT,RECOMMENDED PREREQUISITES,COURSE RESPONSIBLE
41525, FEM,English , 10 ECTS , 2016/2017 ,E5 (Wed 8-17),MSc,Department of Mechanical Engineering,"
To teach the student to program and use the Finite Element Method
(FEM) for solution of mechanical problems. To give the student a
basic understanding for the principle of virtual work and for
incremental and iterative methods for non-linear problems. 
","Use the principle of virtual work to set up finite element
equations Implement the finite element method for truss and continuum
problems Apply the finite element method to the solution of static and
dynamic mechanical problems Solve material and geometrically non-linear problems by use of
explicit and implicit solution methods Optimize simple mechanical structures based on finite element
calculations Implement iso-parametric finite elements based on numerical
integration Verify correctness of calculations based on test problems and
comparisons with analytical solutions Evaluate the quality of a finite element model when the exact
solution is unknown Evaluate the quality of finite element calculations based on
convergence analyses Present results of finite element analyses in a transparent,
easily accessible and efficient form Set up continuous and discrete forms of the principle of
virtual work for arbitrary partial differential equations Plan a larger finite element programming project and in an
independent way suggest and implement test examples.","
The principle of virtual work. The Finite Element Method. Truss
elements. Isoparametric elements and numerical integration. Large
systems of equations. Explicit and implicit methods of solution.
Geometrical and material non-linearities. Topology optimization.
Final project depending on prerequisites.

As a part of the course the students will build their own finite
element code and apply it to simple geometries. Commercial finite
element codes will only be used for pre-processing 
","41560,41502,41516,02631","
Ole Sigmund,
Kim Lau Nielsen"
,,,,,,,,,,,,
41526, Fracture Mechanics,English , 5 ECTS , 2016/2017 ,E2B (Thurs 8-12),MSc,Department of Mechanical Engineering,"
To give thorough insight into the mechanics of materials under both
monotonic and cyclic loading, and to enable the student of using
modern principles for dimensioning structures, while accounting for
fracture in both homogeneous materials and composites. 
","Use stress-functions to solve plane elastic problems. Determine stress intensity factors for cracks. Use linear elastic fracture mechanics (both stress and energy
criteria) to predict crack initiation and growth in brittle
materials. Estimate the size of plastic zones at crack tips. Establish the applicability of linear elastic fracture
mechanics for a given problem. Calculate the J-integral and crack opening displacement in
elastic-plastic materials and use these to determine critical loads
with respect to crack growth. Determine the direction of crack propagation. Determine critical load under fully plastic conditions Analyze crack growth under cyclic loading.","
Stress functions (Airy's and Westergaard's), stress
concentrations, stress singularities at crack tips, linear-elastic
fracture mechanics, energy methods, plasticity at crack tips, the
J-integral, the HRR-field, cohesive zone modeling, criteria for the
direction of crack extension, fatigue during cyclic loading, Paris
law. 
","41502,41534","
Christian Frithiof Niordson"
,,,,,,,,,,,,
41527, Plasticity and Creep,English , 5 ECTS , 2016/2017 ,F4A (Tues 13-17),MSc,Department of Mechanical Engineering,"
To explain the background for non-linear and irreversible material
behaviour in metals, polymers, ceramics and composites due to
plastic and viscoplastic deformation, including creep at high
temperatures. To give insight and to practice the application of
models for the strength of materials, for elastic-plastic as well
as viscoplastic deformations. This includes models for plastic
anisotropy and instability. To determine deformation mechanisms,
which are relevant for the strength of materials and structures. 
","Use incremental theories to determine plastic deformations due
to mechanical loading. Use deformationtheories and point out their differences from
incremental theories. Analyze creep and viscous effects under time dependent
deformation. Perform calculations of micro mechanical deformation mechanisms
i crystalline solids. Analyse equilibrium based on extremum principles for hardening
elastic-plastic materials. Calculate limit loads based on extremum principles beams as
well as for out-of-plane and in-plane loaded plates. Perform numerical non-linear analyses. Determine plastic buckling behavior.","
Deformation and incremental theories for elastic-plastic materials.
Convexity and normality. Micro mechanisms causing plastic
deformation. Equilibrium equations and extremum principles.
Viscoplasticity with dependence of plastic deformation on strain
rates and high temperature creep. Plastic buckling, collapse
analyses, tensile instabilities, localisation of strains. Modern
numerical methods. 
","41502,41534","
Brian Nyvang Legarth"
,,,,,,,,,,,,
41533, Dimensioning and Strength 1,Danish , 5 ECTS , 2016/2017 ,E1A (Mon 8-12)  or  F1A (Mon 8-12),BEng,Department of Mechanical Engineering,"
Introduction to the fundamental concepts and methods of strength of
materials. The student should be able to treat elementary problems
in relation to the strength and deformations of machineries. 
","Compute normal force components and bending moment components
in beam structures. Use the beam differential equation to calculate the deflection
of beams. Determine moments of inertia and bending stiffnesses for
homogeneous and composite beams. Determine stresses in homogeneous and composite beams. Solve statically in-determined beam problems by using
superposition of standard solutions. Determine stresses and deformations in torsion of round
bars. Dimensioning column structures against buckling. Explain the limitations for simple beam theory.","
Statically determined structures. Loads, reactions and internal
forces. Uniaxial tension test. Concept of stress including
allowable stresses. Hookes law for uniaxial tension. Simple elastic
beams. Statically indetermined structures. Composite beams.
Standard solution for statically determined beam structures. The
principle of superposition. Euler columns. Torsion of bars and
pipes with circular cross sections. 
","41532,01902,01901","
Casper Schousboe Andreasen,
Kim Lau Nielsen,
Brian Nyvang Legarth"
,,,,,,,,,,,,
41534, Dimensioning and Strength 2,Danish , 5 ECTS , 2016/2017 ,E5B (Wed 13-17)  or  F5B (Wed 13-17),BEng,Department of Mechanical Engineering,"
It is the aim of the course to introduce the students to
multi-dimensional elastic stress and deformation analysis, as well
as to enable the students to dimension structures against fatigue
loading. 
","Perform stress analyses of thin walled containers and other
simple structures. Determine strain states based on strain gauge
measurements. Perform analyses of principal stresses and strains for general
3D-states. Identify special stress states as for instance uniaxial, plane,
cylindrical or hydrostatic. Calculate stresses based on strains and conversely, as a result
of mechanical and thermal loading. Analyze the stress and strain state in circular in-plane loaded
plates and thick walled pipes. Utilize von Mises' and Tresca's yield hypotheses to
dimension against plastic deformation in structures. Dimension simple beam structures against fatigue. Determine safety factors considering both plastic deformation
and fatigue.","
The course is taught in Danish. 
","41532,41533","
Niels Aage,
Peder Klit"
,,,,,,,,,,,,
41560, Mechanical Vibrations,Danish , 5 ECTS , 2016/2017 ,E2A (Mon 13-17),BSc,Department of Mechanical Engineering,"
To provide a background for solving vibration problems related to
machinery using analytical and numerical methods, and a solid
foundation for advanced studies in dynamics and vibrations. 
","Identify sources for inertia, stiffness, energy-dissipation and
external loads in some standard mechanical systems. Identify the relevant degrees of freedom in simple models of
mechanical systems. Use Newton's second law and free body diagrams to determine
the equations of motion for simple models of mechanical systems
with a finite or infinite number of degrees of freedom. Use Lagrange's equations and the flexibility and stiffness
methods to determine the equations of motion for simple models of
mechanical systems with a finite or infinite number of degrees of
freedom. Rewrite equations of motion for specific models into the
standard form of ordinary differential equations (scalar or
matrix-vector form). Use mathematical and numerical methods to solve standard
equations of motion for mechanical system models. Give applicable interpretations and evaluations of analytical
and numerical results. Identify resonance problems for mechanical systems whose
dynamics (i.e. inertia and energy dissipation) can not be
neglected. Account for the limitations in the models and methods used, and
predict the possible consequences of making simplified assumptions,
especially linearization and limitation of the number of degrees of
freedom. Present written problem solutions and reports that are well
structured, complete, clear and concise, critically assessing /
concluding, and otherwise confirming to accepted standards for
written presentation in the subject area.","
1. Vibrations of linear single-degree-of-freedom systems: Free and
forced vibration; damping.

2. Vibrations of linear multiple-degree-of-freedom systems:
Equations of motion; the stiffness and flexibility methods;
Lagrange's equations; modal analysis; Rayleigh's quotient
and method.

3. Vibrations of continuous systems: Equations of motion;
Rayleigh's quotient and method; The comparison and inclusion
theorems; flexural, axial and torsional vibrations of strings, rods
and beams; rotating shafts; transient vibrations.

4. Introduction to nonlinear vibration analysis. 
","01035,41501","
Jon Juel Thomsen,
Ilmar Santos"
,,,,,,,,,,,,
41562, Fluid Power  ,English , 5 ECTS , 2016/2017 ,F1A (Mon 8-12),MSc,Department of Mechanical Engineering,"
To enable the student to analyse and use mathematical modelling to
evaluate and design hydraulic components, systems and plants. 
","Select fluids for hydraulic systems according to the required
specifications. Describe and select fluid power components for hydraulic
systems according to the required specifications. Derive mathematical models of steady-state and dynamic behavior
of hydraulic components and systems. Analyse and design hydraulic systems by use of numerical tools
such as Matlab/Simulink. Prepare and apply control block diagrams, Prepare and apply state-space models of fluid power
systems. Apply linearization to the nonlinear functions that describe
multivariable machine systems. Analyze dynamic and steady-state performance and stability
utilizing transient and steady-state analysis as well as
frequency-domain analysis.","
Mathematical modelling, analysis, synthesis and design of fluid
power systems, in particular oil hydraulic systems. Numerical
simulation. Properties of hydraulic fluids and behavior under
pressure.

Static and dynamic properties of hydraulic pumps, motors, valves,
flow control, pressure control, direction control and servo
control.

Basic hydraulic systems. Hydraulic drives and actuators. Load
sensing systems. Hydraulic servo mechanisms. Stationary and mobile
hydrostatic transmissions. Hydraulic power suppliers and
accumulators.

Practical examples of hydraulically controlled systems. 
","41312,41560,41535","
Casper Schousboe Andreasen"
,,,,,,,,,,,,
41591, Topology Optimization ,English , 3.5 ECTS , 2016/2017 ,June,Ph.D.,Department of Mechanical Engineering,"
Hands-on experience with the method of topology optimization 
","Understand and use existing topology optimization software for
stiffness design (88- and 99-line codes) Modify existing codes to change boundary conditions, loads,
design domains, etc. Understand principles for design sensitivity analysis and
derive them for new objective functions Implement topology design of compliant mechanisms Understand the theory behind mathematical programming tools and
implement them in topology optimization software Understand the newest developments in theoretical aspects of
topology optimization methods Read and understand research papers on topology
optimization Know the historical foundation of the topology optimization
method Understand new applications of topology optimization in
academic research and industry Implement topology design of dynamic problems with harmonic
loads","
The course deals with theory and practice of topology design.
Topics include:

• Design parametrization (interpolation schemes, composites, etc.)

• Sensitivity analysis (direct and adjoint methods)

• Algorithms (OC-methods, mathematical programming, convex
approximation schemes and other methods)

• Computational issues (checkerboards, filters, robust design,
parallelization)

• Applications in structural and multi-physics problems (industrial
examples, MicroElectroMechanical Systems (MEMS), wave-propagation
problems) 
",,"
Ole Sigmund,
Jakob Søndergaard Jensen"
,,,,,,,,,,,,
41603, Engineering Design  and Problem Solving,Danish , 5 ECTS , 2016/2017 ,E1A (Mon 8-12),BSc,Department of Mechanical Engineering,"
To enable the student to engage in - and complete a limited problem
solving project in a systematic way, and with a reasonable
certainty of reaching a good result in a limited time scope. 
","Complete a problems analysis, including gathering of
information, need concepts, concepts of systems theory, design
specification, requirements and criteria Apply creative and systematic generation of ideas Evaluate alternative solutions based on the problems
analysis Build basic functional models of selected solution if need
be. Execute basic documentation of selected solution by
drawings Summarize and evaluate the application of theory and methods in
a well-defined engineering design project Prepare a report on the project and its outcome Evaluate project work of one's own and others","
The course deals with the early phases of problem solving: Problem
analysis, including need concepts, gathering of information,
concepts of system theory, design specification, requirements and
criteria. Search for solutions, including creative and systematic
generation of ideas. Application of design models. Evaluation of
alternative solutions. Project work. During the laboratory part the
student practise engineering design in project groups on the basis
of formulated need (the groups can choose to formulate a need
themselves). At the end of the course, each group presents and
reports their work. 
",41000,"
Per Boelskifte"
,,,,,,,,,,,,
41612, Product Design and Documentation,Danish , 10 ECTS , 2016/2017 ,"E4 (Tues 13-17, Fri 8-12)",BSc,Department of Mechanical Engineering,"
To enable the participants to design technical products and work
out the drawing documentation needed for production. The
participants must know the various phases of the development of a
product and be able to use methods for determination of the
structure and shape of the product in accordance with a broad
spectrum of criteria concerning production, conditions of
operation, price, appearance, etc. Furthermore, the participants
must be able to use design drafts and proper standard machine
drawing in the design process. 
","design products according to a structured procedure make documentation of products by means of standard
drawings make basic specifications based on the life cycle
principles make functional models based on purpose functions make systematic basic structure variation make systematic quantified structure variation make form variation based on functional surfaces make detailed design make documentation for production by means of a modern CAD
system understand cost calculation principles utilized in design
work","
The product synthesis process. The basic properties of the product:
Structure, shape, material, dimension, and surface. Methods for
structure variance. Product factors: Production, assembly, quality,
industrial design, operation, disposal, etc. Product
specification,. Computer tools for design. The drawing system. The
design draft as an engineering design tool. Standards for drawing.
Shape and position tolerances. Commonly used machine elements.
Through a number of design exercises, the participants work with
systematic methods for product synthesis. The participants will
partly design their own parts and partly design with conventional
machine elements. The exercises include use of outlines, design
drafts, shop drawings, and assembly drawings. The course is
terminated by an independent design project which is carried
through to documentation (written and including drawings) of a
product. Throughout the course, the use of engineering design
handbooks as professional tools is practised. In the long term, it
is expected that all participants will get the opportunity to make
drawing documentation by use of CAD. 
","42305,42301,42302,42303,41781,42309,42901,41020,41703,42020,41601,41602,41603","
Niels Henrik Mortensen"
,,,,,,,,,,,,
41616, CAD,English , 5 ECTS , 2016/2017 ,F2B (Thurs 8-12),BSc,Department of Mechanical Engineering,"
To enable the participants to understand and evaluate the use of
CAD in connection with product development and technical production
planning and to use a CAD system at an introductorily level. 
","give an account for the use of CAD in the design process analyse and make a written account for the structure,
functionality and application of CAD systems give an account for the application and limitations of
different CAD system types conduct modeling by the use of a modern 3D CAD system using the
systems basic features including: extrude, revolve, blend, sweep
and relations and pattern. document the project work and the final CAD model as a part of
the project report apply surface modelling to model parts comprising sculptured
surfaces use CAD tools to make production drawings analyse the product structure with the purpose of modelling it
using CAD select and model a product with a suitable level of
difficulties planning of large assemblies using top-down design","
Geometric modelling, solid modelling, surface description, Boolean
operations on solid models, transfer to drafting programs,
dimensioning, programming in CAD-systems, assembly of solid models
to systems.

 Exercises in 3-D modelling. Drawings of the models. Solid models
based on 2-D profiles and drafting of 3-D models. 
",None,"
Georg Kronborg Christensen"
,,,,,,,,,,,,
41617, Advanced CAD,English , 5 ECTS , 2016/2017 ,E2A (Mon 13-17),BSc,Department of Mechanical Engineering,"
To enable the participants to understand and evaluate the use of
CAD in connection with product development of complex systems and
technical production planning and to use a CAD system at an
advanced level. 
","give an account for the use of CAD in the design process give an account for the application and limitations of
different CAD/CAM system types exploit basic analysis possibilitires of a 3D CAD system conduct modelling by the use of a modern 3D CAD system using
the systems advanced features including: variable section sweep,
variable blend, draft, rib, variable round, analyse feature. design large assemblies using CAD tools for Top-down design
((Skeleton models, motion skeleton, Family tables, data
sharing) apply surface modelling to model parts comprising sculptured
surfaces apply dynamic analysis of CAD models plan the modelling of a product with the application of one or
more element of Top-down design document the project work and the final CAD model as a part of
the project report analyse and make a written account for the structure,
functionality and application of CAD Introduction to PTC/Creo's CAM system","
Parametric modelling. Skeleton models, family tables, master model
techniques, inheritance geometry. Managing large assemblies.
Advanced features in CAD. Advanced surface design. CAE-
applications including kinematic and dynamic analysis. System
customization.Top-Down Design using CAD.Introducing the CAM
application of a CAD system 
","41000,11000,41630,41601","
Georg Kronborg Christensen,
Tomas Benzon"
,,,,,,,,,,,,
41618, CAD for design engineers,Danish , 5 ECTS , 2016/2017 ,E5B (Wed 13-17),BSc,Department of Mechanical Engineering,"
To enable the participants to understand and evaluate the use of
CAD in connection with product development and to use a CAD system
at an introductorily level. Furthermore to enable participants to
use a visualization and animation software program. 
","give an account for the use of CAD in the design process give an account for the application and limitations of
different CAD system types conduct modeling by the use of a modern 3D CAD system using the
systems basic features including: extrude, revolve, blend, sweep
and relations and pattern. apply surface modelling to model parts comprising sculptured
surfaces use CAD tools to make production drawings give an account for the use of visualization and animation
software like 3DStudioMax conduct simple modeling and animation using 3DStudio Max select a product with appropriate level of difficulties and
plan the modeling and presentation of the product make a poster and a project journal to document and present the
project work analyse and make a written account of the structure,
functionality and application of CAD and visualisation
software use learned tools to produce physical models","
Geometric modelling, solid modelling, surface description, Boolean
operations on solid models, transfer to drafting programs,
dimensioning, programming in CAD-systems, assembly of solid models
to systems.

Introduktion to modelling of advanced surface appearance (colour,
reflection, light setting) and animation.

Exercises in 3-D modelling. Drawings of the models.

Rapid prototyping and reverse engineering. 
",,"
Georg Kronborg Christensen,
Tomas Benzon"
,,,,,,,,,,,,
41628, Conceptualisation,English , 10 ECTS , 2016/2017 ,E5 (Wed 8-17),MSc,Department of Mechanical Engineering,"
To enable the students to stage and to carry through a
conceptualisation. To give the students insight and skill into the
creation of concepts for industrial products, taking into account
value, user perceived quality, and costs. To give the students
insight into the theories and methods for conceptualisation. To
give the students insight into the staging of a concept design
project. To give the students the skills for application of methods
for conceptualisation. 
","Collect and evaluate data from a need- and market
analysis. Analyse and classify existing solutions. Interpret results of need-, market-, and technology analyses
and based on this to formulate a goal setting for the design
task. Create ideas and concept proposals. Stretch out a total solution space by combining systematic and
creative techniques. Create comprehensive and integrated solutions. Evaluate conceptual vulnerability (attractiveness and
tractability). Prepare a basis for concept selection taking into account
vulnerability, realise ability, and other relevant criteria. Stage design work based on an evaluation of the task’s scope,
complexity, and required result. Dynamic adjust the staging in relation to current project
status and obtained results.","
Staging of innovative concept work. The product idea and the design
concept. Interpretation of needs and markets. Importance of and
relation between business-, product-, function-, use-, and design
concept. Goal setting in form of the idea with, positioning
properties, user characters, and mission statement.
Multidisciplinary concept work. Systematic engineering design based
on considerations in transformation domain and organ domain.
Evaluation of conceptual vulnerability (attractiveness and
tractability). In the course a project work is carried out where
the students based on a given product idea have to carry through
needs-, markets-, and technology analyses and based on these
analyses to formulate a goal setting for the design task. Hereafter
ideas are created, and the total solution space has to be laid
open. A number of solution proposals are selected for further
development, and promising concept proposals have to be created.
Each student design team hands in a report, which documents the
concept proposals. Hereafter each student has to select a concept
proposal and analyse it with respect to vulnerability, realise
ability, and other relevant criteria. The analysis is documented in
an individually made report. 
","42612,41612,42603,41603","
Claus Thorp Hansen"
,,,,,,,,,,,,
