COURSE NUMBER,COURSE NAME,LANGUAGE OF INSTRUCTION,CREDIT LOAD,YEAR,SCHEDULE,COURSE TYPE,DEPARTMENT,GENERAL COURSE OBJECTIVES,LEARNING OBJECTIVES,CONTENT,RECOMMENDED PREREQUISITES,COURSE RESPONSIBLE
31270 , Structure,English , 10 ECTS , 2016/2017 ,"E4 (Tues 13-17, Fri 8-12)",MSc,Department of Electrical Engineering,"
Structure-borne sound is the field of acoustics that deals with the
generation and propagation of vibrations and forces in solid bodies
and structures, as well as sound radiation of these structures.
Vibration and wave motions in structures like beams and plates are
essential.

By introducing the principles and laws governing the generation,
transmission and radiation of structure-borne sound, it is the
purpose of the course to enable the student to: a) analyse
vibro-acoustic systems, e.g., technical noise and vibration
problems, b) make practical proposals for reducing structure-borne
noise in cabinets, machines, vehicles, buildings, etc., and c)
apply advanced measurement techniques for verifying theoretical
calculations. 
","explain the fundamental mechanisms and phenomena which generate
vibration and sound waves i solid media and structures conduct calculations and analyses of the dynamic properties of
simple resonant systems derive equation of motion for simple resonators and explain
frequency responses and determination of damping properties, eg.
from Nyquist diagram explain/evaluate wave phenomena for longitudinal waves and
bending wave fields in beams and rods and calculate vibrational
responses demonstrate the use of mobility methods for calculating
response of built-up systems conduct and report on vibro-acoustic measurements, including
applied signal analysis (spectral analysis, estimation of transfer
functions, structural damping properties, etc.) explain principle of vibration isolation and calculate
insertion loss of simple vibration isolated sources explain reasons for losses in structures and principles for
added damping and calculate damping of single-layer viscoelastic
vibration damping evaluate reflection and attenuation of structureborne waves in
built-up systems explain and calculate wave fields and propagation of bending
waves in plates apply Statistical Energy Analysis and Matlab-based finite
element analysis for calculating vibration in systems explain and calculate sound radiation from compact simple
sources and from plate-like structures, cabinets and
cylinders","
Mechanisms for the generation of vibration and sound in structures.
Simple resonators and models for damping mechanisms. Concepts of
mobility and mechanical impedance. Vibro-acoustic measurement
techniques. Introduction to applied signal analysis (spectral
analysis, estimation of transfer functions, etc). The generation of
vibration and sound waves in solids and structures (structureborne
sound). Longitudinal waves and bending waves in beams and plates.
Analytical and statistical methods for calculating structureborne
sound and transmission in complex structures. Vibration isolation,
attenuation and damping of structureborne sound in equipment and
machinery. Sound radiation from vibrating structures (plates,
cylinders, cabinets, etc). Active control and damping of vibration
and sound radiation. Principles for altering the transmission and
radiation properties of structures. 
",31200,"
Jonas Brunskog,
Jakob Søndergaard Jensen"
,,,,,,,,,,,,
31280 , Research Topics in Acoustic Technology,English , 5 ECTS , 2016/2017 ,Fall and Spring,Ph.D.,Department of Electrical Engineering,"
To develop the student’s self-learning ability and to increase the
knowledge of recent literature within the student’s own research
area and related topics. To improve the student’s scientific
communication skills

and promote scientific discussions of current topics in acoustics. 
","Present, discuss and critically evaluate current topics in
recent journal papers Understand and explain the principles underlying modern room
acoustic modelling techniques Understand and explain fundamentals of acoustic transducer
technology Understand and explain the principles used in advanced acoustic
measurement techniques, e.g., array-based methods Understand and explain fundamentals of structure-borne
sound Understand and explain radiation of sound from vibrating
structures Understand and explain the psychoacoustic principles used for
modelling perception and speech intelligibility in room
acoustics Understand and explain the psychoacoustic principles used in
estimating annoyance in environmental acoustics","
The course deals with current research in theoretical and
experimental acoustics, such as advanced measurement techniques,
e.g., beamforming and acoustic holography, analysis and reduction
of structural vibrations, determination of room acoustic parameters
and their effect on perception, the vibroacoustic properties of
buildings, and the behaviour of the loudspeaker for small signals
as well as in the non-linear domain.

Each student should give two oral presentations over the course of
the year. One of the presentations should summarize and discuss the
purpose, the methods and the key results in selected recent
scientific publications from high-profile journals and should
emphasize the impact of the findings for future research
directions; the other presentation should focus on the specific
research topic of the individual PhD student and closely related
areas. In addition, a written summary of the presentations and
relevant discussion is required. Each student should to attend at
least 70% of the presentations throughout the course. The
presentations and the written material will be collected during the
course and serve as the basis for evaluation. 
","31221,31240,31260,31270","
Finn T. Agerkvist,
Efren Fernandez Grande"
,,,,,,,,,,,,
31300 , Linear Control Design 1,Danish , 5 ECTS , 2016/2017 ,F5B (Wed 13-17)  or  E5B (Wed 13-17),BSc,Department of Electrical Engineering,"
To provide the necessary foundations for analysis and design of the
majority of simple control systems. 
","Apply heuristic methods for PID controllers. Apply frequency analysis for controller design, including PID,
lead, lag and feed forward controllers. Derive models of dynamic systems and present them on common
mathematical form, including block diagram form Carry out necessary manipulations on the mathematical models
including linearization of nonlinear differential equations Select model parameters based om measurements Apply block diagrams to describe models for both open and
closed-loop systems. Evaluate correspondence between models' characteristic
parameters and their time and frequency responses Carry out analysis on open loop and closed loop systems based
on transfer functions Understand the concepts of stability, stability margin,
overshoot and steady state error. Understand the consequencies of disturbance and noise
sensitivity Evaluate and select standard controllers Apply analysis design and simulation software","
Fundamental concepts in control systems with feedback. Formulation
of models of physical systems. Linearisation. Differential
equations. Laplace transformation and transfer functions. Root
locus and frequency analysis. Stability. basic design methods.
Application of standard controllers and compensators. The theory
and methods reviewed are supported by many practical examples. 
","01005,01035","
Hans Henrik Niemann,
Jens Christian Andersen,
Ilmar Santos"
,,,,,,,,,,,,
31301 , Linear Control Design 1,Danish , 5 ECTS , 2016/2017 ,F5B (Wed 13-17),BEng,Department of Electrical Engineering,"
To provide the necessary foundations for analysis and design of the
majority of simple control systems. 
","Apply heuristic methods for PID controller design. Apply frequency analysis for controller design, including PID,
Lead and feed forward controllers. Derive models of dynamic systems and present them on common
mathematical form, including block diagram form Linearising of non-linear models Select model parameters from measurements. Apply block diagrams to describe models for both open and
closed-loop control systems. Understand the concepts of stability, stability margin,
wind-up, overshoot and steady state error. Understand consequencies of disturbance and noise
sensitivity Implementation of controllers using electrical components Analysis and design of controllers for energy production
systems Apply analysis, design and simulation software","
Fundamental concepts in control systems with feedback. Formulation
of models of physical systems. Linearisation. Differential
equations Laplace transformation and transfer functions. Frequency
analysis. Stability. Basic design methods. Application of standard
controllers and compensators. The theory and methods reviewed are
supported by many practical examples and exercises.

e-learning is used in the form of e.g. quizzes as homework
assignments 
",,"
Hans Henrik Niemann,
Jens Christian Andersen"
,,,,,,,,,,,,
31305 , Projects in Control Practice,English , 5 ECTS , 2016/2017 ,January,MSc,Department of Electrical Engineering,"
The course aims at teaching how theoretical control methods can be
applied for the practical design of closed-loop control systems for
physical apparatus. The course goes through the three fundamental
phases of control systems design - namely system modelling,
controller design, and closed-loop system validation - constantly
mixing the computer-aided design, based on LabVIEW, with the
practical implementation of control systems through analog and
digital devices. 
","Derive dynamic models for the available test rigs, and assess
their validity through full scale measurements gathered with a
multi-channel data acquisition systems Design PID regulators in the LabVIEW Control & Simulation
Environment and analyse their performance Perform hardware-in-the-loop (HIL) testing of the closed loop
systems by means of LabVIEW Design and implement on a bread-board analogue circuits for
signal conditioning and system regulation Compare fully hardware-based solutions for the regulation task
to the LabVIEW-based ones, and discuss advantages/drawbacks Implement simple user interfaces (UI) in LabVIEW for performing
data acquisition tasks and regulation tasks Perform experimental work in laboratory environment Use LabVIEW as CAD tool for analysis, design, simulation and
hardware-in-the-loop testing of dynamic systems Write technical reports","
Analysis, design, implementation and validation of standard control
systems (e.g. PID or lead-lag compensator) for the control of
position, velocity, temperature, flow of a number of physical
apparatus. 
","31300,31301","
Roberto Galeazzi,
Hans Henrik Niemann"
,,,,,,,,,,,,
31310 , Linear Control Design 2,English , 10 ECTS , 2016/2017 ,"E3 (Tues 8-12, Fri 13-17)",MSc,Department of Electrical Engineering,"
The course aims at providing analytical tools and methods for the
design of linear control systems for MIMO (multi-input
multi-ouptut) physical systems, based on the state space framework.
The course also presents how the theoretical methods transpose into
computer aided techniques for the practical design and
implementation of the control systems. 
","Identify state variables of a single/multivariable dynamical
system and formulate the corresponding nonlinear state space
models Compute linear state space models from nonlinear ones and
relate their behaviours close to/far away from the point of
linearization Assess the system's static and dynamic properties and
discuss their effects on the behaviour of the system's states
and outputs Design full state feedback controllers without/with integral
action and compare the respective closed loop performances in
relation to the design specifications Design full/reduced order state estimators and appraise the
behaviour of the estimation error Synthesize output feedback controllers and evaluate their
performance in comparison to full state feedback controllers Explain simple stochastic processes and calculate the effect of
noise propagation through a dynamical system Design linear quadratic optimal feedback controllers and state
estimators (Kalman filter) and evaluate the
advantages/disadvantages of optimal solutions with respect to
non-optimal ones Synthesize optimal output feedback controllers and evaluate
their performance in comparison to non-optimal output feedback
controllers Analyse the closed loop system's performance and conclude
about the level of adherence to the design specifications Use Matlab/Simulink as CAD tool for the analysis, design and
simulation of dynamical systems Write technical reports","
Multivariable (MIMO) continuous and discrete time dynamic systems.
State-space formulation. Linearization, Laplace- and Z-transforms
for MIMO systems. State transformations and canonical forms. Poles,
zeros, eigenvalues, minimal representation. Controllability,
observability, gramians. Stability. State feedback, pole placement.
Integral control. Optimal control in continuous and discrete time
(LQR). Observers in continuous and discrete time. Introduction to
stochastic processes and Kalman filters. LQG design. 
","31300,31301","
Roberto Galeazzi,
Ilmar Santos"
,,,,,,,,,,,,
31320 , Robust and Fault,English , 10 ECTS , 2016/2017 ,"F1 (Mon 8-12, Thurs 13-17)",MSc,Department of Electrical Engineering,"
General objectives:

- to teach the basic in robust control, fault diagnosis and fault
tolerant control

- to show applications

- show how to use robust cantrol and fault tolerant control

- to be able to evaluate advantages and disadvantages in connection
with application of robust control and fault tolerant control. 
","Formulate a structural model of a dymical system Design a residual generator from structural and analytical
results Analyze detectability and isolability of faults and assess the
fault by estimation Master dynamical design of residual generators to achieve
desired properties Design and implement algorithms for change detection and
hypothesis testing Formulate models with uncertainty for a dynamical system Formulate performance specifications for a feedback system Master analysis of sensitivity and performance for a feedback
system Formulate different control requirements as a standard control
problem Master design of feedback control with specified regions of
uncertainty for the control object Redesign a control system for a faulty control object","
The course deals with novel control methods and concepts in the
area of robust and optimal control, fault diagnosis and fault
tolerant control.

Robust and optimal control are applied where the controller need to
be independend of variations in the control object, i.e. the effect
from the variations on the performance is minimal. Fault diagnosis
is applied for detection and/or isolating faults in dynamical
systems. Faults can e.g. be a sensor break down, a valve is not
working optimal etc. Fault diagnosis is applied for supervision of
dynamical systems in connection with fault tolerant control. When a
major changes happen in the control object or in the controller due
to e.g. faults in the system, it can be necessary to make changes
in the controller/control architecture to avoid undesired stop of
production, break down or safety hazards. This can be done in a
systematic way by using fault tolerant control, where the control
system is reconfigured or the control object is closed down in a
safe way.

The first part of the course include an introduction to the other
parts of the course.

Both analysis and design methods will be presented, the
participants will work actively with analysis and design and real
application cases are used to illustrate the concepts. Particants
will work with the latest generation of dedicated software for
analysis and design of fault-tolerant and robust control systems.

A number of small exercises/examples will be applied together with
two larger assignments of practical relevance. 
",31310,"
Hans Henrik Niemann,
Mogens Blanke"
,,,,,,,,,,,,
31321 , Topics in advanced control,English , 5 ECTS , 2016/2017 ,,Ph.D.,Department of Electrical Engineering,"
- to teach the basic in advanced control.

- to show applications of advanced control.

- to be able to use advanced control. 
","read and understand literature in the area of advanced
control. evaluate advantages and disadvantages in connection with
advanced control. describe the methods for other describe the methods based on examples have knowledge to the theoretical basis for the methods apply the methods on specific systems use software for analysis of control systems master design of advanced controllers/filters","
The subject to be studied is chosen according to the profile and
interests of participants. The topic would typically be in one of
the areas: stability and control of non-linear systems, adaprive
methods for control, diagnosis and fault-tolerant control, passive
and active methods for fault diagnosis. 
",31320,"
Mogens Blanke,
Hans Henrik Niemann,
Roberto Galeazzi"
,,,,,,,,,,,,
31324 , Advanced topics in Diagnosis and Fault,English , 7.5 ECTS , 2016/2017 ,Outside schedule structure,Ph.D.,Department of Electrical Engineering,"
To make participants able to apply fault-diagnosis and
fault-tolerant control at an international level.

The course aims at giving participants ability to demonstrate the
theory and methods on a case relevant for the participant's own
research 
","Design and implement a Kalman filter for fault-diagnosis Design a residual generator based on specification and
optimization methods from H-inf Design a change detection scheme with a threshold Be able to perform a fault diagnosis on a system that i
modelled as continuous or discrete Design and simulate residual generators for systems in
continuous-time representation Design and simulate residual generators for systems in discrete
event representation design and implement a fault-tolerant control system for a
plant described in continuous or on discrete-event form demponstrate ability to apply the theory and methodology on an
object chosen by the participant Use system identification to diagnose parametric faults in a
system","
Advanced topics in fault-diagnosis and fault-tolerant control,
including: Adaptive techniques, fault-diagnosis when noticable
noise is present in a system, signal-based diagnosis, application
examples. Participants work indevidually with design and
implementation of diagnosis and fault-tolerant control on an object
chosen by the participant, and approved by the lecturers. 
",31310,"
Mogens Blanke"
,,,,,,,,,,,,
31340 , Computer Control Systems,English , 10 ECTS , 2016/2017 ,E5 (Wed 8-17),MSc,Department of Electrical Engineering,"
The use of computers in control systems gives rise to special
problems of a technical nature. These are a consequence of the fact
that all signals, both those that are measured and those that are
calculated, can only be known with a certain degree of accuracy. It
is the aim of the course to give the participants some knowledge of
these problems and to teach them some rational methods for
designing control algorithms, in order that the effect of limited
accuracy can be reduced as much as possible. Furthermore, the
course looks at the problems surrounding the interaction between
the internal structure of the computer and the basic software, on
the background of the special control requirements that have to be
met by the computer system as a whole. 
","Design digital controllers Analyse digital control systems Develop control models for simple systems Implement digital controllers on computers Analyse and calculate the influence of quantization on control
quality Explain fundamental problems in real-time and multiprogramming
systems Design implement and debug closed loop systems Design and implement larger automation systems","
General overview of the possible applications of computers to
control technology. Programming controller algorithms. Error
sources in controller algorithms, including calculations time
delay, amplitude quantization and product quantization. Methods for
analysing the significance of quantization errors for control
quality. Computerised systems for process control are reviewed,
including the structure of the computer, external I/O units and the
structure of operating systems for process control. 
",31300,"
Nils Axel Andersen"
,,,,,,,,,,,,
31342 , Introduction to Programmable Logic Controllers,English , 5 ECTS , 2016/2017 ,Fall and Spring,BSc,Department of Electrical Engineering,"
The course purpose is to introduce the participants to the
application of Programmable Logic Controllers (PLC's) in
industrial automation task. The participants will be capable of
using methods and tools for building, using and maintaining
industrial automation systems. 
","Explain the architecture and operation of industrial
PLC's. Account for the different PLC programmings methods described in
the IEC-61131 standard. Program logic functions in PLC's by graphical languages,
fx. ladder diagrams. Use timers, counters and shift-registers to achieve sequential
functionality. Describe the most significant communication protocols used with
PLC's. Develop, troubleshoot, test and optimise PLC programs. Use industrial data collection and supervision systems. Create visualisations of PLC controlled automations
task.","
Introduction to the different topics through E-learning modules
combined with a number of practical exercises that illustrate the
typical issues when using PLC's. The course is concluded with a
solving a small PLC task unassisted. 
",None,"
Søren Hansen"
,,,,,,,,,,,,
31343 , Introduction to Programmable Logic Controllers,English , 5 ECTS , 2016/2017 ,January and June,BSc,Department of Electrical Engineering,"
The course purpose is to introduce the participants to the
application of Programmable Logic Controllers (PLC's) in
industrial automation task. The participants will be capable of
using methods and tools for building, using and maintaining
industrial automation systems. 
","Explain the architecture and operation of industrial
PLC's. Account for the different PLC programmings methods described in
the IEC-61131 standard. Program logic functions in PLC's by graphical languages,
fx. ladder diagrams. Use timers, counters and shift-registers to achieve sequential
functionality. Describe the most significant communication protocols used with
PLC's. Develop, troubleshoot, test and optimise PLC programs. Use industrial data collection and supervision systems. Create visualisations of PLC controlled automations
task.","
Introduction to the different topics through E-learning modules
combined with a number of practical exercises that illustrate the
typical issues when using PLC's. The course is concluded with a
solving a small PLC task unassisted. 
",None,"
Søren Hansen"
,,,,,,,,,,,,
31344 , Introduction to Programmable Logic Controllers,English , 5 ECTS , 2016/2017 ,July,BSc,Department of Electrical Engineering,"
The course purpose is to introduce the participants to the
application of Programmable Logic Controllers (PLC's) in
industrial automation task. The participants will be capable of
using methods and tools for building, using and maintaining
industrial automation systems. 
","Explain the architecture and operation of industrial
PLC's. Account for the different PLC programmings methods described in
the IEC-61131 standard. Program logic functions in PLC's by graphical languages,
fx. ladder diagrams. Use timers, counters and shift-registers to achieve sequential
functionality. Describe the most significant communication protocols used with
PLC's. Develop, troubleshoot, test and optimise PLC programs. Use industrial data collection and supervision systems. Create visualisations of PLC controlled automations
task.","
Introduction to the different topics through E-learning modules
combined with a number of practical exercises that illustrate the
typical issues when using PLC's. The course is concluded with a
solving a small PLC task unassisted. 
",None,"
Søren Hansen"
,,,,,,,,,,,,
31345 , Introduction to Programmable Logic Controllers,English , 5 ECTS , 2016/2017 ,August,BSc,Department of Electrical Engineering,"
The course purpose is to introduce the participants to the
application of Programmable Logic Controllers (PLC's) in
industrial automation task. The participants will be capable of
using methods and tools for building, using and maintaining
industrial automation systems. 
","Explain the architecture and operation of industrial
PLC's. Account for the different PLC programmings methods described in
the IEC-61131 standard. Program logic functions in PLC's by graphical languages,
fx. ladder diagrams. Use timers, counters and shift-registers to achieve sequential
functionality. Describe the most significant communication protocols used with
PLC's. Develop, troubleshoot, test and optimise PLC programs. Use industrial data collection and supervision systems. Create visualisations of PLC controlled automations
task.","
Introduction to the different topics through E-learning modules
combined with a number of practical exercises that illustrate the
typical issues when using PLC's. The course is concluded with a
solving a small PLC task unassisted. 
",None,"
Søren Hansen"
,,,,,,,,,,,,
