COURSE NUMBER,COURSE NAME,LANGUAGE OF INSTRUCTION,CREDIT LOAD,YEAR,SCHEDULE,COURSE TYPE,DEPARTMENT,GENERAL COURSE OBJECTIVES,LEARNING OBJECTIVES,CONTENT,RECOMMENDED PREREQUISITES,COURSE RESPONSIBLE
11831 , Construction,Danish , 10 ECTS , 2016/2017 ,Fall,BEng,Department of Civil Engineering,"
The overall goal of the course is to give the student the basic
skills for planning different kinds of construction projects. The
student will be given the basic skills in geotechnical
investigations.

The student will also be introduced to methods used in small to
large scale construction and maintenance projects for bridges,
harbors, airfields, roads or buildings. Special emphasis is laid on
road construction.

For the setting out of construction plans surveying methods are
introduced. Surveying instruments and methods with their achievable
accuracies and the required effort are covered. 
","Explain the elements of a transverse and longitudinal
profile Explain difficulties of arctic construction Plan and perform a terrestrial survey Analyze terrestrial survey data Evaluate mechanical properties of road materials Evaluate the rock quality for construction in mountainous
areas Design a proposal for road structure and road layout Manage a small consultancy tast Describe relevant rock-forming processes, the most common
Greenlanding rock types and their properties in relation to
construction","
Core elements:

Geology

Geotechnics

Road Construction

Surveying

Topics:

Geology: Rock-forming processes, Grenland geology, properties of
Rock types in relation to Construction work

Geotechnics: The geotechnical part of the course focuses on the
special conditions in Greenland within construction technology,
among other things classification of rocks and the mechanical
characteristics of rocks, explosions and the production of gravel,
as well as application-possibilities of geotechnique.

Road constructions: Basic techniques for road planning based on
constraints from topography and geology are presented. The
foundation and the structure of roads under the special condition
of permafrost is further investigated.

Terrestrial surveying: The main instruments for terrestrial
surveying, theodolite with electro-optical distance meter (also
known as total station) and leveling instrument, are introduced and
applied for detail measurements and for setting out outlines of
construction plans. Construction monitoring and deformation
measurements are carried out. 
",11821,"
Thomas Ingeman-Nielsen"
,,,,,,,,,,,,
11832 , Engineering in Greenland,Danish , 5 ECTS , 2016/2017 ,Fall,BEng,Department of Civil Engineering,"
The students will obtain an understanding of the modern society and
the historical conditions for its function and structure, as well
as an emerging recognition of the importance of different cultures
and intercultural interaction. Moreover, a knowledge of engineering
tasks and profiles in Greenland. Finally practiced oral and
multimedia presentations. 
","Describe a professional engineer profile and give the example
of Greenland engineering jobs Characterize the modern society and provide a comprehensive
historical and contemporary description of industrial and labor
relations Display knowledge of models for cultural analysis to describe
the cultural influent of communication in the job Understanding culture-based stereotypes and prejudices and
discuss multicultural cooperation Explain modern ledelsesteoriers importance of leadership in the
areas where Arctic Engineers find employment Knowledge of ""cultural co-management models"" in
relation to engineering work in Greenland / Arctic Be able to give a well-balanced and clear oral
presentation Use multimedia in conjunction with a presentation","
Key elements:

- Social and cultural understanding

- Analytical Methods

- Engineering Profiles

- Culture, management and communication in Greenland

Topics:

Business Conditions / labor relations in the building and
construction in Greenland

Historical forms of management in Greenland

Modern management theory (with relevance to the Arctic labor
markets)

Cultural analysis and communication mechanisms

Cultural Co-Management in the Arctic Study Planning

Engineering Competence and jobs and career opportunities 
",None,"
Kåre Hendriksen,Wolfgang Kahlig Ilisimatusarfi"
,,,,,,,,,,,,
11833 , Project Management in a Multicultural Greenlandic Context,Danish , 2.5 ECTS , 2016/2017 ,Outside schedule structure,BEng,Department of Civil Engineering,"
To provide skills to engage in engineering project management in a
Greenlandic context. 
","Present the basic principles in relation to general project
management. Describe the general principles analyzing good cooperation and
a good mental working environment Define the essential differences in the framework of a
traditional Inuit culture, a modern mix culture and a Danish
management culture Define the essential differences in the framework of an
academic versus an artisan culture Describe the challenges of the the cultural dimension involved
in project management Describe how cultural differences can be turned into a
strength Beskrive hvordan der i projektplanlægningen tages højde for
samarbejdsrelationer Beskrive de væsentligste konsekvenser af utilstrækkelig
projektplanlægning og -ledelse","
The course involves a general introduction to project management,
including how to ensure good working relationship and mental
working in the project organization. An analysis is performed of
the typical differences in cultural frame of the general
stakeholders in Greenlandic projects where engineers are part of
the project management.This is based on current local projects and
/ or the students own projects with focus on the most common
intercultural challenges that may arise in Greenland project
groups.

Project work / group work. The groups will conduct a joint report.
Each student will also write an individual process report which
will be a included in the overall assessment. 
",None,"
Kåre Hendriksen"
,,,,,,,,,,,,
11835 , Building design 3,Danish , 5 ECTS , 2016/2017 ,Fall,BEng,Department of Civil Engineering,"
The purpose of the course is to make students able, in the light of
current standards and norms to dimension technical installations
i.e. systems for heating, ventilation, water and drainage in single
family homes. The course focuses both in Greenlandic and Danish
conditions. Work is continued on the sketched single-family house
of the courses 11823 and 11825.

To provide participants with a basic understanding of constructive
and material conditions of the Greenland wooden houses, and with a
background therein to enable them to design renovation and
rebuilding. 
","Understand the engineer's role in energy and building
renovation Complete a building registration Outline relevant proposals for the renovation of Greenland
residential concrete blocks with focus on a new Building
envelope. Determine the need for ventilation based on legal requirements
and requirements for the thermal and atmospheric indoor
climate Determine the physical and functional requirements for a
mechanical ventilation system and choosing fittings for inject and
exhaust air in arctic conditions Outline heating systems Outline the structure and describe the function of drainage
systems Make rough estimated calculations of hydraulic pipes","
Key elements:

- Renovation

- Building envelope

- Indoor climate

- Energy efficiency

- Basic installations for heating, ventilation, Water and drainage

The course covers registration of renovation needs as well as
methods for renovation, with particular focus on the practical
building envelope and installations under Arctic conditions.
Calculation methods for flow in pipe and duct systems are reviewed.
In addition, there is an exposition of how the building
installations are included in the overall calculation of the energy
consumption of buildings. 
",11825,"
Tove Lading"
,,,,,,,,,,,,
11836 , Environmental Engineering,Danish , 7.5 ECTS , 2016/2017 ,Outside schedule structure,BEng,Department of Civil Engineering,"
The course imparts an understanding of the environment and
resources in urban areas and sustainable development in Greenland,
including waste management, technical supply systems adapted to
Arctic conditions as well as the local and national decision-making
processes related to the area. Furthermore, the course makes the
student aware of the environmental influence of these sytems. 
","Describe environmental and ressource perspectives of
engineering tasks in the Arctic systematically Describe supply systems and identify significant environmental
and resource issues including Discuss the opportunities and barriers to sustainable
development of supply systems Set objectives and action plans for environment and resources
at the municipal level Make analyzes and calculations for water-supply and projecting
limited water and sewer systems Explain technical installations function, their social
significance and their impact on the environment Describe public utilities such as water, drainage,
heating,including any measure necessary for climate protection Communicate and argue for the assignment in writing and orally
to other professionals, politicians and citizens, including the use
of digital tools Discuss the roll of citizens / users in sustainable
infrastructure focusing on waist handeling Explain the team cooperation and development, and reflect on
their own role and work","
Central topics:

• Sustainable supply

• Communication with citizens / users

• Priorities and Decision Making

Topics:

Supply areas of water, heat, energy, water and waste.

Basic hydrology, water extraction and distribution, drainage
systems and water treatment and the recipient water.

Management Technical priorities and decisions related to supply and
environmental engineering. 
",None,"
Kåre Hendriksen,Birgitte Hoffmann,Søren Gabriel,Hans Ole Hansen"
,,,,,,,,,,,,
11837 , AT Summer Project,Danish , 5 ECTS , 2016/2017 ,August,BEng,Department of Civil Engineering,"
To obtain experience on project work in relation to Arctic
technology, end thereby develop skills and experience on project
work in self-governed groups and knowledge of the Arctic as
workplace and constraint. 
","Organize project work in groups in consideration of the group
members strong and weak characters Plan project work with respect to available time and project
goal in due consideration of logistic conditions in the Arctic Define project goal and make well-argued choices of methods to
reach the goal Relate the relevance of project goal and results to the local
Arctic context in which they will be used. Constitute practical fieldwork to reach the project goals Present purpose, background and results of fieldwork in a
well-structured report Search and refer to literature Appropriately illustrate measuring/analysis results Conclude well-argued and clear","
Core elements:

Project planning

Group work

Field work

Report writing

Arctic relevance

Topics:

Arctic relevant projects with local relevance in Greenland are
chosen. The focus of the chosen project should relate to the
specialization, the student anticipates to follow in the remainder
of the education i.e. either buildings, constructions, environment,
planning or mathematics. 
",11836,"
Pernille Erland Jensen,
Gunvor Marie Kirkelund,
Sonia Tomaskovicova"
,,,,,,,,,,,,
11853 , Sustainable building in extreme environments,English , 15 ECTS , 2016/2017 ,Outside schedule structure,MSc,Department of Civil Engineering,"
To obtain the necessary knowledge and skills to plan and design
building structures in extreme environments with focus on
sustainability. 
","Identify and analyze the specific challenges of building under
extreme conditions related to construction engineering, logistics,
skills, energy, climate impacts, local context, etc. Design buildings and building structures adapted extreme
conditions, where sustainability is a major factor Evaluate and document the advantages and disadvantages in
relation to energy needs and energy efficiency in conjunction with
climate, environmental and economic depreciation etc. Explain and analyze sustainable building in a context of island
operations and extreme climates. Plan and design installations, adjusted to local supply and
secured for arctic conditions. Perform geodetic and geotechnical investigations for a
building. Exemplify learning objectives in a conceptual design for a
concrete construction project. Present the conceptual design project in a report for an
appropriate recipient","
Core Elements:

• Building design under extreme conditions

• Sustainability

• Climatic construction design

• Energy consumption and supply

• Installations adapted to extreme conditions

• Soil tests

Topics:

Building design adapted to climatic influences such as snow, ice,
wind, humidity etc .; Sustainable constructions in a built
environment (refurbishment / infill / urban renewal) in Arctic
regions; Indoor climate, heating, heat recovery, cold climate
ventilation; Sustainable materials in a local context; Logistics,
building management, competences and skills in island operated
communities; Construction of building envelopes to meet Arctic
requirements; Foundations in extreme areas (permafrost, cliffs);
Energy concepts in remote areas. 
","11858,11859,11857","
Tove Lading"
,,,,,,,,,,,,
11854 , Infrastructure Constructions in the Arctic,English , 15 ECTS , 2016/2017 ,Spring,MSc,Department of Civil Engineering,"
To give the student the knowledge and skills necessary to construct
infrastructure (roads, ports, airports, tunnels) on rock and
permafrost related to industrial plants (mines, smelters, on-shore
oil installations, hydro-electric stations) in remote areas 
","Perform surveying in remote areas Use GIS for advanced data storage Perform geotechnical investigations Perform geophysical measurements Dimension infrastructure constructions like roads, harbors,
tunnels etc. for industrial installations in remote areas Design constructions in areas with permafrost Explain the principles for construction in tidal zones with
heavy ice Manage logistics in remote production facilities Assess environmental impact from large constructions","
Core elements:

- Geotechnics and Geophysic

- Infrastructure Constructions

Topics:

Site investigations

Geophysics measurement methods

Permafrost – primarily in rocks

Construction of roads and landing strips

Tunneling

Harbor construction

Hydroelectric power plants

Environmental analysis at large scale installations

Infrastructure 
","11858,11859,11857","
Thomas Ingeman-Nielsen"
,,,,,,,,,,,,
11857 , Extreme Climate and Physical Nature,English , 5 ECTS , 2016/2017 ,Spring,MSc,Department of Civil Engineering,"
The course will give the students an introduction to the most
important climate and nature conditions of the Arctic for carrying
out engineering tasks. 
","Explain and quantify the Arctic climate Explain and discuss key issues associated with climate
change Classify typical Arctic physical environments Quantify snow and ice conditions Explain ocean currents and deep water formation in relation to
climate change Understand and and quantify water resources and the
hydrological cycle in the Arctic Quantify sustainable energy potentials Understand physical nature conditions for doing engineering in
the Arctic","
Core elements:

- Climate and nature

- The cryosphere

- Arctic hydrology

Topics:

Climate and climate change

Snow and ice conditions

Hydrology and water resources

The Arctic nature

General oceanography

Renewable energy

The theory will be followed by practical exercises and excursions
to demonstrate the conditions. 
",None,"
Lisbeth M. Ottosen"
,,,,,,,,,,,,
11858 , The Arctic Infrastructure and Society,English , 5 ECTS , 2016/2017 ,Outside schedule structure,MSc,Department of Civil Engineering,"
To give knowledge and proficiency to analyse the development in
settlement pattern and the importence of infrastructure in the
populated Arctic, where settlement often are isolated so that the
infrastructure functions as on islands. 
","Classify and discuss key aspects of settlement and
infrastructure planning Analyse the specific challenges regarding infrastructure and
islanding Explain the consequences of mono-economic dependency and the
correlation between settlement and commercial basis Formulate solutions for the logistics for a construction or
exploration process Classify social impact assessment (SIA) in relation to large
installation Explain the consequences of large scale investments Formulate a strategy for sustainable development for a district
or settlement with scenarios, analysis, creative processes and
discussion paper Communicate and interact professionally with other
professionals, the political level and citizens","
Core elements:

- Sustainable local and regional development

- Strategic and physical planning

- Settlement and infrastructure

- Logistics in the Arctic

The course will have three parts:

The first deals with strategic regional development with focus on
settlement, transportation and business.

The second focuses on the city level with involvement of the
stakeholders.

The third deals with analysis of the sustainability of large
industrial plants including SIA.

The course uses primarily local examples from Greenland, but
examples from the Arctic region in general will be included. The
examples include strategic as well as physical planning.

The competences obtained in this course will be of general value,
since the focus is on developing adapted solutions based on local
conditions. 
",11857,"
Kåre Hendriksen"
,,,,,,,,,,,,
11859 , Environmental Engineering in the Arctic,English , 5 ECTS , 2016/2017 ,Outside schedule structure,MSc,Department of Civil Engineering,"
To obtain the necessary knowledge and skills to be able to suggest,
analyze and evaluate environmental engineering solutions in Arctic
communities. 
","Explain physical, chemical and biological processes for
handling of waste, water, wastewater and contaminated areas in cold
climate. Describe the conceptual differences on how waste, water and
wastewater are handled in different Arctic areas. Evaluate advantages and disadvantages of environmental
engineering solutions for Arctic communities in due consideration
of local geography, climate and infrastructure. Recommend investigations to be made prior to introducing
changes in the handling of waste, water and wastewater in Arctic
communities. Discuss the potential of production of sustainable energy from
local waste resources in Arctic Communities. Suggest changes in the handling of waste, water, waste water,
and contaminated areas in the Arctic for improved environmental,
economical and health standards. Argue for suggested changes in the handling of waste, water,
waste water, and contaminated areas in the Arctic based on
technological and societal considerations. Present suggestions and arguments for suggested investigations
in a project propsal.","
Core elements:

Wastewater treatment in small societies in cold climate

Surface water treatment for drinking water in cold climate

Waste handling in small societies in cold climate

Remediation of contaminated sites in cold climate

Topics:

Characteristics of wastewater and waste: Environmental and societal
impacts in the Arctic

Water and wastewater treatment methods for cold climate including
screening, sedimentation, filtration, disinfection, passive
wastewater ponds, constructed wetlands, septic tanks. Handling of
grey and black water in unsewered communities, separation and
composting toilets, freeze-thaw treatment, aerobic and anaerobic
treatment of blackwater. Small systems for cluster homes and very
small communities

Sludge and organic waste handling incl. aerobic and anaerobic
treatment.

Sorting, reuse, incineration and deposition of waste in Arctic
communities.

Contaminated sites in Arctic communities: remediation needs and
remediation methods. 
",,"
Pernille Erland Jensen"
,,,,,,,,,,,,
11900 , Building component design,English , 10 ECTS , 2016/2017 ,E3A (Tues 8-12) and January,MSc,Department of Civil Engineering,"
To enable the student, in cooperation with others, to propose,
design and document a new building component in an innovative
process.

The course enables the use of gained knowledge from other courses
in a broader engineering context. 
","Understand the component-based building practise Develop artistic as well as analytic skills to evaluate
design Use innovation methods to develop new building components Use conceptual and integrated design methods Create interdisciplinary synthesis Generate and develop the design by the use of virtual and
physical models Work with BIM, CNC-cutting and 3D printing Produce a state-of-art report Produce a design manual for the manufactor Produce a process report to document the process throughout the
course Present a project to different stakeholders","
The course mainly consists of the design and production of a
prototype building component, performed in groups of students.

The group presentations during the course and the evaluation
afterwards are central aspects of the teaching. 
",11995,"
Christian Rønne"
,,,,,,,,,,,,
11909 , Building Design Project 1:1,English , 5 ECTS , 2016/2017 ,August,MSc,Department of Civil Engineering,"
To enable the student to master independent creative concept
implementation from theory into practice, on the basis of obtained
engineering skills.

The learning objectives are shared with DTU's Blue Dot learning
objectives. 
","Use engineering principles/​theories/​methods based on the
latest development/research for holistic solutions Use a methodology for collection/analysis of data and knowledge
on engineering problems Create ideas and conceptual proposals based on
collected/analyzed data Create (radical) innovation with reseachers/professionals Cooperate with both peers and non- peers about the project in
all its phases . Communicate with both peers and non- peers about the project in
all its phases Perform project management and quality control Perform dynamic alignment in relation to project status/results
for ongoing optimization Perform assessments of possible solution's potentials and
viabillities","
The course contains a self-programmed task embedded in the
execution of a major innovation-oriented design project, from
concept to prototype, for example in connection with the Danish
Building Academy activities.

The course may be part of DTU 's Blue Dot program, see
http:/​/​www.groendyst.dtu.dk/​english/​About/​Blue-Dot","11982,11900,11981","
Christian Rønne"
,,,,,,,,,,,,
11911 , Structural Elements and their Function 1,Danish , 5 ECTS , 2016/2017 ,E1B (Thurs 13-17),BEng,Department of Civil Engineering,"
The objectives of the course is to develop the students basic
structural understanding and to make them capable of performing an
analysis of simple structures. 
","Determine reactions by equilibrium equations Determine member forces in statically determinate truss
structures Determine section forces in statically determinate beam
structures Use the principle of virtual work for the determination of
reactions and section forces Determine deformations truss and beam structures by the
principle of virtual work Determine moment of inertia for simple cross sections Determine normal stresses in trusses and beams Find form and forces for simple cables and arches","
- Forces and moments

- Equilibrium

- Section forces

- Stresses

- Trusses

- Beams

- Simple computer programmes

- Simplified analysis of cables and arches 
",None,"
Peter Noe Poulsen"
,,,,,,,,,,,,
11921 , Structural Elements and their Function 2,Danish , 5 ECTS , 2016/2017 ,F2A (Mon 13-17),BEng,Department of Civil Engineering,"
The objective of the course is to develop the students basic
structural understanding which will allow them to perform an
analysis of the state of stress in simple structures. 
","Determine sectional forces og deformations for statically
indeterminate beams by the force method Determine cross sectional constants for general cross
sections Determine principal moments of inertia for general cross
sections Determine normal stress distribution for beams in bending Determine shear stress distribution for beams in bending Determine shear stress distribution for beams in torsion Analyse special states of stress and strain Decide if a state of stress is critical to a given
material","
- Section forces in statically indeterminate beam structures

- The finite element method for beam structures

- Normal stresses in beams in bending

- Shear stresses in beams in bending and in torsion

- Special states of strain and stress

- Principal stresses and Mohr's circle

- Stress invariants

- Mechanical properties of materials

- Simple failure conditions 
",11911,"
John Forbes Olesen"
,,,,,,,,,,,,
