COURSE NUMBER,COURSE NAME,LANGUAGE OF INSTRUCTION,CREDIT LOAD,YEAR,SCHEDULE,COURSE TYPE,DEPARTMENT,GENERAL COURSE OBJECTIVES,LEARNING OBJECTIVES,CONTENT,RECOMMENDED PREREQUISITES,COURSE RESPONSIBLE
10104 , Quantum Mechanics,English,5 ECTS,2016/2017, None,BSc,Department of Physics,"
To establish the most basic theoretical concepts within quantum
mechanics and by this create a systematic starting point for a
scientifically based development of advanced materials for
technological applications. ","Identify physical systems that requires a quantum mechanical
description. Solve Schrödinger's equation for simple one, (two) and
three dimensional systems and interpret the results. Quote the eigenvalues for the most important quantum mechanical
operators. Outline and explain the basic postulates of quantum
mechanics. Recall the most important commutator relations. Formulate the connection between symmetry and conservation
laws. Calculate eigenvalues and eigenfunctions for perturbed
systems. Analyse simple molecular systems by means of the quantum
mechanical variational principle."," Particles as waves, Schrödinger's equation. Expectations values, operators, eigenvalues, and stationary states. Commutators, unitary transformations, and matrix representation. Symmetry and conservation laws. Free particles, the potential well, and the harmonic oscillator. Angular momenta, central potentials, and the hydrogen atom. Perturbation theory and the variational method. Identical spin ½-particles.  ",None,"
Kirstine Berg-Sørensen,
Thomas Olsen"
,,,,,,,,,,,,
10112 , Advanced Quantum Mechanics,English , 10 ECTS , 2016/2017 ,"E2 (Mon 13-17, Thurs 8-12)",MSc,Department of Physics,"
To provide a more advanced understanding of the basic principles
and techniques in quantum mechanics. Special emphasis is put on
providing the student with skills to independently perform quantum
mechanical analysis of nanostructures and solids. 
","Describe the foundational concepts of quantum mechanics; the
superposition principle, the quantum uncertainty relation, the
probability amplitudes and entanglement. Describe the following mathematical concepts: Hilbert space,
self-adjoint and unitary operators, orthogonal projections,
composite systems and the spectral theorem. Explain the properties of mixed and pure quantum states and
calculate measurable quantities using these states. Describe and discuss the structure of a quantum experiment in
terms of a preparation, a manipulation and a measurement
process. Define and apply symmetries in quantum mechanics for
simplification of operator diagonalization and classification of
energy spectra. Discuss orbital and spin angular momentum and exploit these
concepts in physical systems. Calculate the changes in energy spectra to 2nd order and
transition rates to 1st order by stationary and time-dependent
perturbation theory. Explain the consequences of the indistinguishability principle
of quantum particles. Describe the relation between bosons, fermions and the
symmetries of the wave function, and the concept of a Slater
determinant. Define the second quantized form of one- and two-particle
operators and apply Wick's theorem. Describe the principles behind Density Functional Theory. Discuss and perform calculations on modern applications of
quantum mechanics.","
States and state operators, mixtures and the density matrix, field
quantization, angular moments, spin, measurement, atom-field
interaction, entanglement, charged particle in magnetic field,
Aharonov-Bohm effect, Zeeman effect, the classical limit, path
integrals, WKB, identical particles, Pauli principle, second
quantisation, exhange, Hartree-Fock method, density functional
theory, Hohenberg-Kohn theorems, quantum computing, quantum
communication. Selected project topics within modern quantum
physics. 
","10303,10102","
Karsten Wedel Jacobsen"
,,,,,,,,,,,,
10122 , Statistical Physics,English , 5 ECTS , 2016/2017 ,E3A (Tues 8-12),MSc,Department of Physics,"
To teach the student fundamental theoretical concepts within
statistical physics and thereby provide a systematic foundation for
using the introduced methods in new problem areas both of classical
and of quantum nature. In addition, some of the techniques applied
to handle interacting systems are introduced. 
","Express thermodynamic equilibrium conditions for isolated,
closed, as well as open systems. Determine the number of microstates corresponding to a given
macrostate in a wide spectrum of problems and establish the
connection to thermodynamics through the entropy. Argue for the choice of appropriate statistical mechanical
ensemble associated with a given problem and calculate physical
properties by means of partition functions. Solve problems with non-interacting fermions, bosons, and
quasiparticles (like photons). Describe important properties of the Ising-model in 1 and 2
dimensions. Employ mean-field models for describing phase transitions and
properties of interacting systems. Estimate fluctuations in physical quantities, in particular in
nanostructures. Discuss characteristics of phase transitions and apply Landau
free energy expansions on continuous phase transitions. Explain the concepts of universality, scaling and
renormalization group approach to phase transitions.","
Thermodynamical equilibrium and state variables. Thermodynamic
potentials. Number of microstates and entropy. Ensemble theory and
mean values. Partition functions. Fluctuations in nanoscale
systems. The microcanonical, the canonical, and the grand canonical
ensembles. Spin-½ systems. Para- and ferromagnetism. Ising-models.
The classical ideal gas. The equipartition law. Quantum statistics.
The Maxwell-Boltzmann, the Fermi-Dirac, and the Bose-Einstein
distributions. The Planck-distribution: Ultrarelativistic particles
, photons, phonons, and other ""-ons"". Classical gasses
and liquids: Dealing with interacting particles. Phase transitions.
Critical phenomena. 
",,"
Thomas Olsen"
,,,,,,,,,,,,
10200 , The structure and dynamics of materials studied with X,English , 5 ECTS , 2016/2017 ,E1B (Thurs 13-17),MSc,Department of Physics,"
Detailed understanding of the atomic scale structure and dynamics
of materials is a crucial prerequisite for understanding their
physical properties, and therefore also for the design of new
materials of technological interest. Neutron and X-ray scattering
are complementary methods that find broad application within
physics, chemistry, biology and materials science. Using a series
of experimental techniques, which will be introduced during the
course, neutron and X-ray scattering allow the determination of all
relevant structural parameters for molecules and crystals as well
as amorphous materials, including also the magnetic structure.
Furthermore, elementary excitations of the relevant lattice and
magnetic degrees of freedom such as (phonons and spin waves) can be
studied in great detail. Imaging with x-rays and neutrons enables
structural characterization locally within the material. The
overall goal of the course is to provide a broad understanding of
modern X-ray and neutron scattering, and a thorough introduction to
the practical use of these techniques in the study of the structure
and dynamics of materials. The importance of neutron and x-ray
scattering is underscored by the very large investments currently
being made by the Danish state in the construction of the European
Spallation Source (ESS) and MAX-IV in Lund, Sweden, and in the
European XFEL in Hamburg, Germany. The Technical University of
Denmark is strongly involved in instrument design and construction
at all three facilities. 
","Describe methods for production of X-ray and neutron
beams. Discuss how nuclei and electrons interact with neutrons and
X-ray photons. Illustrate the principles behind structure determination with
X-rays and neutrons using concrete examples. Investigate how X-rays and neutrons allow determination of
lattice and magnetic dynamics. Calculate scattering and absorption cross-sections as well as
dynamic structure factors quantitatively. Identify the principles behind basic experimental techniques
for studies of structure and dynamics. Illustrate how Monte Carlo ray-tracing simulations can be used
in the design and optimization of instruments, including
optics. Argue for the complementarity between X-ray and neutron
scattering. Explain how the study of physical processes on certain
characteristic time and length scales dictates the choice of
certain instrument-types at either neutron or X-ray
facilities. Formulate an application for beam-time based on knowledge of
existing and future neutron and X-ray facilities and
instruments.","
The course introduces the student to the connection between the
structure and dynamics of materials and the associated scattering
phenomena, which can be observed at international neutron and X-ray
facilities , such as ILL and ESRF in Grenoble, France, and the
upcoming facilities ESS, MAX-IV and European XFEL. The student is
introduced to key concepts such as cross-sections, scattering
factors, absorption, diffraction, spectroscopy and fluorescence.
After the successful completion of the course, the student will
have acquired suitable prerequisite skills in the area of neutron
and X-ray research to be able to participate in academic or
industrial research collaborations. 
","10303,10102","
Niels Bech Christensen,
Søren Schmidt"
,,,,,,,,,,,,
10209 , X,Danish , 5 ECTS , 2016/2017 ,June,BSc,Department of Physics,"
The course provides a practical introduction to characterization of
materials using X-ray and neutron scattering techniques. The main
focus will be on applications within nanoscience/​nanotechnology,
materials science and sustainable energy. Part of the course will
consist of hands-on exercises performed at international large
scale neutron facility. 
","Account for the basic principles of scattering and absorption
of X-ray and neutrons Determine the atomic structure of a crystal Account for the basic principles of 3D imaging by
tomography Discuss the use of scattering techniques for characterization
of nanostructures Argue about choice of laboratory X-ray sources, synchrotrons
and neutron sources Carry out a simple scattering experiment, including setting up,
data collection and data analysis Document theory, procedures and results in a report -","
The course consists of an introduction to the use of large scale
neutron and X-ray facilities, such as the Paul Scherrer Institute
(PSI) in Switzerland, the European Spallation Source (ESS) and the
MAX-IV synchrotron, both in Lund, Sweden, and the European X-ray
Free Electron Laser (E-XFEL) in Hamburg.

The basic theory of scattering and absorption of x-rays and
neutrons is introduced and the course participants gain familiarity
with some of the most typical applications of laboratory X-ray and
large scale synchrotron X-ray and neutron facilities:
single-crystal diffraction, powder diffraction, small-angle
scattering and tomography.

Exercises: Each student carries out selected laboratory exercises.
In the second week of the course neutron scattering experiments are
carried out at the large scale facility SINQ at PSI in Switzerland.
The main focus of all exercises will be on nano-science and
sustainable energy technology.

The course is concluded by data-analysis, completion of exercise
reports, preparation of posters and examination. 
","10036,01005,10033,10020,02631","
Poul Norby,
Niels Bech Christensen"
,,,,,,,,,,,,
10220 , Physics of soft materials,English , 5 ECTS , 2016/2017 ,F1B (Thurs 13-17),MSc,Department of Physics,"
To provide the students with a basic knowledge of common properties
and nanoscale organization of soft materials other than biological
materials. In addition, a timely topic will be highlighted by a
guest lecturer 
","Identify some common properties of soft materials Describe connections between soft materials and the areas of
materials science, nanoscience, physical chemistry, biophysics and
complex fluids Determine common nanoscale structures, basic phase behaviour
and solutions of polymers, block copolymers, colloids, surfactants
and liquid crystals Determine structural anisotropy and describe how this can be
externally induced Demonstrate how these structures may be theoretically predicted
and experimentally identified Demonstrate how the structural anisotropy can be experimentally
identified Read a scientific paper in the area and identify and restate
its motivation and essential findings Discuss one timely research topic such as active
materials","
Basic features of soft materials other than biological materials.
Their nanometer scale structures and phase transitions, how they
can be predicted and observed. Levels of structural anisotropy. An
example of the current cutting-edge soft matter research 
",None,"
Matti Knaapila"
,,,,,,,,,,,,
10240 , Design,English , 5 ECTS , 2016/2017 ,June,BSc,Department of Physics,"
To be immersed in a problem-based engineering project and solve a
problem (optimization of a wind turbine’s blade design towards
efficient conversion of wind into electrical energy) through
teamwork. Deepen the understanding of the CDIO concept with a focus
on the Design and Implement (Build) phases. Be motivated to think
about the engineering process in the context of cooperation in a
project team. 
","Explain the concepts and challenges of wind energy conversion
and explain their relationship to the bigger perspective of
sustainable energy production Devise a project plan including detailed time management for
the 3-weeks course taking into account the time constraints of the
different project stages and the skills and competencies
represented by individual team members Perform the stages of the planned project by effective team
work Apply design principles to design and produce an efficient wind
blade by 3D printing Explain and adapt the data acquisition setup for measuring the
energy conversion as a function of wind speed Measure the energy conversion efficiency of the produced
blade Analyze and discuss possible sources of error in the
measurements Evaluate the overall conversion with respect to individual
component efficiency, e.g. the electrical generator, and the chosen
blade design Present the project results on a poster and explain it in
detail","
This course will build on the Design-Build 1 course of the first
semester and further introduce the students to the CDIO concepts.
The problem to be solved in this course is related to wind energy
harvesting, i.e. efficient conversion of wind kinetic energy into
electrical energy. Given a wind turbine setup and electrical
generator, the part to be optimized is the form of the wind blades.

 Based on some introductory lectures, the students will design and
manufacture their own wind turbine with a 3D printer and measure
the resulting energy conversion efficiency as a function of wind
speed. To this end, interdisciplinary student teams will be formed
with special consideration for the required skills/competencies
needed for the problem.

 Given the time constraints of the 3-weeks course, special emphasis
will be put on the development of an efficient project plan with
appropriate time management. These plans will be presented and
peer-reviewed during the course.

 Besides for their overall efficiency, the blades can (if time
permits) also be evaluated for their durability under heavy wind
load. Another optional subproject could be the deconvolution of the
individual part’s efficiencies, e.g. the influence of the
electrical generator. Data collection will be performed in
available setups in Nanoteket, where it is possible for interested
students to dive further into computer based data acquisition based
on LabView.

 Finally, the project plan, blade design and measured data will be
presented on a poster. This poster will be the basis of the final,
summative assessment, where each group member should be able to
defend the entire poster.

 Additionally, a competition will be held with prices for the best
wind blade design (highest achieved energy conversion efficiency)
and the poster with the best communication of the content. 
","10018,01005,02631,27016","
Sebastian Horch"
,,,,,,,,,,,,
10250 , Electron microscopy for the characterization of advanced materials,English , 5 ECTS , 2016/2017 ,E4A (Tues 13-17),MSc,Department of Physics,"
The course aims at providing students with a comprehensive view of
how electron microscopy can be used to study and reveal links
between structure and functionality of modern nanostructured
materials.

Such links are essential for developing a variety of applications
including nanoparticles for catalysis, electronic devices for
energy harvesting/​conversion/​storage and applications in
photonics and plasmonics, magnetic materials for spintronic and
biomedical applications. Electron Microscopy in its various forms
(SEM, TEM), complemented by analytical tools (EELS spectrometer,
EDX detector, etc.) and assisted by sample preparation techniques
(FIB, Cryo, etc.) provides a versatile characterization platform to
help solve real-world materials problems.

This course will enable the participants to choose EM techniques
appropriate for specific tasks, understand and interpret EM
micrographs, diffraction patterns, spectra, and various other
signals that we can collect with a modern electron microscope.
Students will learn how an image is formed in the electron
microscope (contrast mechanisms), and gain hands-on experience in
acquiring, processing, interpreting and quantifying data on the
basis of electron-matter interactions. 
","List the microscopy techniques that may be used to quantify the
structure of materials at the nanoscale Describe the various components of scanning and transmission
electron microscopes and their operating principles Compare the different scattering processes (elastic and
inelastic) that occur when electrons encounter a crystal, and
illustrate how scattering of high-energy electrons turns into
observable contrast Apply the most appropriate microscopy technique for a given
problem (e.g. measuring atomic displacements), by designing a
suitable (S)TEM/SEM experiment Prepare a sample suitable for TEM or SEM observations Simulate images, spectra and signals using appropriate
software Interpret and index electron diffraction patterns of crystals,
polycrystalline, and amorphous materials Acquire an EELS spectrum, and extract chemical information from
it by analyzing peaks/edges Analyze energy-dispersive X-ray spectra obtained in the SEM or
TEM, measure the atomic percentage of species present and estimate
the accuracy of such analysis","
This course introduces the Electron Microscope as a basic tool for
investigating matter at the nanoscale. Students will learn the
operating principle of the instrument, with emphasis on how images
are formed, what kind of physical information they contain, how the
information is affected by instrumental imperfections, and how to
retrieve and quantify the information. Topics will include:

• Elements of electron-optics (what the microscope does to the
electron beam)

• Electron-matter interactions, scattering theory (what the sample
does to the electron beam)

• Image formation theory (how an image is formed)

• Imaging methods in the (S)TEM (bright-field, dark-field,
diffraction, high-resolution, phase contrast)

• Imaging methods in the SEM (secondaries, backscattered)

• Spectroscopic methods (EDX in the SEM and TEM, EELS)

• Sample preparation (what criteria should be met in order to have
viable samples that we can study)

• Image simulation and image interpretation (using available
software)

• Preview of advanced techniques (electron holography,
environmental TEM, tomography, phase tomography, STEM DPC, EBSD,
etc.) 
","33257,10036,10303","
Marco Beleggia,
Christian Danvad Damsgaard,
Jakob Birkedal Wagner,
Thomas Willum Hansen"
,,,,,,,,,,,,
10302 ," Electronic Structure Methods in Material Physics, Chemistry and Biology",English , 10 ECTS , 2016/2017 ,F5 (Wed 8-17),MSc,Department of Physics,"
To give the student insight into modern electronic structure
methods with special emphasis on the description of molecules and
solids at the atomic level. 
","Explain the basis of density functional theory, Hohenberg-Kohn
theorems and Kohn-Sham equations. Identify the assumptions and parameters necessary for different
implementations of DFT Explaining the definition of the exchange-correlation energy,
and know about the different level of appromixations to the
xc-functional Read and explain current literature to a level where you can
give a talk on a selected paper. Identify problems in physics, chemistry and biology where DFT
can be applied. Perform simulations on test systems using the ASE code. Define your own novel research project and perform the DFT
simulations to address the issues within your project. Write a report on the basis of the results obtained in the
project.","
The course will provide an overview of different methods to solve
the qunatum mechanical electronic structure problem. The following
topics will be discussed: Interatomic interactions, the quantum
mechanical many-body problem, density functional theory,
approximative total energy methods, applications in surface and
materials physics. 
","10303,10112","
Kristian Sommer Thygesen"
,,,,,,,,,,,,
10303 , Condensed Matter Physics and Nanoscale Materials Physics,English , 10 ECTS , 2016/2017 ,"E4 (Tues 13-17, Fri 8-12)  or  F4 (Tues 13-17, Fri 8-12)",BSc,Department of Physics,"
To give the student a basic understanding of the fundamental
concepts of condensed matter physics and of nanometer scale
materials physics with the goal of establishing a systematic basis
for the development of advanced engineering materials and
functional structures. 
","Describe condensed matter qualitatively. Operate with the energy concept and the crystal momentum in
condensed matter. Operate with crystal lattices and symmetries both in real space
and in the reciprocal space (momentum space). Apply quantum mechanics on condensed matter to describe
scatttering of waves in crystals and to describe the eigen-states
and the eigen-energies in systems with periodic boundary
conditions. Construct theoretical models of the electromagnetic, mechanical
and thermal properties both in the single-particle picture and in
systems with electron-electron correlations (magnetism). Apply the theoretical models to calculate the characteristic
properties of materials (e.g. elastic moduli, sound velocity,
specific heat, electrical and themal conductivities, magnetic and
dielectric susceptibilities). Apply the theoretical models on a number of semiconductor
devices of technical interest to calculate the electrical and
optical properties. Analyze problems in condensed matter and select and apply the
appropriate models. Ananlyze, select and apply condensed matter methods and quantum
mechanics on nanoscale systems which exhibit size
quantization. Recognize and apply professional terminology in
English.","
Crystal lattices, reciprocal space, and X-ray diffraction, Phonons,
heat capacity, heat conduction, and anharmonic effects. Electronic
structure, free-, nearly-free-, and tight-binding models. The
diatomic molecule, metallic binding, and ion binding.
Semiconductors and semiconductor devices. Transport theory and
optical properties of metals and semiconductors. Semiconductor
nanostructures: Quantum wells, wires and dots. Itinerant

magnetism and the mean-field approximation. 
","10034,10036,10102","
Jakob Schiøtz,
N. Asger Mortensen,
Niels Bech Christensen"
,,,,,,,,,,,,
