COURSE NUMBER,COURSE NAME,LANGUAGE OF INSTRUCTION,CREDIT LOAD,YEAR,SCHEDULE,COURSE TYPE,DEPARTMENT,GENERAL COURSE OBJECTIVES,LEARNING OBJECTIVES,CONTENT,RECOMMENDED PREREQUISITES,COURSE RESPONSIBLE
10386 , Experimental Techniques in Quantum Technology,English , 5 ECTS , 2016/2017 ,January,MSc,Department of Physics,"
Spooky quantum effects such as quantum superposition and
entanglement are now being used to develop radically new
technologies with far-reaching applications, including super-secure
communication, a new paradigm for computing (quantum computing),
and sensors with unpreceedented sensitivty for e.g. biomedical
imaging. This is a true technological revolution and thus
companies, like Google and Microsoft, are investing substantially
in this new technology.

The goal of this course is to experimentally explore some of these
technologies with focus on quantum optical technology. This
includes an understanding of the production, the detection and the
characterization of quantum states. A special focus will be put on
how to deal with unavoidable technical noise sources, present in
all implementations, which disturb quantum effects. 
","Explain the different techniques used in a particular quantum
technology Characterize the properties of a parametric down-conversion
source Account for technical noise sources present in experiments Implement a data acquisition system Perform quantum state tomography Discuss landmark experiments in quantum optics Perform correlation analysis of photon detection Organize, plan and carry out collaborative work in group
projects","
The course introduces the student to experimental techniques for
generating quantum states based on particle properties of light
(single photons) using a parametric-down conversion source. We will
detect the generated quantum states with single photon detection,
thereby learning the fundamental detection principle and their
associated noise sources.

We will experimentally characterize the quantum states by
performing quantum state tomography. Properties of photon pairs
will be studied by the famous Hong-Ou-Mandel and
Hanbury-Brown-Twiss experiments.

Implementing applications of quantum technology is possible.
Special emphasis will be put on technical details an
experimentalist has to deal with when demonstrating theoretical
quantum optical predictions and when making use of those in
practical measurement devices. The student is, thus, introduced to
cutting-edge technological challenges faced by quantum engineers. 
",10380,"
Tobias Gehring,
Ulrich Busk Hoff"
,,,,,,,,,,,,
10400 , Plasma Physics,English , 5 ECTS , 2016/2017 ,E5A (Wed 8-12),MSc,Department of Physics,"
The objective is to give the students an understanding of what a
plasma is, how it behaves, which scientific and industrial contexts
plasma appears in. The course will give the student insight into
how the dynamics in plasma is modeled mathematically and
numerically, and on the basis of simplified models give the student
the ability to model fundamental plasma phenomena. Acquired
knowledge from this course provides a foundation for advanced
studies of fusion plasmas, astrophysical plasmas and process
plasmas that are applied in a broad range of industrial processes. 
","Describe the general characteristics of a plasma, its
application and occurrence Deduce the continuum equations of motion for plasmas Compute particle trajectories in electric and magnetic
fields Describe plasma equilibrium states and associated electric and
magnetic fields Describe fundamental wave phenomena in plasmas Account for the exchange of energy between waves and
particles Assess which models should be used in describing a given plasma
phenomenon Describe fundamental diagnostic methods applied in plasmas Deduce information about the state of a plasma on the basis of
measurements","
Conditions under which a gas is partially or completely ionised and
forms a plasma. Shielding of charged objects in plasma, and
collective behavior of particles that constitute the plasma.
Fundamental equations of motion for populations of charged
particles in electromagnetic fields including self-generated
fields. Plasma equilibrium states and fundamental criteria for
stability. Collisions and diffusion. Dielectric response of – and
fundamental wave phenomena in – plasma. Resonance and total
reflection. Elementary dielectric effects in thermal plasmas,
including Landau damping and cyclotron resonances. Development of
magnetic topology – magnetic reconnection. Elementary diagnostic
methods. Plasma in space and laboratory, fusion plasma. 
","10034,10036,01035,10033,10346","
Jens Juul Rasmussen,
Volker Naulin,
Mirko Salewski"
,,,,,,,,,,,,
10401 , Fusion energy and fusion plasma physics,English , 5 ECTS , 2016/2017 ,January,MSc,Department of Physics,"
The objective is to give the students an understanding of the basic
principles behind fusion energy and the placement of fusion energy
in the future energy distribution networks. The course will provide
insight into plasmas and technology required for the development of
fusion energy. This covers the dynamics of the plasma and
particularly the confinement properties of fusion-grade plasmas
with particular attention to magnetic confinement. Acquired
knowledge from this course provides a foundation for advanced
studies of fusion plasmas and for a future career in fusion energy
research and engineering at international fusion research
facilities. 
","Describe the basic physical processes and technological
requirements for the development of fusion energy Describe the required plasma conditions for achieving fusion
energy Differentiate between various models for plasma dynamics and
their applicability in various scenarios Describe magnetic plasma confinement in toroidal devices :
Tokamaks and Stellarators Deduce the plasma equilibrium state in tokamaks Deduce basic plasma instabilities and their influence on
confinement Design set-ups for confining and generating plasma Describe the fundamental heating methods of magnetically
confined plasma Describe basic diagnostic methods for fusion plasmas Deduce information about the state of plasma on the basis of
measurements Describe the special requirements to materials for fusion
devices Discuss the role of fusion energy in the future energy supply
scheme","
Description of the fundamental processes of fusion energy and how
it will be exploited. Conditions for ignition of fusion energy,
i.e., the condition for producing more energy by the fusion
processes than the input energy. Confinemt of hot fusion-grade
plasmas. Magnetic confinement in toroidal devices: tokamaks
andstellarators. Plasma equilibrium states in tokamaks. Basic
instabilities in magnetically confined plasmas. Plasma
transport/diffusion and confinement degradation. Basic modelling of
cross-field transport. Plasma exhaust and plasma-wall-interaction.
Basic plasma heating schemes. Diagnostics of fusion plasmas.
Materials for fusion devices. Fusion reactor simulator. Remote
experiments at a tokamak device. The European Roadmap towards
fusion energy. Fusion energy and its role in the future energy
supply. 
","10400,01035,10034,10036,10346,10033","
Jens Juul Rasmussen,
Volker Naulin,
Stefan Kragh Nielsen"
,,,,,,,,,,,,
10405 , Theory of Relativity,English , 5 ECTS , 2016/2017 ,E1B (Thurs 13-17),MSc,Department of Physics,"
To give the student a basic understanding of the special theory of
relativity and its importance for modern physics. Examples of
applications

of the theory are studied in the context of electromagnetism,
atomic physics, high energy physics, and astrophysics. 
","Account for the principle of special relativity, inertial
systems, and the form invariance of the laws of physics. Account for the Lorentz contraction, time dilation, and the
concept of simultaneity. Reproduce the Lorentz transformation and apply it on position,
velocity, and acceleration of a particle. Account for relativistic invariant quantities, space-time
diagrams, 4-vectors, and proper time. Account for relativistic energy-momentum 4-vector, conservation
of energi-momentum, kinetic energy and reaction energy. Account for relativistic particle dynamics, the center-of-mass
concept, and elastic scattering. Explain the relativistic Doppler effect and gravitational red
shift. Account for the relativistic properties of plane waves and the
index of refraction in a moving medium. Account for the basic elements of relativistic
electrodynamics. Derive the Dirac equation in the relativistic quantum theory of
the electron","
The course treats the special theory of relativity. The starting
point is electromagnetic phenomena, in particular the
electromagnetic fields around a point charge as observed in
different inertial systems. Then follows a discussion on the
form-invariance of the laws of physics as well as the two
postulates of Einstein, and the Lorentz transformation is derived
and used to prove Lorentz contraction, time dilation, and the
concept of relativistic simultaneity. Transformation of particle
position, velocity, and acceleration is treated, and invariant
quantities are sen to lead to space-time diagrams, 4-vectors, and
proper time. 4-vectors are applied to particle dynamics,
energy-momentum 4-vector, the center-of-mass concept, as well as
relativistic energy (kinetic and reaction energy), and
energy-momentum conservation is applied to elastic scattering (the
Compton effect). Relativistic Doppler effect is treated, followed
by a relativistic description of plane waves, the 4-vector phase,
the group and phase velocity, and the propagation in and index of
refraction of a moving medium. Finally, elements of relativistic
electrodynamics and the Lorentz transformation of the
electromagnetic fields are treated, and the Dirac equation in the
relativistic quantum theory of the electron is derived. The general
theory of relativity is introducered in a breif overview and its
importance for the GPS technology is discussed. Throughout the
course are given examples of applications of the theory within
electromagnetism, atomic physics, high energy physics, and astro
physics, 
",,"
Henrik Bruus"
,,,,,,,,,,,,
10420 , Physics of Sports,English , 5 ECTS , 2016/2017 ,June,BSc,Department of Physics,"
In this course you learn how to examine the physics of a variety of
sports disciplines by applying scientific concepts such as force,
momentum and energy. We will apply the relevant equations in models
to help us understand, appreciate and optimize motion in sports. We
will observe and measure the performance of top athletes of Team
Denmark as well as ourselves during training sessions, and we will
analyze the obtained video footage and measurements using the
models. 
","Analyze a physics problem in sports, plan and carry out a
solution, and critically judge the results. Define concepts of mechanics and fluid mechanics appearing in
sports - such as position, velocity, acceleration, angular
velocity, momentum, angular momentum, moment of inertia, kinetic
and potential energy, center of mass, forces and torques, lift,
drag, the Magnus force, the Reynolds number, Newton’s laws, and
conservation of energy, momentum and angular momentum. Apply concepts of mechanics and fluid mechanics to analyze
motion in sports. Explain and model forces and torques on athletes and sporting
equipment and their motion. Make experiments in sporting facilities and in the lab and
analyze the measurements and video footage using concepts of
mechanics and fluid mechanics. Analyze the limitations of the human body and sporting
equipment. Optimize the sports performance and give recommendations for
improvements. Present essential physics of a sport of own choice.","
Physics of various sports disciplines in theory and experiment.
Football, swimming, basketball, volleyball, cycling, rowing,
trampoline, gymnastics, archery, athletics, ice hockey, skiing,
golf, tennis and many others. 
","10050,10916,10917,10020,10935,10024,10022,10931,10033,10933","
Mirko Salewski"
,,,,,,,,,,,,
10467 , Experimental Methods and Instrumentation in Physics,Danish , 5 ECTS , 2016/2017 ,January and June,BSc,Department of Physics,"
In this course you will learn how to design simple electrical
circuits for amplification of signals, handling of noise, control
of experiments, and data acquisition. At the same time you will
obtain practical experience in building and characterizing
electrical circuits and in working with experiments and measurement
equipment in the laboratory. 
","Select appropriate measurement equipment during execution of
projects Design simple electrical circuits for amplification and
filtering Select basic models for clarifying sources of disturbances in
measured data Apply methods for noise suppression Perform data analysis Code simple measurement and control tasks in LabVIEW Carry out a small, independent measurement project Write laboratory records and document research results Prepare and present a talk","
During the first week, lectures, problem sets and laboratory
exercises provide basic theoretical knowledge and experimental
experience with electrical measurement methods. Topics include
introduction to circuits, amplifiers, transfer functions,
oscillators, filters, noise and data analysis. During the second
week the participants carry out thematic laboratory exercises. The
topics for the exercises are noise and electrical filters, cabling
and grounding, construction and characterization of a photo
detector, introduction to LabVIEW, and high-speed digital video.
The students work experimentally in groups of three. During the
third week each group works on a concrete, small research project
and presents the results in a report and a brief talk. 
","31400,10036,10044","
Anders Peter Andersen"
,,,,,,,,,,,,
10501 , Modern Physics,English , 7.5 ECTS , 2016/2017 ,F5A (Wed 8-12),Ph.D.,Department of Physics,"
To give the students knowledge about subjects in modern physics and
presentation training. 
","Prepare pedagogical slides for a digital presentation of a
scientific subject. Quickly make himself/herself acquainted with scientific papers
in different areas of modern physics. Give a pedagogical presentation of other peoples'
scientific work. Observe time limits at an oral presentation. Evaluate and give constructive criticism of presentations given
by others. Formulate good questions in English to lectures within a broad
range of subjects within modern physics . Prepare a summary report on a selected topic for a non expert
audience - discuss the future impact of these new research
result. Follow principles for good scientific and ethical
conduct","
The course covers a wide range of subjects in the field of
solid-state physics, optics, non-linear dynamics, and biophysics,
plasma physics and physical fluid dynamics. The purpose of the
course is to ensure that the Ph.D.-students in physics are
well-informed in all areas of physics, also the areas they do not
specialize in. The specific content of the course changes from
semester to semester depending on the teachers and guests
participating in the course and also depending on the interests of
the participating students.

Additionally, the course will contain presentations on innovation
and patent issues, scientific communication, and proper scientific
and ethical conduct.

During the course the student should present a short summary of
their Ph.D. project. They should write a summary report (about 5
pages) on a selected topic different from the topic of their Ph.D
project, in addition they should prepare and give a presentation
based on this report. These reports and presentations should be
evaluated by a group of other students (4-5), which will be
selected a priory. It is expected that the students prepare
themselves for each of the presentations by reading background
material. 
",None,"
Jens Juul Rasmussen,
Peter Christian Kjærgaard Vesborg"
,,,,,,,,,,,,
10502 , Quantum,English , 5 ECTS , 2016/2017 ,June,Ph.D.,Department of Physics,"
Introduction to selected topics within nonlinear optical and
quantum optics of special relevance to contemporary research.
Students will be brought fully up-to-date on these topics by
teachers, who are themselves experts in the field and skilled
teachers. However, the course also contains material that ensures
that the students will refresh their knowledge of the basic
subjects.

The course presumes knowledge of basic optics, nonlinear optics and
quantum physics at the graduate level. 
","Knowledge of selected areas of nonlinear optics and quantum
optics as a basis for the work with selected research topics. Quasi phase matching of 2. order nonlinear processes; design of
structures and calculation of efficiencies. Coupled wave equations, second harmonic generation, sum- and
difference frequency generation. Knowledge about sources of coherent light, devices and systems,
specially solid-state light sources, semiconductor lasers and
–amplifiers, quantum dots. Generation, conversion, communication, manipulation and
detection of quantum states for information processing. Generation and use of discrete and continuous quantum
states. Interaction between light quanta and atoms, exchange of quantum
states. Solid-state quantum optics relevant for obtaining high optical
nonlinearity and for use in quantum information
processing.","
The course is conducted as a Ph.D.-summer school of a one week
duration, often at an
e
http:/​/​www.fysik.dtu.dk/​english/​Research/​QPIT/​Events/​Summer_school_2015
xternal corese centre outside DTU. Seee the home page for the
current or previous course:

http:/​/​www.fysik.dtu.dk/​english/​Research/​QPIT/​Events/​Summer_school_2015",None,"
Ulrik Lund Andersen"
,,,,,,,,,,,,
10506 , Journal club on nanostructures and reactivity,English , 5 ECTS , 2016/2017 ,E4B (Fri 8-12) and F4B (Fri 8-12),Ph.D.,Department of Physics,"
The course aims at giving the students knowledge about new
literature within their research areas, and to practice scientific
communication skills and discussions as well as assess ethical
aspects. 
","Conduct a systematic and scientific information search. Apply various search methods on the internet (e.g. WebOfScience
and DTIC). Select relevant scientific publications. Explain results and conclusions from publications. Criticise and defend the applied methods. Relate conclusions to own research projects. Communicate methods, results, and conclusions to other PhD
students. Argue scientifically in a discussion.","
The course consists of presentations of scienctific papers from
high-profile journals by the PhD-students. The subjects for the
chosen papers should deal with “Nanostructures and their
reactivity”, see the keywords for examples. The purpose of the
paper, results, and conclusions must be presented, and a critical
discussion of the methods and the results should also be included.
The student should also emphasize what the new issues in the paper
are, and how these can contribute to his/hers PhD project. Each
presentation must result in a short summary with the most important
results and conclusions. These summaries are collected for the
course, such that a relevant database is constructed during the
course. 
",10304,"
Ib Chorkendorff"
,,,,,,,,,,,,
10508 , Electronic structure journal club,English , 5 ECTS , 2016/2017 ,E2A (Mon 13-17) and F2A (Mon 13-17),Ph.D.,Department of Physics,"
To provide the participants with knowledge about the latest
research within electronic structure methods and atomistic
simulations and to practice scientific discussion and presentation.

","Recognize concepts and abbreviations that are often employed in
classical and modern electronic structure theory. Describe methods for calculating the total energy of molecules
and solids. Discuss the central concepts related to interacting electron
systems. Perform an independent literature search. Perform a well-defined delimitation of a larger research area,
with the purpose to enable a comprehensible presentation of an
issue or method of electronic structure theory. Present methods and results orally in a clear and
comprehensible fashion. Critically evaluate the usefulness of methods for calculating
specific materials- and electronic structure properties with
respect to accuracy. Critically evaluate the usefulness of computational methods
with respect to their required computational resources.","
The course will consist in presentations and discussions of
scientific articles within electronic structure and atomistic
simulations. The discussions may also include more computer
technical aspects of simulations and large-scale computations. The
student who presents prepares a computer presentation or a one-page
summary of the main results. 
",10302,"
Jakob Schiøtz"
,,,,,,,,,,,,
10512 , Journal club in Quantum Optics,English , 7.5 ECTS , 2016/2017 ,E1B (Thurs 13-17) and F1B (Thurs 13-17),Ph.D.,Department of Physics,"
To give the students knowledge about the newest research within
quantum optics and quantum information, and to practice scientific
communication and discussions. 
","Conduct a systematic and scientific information search. Select relevant scientific publications within the field of
quantum optics. Explain results and conclusions from publications Criticise and defend the applied methods. Respond critical to the methods used and to the new
results. Relate conclusions to own research projects. Communicate methods, results, and conclusions to other PhD
students. Argue scientifically in a discussion.","
The course consists of presentations of new scientific papers from
high-profile journals by the PhD-students. The subjects for the
chosen papers should deal with “Quantum Optics” or “Quantum
Information”. The purpose of the paper, results, and conclusions
must be presented, and a critical discussion of the methods and the
results should also be included. The student should also emphasize
what the new issues in the paper are, and how these can contribute
to his/hers PhD project. 
",None,"
Ulrik Lund Andersen"
,,,,,,,,,,,,
10520 , Journal club on plasma physics and fusion energy,English , 5 ECTS , 2016/2017 ,E4B (Fri 8-12) and F4B (Fri 8-12),Ph.D.,Department of Physics,"
To give the students knowledge about new literature within plasma
physics and fusion energy and to practice scientific communication
skills and discussions 
","Conduct a systematic and scientific information search Select relevant scientific publications Explain results and conclusions from publications Criticize and defend the applied methods Relate conclusions to own research projects Communicate methods, results, and conclusions to other PhD
students Argue scientifically in a discussion -","
The course consists of presentations of scientific papers from
high-profile journals by the PhD-students. The subjects for the
chosen papers should deal with plasma physics or fusion energy. The
purpose of the paper, results, and conclusions must be presented,
and a critical discussion of the methods and the results should
also be included. The student should also emphasize what the new
issues in the paper are, and how these can contribute to his/hers
PhD project 
",None,"
Anders Henry Nielsen,
Volker Naulin"
,,,,,,,,,,,,
10530 , CINF Summer School on Reactivity for Sustainable Energy Conversion and Environmental Protection 2018,English , 2.5 ECTS , 2016/2017 ,August,Ph.D.,Department of Physics,"
To give the students an overview of the status and challenges in
fundamental energy research. 
","have knowledge at the general level of the energy challenges we
are faced with be able to point out different solution scenarios for the
energy production and conversion of the future have thorough knowledge about tools for design and synthesis
used in the production of catalysts be able to point out the most interesting scientific problems
within heterogeneous catalysis as it pertains to energy conversion
and protection of the environment be able to identify key scientific questions within
electrochemistry and identify how certain processes can be used to
store and convert energy be able to discuss advantages and disadvantages between
electrolysis and photo electro catalysis and be able to identify
the most important areas in which to focus the research effort be able to discuss the extent of our energy challenge in a
quantitative manner be able to achieve a quick and concise insight of his/her own
research related to above areas","
The course is a 1 week PhD summer school 
","10333,10304,10222","
Ib Chorkendorff"
,,,,,,,,,,,,
