COURSE NUMBER,COURSE NAME,LANGUAGE OF INSTRUCTION,CREDIT LOAD,YEAR,SCHEDULE,COURSE TYPE,DEPARTMENT,GENERAL COURSE OBJECTIVES,LEARNING OBJECTIVES,CONTENT,RECOMMENDED PREREQUISITES,COURSE RESPONSIBLE
,,,,,,,,,,,,
31001 , Electric circuits 1,Danish , 5 ECTS , 2016/2017 ,E3A (Tues 8-12),BSc,Department of Electrical Engineering,"
To train skills in analyzing and synthesizing simple electronic
circuits for processing of analog signals. 
","Define current, voltage, and power. Explain independent and
dependent ideal voltage and current sources. State and apply basic circuit laws (Kirchhoff) and solve
circuits by systematic node-voltage and mesh-current
techniques. Solve simple circuits with resistances in series or parallel.
Apply relaations for voltage dividers and current dividers. Find and apply Thévenin and Norton equivalents. Apply the
superposition principle. Explain and apply component relations for capacitances and
inductances. Find DC-solutions for circuits with resistances,
capacitances and inductances. Solve first-order RC and RL transient
problems. Explain and use generel amplifier models and amplifier
concepts. Explain the ideal opamp. Analyze ideal opamp circuits with
negative feedback. Explain and analyze standard opamp circuits,
such as voltage follower, inverting and noninverting voltage
amplifier, integrator, and differentiator. Explain diode models and use the ideal-diode model and
piecewise-linear models to solve circuits. Explain various
rectifier circuits and complete rectifier systems. Explain the operation of transistors (bipolar and/or FET). Use
large-signal equivalent circuits to analyze transistor circuits.
Use small-signal equivalent circuits to analyze transistor
circuits. Make computer simulations of simple circuits by the use of
simulation programs (currently LTspice). Make laboratory measurements with standard laboratory
equipment. Understand Danish and English basic electro-technical
terminology.","
Kirchhoff's rules and circuit calculations. Thevenin's
theorem. Superposition. Resistors, capacitors, and inductors,
voltage sources and current sources. Transient behaviour.
Operational amplifiers. Semiconductor components and model
descriptions. Amplifier stages. Large signal and small signal
models. Computer analysis. 
",None,"
Michael A. E. Andersen"
,,,,,,,,,,,,
31003 , Electric circuits 2,Danish , 5 ECTS , 2016/2017 ,F2B (Thurs 8-12),BSc,Department of Electrical Engineering,"
To train skills in analyzing and synthesizing simple electronic
circuits for power management and analog signal processing. 
","Solve steady-state ac circuits, using phasors and complex
impedances. Compute power for steady-state ac circuits, and determine load
impedance for maximum power transfer. Calculate active, reactive and apparent power. Analyze three-phase systems and three-phase power. Determine the transfer functions of first-order and
second-order filters. Explain and use decibels, logarithmic
frequency scales, and Bode plots. Make calculations on magnetic circuits. Make calculations on rotating machines. Make calculations on rectifiers and inverters Make calculations on DC/DC converters. Calculate RMS and average values of AC waveforms.","
Steady-state sinusoidal analysis. Phasors and complex impedances.
Filters and complex transfer functions. Power management circuits.
Transformers and rotating machines. 
",31001,"
Esben Larsen"
,,,,,,,,,,,,
31013 , Engineering Practices ,Danish , 10 ECTS , 2016/2017 ,E1B (Thurs 13-17) and January,BSc,Department of Electrical Engineering,"
To give an introduction to studying at DTU and to give an
introduction to the area of electrotechnology, including
presentations of typical methods and tasks within this area. This
includes also laboratory work. To develop good study and work
methods for both theoretical and experimental tasks and to practice
written documentation. 
","Make use of the DTU IT facilities. Make use of the DTU CampusNet facilities. Gain whithout prerequisites a quick understanding of a tecnical
topic. Organize and implement project work in groups. Behave adequately in a (electro) laboratory environment. Make short written reports on technical project works. Be conscious about personal study techniques in other
courses. Make a consistent plan for an entire bachelor curriculum, under
here independent to select courses from professional
interest.","
Project tasks within the area of electro technology. The project
will include elements from other courses on first semester.

Studying techniques and study planning. Use of DTU's
facilities, including the databar system.

In the 13-week period, there will be a number of different projects
in the different suggested study lines. In the 3-week perriod, a
single project is given. The project is a laboratory project and is
based on the courses Digital Electronics 1 and Electric Circuits 1.
Further, there is also fucus on who to work and behave in a electro
laboratory. 
",None,"
Hans Henrik Niemann"
,,,,,,,,,,,,
31015 , Introductory project ,Danish , 10 ECTS , 2016/2017 ,F2A (Mon 13-17) and June,BSc,Department of Electrical Engineering,"
Learning to formulate an open design oriented project, i.e. give a
problemstatement and its limitations, to plan, and to carry out an
engineering project. Training in group work on a technical project.
To focus safety issues under experimental lab environments. Deeper
understanding of a selected subject within electrotechnology. 
","Describe a technical problem Determine delimitations for a technical project Illustrate a methods for solving a technical problem Evaluate solutions of a technical problem Estimate necessary resources for solving a technical
project Practice a general method of project work Through a team work to solve and evaluate a technical
problem Docoment and defend results of a project work Evaluate safety requirements given for persons and equipments
operating in laboratories","
General teaching in information retrieval, project work, and
reporting. Specific teaching in relevant theories and practices
associated with the selected subject. Approval (within the 13-week
period) of a project plan. Practical project work during the last
part of the 13-week period and the 3-week period. Document the
results of the project work through a paper/poster/self evaluation
and a defend on these activities. 
",,"
Esben Larsen,
Hans Henrik Niemann"
,,,,,,,,,,,,
31035 , Engineering Electromagnetics,English , 10 ECTS , 2016/2017 ,E1A (Mon 8-12) and E5A (Wed 8-12),BEng,Department of Electrical Engineering,"
The purpose of the course is to introduce electromagnetics so that
the basic laws, which in the course are applied to idealized
special cases, can be used to estimate the behavior of realistic
electrical systems. In addition to classical electromagnetism, the
students should be able to make simple calculations on transmission
line circuits which are important e.g. for high-speed digital
electronics or microwave engineering. Additionally, the students
should be trained in combining theoretical considerations with
quantitative calculations from computer programs such as Matlab and
laboratory measurements generated using standard instruments such
as, e.g., oscilloscopes, signal generators and network analysers.
Finally, the course is intended as the first in a sequence for
students pursuing a carrier in antenna- or microwave circuit
design. 
","Describe waves and wave propagation mathematically in the time
domain as well as by use of phasors and be able to translate
between the two representations. Calculate propagation and attenuation in transmission lines
based on physical parameters such as dimensions and dielectric
properties. Calculate voltages, currents, transmitted power, etc. in
cascaded transmission line circuits with parallel load (e.g.
stubs), with time-harmonic signals. Calculate input and output voltages and currents in
transmission line circuits with transient signals. Explain the electrostatic field quantities and the constitutive
parameters. Explain Coulomb’s law, Gauss’ law and the concepts of
potential, capacitance, and polarization. Use knowledge of the behaviour of the electrical field in
conductors and dielectrics together with the boundary conditions
for calculation of the capacitance of idealized special geometries.
Estimate capacitance for realistic structures by analo Explain the magnetostatic field quantities and the constitutive
parameters. Explain Biot-Savart’s law, Gauss’ law for magnetism and
the concept of inductance. Use the knowledge of the behaviour of the magnetic field around
conductors together with the boundary conditions for calculation of
the inductance of idealized special geometries. Estimate inductance
for realistic structures by analogy. Use Faraday’s law to calculate induced voltage in simple
idealized geometries. Use this to estimate desired or undesired
inductive coupling. Give a mathematical description of plane waves in homogeneous
media and explain the concept of polarization. Calculate reflection and transmission coefficients for plane
waves at normal incidence to plane, homogeneous conductors and
dielectrics. Explain plane and perpendicular polarisation and
choose corresponding Fresnel reflection coefficients. Use common instruments such as, e.g., oscilloscopes, network
analysers, and signal generators. Use mathematical software e.g.
Matlab in support of calculations. Assess and analyse models by
comparison with measurements and vice versa. Apply Danish as well
as English electro-technical terminology","
- Waves and phasors, frequency, wave number, attenuation constant,
propagation constant.

- Transmission lines, transmission line parameters (R’, L’, G’,
C’), telegraphers equations, characteristic impedance, reflection
coefficient, transmission coefficient, standing wave ratio, input
impedance, power flow, Smith chart, matching, stub matching,
quarter wave transformer, transients.

- Coaxial cable, two-wire transmission line, micro strip
transmission line.

- Vector analysis, gradient, divergence, curl, cylindrical
coordinates, spherical coordinates.

- Electrostatics, electrical field quantities, charge and charge
density, dielectric constant, Coulomb’s law, Gauss’ law,
(electrical) potential, perfect conductor, conductor with loss,
isolators (dielectrics), polarisation, boundary conditions,
capacitance.

- Magnetostatics, magnetic field quantities, the Biot-Savart law,
Gauss law for magnetostatics, magnetic materials and permeability,
boundary conditions, inductance.

- Induction, Faraday’s law, Lenz’ law, ideal transformer, mutual
inductance.

- Maxwell's equations.

- Plane waves, intrinsic impedance, propagation constant, linear,
circular, and elliptical polarisation, reflection coefficient,
parallel and perpendicular polarisation, Fresnel reflection
coefficients, Brewster angle, Poynting vector and power flow.

- Laboratory measurements, oscilloscope, signal generator, network
analyzer.

- Simulation, Matlab.

Furthermore, the students should work with sensors based on an
electromagnetic principle as capacitive, inductive, or emf sensors,
so that they can be used in a measurement or communication system
in the semesters CDIO project. 
","01902,62732","
Michael Mattes"
,,,,,,,,,,,,
31036 , Electrical Energy Systems,Danish , 10 ECTS , 2016/2017 ,F4A (Tues 13-17) and June,BEng,Department of Electrical Engineering,"
The main goal of the course is

- to give the student a basic understanding of the electric power
system, i.e. the production, distribution and control of the
electric energy as well as insight into rectifiers with and without
galvanic separation.

- also to train the student in handling projects and team work,
involving all aspects of CDIO- going from generating ideas all the
way to functional models. 
","perform basic calculations for ac grids calculate complex power condition in single and three phase
systems handle electrical equivalents for cables, transformers and
induction manchines explain functional and operational aspects of the electric
power grid and its components define and use mean and rms values for sinusoidal currents and
voltages explain the function of coils and capacitors in power
electronics curcuits determine the temporal trace of voltages and currents and
derive the transfer function of fundamental converter
topologies use transformers in galvanic separated topologies be able to exploit the acquired professional skills in building
a larger energy converting system be able to divide task into subtasks and be able to organize a
structured solution in a team of up to 10 people document the results in precise and condensed manner e.g. on a
poster analyse a larger system with the aim of optimizing the system
operation","
Fundamental concepts relating to single phase and three phase ac
technologies as well as power and voltages condition in the
electric power grid.

Further, the following grid components are treated: overhead lines
and cables, synchronous generators, induction generators and
transformers.

Fundamental converter topologies with and without galvanic
separation, and related to this, capacitors and coils, mean and rms
values and the single phase transformer.

Project involving a model electrical energy system. 
","31022,31032","
Chresten Træholt,
Claus Kjærgaard"
,,,,,,,,,,,,
31039 , Power electronics in energy systems,English , 5 ECTS , 2016/2017 ,F1B (Thurs 13-17),BEng,Department of Electrical Engineering,"
The goal of this course is to provide the students with a
fundamental understanding of power electronics converters such as
DC-DC converters, active rectifiers and DC-AC inverters and their
corresponding control methods in single- and three-phase power
systems. Further to provide the students a fundamental knowledge of
the use of power electronics converters for electrical power
conversion in energy systems for example three-phase motor drive
and renewable energy generation. 
","Identify the most common applications of DC-DC converters Identify the most common applications of single-/three-phase
PWM rectifier/inverter Classify converter types Classify PWM modulation schemes Determine fundamental parameters for DC-DC converters and DC-AC
inverters based on calculation and simulation Explain determining parameters of passive and active components
with respect to power converters Understand regulating both active power and reactive power Explain, calculate and evaluate losses and power conversion
efficiency Explain operation principles of frequency converters Explain operation principles of V/Hz control of three-phase AC
motors","
Overview of power Electronics

Solar cells, batteries, rotating machines, and power grid

DC-DC converters w/o galvanic isolation

Single- and three-phase PWM inverters and rectifiers

Modulation strategies (PWM)

Calculation of voltage drop, power loss and efficiency

Frequency converters

Three-phase V/Hz control of AC machines

Single-/​multiple-quadrant operation 
",None,"
Zhe Zhang"
,,,,,,,,,,,,
31070 , Hands,English , 5 ECTS , 2016/2017 ,January,MSc,Department of Electrical Engineering,"
The term Smart Grid is used to describe the vision of a future
energy system that incorporates a large share of renewable energy
sources into a highly automated, flexible and reliable system.

Examples of Smart Grid technologies are household appliances that
react intelligently to varying system conditions, automatic
mechanisms for coordination of resources, and advanced information
exchange systems.

The objective of this course is to gain hands-on experience with
technologies used in such systems, by designing, implementing and
testing a Smart Grid application on a microcontroller system.

The intelligent energy systems are used as a case for the
application, but no previous experience with energy systems is
required from the students. 
","understand the basic concepts of Smart Grids analyze the requirements of a Smart Grid application design an application that uses inputs and outputs to interact
with a physical device design a user interface for local control and monitoring design a communication interface for remote control and
monitoring implement the application on a microcontroller system design a test procedure that utilizes laboratory facilities to
validate the function of the application perform tests in the laboratory document the entire process and the developed
application","
Most of the time, the students will work in the laboratory in
project teams.

Introductory lectures are given on:

- Smart Grids and related ICT technology

- specific Smart Grid applications (projects)

- the ARM microcontroller system and its peripherals (A/D and D/A
converters, Ethernet adapter, LCD display etc.)

- the integrated development environment IAR Embedded Workbench

- communication systems in intelligent energy systems

- user-centered design 
","02102,31004,02101,30010","
Chresten Træholt,
Venkatachalam Lakshmanan,
Yi Zong,
Sergejus Martinenas"
,,,,,,,,,,,,
31200 , Fundamentals of Acoustics and Noise Control,English , 5 ECTS , 2016/2017 ,E3A (Tues 8-12),MSc,Department of Electrical Engineering,"
To introduce the participants to fundamental acoustic concepts and
to give the necessary background for more specialised courses in
acoustics, ranging from acoustic communication and virtual reality
to control of noise and vibration. 
","describe fundamental acoustic concepts such as the sound
pressure, the particle velocity, the speed of sound, the
characteristic impedance of the medium describe and interpret plane sound fields, including standing
waves describe and interpret the sound field generated by monopoles
and dipoles describe the fundamental properties of transducers calculate sound transmission between two fluids explain the effect of a reflecting plane explain how sound is measured, describe the decibel scale,
A-weighted levels, and octave and one-third octave bands explain the usefulness of the concept of sound power and
describe how this quantity is used describe and interpret resonances and modes in rooms describe and interpret acoustic energy balance considerations
in a room describe fundamental properties of our hearing, hearing
threshold, masking calculate sound transmission through simple
constructions","
Fundamental acoustic concepts and measuring units. Human hearing
and speech. Measurement and evaluation of sound, A-weighting, time
constants and equivalent sound pressure level. Octave and one-third
octave band analyses of noise. Addition of noise from uncorrelated
sound sources. The use of complex notation. Energy density, sound
intensity and sound power. Impedance concepts. Plane and spherical
sound waves, interference fields. Reflection and transmission of
sound. Sound radiation from monopole and dipole sources, sound
radiation from a piston in a baffle. Normal modes in a rectangular
room. The diffuse sound field, the energy balance equation in a
room and the reverberation time. Sound absorbing materials. Natural
modes and resonances in simple mechanical and acoustic systems.
Structure-borne sound, vibration isolation of machinery. Sound
insulation of single and double constructions. Elektrodynamic
loudspeakers 
","01007,01005","
Efren Fernandez Grande,
Finn T. Agerkvist"
,,,,,,,,,,,,
31220 , Electroacoustic Transducers and Systems,English , 10 ECTS , 2016/2017 ,"E2 (Mon 13-17, Thurs 8-12)",MSc,Department of Electrical Engineering,"
To give the student knowledge on elements in the audio chain:

stereo recording, microphone, loudspeaker units and systems. 
","Explain the principles of analogies between electrical,
mechanical and acoustic sytems Draw equivalent circuits for simple mechanical and acoustic
systems Apply the analogies when analyzing and modelling electro
acoustic devices Explain the two basic techniques in stereo recording Predict the frequency response of dynamic- and condenser
microphones and explain the influence of each microphone component
in this response Predict the frequency response of electro dynamic loudspeakers
and explain the influence of each loudspeaker component on the
response Explain the effects of closed and vented enclosures on
frequency response and impedance of the loudspeaker and to design
such enclosures for a given loudspeaker unit Explain what the common problems in crossover filters design
are and how to solve them Select a suitable microphone stereo setup in a simple practical
recording situation Make a frequency analysis of simple linear circuits in
PSpice","
Analogies between mechanical, acoustical and electrical systems.
Transducers: loudspeakers, microphones and accelerometers; theory,
construction, directivity, radiation, measurements and calibration.
Theory of two-channel stereo. Microphone and loudspeaker
configurations.

The exercises comprise the measurement of microphones and
loudspeakers and stereo recording. PSpice modelisation is used for
the practice problems.

The course also contains a project on loudspeaker system design. 
","31004,31605,31003,31200","
Finn T. Agerkvist,
Vicente Cutanda Henriquez"
,,,,,,,,,,,,
31221 , Advanced loudspeaker models,English , 5 ECTS , 2016/2017 ,January,MSc,Department of Electrical Engineering,"
To introduce advanced elements in loudspeaker models in order to
improve the validity of the models at higher levels. To describe
the dominant sources of distortion in the loudspeaker and to
introduce methods for compensation of the distortion.

To introduce models for microloudspeakers as used in mobile phones.

Finally To introduce models for predicting the vibration pattern of
the loudspeaker diaphragm. 
","Explain the fundamental differences between linear and
non-linear systems Account for the dominant nonlinearities in electrodynamic
loudspeakers and to predict how a given nonlinearity will affect
the movement of loudspeaker Explain how the loudspeaker behaves in the non-linear mode,
including harmonic spectrum and DC position Compare and apply techniques for modelling physical systems in
discrete time Carry out measurements and calculation of common measures of
distortion Account for typical effect in diaphragm movement at high
frequencies Explain how the linear and nonlinear parameters of micro
speakers differ from those of normal speakers Explain the fundamentals of non-linear compensation","
Nonlinear components in loudspeakers.

Compensation of distortion

Microloudspeakers

Loudspeaker diaphragm vibrations 
",31220,"
Finn T. Agerkvist"
,,,,,,,,,,,,
31230 , Acoustic Communication,English , 10 ECTS , 2016/2017 ,"E1 (Mon 8-12, Thurs 13-17)",MSc,Department of Electrical Engineering,"
The aim of the course is to provide fundamental knowledge to the
participants of the elements of an acoustic communication. The
communication could be e.g. two persons talking together, listening
to music, or the listening for a door bell. Thus the course
comprises topics like hearing (anatomy, physiology), hearing loss,
perception of sound (psychoacoustics), speech and speech
intelligibility. The aim of the course is to provide knowledge and
comprehension to the participants on these topics and their mutual
relations for both normal hearing and hearing impaired persons.
Through lectures the participants will learn about the special
psychoacoustic measurements methods and will apply these methods in
laboratory exercises. Finally group work and writing of reports are
part of the course objectives. 
","Describe the structure of the ear and explain the function of
the various components Sketch the hearing threshold in a free field (dB SPL-Frequency)
and interpret the course of the curve Describe classical and adaptive psychometric methods, signal
detection theory, and explain a psychometric function Define the concept of loudness and loudness level and describe
Stevens’ power law Explain the concept of masking (simultaneous-, forward-,
backward-) and it’s relation to the function of the inner ear Explain how speech is produced and describe the physical
properties of the speech signal Define the concept of speech intelligibility, explain how
different factors influence intelligibility, and discuss methods
for measuring and calculation of speech intelligibility (AI, SII,
STI) Describe the principles of sound localization and sketch
results of localization measurements Discuss different diagnostic techniques, classify different
hearing loss types by means of an audiogram, and explain the
implication of a hearing loss for the perception of sound Write an exercise report that is understandable for next years
students","
The anatomy and physiology of the ear. Psychophysical principles
and psychoacoustic measuring methods. Psychoacoustics (hearing
threshold, loudness, masking, etc). Speech and speech
intelligibility. Hearing impairment. Principles of hearing aids and
hearing aid fitting. Hearing conservation and hearing protectors.
Noise annoyance. 
",31200,"
Ewen MacDonald"
,,,,,,,,,,,,
