COURSE NUMBER,COURSE NAME,LANGUAGE OF INSTRUCTION,CREDIT LOAD,YEAR,SCHEDULE,COURSE TYPE,DEPARTMENT,GENERAL COURSE OBJECTIVES,LEARNING OBJECTIVES,CONTENT,RECOMMENDED PREREQUISITES,COURSE RESPONSIBLE
10304 , Experimental Surface Physics,English , 10 ECTS , 2016/2017 ,"F3 (Tues 8-12, Fri 13-17)",MSc,Department of Physics,"
To give the students knowledge of the atomic-scale physics
prevailing at the interface between solid and gas/liquid phases.
This is of fundamental importance if you want to understand
technologically important processes, e.g. catalysis, adhesion,
tribology, and mechanical and chemical properties of new
nanomaterials. The course aims at giving the students an overview
of the most applied methods and an introduction to how these can be
used to study realistic problems within the surface physics area.
The student will during the course independently perform
experiments on advanced equipment, such that hands-on experience
with some of the methods is acquired. An important part of this
course is the combination of experiments, report-writing, and oral
presentations in order to give the students experience with
evaluating the individual methods for solving specific problems and
to read the relevant literature. 
","Explain phenomena which are responsible for the structure and
composition of surfaces. Explain the physical phenomena which are responsible for
adsorption on surfaces. Explain general tendencies in surface reactivity and surface
energy. Determine nanoparticle structure and stability under vacuum and
in reactive atmospheres. Analyze catalytic processes by simple models. Explain the most important catalytical processes and describe
the most significant technical obstacles. Explain how nanoparticles in the future may provide solutions
for future energy production. Explain in detail the principles of methods for surface
analysis, and why they are surface sensitive. Determine which method is most appropriate for a certain
problem like for example determining the surface composition. Perform a critical and comparative evaluation of results
obtained with various surface sensitive methods. Evaluate the different methods on the obtainable results, time,
and investments.","
Quantum mechanical description of the physics and chemistry of
clean surfaces, including the electronic and structural properties.
Description of electron structure of adsorbates of the surface,
epitaxy, adsorption/desorption mechanisms, chemisorption and the
dynamics of chemical and physical reactions. Description of the
prerequisite for experimental studies of these surfaces under
well-defined conditions - this is ultra-high vacuum (UHV) with base
pressures below 10E-13 bar. The most popular methods, e.g. x-ray
photoelectron spectroscopy (XPS), Auger electron spectroscopy
(AES), ion scattering spectroscopy (ISS), low energy electron
diffraction (LEED), electron microscopy (EM) and scanning probe
microscopy (AFM and STM) will also be described. Furthermore,
fundamental aspects of heterogeneous catalysis especially in
connection with the future energy production will be analysed. All
the above-mentioned methods will be discussed by use of a
combination of lectures, exciting new research and application
papers, and experiments followed by reports and oral presentations.
A visit to the industry is also enclosed. 
","10303,10300","
Ib Chorkendorff,
Sebastian Horch"
,,,,,,,,,,,,
10305 , Advanced Solid State Physics,English , 5 ECTS , 2016/2017 ,E2B (Thurs 8-12),MSc,Department of Physics,"
To provide a more advanced understanding of the electronic
structure of solid state and nanostructured systems with emphasis
on the phenomena which require a description beyond the
single-particle approximation, e.g. excites state properties and
correlation effects. The course will enable the student to read the
modern litterature and undertake smaller research projects in the
field. 
","Define and discuss the concept of the density response function
of a system of interacting electrons and its relation to the
elementary electronic excitations in the system. Formulate and derive the analytic properties of general
response functions including the Kramer-Kronig relations between
the real- and imaginary parts, and the f-sum rule. Discuss and characterize the various types of elementary
electronic excitations in a solid state system including collective
excitations, bound electron-hole, and single-particle
excitations. Explain the the key features of the density response function
of the homogeneous electron gas. Describe the connection between the microscopic dielectric
function and the density response function. Relate the microscopic dielectric function to the macroscopic
optical constants of a solid such as the absorption coefficient and
reflectivity, and discuss the role of local field effect. Define the single-particle Green function and the self-energy,
and discuss its relation to the band structure of a solid. Discuss the GW and the static COHSEX approximations to the
self-energy, and explain the effect of screening on the band gap of
a semiconductor. Discuss the Bethe-Salpeter equation for the four-point response
function and use it to derive an effective Hamiltonian for the
neutral excitations. Discuss the exchange-correlation kernel of time-dependent
density functional theory. Explain the concept of an excitonic wave function and describe
simple models for the exciton binding energy.","
(Density) response functions and its relation to the dielectric
function, quantum expression for the response function, retarded
functions and Kramers-Kronig relations, static and dynamical
screening within the random phase approximation (RPA), plasmons and
plasmon-polaritons, local field effects in inhomogeneous systems,
band structure and quasi-particles, single-particle Green's
functions and self-energy , the GW approximation to the electron
self-energy, the Bethe-Salpeter equation for optical excitations,
time-dependent density functional theory, the exchange-correlation
kernel, excitons. 
","10112,10303","
Kristian Sommer Thygesen"
,,,,,,,,,,,,
10314 , Magnetism and Magnetic Materials,English , 5 ECTS , 2016/2017 ,F5A (Wed 8-12),MSc,Department of Physics,"
The aim of the course is to give the student a broad knowledge of
magnetism and magnetic materials and related experimental
techniques. 
","Describe why materials have magnetic moments Describe why and how magnetic moments in materials
interact Calculate the magnetic response of a magnetic material to an
external magnetic field Describe and visualize the different types of magnetically
ordered structures (ferro-, antiferro-, and ferrimagnets) Calculate the magnetic phase transition temperature in the mean
field model Derive an expression for magnetic excitations (spin waves) Explain formation of magnetic domains and single-domain
properties Explain the particular magnetic properties of
nanoparticles Describe the principles in a series of magnetic measurement
techniques: magnetization measurements, magnetic spin resonance
techniques (including NMR), Mössbauer spectroscopy, neutron
scattering, magnetic force microscopy, electron
holography","
Magnetic moments in solids, magnetic interaction, magnetic
ordering, ferromagnetism, ferrimagnetism and antiferromagnetism,
magnetic model systems, magnetic domains, spin waves, magnetic
nanoparticles, magnetic materials, nuclear magnetism, NMR,
magnetization measurements, Mössbauer spektroscopi, neutron
scattering, magnetic force microscopy, electron holography, and
magneto caloric effect 
",10303,"
Cathrine Frandsen,
Mikkel Fougt Hansen,
Marco Beleggia,Kim Lefmann"
,,,,,,,,,,,,
10315 , Magnetism and Magnetic Materials ,English , 10 ECTS , 2016/2017 ,F5A (Wed 8-12),MSc,Department of Physics,"
The aim of the course is to give the student a broad knowledge of
magnetism and magnetic materials and related experimental
techniques. 
","Describe why materials have magnetic moments Describe why and how magnetic moments in materials
interact Calculate the magnetic response of a magnetic material to an
external magnetic field Describe and visualize the different types of magnetically
ordered structures (ferro-, antiferro-, and ferrimagnets) Calculate the magnetic phase transition temperature in the mean
field model Derive an expression for magnetic excitations (spin waves) Explain formation of magnetic domains and single-domain
properties Explain the particular magnetic properties of
nanoparticles Describe the principles in a series of magnetic measurement
techniques: magnetization measurements, magnetic spin resonance
techniques (including NMR), Mössbauer spectroscopy, neutron
scattering, magnetic force microscopy, electron holography Do an in-depth study equivalent of 5 ECTS points on magnetism
and magnetic materials using one of the topics/techniques presented
in the course","
Magnetic moments in solids, magnetic interaction, magnetic
ordering, ferromagnetism, ferrimagnetism and antiferromagnetism,
magnetic model systems, magnetic domains, spin waves, magnetic
nanoparticles, magnetic materials, nuclear magnetism, NMR,
magnetization measurements, Mössbauer spektroscopi, neutron
scattering, magnetic force microscopy, electron holography, and
magneto caloric effect 
",10303,"
Cathrine Frandsen,
Mikkel Fougt Hansen,
Marco Beleggia,Kim Lefmann"
,,,,,,,,,,,,
10333 , Physics of Sustainable Energy,English , 5 ECTS , 2016/2017 ,E4B (Fri 8-12),MSc,Department of Physics,"
To give the student insight into the physics behind different
sustainable energy technologies for energy harvesting, storage and
conversion, and their limitations determined by the laws of nature.

","Describe the possible sources of sustainable energy and analyze
the amount of energy available in them Describe the climate models and identify the assumptions
behind Explain the principles behind different energy harvesting
methods Describe different methods for energy storage and conversion
and explain the principles behind them Estimate and calculate the limitations of e.g. storage capacity
and energy conversion efficiency based on physical principles Critically read, understand and analyze current literature to a
level where you can evaluate its findings Formulate your own project related to sustainable energy and
determine the relevant data for the analysis Analyze the link between different energy harvesting and
storage methods. The student should be able to determine in which
situations different methods are working together and in which
situations they are competitive","
The course will provide an overview of the energy situation, energy
sources and demand. It will go into detail with solar spectrum,
climate, harvesting of solar energy, photo synthesis, fuel/energy
conversion and energy storage. For understanding the principles
behind these topics we will apply elements of quantum mechanics,
thermo dynamics, classical mechanics, material science,
semi-conductor physics and surface science. 
","10034,10303","
Brian Seger,
Ifan Stephens"
,,,,,,,,,,,,
10337 , Theoretical microfluidics,English , 5 ECTS , 2016/2017 ,E4A (Tues 13-17),MSc,Department of Physics,"
This course, aimed at both theorists and experimentalists, will
give you an introduction to some advanced theoretical topics in the
field of microfluidics, i.e., the dynamics of fluid flow at the
sub-millimeter scale under the influence of different physical
forces. Contemporary microfluidics plays a crucial role in
uncovering new physical phenomena of fluid flows in confined
geometries, in designing lab-on-a-chip systems for integrating
entire biological and chemical laboratories on single microchips,
and in developing theoretical models and experiments at the
interface between physics and biology to understand, say, the sap
flow in trees, the biophysics of individual cells, and the swimming
and feeding mechanisms of micro-organisms such as aquatic
zooplankton. The course will give you a strong theoretical basis
and a good starting point for subsequent M.Sc. project work at,
e.g., DTU Physics, DTU Nanotech, and DTU Aqua on fundamental fluid
dynamics, lab-on-a-chip systems, or biological fluid dynamics. 
","Derive the Navier-Stokes (NS) equation and continuity equation
from basic principles Solve the NS equation for microfluidic flows including inertial
effects Explain the physics of important dimensionless numbers in
microfluidics Derive and solve the NS equation of acoustically driven fluid
flows using 1st- and 2nd-order perturbation theory Set up and solve models of simple advection-diffusion
problems Describe forces on a particle in a laminar fluid flow Explain the basic physical processes behind biological liquid
pumps Solve the NS equation for microfluidic flows in and between
living cells Formulate and apply the principles behind optimization of
biological transport networks Derive the Stokeslet and stresslet solutions as models of
aquatic micro-organisms Explain and apply the principle of drag-based swimming and
resistive force theory","
The course consists of three parts, which all let you develop both
your theoretical skills and physical understanding. You will learn
the basic theory of fluid dynamics, i.e., the transport equations
for mass (the continuity equation), momentum (the Navier-Stokes
equation), and energy (the heat equation). You will get acquainted
with some of the dimensionless numbers that characterize fluid
flows, and you will learn how to use them for setting up and
analysing models in microfluidics. Progressively, you will learn
methods to handle complex microfluidic effects, including unsteady
forces, inertial effects at low-to-moderate Reynolds numbers,
compressibility, and interactions between a solid elastic
structure, say, a cell, and a surrounding fluid in motion. In the
first part of the course you will learn about ultrasound driven
fluid motion with applications in lab-on-a-chip systems. In the
second part of the course you will learn about vascular flows in
animals and plants, and about the design principles behind
biological transport networks. In the third part of the course you
will learn about the fluid dynamics of swimming and feeding
micro-organisms. You will become familiar with the physics of
swimming at low Reynolds numbers and learn how micro-organisms use
flagella or cilia to swim or to drive feeding currents. 
",,"
Anders Peter Andersen,
Henrik Bruus,
Kaare Hartvig Jensen"
,,,,,,,,,,,,
10346 , Continuum Physics,English , 5 ECTS , 2016/2017 ,F2A (Mon 13-17),MSc,Department of Physics,"
The aim of the course is to give the student a basic understanding
of the physics of spatially extended media consisting of solid
materials, liquids, and gasses. The course can be regarded as a
natural extension of classical mechanics (including
thermodynamics/​statistical mechanics) or be the basis for more
specialized studies in elasticity, hydrodynamics, microfluidics,
biophysics, and complex systems. 
","Explain the theory of hydrostatic equilibrium, including
pressure, buoyancy, stability of a floating object, hydrostatic
shapes and surface tension. Explain the concepts of strain and stress in elastic materials
and explain the derivation of Cauchy’s equilibrium equation and
Hooke’s law. Explain the derivation of Euler’s equation, Navier-Stokes
equation, and the equation of continuity for incompressible fluid
flows. Formulate and apply the Bernoulli equation and the equations
for potential flow Derive the dispersion relation for linear surface waves in
hydrodynamics. Explain the concepts vorticity and circulation and describe
important vortex models. Apply linear stability theory and explain the Rayleigh-Plateau
instability. Apply dimensional analysis to make estimates in continuum
physics. Solve analytic problems from selected models in continuum
physics. Use numerical methods to solve ordinary, linear and nonlinear
differential equations in fluid mechanics and theory of
elasticity. Explain the assumptions leading to Prandtl’s boundary layer
equations. Describe flows at low Reynolds number and the meaning of the
scallop theorem.","
Introduction of velocity field and pressure field. Hydrostatic
problems with special focus on surface tension. Strain and stress
in elastic media. The equations for linear elasticity. Bending and
buckling. Ideal, incompressible fluid motion (the Euler equation).
Viscosity and Navier-Stokes equation. Potential flow theory and
surface waves. Boundary layers. Vortices. Hydrodynamical
instabilities. Creeping flows. 
",,"
Tomas Bohr,
Anders Peter Andersen"
,,,,,,,,,,,,
10347 , Introduction to Biophysics,Danish , 5 ECTS , 2016/2017 ,E5B (Wed 13-17),BSc,Department of Physics,"
To provide the students with a basic knowledge of methods from
physics that can be applied with success to gain knowledge about
biological systems, ranging from single molecules to cells.

In addition, research activities of biological physics at the
Department of Physics and Department of Nanotechnology will be
presented through guest lectures. 
","Explain basic constituents (molecules, organelles) of
procaryotic and eucaryotic cells. Explain passive and active transport in biological
systems. Explain basic principles of motility in selected biological
systems, in particular at low Reynolds number Recognize and explain relevant biological terms. Knowledge of
typical length- and timescales for cellular (biological)
processes Calculate properties of simple biophysical systems, based on
arguments from basic mechanics, thermodynamics, electrodynamics and
statistical physics. Explain which physical principles that may be applied to give a
simple description of a given biological system Explain the physical principles behind experimental methods for
determination of forces and structures, applied in biological
physics. Describe and discuss biophysical experiments that apply one or
several of the methods mentioned above. Explain ion-transport across membranes via equivalent
electrical curcuits and describe how these can be used in the
description of propagating nerve signals","
Basic cellular physiology. Thermal movement and diffusion. Active
versus passive transport. Low Reynolds-number dynamics Entropic
forces, temperature. Enzymes and molecular machines. Basic
electrophysiology. Examples of experimental methods in modern
biophysics. 
","27002,01035,10034,10024,10036,10022,10033","
Kirstine Berg-Sørensen"
,,,,,,,,,,,,
10380 , Quantum Optics,English , 10 ECTS , 2016/2017 ,"E4 (Tues 13-17, Fri 8-12)",MSc,Department of Physics,"
Modern optics and photonics more and more use quantum physics in
the description of optical processes and systems. This is primarily
a result of the advances in laser technology and the
miniaturisation of optical nano structures, where

interactions between small numbers of atoms or even a single atom
and photons occur.

The goal is to give the student a good general background and a
thorough basis for further work within quantum optics. 
","Understand the quantization of the electromagnetic field and
apply this to describe the vacuum field as well as the coherence
properties of optical quantum states. Explain the properties of mixed and pure optical quantum states
and calculate measurable quantities of such states. Discuss different mathematical representations of quantum
states of light such as the Fock state representation, the position
representation and the Wigner function formalism. Describe different measurement techniques in quantum optics
such as homodyne detection and photon counting. Explain the fundamental atom-light interaction using the
semi-classical and the fully quantum mechanical approach
(Jaynes-Cummings model). Understand open, dissipative quantum systems and in particular
cavity quantum electrodynamics. Discuss how a quantum system can be protected from decoherence
and disentanglement. Discuss different optical elements that transform quantum
states such as the beam splitter, the parametric amplifier and the
phase plate. Discuss and perform calculations on modern applications of
quantum optics including quantum metrology, quantum information
processing and quantum opto-mechanics. Understand advanced experiments in quantum optics.","
The course introduces the student to the semi-classical description
as well as to the full quantum theoretical description of the
interaction between matter and nano structures. These methods are
used to describe the light field in various quantum optical states
and to describe absorption, emission and photo detection. In the
final part of the course we work with the quantum optical
description of interference and coherence as well as with noise
phenomena in detectors and lasers. We also study the generation and
measurement of uniquely quantum optical phenomena such as squeezed
light and entanglement. The student is also introduced to the
quantum mechanical coupling between light and nano structures in
optical micro cavities as well as applications of quantum optics in
metrology and informatics. The student is thus introduced to the
most current research in quantum optics. In addition to the
lectures the students will apply some of the concepts studied in
theory by carrying out quantum optical experiments. 
","34020,10102","
Ulrik Lund Andersen,
Alexander Huck,
Jesper Mørk,
Niels Gregersen"
,,,,,,,,,,,,
10384 , Quantum information,English , 5 ECTS , 2016/2017 ,F3A (Tues 8-12),MSc,Department of Physics,"
Quantum mechanics tells us that an object can attain two values
simultaneously! This leads to the definition of a quantum bit which
can be used to realize new types of information protocols that
would be impossible with classical bits. One striking example is
the possible realization of a futuristic quantum computer which
allows for exponentially faster computation than the traditional
computer. The aim of this course is twofold: 1) to introduce you to
the theory of quantum information thereby providing you with an
understanding of the function of different quantum information
protocols such as quantum cryptography, quantum teleportation and
quantum computing and 2) to introduce you to the new quantum
nanotechnologies that can be used to implement quantum information
protocols. 
","Understand the notion of quantum superposition in the context
of quantum information. Understand how to treat generalized measurements in quantum
mechanics. Describe the difference between continuous variable and
discrete variable quantum information processing. Gain a deeper understanding of the concept of entanglement and
its uses. Discuss the concept of quantum communication including quantum
teleportation, quantum distillation and quantum repeaters. Describe the protocol of quantum key distribution for Gaussian
and qubit states. Explain the main concepts of quantum computing including the
algorithms of Shor and Grover. Discuss different approaches to quantum computing. Describe different quantum technologies for quantum information
processing.","
A concept of quantum information will be introduced and discussed.
Starting from the basic principles of quantum mechanics
(superposition principle, unitary transformations, and
measurements), qubit states, Gaussian states, entangled states and
mixed states will be rigorously discussed. Various quantum
information protocols such as quantum key distribution, quantum
teleportation, quantum distillation, and quantum purification will
be introduced. Another subject is quantum computing which includes
the discussion of different single mode and two modes gates as well
as Shor’s factorization algorithm and Grover’s search algorithm.
The different physical technologies for the implementation of
quantum information processing will be discussed. This includes
light, ions, condensed matter, opto-mechanics, and superconducting
circuits. 
",10102,"
Ulrik Lund Andersen,
Alexander Huck"
,,,,,,,,,,,,
