COURSE NUMBER,COURSE NAME,LANGUAGE OF INSTRUCTION,CREDIT LOAD,YEAR,SCHEDULE,COURSE TYPE,DEPARTMENT,GENERAL COURSE OBJECTIVES,LEARNING OBJECTIVES,CONTENT,RECOMMENDED PREREQUISITES,COURSE RESPONSIBLE
11450 , Basic Course in Road Pavements,English , 5 ECTS , 2016/2017 ,F4B (Fri 8-12),BSc,Department of Civil Engineering,"
This course serves as an introduction to the design and
construction of asphalt pavements; its main objective is exposition
of the students to the scope and complexity of the pavement
engineering discipline. 
","Classify pavement types Understand expected pavement roles Use basic pavement terminology adequately and correctly Appreciate the importance of proper compaction of pavement
layers Perform basic pavement mechanics calculations involving
material properties Perform basic pavement mechanics calculations involving traffic
loads Identify common asphalt pavement distress types List probable causes of common distress types in asphalt
pavements","
The following topics are covered:

(i) Recap of soil mechanics concepts;

(ii) Pavement roles and functions;

(iii) Pavement types, definitions and terminology;

(iv) Overview of asphalt pavement construction process;

(v) Pavement materials - resilient modulus, linear viscoelasticity;

(vi) Traffic loads;

(vii) Pavement mechanics - elastic half-space;

(viii) Environmental aspects;

(ix) Pavement distress - structural and functional;

(x) Design methods and approaches for roads and airport pavements. 
",None,"
Eyal Levenberg"
,,,,,,,,,,,,
11451 , Highway Pavements,English , 5 ECTS , 2016/2017 ,E1B (Thurs 13-17),MSc,Department of Civil Engineering,"
This course covers advanced analysis, design, and construction
topics related to both concrete and asphalt pavements. Its main
objective is to elevate and enrich the knowledge level of the
students in order that they could understand the basic assumptions
and limitations underlying existing state-of-the-practice methods,
and also that they would be able to appreciate and critically
evaluate new ideas. 
","Better understand how pavements behave under service
conditions Identify construction and design parameters that affect
performance Compute mechanical responses by means of classical plate
theory Compute mechanical responses by means of layered elasticity
theory Identify common concrete pavement distress types Perform inverse analysis of pavement layer properties Employ linear viscoelastic theory for material
characterization Utilize linear viscoelastic theory for structural
modeling","
General mechanics background (10%):

(i) Deformation, rotation and strain, compatibility equations,
traction and stress;

(ii) Equilibrium equations, linear elastic constitutive equations,
boundary value problems;

Concrete pavements (45%):

(iii) Introduction and terminology;

(iv) Overview of construction process;

(v) Mechanics of slab-on-grade;

(vi) Concrete properties and environmental effects;

(vii) Joints - roles, types, arrangement, design, sealing;

(viii) Common distress modes and causes;

Asphalt pavements (45%):

(ix) Layered elastic half-space - problem formulation and solution
method;

(x) Elastostatic FWD backcalculation;

(xi) Linear viscoelastic solids - Boltzmann superposition, creep
and relaxation;

(xii) Interconversion and Laplace transform

(xiii) Frequency domain - dynamic modulus and phase angle;

(xiv) Time-temperature superposition;

(xv) Spectra and mechanical analogs;

(xvi) Layered viscoelastic half-space - correspondence principle. 
",None,"
Eyal Levenberg"
,,,,,,,,,,,,
11462 , Engineering Geology – an introductory course,Danish , 5 ECTS , 2016/2017 ,F3B (Fri 13-17),BSc,Department of Civil Engineering,"
- To achieve insight into engineering geological conditions in
Denmark.

-To give the student insights into how the Earth and the various
systems and spheres, the lithosphere, hydrosphere, cryosphere,
atmosphere and biosphere work and and relate. 
","know basic geological and hydrogeological definitions:
minerals, soil, rocks, porosity, hydraulic conductivity, etc. demonstrate knowledge of commonly used laboratory methods for
the characterization of sediments demonstrate knowledge and understanding of the geological
conditions in Denmark know the geological maps and relevant databases for bore holes
and ground water quality in Denmark and be able to use them for
engineering purpose know the processes which created the Danish sediments and the
Danish landscape knowledge of geological processes that affect humans and
infrastructure: landslides, coastal erosion, volcanism, earth
quakes have knowledge of environmental aspects of the use of
geological raw materials in sedimentary areas have knowledge of geological raw materials, water,
minerals know the relationship between natural klimatic oscilations and
geology have knowledege of prominent Danish groundwater reservoirs,
including their hydraulic properties understand the relationship between hydraulic properties and
ground water flow, including know concepts as groundwater magasin
and catchment area describe relationship between accumulation of groundwater,
groundwater quality and land use.","
Introduction to the geological conditions in Denmark. Sediments and
their formation. Weathering processes and erosion. Rivers, ice and
wind as transport systems of sediment material and sedimentation
from these. Coastal Geology. Glacial deposits in Denmark. Soil
description. Geological raw materials (water, gravel, limestone,
lignite, clay for brickworks). Geology and klimate. Hydrogeologi. 
",11411,"
Ida Lykke Fabricius"
,,,,,,,,,,,,
11463 , Basic Geotechnical Engineering,English , 5 ECTS , 2016/2017 ,January,BSc,Department of Civil Engineering,"
To enable the participants to a) describe and apply calculation
methods for the solution of geotechnical problems in normal
engineering practice, b) describe the most important design methods
for problems such as retaining walls, quay constructions, sheet
pile walls,pile groups, embankments and excavations. 
","Calculate earth pressure on a wall based on zone rupture Design a retaining wall based on information about load and
material properties Calculate eart pressure and water pressure on a wall taking
account of seepage forces Design an anchored sheet pile wall according to the earth
pressure theory by Brinch Hansen, as determined by depth and
resisting moment of the wall, and anchor force. Evaluate total stability safety of a structure by combined
failure lines. Calculate the safety of stability for a free slope in clay
and/or sand Determine safety against ultimate failure for a plane and
statically indeterminate pile group Design a plane pile group, and place the piles in an
appropriate way according to economical and practical
considerations Design a system of wells (number and placement) for lowering of
ground water table, when artesian or free flow is assumed. Write a short technical report as documentation for design Present the main results from a design project on a poster Give qualified feedback to others work","
Advanced earth pressure theory. Retaining walls. Sheet pile walls.
Stability of slopes. Plane pile groups. Ground water problems. 
","12410,11462","
Varvara Zania"
,,,,,,,,,,,,
11464 , Advanced Soil Mechanics,English , 5 ECTS , 2016/2017 ,E2B (Thurs 8-12),MSc,Department of Civil Engineering,"
To enable the participants - on the basis of an advanced knowledge
of strength and deformation characteristics of soils - to describe
the basic features of commonly used models of soil behaviour
including elastic, elastic perfectly plastic (Mohr-Coulomb) and Cam
clay and to assess their advantages and limitations. The
participants will develop the ability to select the appropriate
soil parameters from stress paths and laboratory tests and use them
to analyse a wide range of geotechnical applications 
","Understand and manipulate three-dimensional stress and strain
variables in terms of various representations e.g.
volumetric/deviatoric split Qualitatively describe the mechanical behaviour of soils based
on concepts such as relative density, water content, stress level
and over-consolidation ration (OCR) Formulate the principle of Critical State Soil Mechanics (CSSM)
for soil behaviour based on stress paths and standard laboratory
tests Use the CSSM framework to interpreted and predict stress-strain
responses soils Undertake conventional triaxial compression tests on sand
and/or clay Describe time and strain-rate effects on soil behaviour using
visco-plastic constitutive equations Extend the basis of soil modelling to include advanced 3D
constitutive in the validation and calibration of relevant
laboratory tests Structure and present laboratory tests in data report and
synthesize the results in an interpretation report Produce a report summarizing the methods used to obtain the
data and results of the laboratory tests.","
Constitutive equations for soils. Theory of consolidation. Theory
of plasticity for undrained behaviour of clay and sand. Advanced
experimental soil mechanics (incl. triaxial testing). 
","12410,11413,11463,11462","
Varvara Zania"
,,,,,,,,,,,,
11465 , Advanced Geotechnical Engineering,English , 5 ECTS , 2016/2017 ,F4A (Tues 13-17),MSc,Department of Civil Engineering,"
To enable the participants

- to analyse and design complex geotechnical structures among
others piles and pile groups, laterally loaded piles, ground
anchors and various types of earth pressure loaded structures

- to elaborate on the numerical methods employed to solve
deformation and failure problems for selected geotechnical
structures. 
","Identify the soil properties that are relevant for designing a
pile Calculate the axial and lateral capacity of single piles using
state-of-art methods Apply numerical methods for lateral pile response Evaluate and compare analytical and numerical methods for pile
response Design 3D pile groups and determine group efficiency List the different types of retaining walls and the applicable
support measures Design and optimize a retaining system using analytical and
numerical methods Calculate the bearing resistance of support measures for a
retaining wall Estimate the settlements due to deep excavations Assess the building damage due to induced soil
displacements Review the numerical methods, e.g. finite element method, which
are employed to analyse soil-structure interaction problems for
various geotechnical structures Evaluate the results of field tests and select characteristic
values","
Piles, braced excavations, anchors. Numerical methods in soil
mechanics (incl. finite element method). 
",11464,"
Varvara Zania"
,,,,,,,,,,,,
11521 , Sustainable Urbanization from a practical case perspective,English , 5 ECTS , 2016/2017 ,August,MSc,Department of Civil Engineering,"
Cities are considered to be the melting pots of modern society -
the proximity and density of people and organizations tend to
foster innovation, creativity, and entrepreneurship. One of the
biggest challenges in the 21st century is to plan urbanized areas
in a way that they facilitate thriving businesses, organizations
and people, while addressing global environmental and social
challenges, such as climate change, immigration and income
disparities. This course is located between the sometimes
conflicting, sometimes reinforcing poles of urban sustainability.
Thus, the Hamburg-Copenhagen Urban Challenge takes a citywide and
regional development perspective on public, private, and nonprofit
sector actions that shape solutions to the most pressing issues of
today’s societies.

The vision of the course is to create a trans-disciplinary,
cross-institutional, and cross-cultural learning experience for
students, researchers, and practitioners that build capacity to
identify and solve complex urban issues sustainably and
collaboratively across disciplines. With CBS and DTU we have two
participating universities with a strong engineering and business
related background, which gets completed by the HCU with a more
sociological background. Further, several private companies from
consultancy and city development (e.g. Rambøll, By&Havn, etc.)
are involved in the course. Hence, the students will learn to work
on the interdisciplinary challenge of sustainable urban structures
with colleagues from different disciplines and with other
problem-solving approaches. 
","Identify and analyze complex urban challenges faced by
business, local governments and citizens Assess new technologies and models for sustainable change Identify the interdependencies, actors and networks of the
chosen urban challenge Establish connections between technological state-of-the-art
solutions and their use in a planning, commercial and user-related
context Evaluate the scope of potential solutions that help tackle the
chosen urban challenge Evaluate the viability of potential solutions that help tackle
the chosen urban challenge Uncover potential innovative business opportunities for
tackling the chosen urban challenge Work alongside leading companies who are actively seeking to
make lasting changes within cities","
Students will conduct a comparative analysis of HafenCity in
Hamburg and Nordhavn in Copenhagen contextualizing both districts
within the larger development patterns of the metro-regions of
Hamburg and Copenhagen and in contrast to a selection of other
cases. Assessing the role of the districts within the larger
context will enable students to identify drivers within private,
public, and non-profit activities that could enhance the districts
and cities ability to address technological, economic and social
challenges in a sustainable manner. The solutions may include for
instance smart energy technologies, public policy changes, new
business models, infrastructure projects or citizen involvement.

 Guiding questions for the course are the following:

• What technological solutions are needed for a sustainable urban
agglomerations and how to implement these in specific contexts?

• How do we make decisions in cities while considering global
challenges such as immigration, climate change, and growing income
disparities?

• How supportive are our government policies and relationships with
investors, technology enterprises, utilities and citizens to meet
these challenges?

• What are the agents of change and who is leading the way?

• How do NGO’s and citizens gain legitimacy and influence local
city governments?

Main academic issues addressed during the course are:

• Climate mitigation and adaptation strategies in the urban context

• Sustainable urbanizations and integrated design

• Complexity of interdisciplinarity, localization and globalization

• Urban governance forms (public, private, and crossover forms)

• Business and political ethics

• Business innovation and entrepreneurship 
",None,"Luise Noring,Carsten Rode,Jens-Phillip Petersen,Martin A. Petersen"
,,,,,,,,,,,,
11522 , Simulation of indoor environment and energy consumption using IDA ICE,English , 5 ECTS , 2016/2017 ,August,MSc,Department of Civil Engineering,"
To introduce to the student simulations of indoor environment and
energy consumption of systems and buildings in IDA ICE. To enable
the student to design and assign systems to a building geometry,
and specify customized controls of HVAC systems. To evaluate the
modelling approach and simulation output and understand the working
principles of building energy simulation programs and in particular
of IDA ICE. The course enables the participants to use advanced
tools for building performance simulation. 
","Define building envelope properties and system characteristics
in IDA ICE Outline the basic working principles of IDA ICE and related
simulation programs Relate simulation variables to model functionality Build versions of a model using the version handling system in
IDA ICE Distinguish between Variables, parameters and interfaces in the
structure of objects in IDA ICE Design customized and advanced control macros for the operation
of HVAC systems Integrate stochastic models of occupants’ behaviour in a
control macro Assess model validity based on simulation outputs","
General hands on experience using standard and advanced levels of
IDA ICE. Load calculations in IDA ICE. Approach for simulation of
indoor environment and building energy. Mathematical modelling
approach used by IDA ICE (zone divisions, controllers etc.).
Version handling in IDA ICE (a tool for quick and easy parameter
variations). Macros and advanced controls. Output files and logging
of variables. Analysis of results. 
","11937,11203,11112,11115,11141","
Rune Korsholm Andersen"
,,,,,,,,,,,,
11525 , Interdisciplinary summerschool,English , 5 ECTS , 2016/2017 ,Outside schedule structure,BSc,Department of Civil Engineering,"
To give an opportunity to Work in international and
interdisciplinary design teams with real life problems in a city. 
",Multidisciplinary Design Development Project Management Professional Behavior Time and Resource Management Oral Presentation and Interpersonal Communication Graphical Communication Utilization of engineering Knowledge in Design The Design Process Phasing and Approaches,"
Group Work in project teams, excursions, lectures 
",,"
Lotte Bjerregaard Jensen"
,,,,,,,,,,,,
11561 , Construction Materials ,Danish , 5 ECTS , 2016/2017 ,June,BSc,Department of Civil Engineering,"
To give the students an insight into the use of the most important
construction materials and knowledge of the most important material
testing methods. 
","Describe characteristic properties of the different important
construction materials Plan and accomplish relevant laboratory work Document understanding for safe and appropriate laboratory
behaviour Select important material testing methods Measure selected properties for the most important construction
materials Interpret and value measurement results Organize and accomplish project work in a group Present the laboratory exercises as short technical
reports","
The course consists of the following laboratory exercises:
Laboratory safety, testing of concrete aggregates, design of
concrete mixes and testing of fresh concrete, testing of hardened
concrete, wood properties, gypsum composites, Young's modulus
for steel and aluminium, steel corrosion, drying of aerated
concrete. 
","11560,11946,11562,11735,11765","
Kurt Kielsgaard Hansen"
,,,,,,,,,,,,
11562 , Materials Science for Civil Engineers,Danish , 5 ECTS , 2016/2017 ,F5A (Wed 8-12),BSc,Department of Civil Engineering,"
To enable the participants – on a physico-chemical basis – to carry
out a calculative estimation of the properties of materials and
their behaviour during chemical, thermal and mechanical exposure.
In addition, the participants are given a calculative basis for
independent, further analysis of materials scientific problems. 
","Define and apply basic thermodynamic state parameters and
measures for amount and concentration State basic chemical components and reactions as well as values
and units for basic quantities within the science of construction
materials Explain and apply the laws of thermodynamics Describe the types of thermodynamic systems and processes Explain and apply the basic laws within the science of
construction materials Draw up and analyse the basic chemical problems of equilibria
of relevance to the science of construction materials Extract and analyse material technological problems from a
practical, engineering situation Evaluate the material properties and behaviour during chemical,
thermal and mechanical influence","
Lectures: Description of systems of matter, chemical and physical
influential factors, reactions and equilibrium of reactions,
thermal properties, moisture technical calculations and mechanical
phenomena in relation to materials science. Emphasis is put on
exercising a broad, practical engineering applicability of the
subjects. Examples of this include the frost resistance of
concrete, moisture take-up of wood and corrosion of steel. Relevant
physico-chemical phenomena will be demonstrated during the
lectures. Exercises: Lecture exercises, Repetition exercises, Group
exercises. 
",None,"
Ole Mejlhede Jensen"
,,,,,,,,,,,,
11563 , Concrete Technology,English , 5 ECTS , 2016/2017 ,E5A (Wed 8-12),MSc,Department of Civil Engineering,"
To give the students a basic knowledge about the (micro)structure
and properties of concrete, so that they obtain a sufficient
background to

- estimate simple relationships between concrete structure,
materials, execution, and environmental exposure

- select materials for typical concrete structures in consideration
of structural detailing, execution methods, and environmental
exposure. 
","Describe the effect of concrete composition on the workability
and evaluate possible means to vary the workability Describe important raw materials for production of concrete and
their properties Calculate the property development as a function of time and
temperature Calculate the volume of solids and porosity within the Portland
cement-water system during cement hydration Estimate relevant properties of cement paste from the chemical
composition of the cement Identify relevant transport mechanisms and estimate transport
of matter in concrete Describe typical deterioration mechanisms, typical damage types
and propose means of mitigation Estimate typical mechanical and moisture dependent properties
of hardened concrete. Describe the fundamental developments within cement and
concrete technology","
As far as practically possible the course is based on materials
science concepts, so that the students obtain a fundamental
understanding of the relationships between structure and properties
of concrete. Problems of practical use for civil engineers:
Selection of constituent materials, including properties of cement.
Flow properties. Execution, including production and curing.
Development of properties as a function of time and temperature.
Mechanical properties. Durability. 
","11704,11561,11562","
Marianne Tange Hasholt"
,,,,,,,,,,,,
11569 , Durability and repair of concrete structures,English , 5 ECTS , 2016/2017 ,F1A (Mon 8-12),MSc,Department of Civil Engineering,"
The participants will learn about the most common types of concrete
degradation and they become capable in identifying different damage
mechanisms. Moreover, the participants will obtain relevant tools
to act upon the findings by suggesting appropriate methods for
maintenance and repair. 
","select and perform relevant test methods to support damage
assessment estimate rate of deterioration, based on realistic data understand mass transfer model’s usability and limitations analyze the influence of mass transfer on the durability of
concrete select materials that are durable under given environmental
exposure conditions identify situations with risk of material degradation and
material failure assess strategies and methods for maintenance and repair by
using the methodology described in EN 1504 ""Products and
systems for the protection and repair of concrete structures –
Definitions, requirements, quality control and evaluation of
conformity"" describe advantages and disadvantages of concrete repair
methods, including different kinds of surface protection and
cathodic protection","
Concrete durability is governed by a large number of different
physical and chemical processes. Often degradation is the result of
a complex interplay between several processes; however, transport
processes are typically centrally involved. The transport processes
both comprise moisture transport and transport of other matters,
e.g. chlorides in concrete.

The course includes a number of practical exercises in the
laboratory, where students train techniques that can be used to
elaborate the findings of a visual condition survey of a structure.
Furthermore, the course provides an introduction to the general
methodology of maintenance and repair work.

During the course, selected repair methods are presented. However,
the main focus of the course is to provide the necessary
theoretical background for the students to identify transport
processes and damage mechanisms in a range of situations. Only
after identification of the dominant process of deterioration it is
possible to initiate optimal repair strategies. 
","11562,11563","
Marianne Tange Hasholt"
,,,,,,,,,,,,
11619 , Chalk Physics,English , 5 ECTS , 2016/2017 ,June,Ph.D.,Department of Civil Engineering,"
The aim is to provide to the participant skills in evaluating chalk
from a physical perspective: How composition, texture, diagenesis
and rock properties are interrelated. How reservoir properties are
evaluated by petrophysics. Rock physical interpretation and rock
mechanics of this soft-hard or hard-soft sedimentary rock; and
finally how physical properties depend on scale of measurement. 
","Read and use information on compositional and textural
properties of chalk Evaluate and participate in petrophyscal interpretation of
chalk Evaluate and participate in rock physical interpretation of
chalk Read and use information on rock mechanical properties of
chalk Evaluate physical data on chalk from a scale-perspective Communicate information on a predefined aspect of chalk Participate in discussion of results of other participants Understand reasons for scientific disagreement","
Day 1: Chalk composition, texture and diagenesis (ILF)

Evening 1: Presentations by participants

Day 2: Rock mechanics of chalk (HFC)

Evening 2: Excursion

Day 3: Petrophysics of chalk (ILF)

Evening 3: Presentations by participants

Day 4: Scaling of petrophysical properties (PF)

Evening 4: Excursion

Day 5: Rock physics of chalk (ILF)

Evening 5: Course evaluation 
",None,"
Ida Lykke Fabricius,Niels Trads,Peter Frykman"
,,,,,,,,,,,,
