COURSE NUMBER,COURSE NAME,LANGUAGE OF INSTRUCTION,CREDIT LOAD,YEAR,SCHEDULE,COURSE TYPE,DEPARTMENT,GENERAL COURSE OBJECTIVES,LEARNING OBJECTIVES,CONTENT,RECOMMENDED PREREQUISITES,COURSE RESPONSIBLE
31561 , Applied Signal Processing,English , 10 ECTS , 2016/2017 ,"F2 (Mon 13-17, Thurs 8-12)",BSc,Department of Electrical Engineering,"
The aim of the course is to give the student a solid basis for
analysis and processing of analog and digital signals emanating
from either deterministic or stochastic system. The major emphasize
is on signal examples from the medical world, and practical
introduction to analysis and processing of signals is given through
computer demonstrations and exercises. The program Matlab is used
for the exercises in combination with different signals from the
medical word (e.g. ECG and medical ultrasound). The main emphasize
is here on stochastic signals. The course contains a number of
computer exercises in Matlab. The course is concluded with a
written exam. 
","Use common Fourier transform pairs and properties to determine
the Fourier transform of complex analog and digital signals. Relate spectra of periodic and aperiodic analog and digital
signals and plot these using correct physical units such as Hertz
and Volt. Determine the auto- and cross correlation functions of analog
and digital random signals. Analyze zero-pole diagrams to determine the causality and
stability of linear time-invariant systems. Use the z-transform to calculate the impulse response and the
transfer function of a linear time-invariant system. Determine the quantization errors in analog-to-digital
conversion and model error sources in filters due to finite word
length. Design simple low-pass, high-pass, band-pass, band-stop and
notch filters using pole-zero placement, simple windowing
functions, filter transformation rules and the signal processing
toolbox in Matlab. Find the power density spectra of random signals using
non-parametric and parametric spectral estimation methods. Apply signal processing techniques to signals emanating from
biological systems (ECG, ultrasound) and design procedures to
estimate some parameters such as heart rate, blood velocity and
profile of blood flow. Give in own words examples of signal processing techniques
applied in various applications such as telecommunications, radar
and sonar and biomedical systems. Ability to communicate proficiently the signal processing
topics in English","
Classification of signals. Analytic signals. Use of the fast
fourier transform (FFT). Analysis of random signals. Correlations
functions, power and cross spectra. Errors in analog to digital
conversion. Digital filters and their error sources. Simple signal
measures. Modulation of analog and digital signals. Matched filter.
Spectral estimation. Parametric models. Use of signal processing
software (Matlab). Processing of biomedical signals. Exercises. 
","02405,02403,02402,31605","
Sadasivan Puthusserypady"
,,,,,,,,,,,,
31566 , Personal portable health technologies,English , 10 ECTS , 2016/2017 ,F2A (Mon 13-17) and F2B (Thurs 8-12),MSc,Department of Electrical Engineering,"
To gain insight into intelligent personal portable health
technologies, that citizens unembarrassed can wear in daily life
intended for improved disease treatment, disease prevention,
rehabilitation or exercise.

Introducing the scientific medical and -technical foundation for
design and test of new portable wireless miniature health
technologies.

Achieving practical experience with one or more self-elected
personal portable health technical applications in dialogue with
researchers (doctors and engineers).

Obtain understanding and visions for the health system of the
future, that to a great extent can and will support citizens in
daily life with intelligent miniature health technologies.

Insight into new and until now unknown long-term knowledge about
diseases, and improved possibilities for treatment, will be
achieved. 
","A student who has met the objectives of the course will be able
to: Participate in research teams consisting of medical doctors and
engineers, who want to develop/apply new solutions for daily life
of citizens based on personal health technologies. Analyze and demonstrate opportunities for new diagnostic
knowledge via portable technologies. Understand wireless communication between portable biomedical
sensors and smartphones and clinic. Programming of smarphones/processors by advanced biomedical
signal processing. Understand clinical application of knowledge from portable
sensors and smartphones etc. Describe the advantages and limitations of the biomedical
signal processing potentials. Planning and complete lab- and project activities, communicate
results via a project report, fulfilling basic requirements for
scientific communication. Present project results at a workshop with participating
medical doctors and engineers.","
Lectures from hospital medical doctors regarding clinical
potentials by personal portable health technologies.

Lectures from biomedical engineers concerning technical potentials
by personal portable technologies.

Practical data acquisition using body worn intelligent sensors.

Wireless communication between intelligent sensors and smartphones
and clinic.

Programming of smartphones/processors for analysis and
interpretation of diseases and health promotion.

Advanced biomedical signal processing for real-world signals from
the human body.

Project activities in dialogue with medical doctors and engineers.

Presentation of project results on workshop with participating
medical doctors and engineers. 
",31560,"
Helge Bjarup Dissing Sørensen"
,,,,,,,,,,,,
31567 , Principles of Brain Computer Interface,English , 5 ECTS , 2016/2017 ,January,MSc,Department of Electrical Engineering,"
The objective is to obtain basic understanding of Brain Computer
Interface (BCI: Computer-based systems that record, decode and
translate measurable neurophysiological signals into commands for
output devices to perform an action without any muscular
activation). This is achieved by incorporating real-time signal
processing methods for the feature extraction and classification in
EEG (electroencephalography) - based BCIs. 
","Understand the EEG signals that can be detected as markers of
mental activity Understand different BCI systems and neural prostheses Apply signal processing techniques to condition these EEG
signals Develop methods for extracting relevant features Implement classification algorithms to classify these
signals Build a functioning BCI system Review and present selected scientific articles Discuss the developments and the future of this field","
BCIs based on different types of EEGs (evoked response and movement
imagery) will be covered in the form of lectures, discussions,
practical and theoretical learning methods. The students will have
to present a selected scientific article. A BCI design group
project (group of 2) using the available BCI data or new data will
be completed with a final report and a presentation. 
","31545,31610,31560","
Sadasivan Puthusserypady"
,,,,,,,,,,,,
31590 , Biomedical product development,English , 10 ECTS , 2016/2017 ,"E4 (Tues 13-17, Fri 8-12)",MSc,Department of Electrical Engineering,"
The objectives of the course are to give the participants a
practical understanding and knowledge about general aspects and
different phases of medico-technical product development,
documentation, clinical evaluation, regulatory requirements,
standards, manufacturing, marketing, sales, service and complaint
handling. 
","Evaluate and provide constructive criticism of own and others
suggestions of ideas and concepts for new medico-technical products
on the market. Specify a cross functional developing team and a product
development model for a specific medico-technical product project
and insert relevant critical milestones in a time schedule plan for
such a development. Evaluate and specify general technical and clinical quality
safety issues regarding requirements and needs of a
medico-technical product. Translate customer needs and expections to product
specifications using the QFD (Quality Function Deployment)
model. Determine and evaluate general health hazard risks (Health
Hazard Evaluation) for medico-technical products based on clinical
and technical as well as regulatory requirements using for example
FMEA (Failure Mode & Effect Analysis) and FTA . Evaluate and address high failure rates of certain components
by calculating e.g. MTBF – Mean Time Between Failure of different
medico-technical products in relation to the reliability needs of
such components. Outline human factors and limitations of importance for the
design of medico-technical systems and equipment for efficient,
safe, effective and reliable operation. Describe the process of how to verify and validate technical
design parameters and performance data for a given medical
device. Describe and evaluate technical quality assurance features
operating a given medico-technical product in use. Outline an overall company organization as well as a quality
assurance system for medico-technical product manufacturing. Establish detailed knowledge of various regulatory demands and
requirements related to marketing and selling medico-technical
products in the US (FDA) and Europe (EU directives). Describe and evaluate a general CAPA-system (Corrective and
Preventive Actions) dealing with customer complaints and risk
assessment regarding medico-technical products on the market in
relation to regulatory issues.","
The course deals with the important clinical, technical, and
regulatory documentation issues (US and Europe) concerning product
development, testing, preclinical and clinical research,
manufacturing, marketing, sales and service support as well as
corrective and preventive actions and health hazard analysis a
medico-technical company has to deal with in the US and European
markets. 
",None,"
Henrik Egesborg,
Jens E. Wilhjelm"
,,,,,,,,,,,,
31598 , Engineering World Health Summer School in Biomedical Instrumentation,English , 5 ECTS , 2016/2017 ,Outside schedule structure,MSc,Department of Electrical Engineering,"
The course aims to prepare students for participation in
Engineering World Health Summer Institute. 
","Identify electrical and mechanical components and explain their
operating principle Demonstrate correct use of test equipment and hand tools for
repair of electro-mechanical equipment Explain the intended use and operating principles of medical
equipment Explain typical faults in the medical equipment covered in the
course Conduct an electric safety assessment of a medical
equipment Design strategies for diagnosing medical devices Conduct tests and repairs on medical devices Solve problems in step with complex description of inconsistent
and inaccurate information in unknown problem sphere and with
unfamiliar and unconventional tools Prioritize and adapt procedures and use of tools to new and
unfamiliar situations Take leadership while observing professional and cultural
norms Work in teams with responsibility for planning, management and
development of collaborative processes Communicate in English orally and in writing on medical devices
while observing professional and cultural etiquette","
Theory (depends on availability of equipment):

Mechanical ventilators, oxygen concentrators, infusion pumps, ECG
monitors, blood pressure monitors, pulse oximetry, neonatal
incubators, phototherapy equipment, respiratory monitors,
electrosurgery units, suction pumps, lamps, anesthesia devices,
bottled gas, batteries, centrifuges, autoclaves, electric safety.

Shop skills:

Soldering, cable repair, electronic measurement instruments,
troubleshooting power supplies and fuses.

Equipment skills:

Disassemble and reassemble medical equipment, calibrate and operate
equipment, conduct electric safety tests on medical equipment and
identify and correct mistakes in assembling equipment components. 
","31001,31511","
Kaj-Åge Henneberg,
Jens E. Wilhjelm,
René Gadkjær"
,,,,,,,,,,,,
31605 , Continuous Time Signals and Linear Systems,Danish , 5 ECTS , 2016/2017 ,F3A (Tues 8-12),BSc,Department of Electrical Engineering,"
The overall goal of the course is to enable the student to build
mathmatical models for simple linear physical systems and use these
models to characterize the properties of the systems. 
","Identify and categorize deterministic/​stochastic,
analog/digital, causal/noncausal, periodic/aperiodic signals and
signals with finite energy/power. Identify and categorize systems according to linearity,
stability, causality, time invariance and order. Analyse linear physical systems and build corresponding
mathematical models. Investigate strengths and weaknesses in a system or filter
design according to the systems differential equation, transfer
function, frequency response, and pole-zero diagram and convert
between these representations. Use and define the mathematical properties of the Fourier and
the Laplace transform and the conditions for their use. Calculate output signals for known input signals using
convolution, Fourier, and Laplace transformation. Calculate the impulse, step, and ramp responses and their
steady state error. Calculate the frequency and amplitude spectrum of for
deterministic signals. Investigate and explain the influence of the damping ratio and
the natural frequency on the position of poles, step response, and
amplitude characteristic for second order systems. Design the transfer function for lowpass, highpass and bandstop
Butterworth filters. Use computer tools for signal and systems analysis.","
This course concerns signals and linear systems in continuous time.
Review of circuit theory, classification of signals and systems,
derivation and solutions of system equations, impulse/step
response, convolution, Fourier transformation of aperiodic and
periodic signals, amplitude and phase spectra, Bode plot, pole-zero
diagrams, Laplace domain derivation of impulse and step response,
Butterworth filters, and application of Matlab in signal and
systems analysis. 
","31004,01005,01035,31510,10026,10024,10022,02631,10020,02633","
Thomas Sams"
,,,,,,,,,,,,
31606 , Signals and Linear Systems in discrete time,English , 5 ECTS , 2016/2017 ,E1B (Thurs 13-17),BSc,Department of Electrical Engineering,"
The general goal of the course is to introduce theory, analysis,
and synthesis of discrete-time signals and systems, as they are
used and needed for a broad variety of computer-based DSP
applications. The students will make quantitative estimations as
well as detailed written calculations. Exemplary technical
applications will be examined in exercises and in Matlab
simulations. Formative feedback will be given on submitted
assignments. 
","Explain the principles of sampling of continuous-time
signals. Explain the connections and differences between the Fourier
transform, the time-discrete Fourier transform and the discrete
Fourier transform. Implement algorithms for the calculation of recursive and
non-recursive filters in Matlab. Convert continuous-time filters into discrete-time filters
using the bilinear transform. Use a spectrogram to analyse the time/frequency content of a
signal. Calculate the spectral density of a stochastic signal. Analyse discrete-time signals and discrete-time systems in the
time-, frequency- and z-domain. Design recursive and non-recursive digital filters Judge which sampling frequency, quantization depth and filter
type is necessary to fulfill a simple problem specification. Implement computer programs and visualise results using
Matlab. Apply English terminology in digital signal processing and
write reports in English. Extract and combine information from different literature
sources","
As an extension of course 31605, Continuous-Time Signals and Linear
Systems, 31606 introduces linear discrete-time signals and systems,
digital filters and adaptive linear neural networks from a
technical perspective. The algorithms can be applied to various
fields of linear digital signal processing: acoustics,
telecommunication, biomedical engineering, control theory. The
following topics will be covered:

- Time-domain analysis and difference equations,

- Sampling theorem,

- Discrete-time Fourier transform (DTFT),

- Fast Fourier transforms (FFT),

- z-transform,

- IIR and FIR digital filters,

- The short-time Fourier transform

- Spectral density of a stochastic signal

- Noise reduction 
",31605,"
Bastian Epp"
,,,,,,,,,,,,
31631 , Integrated Analog Electronics 1,English , 5 ECTS , 2016/2017 ,E4B (Fri 8-12),BSc,Department of Electrical Engineering,"
To enable the student to analyze and design analog amplifiers with
an emphasis on integrated circuits in CMOS technology 
","Know large signal models and small signal models for MOS
transistors and use the models for circuit analysis Analyze single-transistor amplifier stages realized with MOS
transistors Analyze differential stages realized with MOS transistors Analyze multistage amplifiers realized with MOS
transistors Analyze circuits with negative feedback Design a simple two-stage operational amplifier realized with
MOS transistors Design simple circuits for the generation of bias currents and
bias voltages Simulate CMOS integrated circuits using LTspice Apply Danish as well as English electro-technical
terminology","
Amplifier stages, opamps, feedback 
","62732,31003","
Ivan Harald Holger Jørgensen,
Erik Bruun"
,,,,,,,,,,,,
31632 , Integrated Analog Electronics 2,English , 5 ECTS , 2016/2017 ,F4A (Tues 13-17),MSc,Department of Electrical Engineering,"
To enable the student to analyze and design analog circuits with an
emphasis on integrated amplifiers and data converters in CMOS
technology 
","Analyze and design different basic types of CMOS opamps (folded
cascode opamp, current mirror opamp, two-stage opamp) Analyze the frequency response of CMOS opamps Design the frequency compensation for opamps with feedback Apply noise models for transistors and resistors Analyze lay-out of simple transistor circuits Describe basic types and properties of data converters (A/D
converters and D/A converters) Analyze different types of Nyquist D/A converters Analyze different types of Nyquist A/D converters Analyze oversampled data converters Make simulations of simple transistor circuits in MOS
technology","
CMOS opamps, analog to digital converters, digital to analog
converters, circuit simulation, industrial application examples 
","31606,31631","
Ivan Harald Holger Jørgensen"
,,,,,,,,,,,,
31633 , Design and Layout of Integrated CMOS circuits,English , 5 ECTS , 2016/2017 ,June,MSc,Department of Electrical Engineering,"
To enable the student to conduct a complete design of integrated
analog circuitry from a given specification through schematic
design and analysis to a layout ready for manufacturing. 
","Synthesize an operational amplifier according to a certain
specification in a CMOS process Use a schematic editor and a simulation environment for design
and analysis of analog circuitry Analyze the performance of the design circuit in all process
corners Correlate simulated results with calculated values based on a
small signal equivalent of the operational amplifier Use a layout editor for making layout of analog circuitry Identify the parts of the design critical to matching and make
layout that ensures good matching for these parts Use a DRC tool (Design Rule Checking) to ensure the design
fulfills the design rules Use a LVS tool (Layout Versus Schematic) to ensure the layout
matches the schematic design Design a simple padring for the design at schematic level Document the work in a final report","
The course is conducted as a project where the students work in
groups of 2. During the project status and review meeting will be
held where the students exchange experiences and help each other
with various challenges and problems. During the project lectures
will be given in selected topics.

The course treats analog circuits, schematic design, layout,
computer simulations (DC; AC, transient), design rule check (DRC),
layout versus schematic (LVS) 
","31632,31630,31631","
Ivan Harald Holger Jørgensen"
,,,,,,,,,,,,
31700 , Electric Power Technology ,Danish , 5 ECTS , 2016/2017 ,January,"BSc,,MSc",Department of Electrical Engineering,"
To give the students knowledge of electric power technology
problems seen from the given political and economical conditions.
Focus will be on problem oriented project work which is related to
the companies which we will visit during the course period. 
","Describe a technical problem Determine delimitations for a technical project Estimate necessary resources for solving a technical
project Through a team work to prepare proposals for solving technical
problem Work efficiently in team work Discuss technical, economical, and political problems in the
sector of Power systems Explain the future challenges in the power systems Identify problems in the power sector to be solved through
student project work","
The course includes introduction of the technological, economical
and political conditions in electric power companies. These
conditions will be illustrated at several excursions and by
external lecturers from the electric industry. The course includes
method learning in preparation for a project work. Excursions and
lectures will conclude in an introductory treatment of a present
technical problem chosen by the student himself with reference to
one or more of the companies which will be visited. 
",31003,"
Esben Larsen,
Flemming Juul Petersen,Louise Carina Jensen"
,,,,,,,,,,,,
31730 ," Electric Power Engineering, fundamentals",English , 10 ECTS , 2016/2017 ,"E4 (Tues 13-17, Fri 8-12)",MSc,Department of Electrical Engineering,"
To give basic understanding of the power system and the essential
aspects having influence on issues like the future electrical power
system.

The students achieve knowledge about the power grid and the main
components involved under production, transmission and distribution
of electric energy. The main principles and numerical tools for
grid calculations are treated and will give experience and
confidence for use hereof.

The course forms the base for further education within power
engineering, but is in general useful for all students aiming at
some specialization within electrical energy systems. 
","Identify the essential relations in the power grid Calculate electric variables in a larger grid Construct and applicate equivalents for electric
components Model the grid with appropriate equivalents Describe grid control by P, Q, V, delta Simulate and evaluate power flow Analyse given load situations Evaluate symmetric fault situations Use load flow programs like PowerFactory for grid
simulations","
- Power grid

- AC circuits, 3-phase systems, power considerations

- Components in the grid like transmission lines, cables,
transformers, generators and more.

- Power flows and tools for simulation

- Symmetrical faults

The topics from the text book can be supported by related topics
like wind turbine technology or other actual issues.

In the project, a realistic problem will be defined and has to be
solved by means of the numerical simulation program PowerFactory
(load flow) with graphical user interface. 
",,"
Joachim Holbøll,
Guangya Yang,
Spyros Chatzivasileiadis"
,,,,,,,,,,,,
31742 , Power system operation,English , 5 ECTS , 2016/2017 ,F3A (Tues 8-12),MSc,Department of Electrical Engineering,"
The aim of the course is to give the students the necessary
background knowledge of power system operation and protection, the
ability to model and solve the basic operation issues and analyze
the system under faulty conditions. 
","Describe power system operation principles and basic functions
in energy management system; Perform load flow calculations and use them for steady-state
power system analysis; Model complex power system operation issues for economic and
secure operation; Apply optimization techniques to solve fundamental operation
problems; Understand and perform N-1 steady state contingency
analysis; Understand power system state estimation and the incorporation
with phasor measurement units; Describe faulty system operation, balanced and unbalanced
faults; Apply symmetrical components for unbalanced fault
analysis; Understand basic protective methods; Apply basic system protection principles;","
Load flow calculation techniques, Newton-Raphson, fast decoupled
and DC power flow;

Fundamental techniques for fault analysis, symmetric components,
sequence networks and the application to unbalanced fault analysis;

Protection system design principles, measurement transformers,
basic relays, zones of protection and the need for protection
redundancy and coordination, system protections;

Load frequency control and basic power flow control principles,
energy management system functions;

Generator cost characteristics, formulations of basic optimal
operation problems from different aspects, solutions to simple and
complex optimal operation issues;

Contingency analysis under N-1 security criterion with contingency
ranking techniques, cascading failures, voltage security and the
effect of load models on voltage security;

State estimation by maximum likelihood method, incorporation of
phasor measurement units for traditional state estimation; 
",31730,"
Guangya Yang"
,,,,,,,,,,,,
