COURSE NUMBER,COURSE NAME,LANGUAGE OF INSTRUCTION,CREDIT LOAD,YEAR,SCHEDULE,COURSE TYPE,DEPARTMENT,GENERAL COURSE OBJECTIVES,LEARNING OBJECTIVES,CONTENT,RECOMMENDED PREREQUISITES,COURSE RESPONSIBLE
,,,,,,,,,,,,
10018 , Physics 1,English , 10 ECTS , 2016/2017 ,E3A (Tues 8-12) and F3A (Tues 8-12),BSc,Department of Physics,"
To introduce the student to the basic concepts of mechanics and
thermodynamics, and enable the student to solve idealized
mechanical, thermodynamical and technical problems. Furthermore the
student receives practice in using idealized models to describe
real systems through cases. 
","Apply the kinematic concepts position, velocity, and
acceleration, and recognize important types of motion such as
projectile motion and circular motion. Identify forces and sketch free body diagrams for simple
mechanical systems consisting of particles and rigid bodies. Apply Newton's laws for translation and rotational motion
to simple mechanical systems consisting of particles and rigid
bodies. Compute the work and impulse of a force and apply the
work-energy theorem to simple mechanical systems. Formulate the principles of conservation of momentum, angular
momentum and mechanical energy and apply these principles to simple
mechanical systems. Apply the continuity equation and Bernoulli's equation to
simple stationary flows. Compute thermal expansion and carry out caliometric
calculations. Apply the ideal gas equation to determine pressure,
temperature, volume, and number of moles, and compute microscopic
properties of molecules. Explain the first and second laws of thermodynamics. Recognize simple thermodynamical processes (isochoric,
isobaric, isothermal, and adiabatic processes) and compute work
done and heat transfer for processes (including cyclic processes)
composed of these. Perform error analysis including propagation of
errors.","
Motion in 1+2+3 dimensions. Newton's laws. Work and kinetic
energy. Potential energy and energy conservation. Momentum and
collisions. Rotation of rigid bodies. Dynamics of rotational
motion. Equilibrium and elasticity. Gravitation. Periodic motion.
Fluid mechanics. Temperature and heat. Thermal properties of
matter. The first and second law of thermodynamics. 
",None,"
Carsten Knudsen,
Brian Seger,
Rasmus Bjørk,
Luise Theil Kuhn"
,,,,,,,,,,,,
10020 , Physics 1,Danish , 10 ECTS , 2016/2017 ,E1B (Thurs 13-17) and F1B (Thurs 13-17),BSc,Department of Physics,"
To introduce the student to the basic concepts of mechanics and
electric charge and field and magnetism, and enable the student to
solve idealized problems. Furthermore the student receives practice
in using idealized models to describe real systems through project
work. 
","Apply the kinematic concepts position, velocity, and
acceleration, and recognize important types of motion such as
projectile motion and circular motion. Identify forces and sketch free body diagrams for simple
mechanical systems consisting of particles and rigid bodies. Apply Newton's laws for translation and rotational motion
to simple mechanical systems consisting of particles and rigid
bodies. Compute the work and impulse of a force and apply the
work-energy theorem to simple mechanical systems. Formulate the principles of conservation of momentum, angular
momentum and mechanical energy and apply these principles to simple
mechanical systems. Apply the continuity equation and Bernoulli's equation to
simple stationary flows. Compute electrostatic forces, fields, and potentials in
connection with simple and/or symmetric charge distributions. Describe the capacitance in connection with electrical energy
and the influence of dielectrica. Compute magnetic forces and fields in connection with simple
and/or symmetric charge distributions.","
Motion in 1+2+3 dimensions. Newton's laws. Work and kinetic
energy. Potential energy and energy conservation. Momentum and
collisions. Rotation of rigid bodies. Dynamics of rotational
motion. Equilibrium and elasticity. Gravitation. Periodic motion.
Fluid mechanics. Electric charge and electric field. Magnetism. 
",None,"
Jesper Lægsgaard,
Carsten Knudsen"
,,,,,,,,,,,,
10022 , Physics 1,Danish , 10 ECTS , 2016/2017 ,E1A (Mon 8-12) and F1A (Mon 8-12),BSc,Department of Physics,"
To introduce the student to the basic concepts of mechanics and
thermodynamics, and enable the student to solve idealized
mechanical, thermodynamical and technical problems. Furthermore the
student receives practice in using idealized models to describe
real systems through project work. 
","Apply the kinematic concepts position, velocity, and
acceleration, and recognize important types of motion such as
projectile motion and circular motion. Identify forces and sketch free body diagrams for simple
mechanical systems consisting of particles and rigid bodies. Apply Newton's laws for translation and rotational motion
to simple mechanical systems consisting of particles and rigid
bodies. Compute the work and impulse of a force and apply the
work-energy theorem to simple mechanical systems. Formulate the principles of conservation of momentum, angular
momentum and mechanical energy and apply these principles to simple
mechanical systems. Apply the continuity equation and Bernoulli's equation to
simple stationary flows. Compute thermal expansion and carry out caliometric
calculations. Apply the ideal gas equation to determine pressure,
temperature, volume, and number of moles, and compute microscopic
properties of molecules. Explain the first and second laws of thermodynamics. Recognize simple thermodynamical processes (isochoric,
isobaric, isothermal, and adiabatic processes) and compute work
done and heat transfer for processes (including cyclic processes)
composed of these.","
Motion in 1+2+3 dimensions. Newton's laws. Work and kinetic
energy. Potential energy and energy conservation. Momentum and
collisions. Rotation of rigid bodies. Dynamics of rotational
motion. Equilibrium and elasticity. Gravitation. Periodic motion.
Fluid mechanics. Temperature and heat. Thermal properties of
matter. The first and second law of thermodynamics. 
",None,"
Carsten Knudsen,
Michael Brix Pedersen"
,,,,,,,,,,,,
10024 , Physics 1,Danish , 10 ECTS , 2016/2017 ,E5A (Wed 8-12) and F5A (Wed 8-12),BSc,Department of Physics,"
To introduce the student to the basic concepts of mechanics and
thermodynamics, and enable the student to solve idealized
mechanical, thermodynamical and technical problems. Furthermore the
student receives practice in using idealized models to describe
real systems through project work. 
","Apply the kinematic concepts position, velocity, and
acceleration, and recognize important types of motion such as
projectile motion and circular motion. Identify forces and sketch free body diagrams for simple
mechanical systems consisting of particles and rigid bodies. Apply Newton's laws for translation and rotational motion
to simple mechanical systems consisting of particles and rigid
bodies. Compute the work and impulse of a force and apply the
work-energy theorem to simple mechanical systems. Formulate the principles of conservation of momentum, angular
momentum and mechanical energy and apply these principles to simple
mechanical systems. Apply the continuity equation and Bernoulli's equation to
simple stationary flows. Compute thermal expansion and carry out caliometric
calculations. Apply the ideal gas equation to determine pressure,
temperature, volume, and number of moles, and compute microscopic
properties of molecules. Explain the first and second laws of thermodynamics. Recognize simple thermodynamical processes (isochoric,
isobaric, isothermal, and adiabatic processes) and compute work
done and heat transfer for processes (including cyclic processes)
composed of these.","
Motion in 1+2+3 dimensions. Newton's laws. Work and kinetic
energy. Potential energy and energy conservation. Momentum and
collisions. Rotation of rigid bodies. Dynamics of rotational
motion. Equilibrium and elasticity. Gravitation. Periodic motion.
Fluid mechanics. Temperature and heat. Thermal properties of
matter. The first and second law of thermodynamics. 
",None,"
Carsten Knudsen,
Peter Christian Kjærgaard Vesborg,
Rasmus Bjørk,
Kaspar Kirstein Nielsen"
,,,,,,,,,,,,
10031 , Introduction to Physics and Nanotechnology,Danish , 10 ECTS , 2016/2017 ,E1A (Mon 8-12) and F1A (Mon 8-12),BSc,Department of Physics,"
The overall goal is to give Physics and Nanotechnology students an
engineerwise perspective on their bachelor education. This is
obtained by working with a number of topics within physics and
nanotechnology at DTU. Additionally, it is a goal to train a
correct measurement method in the laboratory, and finally it is a
goal to train working in groups and writing reports. 
","Explain the underlying physics for the following subjects:
x-rays and the inner structure of mattter, ultrafast optical
pulses, hydrodynamics and lab-on-a-chip technology, accelerometers,
semiconductor nanostructures, and graphene/2D materials. Conduct simple calculations of important quantities within the
subjects mentioned above. Discuss the research and technology related perspectives of the
subjects mentioned above. Conduct laboratory exercises and document understanding of how
to work in the laboratory and how to perform experiments. Interpret results - theoretical and experimental - and discuss
these in relation to the overall subject. Present and communicate results from measurement and/or
simulations, including knowing how to write a well structured and
well documented report. Process measured or calculated data, and evaluate them
critically. Participate constructively in group work, and use the
competences of the entire group. Apply modern software to data processing and computer
simulations.","
The course contains a number of condensed 4-week sections - each
with its own topic - in the 13-week periods. Each section is
planned and taught by an expert within the specific topic, and
contains both research and technology/engineering aspects. The
sections are taught by: Departments of Physics, Micro- and
Nanotechnology, and Photonics Engineering. The sections deal with:
""seeing the invisible"", ultrafast optical pulses,
hydrodynamics and lab-on-a-chip technology, accelerometers, semi
conductor nanostructures, and graphene/2D materials. The content in
these sections will vary from year to year. 
",None,"
Kristoffer Haldrup,
Mikkel Fougt Hansen,
N. Asger Mortensen"
,,,,,,,,,,,,
10033 , Mechanics and Physical Modeling,Danish , 10 ECTS , 2016/2017 ,"E2 (Mon 13-17, Thurs 8-12)",BSc,Department of Physics,"
Our aim is to make the student familiar with the fundamental
concepts of mechanics, and enable him/her to apply analytical
methods, when solving simple mechanical and technical problems.

To achieve our objective of giving our students a more intuitive
understanding of the laws of motion, we use a combination of
analytical methods and computer simulations. The use of computer
simulations will enable us to perform more complex as well as
technically relevant tasks. 
","Analyse a problem, plan and carry out a solution, and control
the results. Define important concepts of mechanics - such as position,
velocity, acceleration, angular velocity, momentum, angular
momentum, moment of inertia, kinetic and potential energy, centre
of mass, forces and torques. Know Newton's laws of motion: centre of mass motion and
rotational motion. Recognise when momentum, angular momentum and/or total
mechanical energy is conserved, and apply conservation laws to
solving mechanical problems. Use calculus and the laws of motion to solve problems for
particles and rigid bodies. Perform nondimensionalisation in order to simplify equations
and determine central dimensionless parameters. Use Lagrange and Hamilton formalisms for conservative systems
to derive the equations of motion for a particle or a rigid
body. Apply dimensional analysis to determine relationships between
physical quantities. Use computer programs to solve more complicated problems when a
numeric solution is necessary for particles and rigid bodies by
using the laws of motion. Perform error analysis including propagation of
errors.","
Newton’s laws, and the angular momentum relation – applied partly
to particles and partly to rigid bodies. The law of conservation of
energy, conservative and non-conservative forces. Collisions. The
introduction of fictive forces. Oscillations. Elements of
Lagrangian and Hamiltonian formalisms. Practical considerations
concerning computer simulation. Applications of error analysis.
Applications of dimensional analysis and non-dimensionalisation. 
",None,"
Sebastian Horch,
Martin Meedom Nielsen,
Carsten Knudsen"
,,,,,,,,,,,,
10034 , Thermodynamics and statistical physics,Danish , 5 ECTS , 2016/2017 ,F2A (Mon 13-17),BSc,Department of Physics,"
The aim with the course is to give the students an introduction to
the basic concepts of thermodynamics on the basis of elements from
statistical physics. The students acquire a knowledge of how
thermodynamics is derived from statistical physics, and become able
to perform calculations on simple systems within statistical
physics and thermodynamics. 
","Operate with the terms multiplicity, entropy and temperature,
and account for their relationship Calculate the probability of finding a system in a given state
with known energy, if the system is in equilibrium with a heat
bath. Calculate the partition function for simple model systems with
discrete states. Calculate average energy, free energy and entropy from the
partition function. Calculate changes in volume, pressure and temperature of an
ideal gas undergoing the four fundamental processes: isochoric,
isobaric, isothermal and a reversible diabatic processes. Calculate heat and work on an ideal gas undergoing one or more
processes. Calculate the efficiency of a simple heat engine, and the
coefficient of performance of a simple refrigerator. Apply the first and second law of thermodynamics. Estimate if a process is possible using the concepts entropy
and free energy. Carry out a specific project in a small group, and explain the
results in writing.","
Thermodynamical states and equations of states. Phases and phase
transformations. Statistical ensemble. Entropy and temperature. The
laws of thermodynamics. Boltzmann factor. Free energy. Heat, work,
and energy conversion. Ideal gas processes. 
",None,"
Kaare Hartvig Jensen,
Henrik Bruus"
,,,,,,,,,,,,
10036 , Electromagnetism for physicists,Danish , 10 ECTS , 2016/2017 ,"E4 (Tues 13-17, Fri 8-12)",BSc,Department of Physics,"
To obtain a working knowledge – theoretical as well as practical -
of basic electromagnetic theory and its applications, including
elementary circuit theory. 
","Identify the divergence and the curl of a vector field, and
find the flux of the field through a given surface . Calculate electrostatic forces, fields, and potentials
associated with simple and/or symmetrical charge
distributions. Adapt known solutions of the Laplace equation to new
problems. Calculate magnetic forces, fields, and potentials associated
with simple and/or symmetrical current distributions. Discuss and apply the D-field on problems with dielectric
materials and the H-field on problems with magnetic materials. Determine 3-dimensional fields of current by means of
electrostatic analogues. Explain and determine induced electromotive forces in simple
geometries. Apply the concept of mechanical work and the electric and
magnetic field energies to determine forces. Interpret Maxwell’s equations as a basis for explaining
electromagnetic waves. Determine the geometry of the fields and the energy propagation
in a plane, linearly polarised electromagnetic wave. Analyse simple electrical, linear circuits. Relate exercises in the laboratory to the theory.","
Electric charge. Electrostatics: The electric field E, the scalar
potential V, dielectrics and the D-field, Gauss´s law, energy and
forces. Electric current: Extended currents, Ohm's law, Joule
heat. Magnetostatics: The flux density B, Biot and Savart's
law, Gauss law for B, the vector potential A, magnetic materials
and the H-field, Ampere´s law, magnetic circuits. Energy and
forces. Induction: Faraday´s law, inductances. Circuits: DC, AC,
and transients. The Maxwell equations: The displacement current,
energy flow, the wave equations. Electromagnetic waves. Plane waves
and polarisation. 
","01005,10033","
Tomas Bohr,
Cathrine Frandsen"
,,,,,,,,,,,,
10041 , Physics 2 ,English , 5 ECTS , 2016/2017 ,E4A (Tues 13-17),BSc,Department of Physics,"
To introduce the student to electromagnetism, Maxwell's
equations, introductory optics, and introductory quantum mechanics.
Also, electrical circuits, the propagation of light and
electromagnetic waves, and interference and diffraction of light. 
","Calculate electrostatic forces, fields and potentials
associated with simple and/or symmetrical charge
distributions. Describe the concept of capacitance. Calculate magnetic forces and fields associated with simple
and/or symmetrical current distributions. Explain and determine induced electromotive forces. Apply Ohm's law and Kirchhoff's rules. Describe capacitors' and inductors' circuit behaviour
and solve simple transient and alternating current problems. Determine the field geometry for linearly polarized plane
electromagnetic waves. Describe reflection, refraction, dispersion, Huygen's
principle, total reflection and the Brewster angle. Solve simple problems with reflection and refraction.. Sketch simple consequences of interference and
diffraction. Describe the quantum mechanical wave function and the
Schrödinger equation. Describe and solve simple calculations for one-dimensional
quantum mechanical problems.","
Charges and fields. Potential and capacitance. Magnetism.
Induction. Ampere's and Faraday's laws. DC circuits.
Self-inductance and transients. AC circuits. Electromagnetic waves.
Dispersion. Diffraction. Photons. Particle waves and quantum
mechanics. Schrödinger equation. 
","10024,01005,10022,10020","
Mirko Salewski,
Cathrine Frandsen,
Christian Bahl"
,,,,,,,,,,,,
10044 , Physics 2,Danish , 5 ECTS , 2016/2017 ,E4A (Tues 13-17),BSc,Department of Physics,"
To introduce the student to electromagnetism, Maxwell's
equations, introductory optics, and introductory quantum mechanics.
Also, electrical circuits, the propagation of light and
electromagnetic waves, and interference and diffraction of light. 
","Calculate electrostatic forces, fields and potentials
associated with simple and/or symmetrical charge
distributions. Describe the concept of capacitance. Calculate magnetic forces and fields associated with simple
and/or symmetrical current distributions. Explain and determine induced electromotive forces. Apply Ohm's law and Kirchhoff's rules. Describe capacitors' and inductors' circuit behaviour
and solve simple transient and alternating current problems. Determine the field geometry for linearly polarized plane
electromagnetic waves. Describe reflection, refraction, dispersion, Huygen's
principle, total reflection and the Brewster angle. Solve simple problems with reflection and refraction.. Sketch simple consequences of interference and
diffraction. Describe the quantum mechanical wave function and the
Schrödinger equation. Describe and solve simple calculations for one-dimensional
quantum mechanical problems.","
Charges and fields. Potential and capacitance. Magnetism.
Induction. Ampere's and Faraday's laws. DC circuits.
Self-inductance and transients. AC circuits. Electromagnetic waves.
Dispersion. Diffraction. Photons. Particle waves and quantum
mechanics. Schrödinger equation. 
","10024,01005,10022,10020","
Mirko Salewski"
,,,,,,,,,,,,
10050 , Model Physics,Danish , 10 ECTS , 2016/2017 ,E1A (Mon 8-12) and F1A (Mon 8-12),BSc,Department of Physics,"
The aim of the course is to enable students to construct and
analyse models. 
","Perform physical experiments and perform statistical analysis
and curve fitting of data, and suggest improvements of
experiments. Carry out error analysis. Apply dimensional analysis and carry out non-dimensionalisation
to simplify equations and determine central dimensionsless
parameters. Estimate orders of magnitude and judge the validity of the
result. Solve problems in collaboration with others. Apply computer programs to simulate models, visualise
solutions, and perform sensitivity analyses of technical
problems. Identify forces and sketch free body diagrams for mechanical
systems of particles. Apply kinematic relations and conservation laws to solve
technical problems. Construct system dynamics flow diagrams and translate the flow
diagrams to differential equations. Apply elements of scientific methods to the solutions of
technical problems and identify inductive and deductive elements in
a method. Apply hypotheses to relations in quantitative data.","
System dynamics flow diagrams. Differential equation models.
Simulation, visualisation, and interpretation of results.
Sensitivity analysis. Error analysis of differential equation
models. 
",01005,"
Carsten Knudsen"
,,,,,,,,,,,,
10052 , Basic Physics and Chemistry,Danish , 10 ECTS , 2016/2017 ,E4B (Fri 8-12) and January,BSc,Department of Physics,"
The aim of the course is to present basic notions from physics and
chemistry, as well as introduce error analysis and dimensional
analysis. 
","Explain the structure of the periodic system of elements and
types of chemical bonds. Perform calculations with the basic quantities atomic mass,
formula mass, molecular mass and molar mass. Balance chemical equations and perform stoichiometric
calculations. Perform calculations on redox reactions, simple acid-base
reactions, chemical equilibrium, and determine equilibrium
constants. Perform calculations and modelling of chemical reactions. Estimate orders of magnitude and judge the results. Identify forces and sketch free body diagrams for mechanical
systems. Construct models and solve technical problems by use of
Newton's laws and kinematics. Compute the work done by a force and apply the work-energy
theorem and the principle of conservation of energy. Compute thermal expansion and carry out caliometric
calculations Perform uncertainty calculations. Perform experiments and carry out statistical analysis and
curve fitting of data.","
The Periodic System. Chemical bonds. Chemical reactions. Acids and
bases. Stoichiometry. Chemical equilibrium. Kinematics. Forces.
Newton's laws. Work. Energy. Estimation. Error analysis. 
",None,"
Carsten Knudsen,
Christian Thune Jacobsen,
Luise Theil Kuhn"
,,,,,,,,,,,,
10054 , Model Physics,Danish , 5 ECTS , 2016/2017 ,F5A (Wed 8-12),BSc,Department of Physics,"
The aim of the course is to enable students to construct and
analyse models. 
","Formulate system dynamics flow diagrams for chemical and
mechanical systems. Construct system dynamics flow diagrams for for example micro
and macro economical systems, energy systems, as well as technical
systems. Translate system dynamics flow diagrams to differential
equations. Translate between prototypes and scale models. Estimate orders of magnitude and relations in models. Apply computer programs to simulation models and visualise
solutions. Perform sensitivity analysis of differential equation
models. Perform error analysis of differential equation models. Interpretate and disseminate results of simulations,
sensitivity analysis, and error analysis of data. Apply dimensional analysis and perform non-dimensionalisation
to simplify equations and determine central dimensionless
parameters. Create and simulate stochastic models.","
System dynamics flow diagrams. Differential equation models.
Simulation, visualisation, and interpretation of results.
Sensitivity analysis. Error analysis of differential equation
models. Apply dimensional analysis and perform
non-dimensionalisation to simplify equations and determine central
dimensionless parameters. 
",None,"
Carsten Knudsen"
,,,,,,,,,,,,
10102 , Quantum Mechanics,Danish , 10 ECTS , 2016/2017 ,"F4 (Tues 13-17, Fri 8-12)",BSc,Department of Physics,"
To establish basic theoretical concepts within quantum mechanics
and by this create a systematic starting point for a scientifically
based development of advanced materials for technological
applications. 
","Iidentify physical systems that requires a quantum mechanical
description. Solve Schrödinger's equation for simple one-dimensional
systems and interpret the results. Quote the eigenvalues for the most important quantum mechanical
operators. Outline and explain the basic postulates of quantum
mechanics. Explain and apply Dirac notation. Recall the most important commutator relations. Formulate the connection between symmetry and conservation
laws. Apply creation and anihilation operator techniques. Calculate eigenvalues and eigenfunctions for perturbed
systems. Analyse simple molecular systems by means of the quantum
mechanical variational principle. Recognize and apply professional terminology in
English.","
Particles as waves, Schrödinger's equation. Expectations
values, operators, eigenvalues, and stationary states. Dirac
formalism. Commutators, unitary transformations, and matrix
representation. Symmetry and conservation laws. Free particles, the
potential well, and the harmonic oscillator. Angular momenta,
central potentials, and the hydrogen atom. Perturbation theory and
the variational method. Identical spin ½-particles. 
","31400,10036,01325,01035,34031","
Kirstine Berg-Sørensen,
Thomas Olsen"
,,,,,,,,,,,,
10103 , Quantum Mechanics revision,Danish , 0 ECTS , 2016/2017 ,August,BSc,Department of Physics,"
- 
",- - - - - - - -,"
- 
",None,"
Kirstine Berg-Sørensen,
Thomas Olsen"
,,,,,,,,,,,,
