COURSE NUMBER,COURSE NAME,LANGUAGE OF INSTRUCTION,CREDIT LOAD,YEAR,SCHEDULE,COURSE TYPE,DEPARTMENT,GENERAL COURSE OBJECTIVES,LEARNING OBJECTIVES,CONTENT,RECOMMENDED PREREQUISITES,COURSE RESPONSIBLE
,,,,,,,,,,,,
11000 , Engineering work,Danish , 10 ECTS , 2016/2017 ,E3B (Fri 13-17) and E5 (Wed 8-17),BSc,Department of Civil Engineering,"
Introduction to engineering work. Training of diciplines such as
problem solving, teamwork, documentation and presentation.
Introduce studyforms such as lectures, selfstudy, groupwork and
project work. Obtain skills in drawing/communication. 
","Describe/list the building engineers typical work areas Accumulate knowledge independently (and in groups) Arrange and execute simple project assignments Use basic rules in writing technical reports Describe general technical/physical conditions in/at simple
buildings Identify and explain/interpret simple problems of the ding
physics type Distinguish between and select solutions for functional
requirements of technical/physical nature Design more independently developed solutions for simple
problems Use freehand drawings for problem solving and presentation Use CAD to produce technical drawings Use Building Information Modelling (BIM) as design method and
tool","
The course is an introduction to engineering work. What does an
engineer do and how? Through practical examples from the world of
engineering problem solving skills are exercised and various
methods and tools for scketching, drawing (CAD) and building
modelling (BIM) are essential elements. 
",None,"
Per Goltermann,
Kurt Kielsgaard Hansen,
Flemming Vestergaard,
Christian Rønne,
Carsten Rode"
,,,,,,,,,,,,
11010 , Building technology,Danish , 5 ECTS , 2016/2017 ,January,BSc,Department of Civil Engineering,"
To make the students familiar with basic facts and concepts in
construction and Danish construction technology.

To provide an understanding of the design- and project phases
content and engineers involvement therein.

To make the student able to analyze simple functional
relationships, dispose areas and propose design, building envelope
construction and simple installations for simpler types of
buildings - and produce optimized and collocated project proposals
including drawings and documented through appropriate perspective
calculations. 
","Identify and describe plain building-parts Collect and classify basic information as the basis for the
hypothesis Suggest appropriate area planning for simple buildings
features Suggest construction system and building envelope construction
of simple buildings Suggest rather simple installation systems Integrate current partial solutions into a single optimized
building design Detail relevant building solutions within limited topics Organize and carry out project-work in groups Perform drawings that exhaustively documents the suggested
solutions Produce the results obtained in a recognized academic report
format Presenting highlights of the report content in a short
presentation","
Building components and usual design, design and construction
processes, proposed provision of simple building layout incl. area
use, design of structural systems, building envelope and defining
key technical construction features, principles and routing.

Estimates of building design and sizing of ductwork in simple
ventilation design and dimensioning of simple heating systems,
performance of CAD drawings and project presentation.

Integration of all partial solutions into a single, optimized
project. 
",11000,"
Christian Rønne"
,,,,,,,,,,,,
11020 , Building Fire Safety,English , 5 ECTS , 2016/2017 ,E4A (Tues 13-17),MSc,Department of Civil Engineering,"
To obtain knowledge of fire safety engineering with a focus on the
regulations in Denmark. The focus is on life safety, which is
achieved through a robust design that ensures shorter evacuation
times than critical fire times. 
","Discuss the valid regulations in the domain of fire safety
engineering Differentiate projects to be designed according to the building
regulative system, from projects according to the rules established
by the emergency management act Select the right category of application in relation to a
project Explain methods for active and passive fire safety Evaluate and select appropriate fire test methods for building
materials Explain principles of detection and suppression of fires Analyse the evacuation safety level in a building, based on a
comparison of RSET and ASET Review tenability criteria for fire Make a calculation of the evacuation of a building Perform timeline analysis for a fire scenario that is deemed
relevant Perform a simple risk analysis","
- Injuries after a building fire

- The fire regulations in Denmark

- Performance based codes

- Fire tests and classification

- Basic fire dynamics properties

- Fire properties of common buildings materials

- Active and passive fire safety systems

- Evacuation analysis

- Fire safety analysis and planning of building projects

- Fire risk assessment

- Sustainable fire safety design

- Fire modeling 
",,"
Grunde Jomaas"
,,,,,,,,,,,,
11022 , Fire dynamics,English , 5 ECTS , 2016/2017 ,F4B (Fri 8-12),MSc,Department of Civil Engineering,"
To make the students able to carry out fire dynamic analysis in
enclosures. 
","Explain the assumptions for the empirical and theoretical
formulas in fire dynamics Review the terminology in the domain of fire dynamics Make simple calculations of parameters in the domain of fire
dynamics, i.e. heat release rates, temperatures, smoke layer
properties, radiation etc. Validate the calculated results Analyse an initial fire room and estimate input parameters to
the used calculation models Explain the principle in a two-zone model Interpret and estimate the values of fire test data Plan a fire dynamic analysis based on hand calculation as well
as a zone model Give a description of a room fire in a pressure as well as in a
temperature related perspective Calculate properties of importance to ignition, flame spread
and heat transfer during a fire Explain the central theoretical basis that a two-zone model and
a CFD-model are based on","
1. Fire load

2. Energy release rates

3. Flames and plumes

4. Pressure and ventilation flow

5. Gas temperatures in enclosures

6. Heat transfer and ignition

7. Smoke filling

8. Fire models 
",None,"
Grunde Jomaas"
,,,,,,,,,,,,
11023 , Structural Fire Safety Design,English , 5 ECTS , 2016/2017 ,E2B (Thurs 8-12),MSc,Department of Civil Engineering,"
The course aims to give the participants competences to understand,
design and calculate load-bearing structures exposed to fully
developed fires, standard fires and high temperatures. 
","Understand how the fire development affects the load-bearing
capacity of a structure Analyse a fire compartment of a building Assess a structural design fire Comprehend the behaviour of a fire exposed structure Analyse the damage of a fire exposed structure Design a structure of wood, steel and concrete for a fully
developed fire Design a structure of wood, steel and concrete for a
standardised fire Assess how connections may respond to a given fire Evaluate results of structural fire tests Assess possibilities of repair of a fire damaged
structure","
Technical basis

Performance-based fire safety design of structures

Fire load

High temperature material properties for wood, steel and concrete

Fire resistant structural materials

Load-bearing capacity at fire of beams, columns, decks, walls and
whole structures

Load-bearing capacity of fire exposed connections

Anchorage of fire exposed reinforcement

Explosive spalling

Examples of appropriate design and construction 
","11744,11746,11531,11941,11312,11311","
Kristian Dahl Hertz,
Luisa Giuliani"
,,,,,,,,,,,,
11031 , Building Information Modeling (BIM),Danish , 5 ECTS , 2016/2017 ,F3A (Tues 8-12),BSc,Department of Civil Engineering,"
The overall course objective is to enable the participants to work
with a 3D object-oriented approach through building processes.
Being able to develop digital building models as bearers of project
information for data extraction, exchange and communication. Being
able to use methods, standards and tools that support Building
Information Modelling concept (BIM) and parametric design. Being
able to handle the basic working methods as result of the public
client requirements from the Danish Digital Construction. 
","Apply a koncept of 3D objectoriented working method, Building
Information Modeling (BIM) Apply the koncept of BIM in a concrete project Apply BIM-tools in object oriented and parametric modeling in a
building project Create digital parametric building components and attach
properties to components Cooperate in a structural manner with partners in a project
using discipline models and aggregate model on a basic level Apply model based simulations of building properties and
functions Apply coordination between discipline models and model
checking Apply the principles for data exchange between different
discipline models via ICT Specifications and the neutral IFC-format
(buildingSmart) Apply Information Level method in discipline models for
successive concretization Analyzing an academic issue within BIM in a report","
Create digital building models using a 3D object-oriented approach
from BIM.

Testing model based integrated collaboration. Apply ICT
specification of a project through a standardized paradigm. Apply
standards for data exchange.

Apply classification of building objects using the danish
classification system CCS among other.

Apply BIM tool for modelling discipline models at different
Information Levels (LOD).

Combine discipline models to aggregate models for model checking.

Make simulation/calculation model based. Perform financial
estimates model based through price databases.

Exchange of data via the neutral IFC format (buildingSmart).

Create site and toposurface. Linking files and share coordinates
for world localization and orientation.

Create digital parametric model components with intelligent
constraints.

Produce a report of an academic issue regarding BIM addressed in
the course. 
","11990,11000,11951","
Flemming Vestergaard"
,,,,,,,,,,,,
11034 , Advanced Building Information Modeling (BIM),English , 5 ECTS , 2016/2017 ,E2A (Mon 13-17),MSc,Department of Civil Engineering,"
The general course objective is to give the participants a deeper
understanding of the main factors that characterize the vision of
digital building models and the integration of the overall
construction process (integrated BIM/VDC). Analyze and develop 3D
models and object-oriented methods for data representation, data
exchange, simulation and communication in a project. The course
focuses on analyzing and applying model-based methods and tools
that forms the future building processes, as well as to evaluate
the potentials and barriers in the implementation of BIM. 
","Analyse and apply tools and methods for project collaboration,
data exchange and project coordination Interpret and evaluate a parametric modeling concept importance
of a future 3D object-oriented workflow Apply a neutral common format as exchange format between
applications and the project partners for interoperability Perform and analysis of and use construction classification and
other standards, national and international, for data exchange and
data reuse Develop built applications for the generation of complex
parametric building structures and components using visual
programming. Perform simulations of building models and building entities
within a professional domain Analyse and evaluate objectoriented working methods impact on
the integration in the building process Analyse building processes and specify requirements for input
and output in an integrated process flow Evaluate the potentials in a BIM working method and the
barriers in the implementation of BIM Produce a report of an academic issue addressed at the
course","
Setting up a collaboration project through project agreements, ICT
specification for ICT regulations.

Model consistency check with model checker program (Solibri MC),
set up a project specific checklist.

Building structure for project coordination through exchange
platforms and guidelines.

Apply IFC as a common interchange format.

Analysis of the Danish building classification CCS and its
applications.

Apply the Danish guidelines and standardization as common
classification and reference structure, property data and
information levels, developed by Cuneco.

Development of digital, parametric building structures and
components with construction constraints, Revit and Dynamo,
graphical programming, adaptive components (Dynamo-Revit).

Simulation of properties for a building model within building
domaines as construction, energy and facilities management.

Analysis of selected construction processes to optimize them
through model-based methods, requirements for input and output in
the form of a standardized specification of building elements and
attributes using the method 'Information Delivery Manuals'
from building smart (IDM).

Evaluate the potentials in a BIM working method and the barriers in
the implementation of BIM

It concludes with a report of a distributed topic within the course
area or a case study of the implementation of ICT. 
",None,"
Flemming Vestergaard,
Jan Karlshøj"
,,,,,,,,,,,,
11035 , Advanced BIM for architectural engineering,Danish , 5 ECTS , 2016/2017 ,E2A (Mon 13-17),BEng,Department of Civil Engineering,"
The overall goal is to provide building design students a variety
of specialized methods and tools in Building Information Modeling
(BIM), which can be used to solve more complex tasks in a design
and engineering context. The subject areas are: Analysis and
modeling of complex geometry and form; Parametrics in building
construction; Visual programming of parametric systems and
structures, 3D printing for presentation.

Finally there is a specific design task within the area of the
course. 
","Analyzing complex geometry in different scales, building
systems and building components Developing models of complex structures and elements from the
construction domain Analyzing parametrien with relations and constraints in an
existing and in an imaginary building construction Creating digital parametric building structures using tools for
visual programming Implement design iterations through parametric
specifications Creating physical models through 3D printing of digital
models Developing a concrete designs project using the methods,
techniques and tools that are introduced on the course Making presentation and communication of projects and solutions
through models, visualizations, charts and other media","
Tools for the analysis of complex geometry and shape: curves,
surfaces, solids.

Modeling of complex structures from the engineer's professional
practice.

Parametric studies of entities, relationships, variables in
building structures.

Development of digital parametric building structures - systems,
building elements and characteristics - using visual programming
tools such as Rhino/Grasshopper and/or Revit/ Dynamo.

3D printing from digital models for project presentation and
communication.

Finally there is a specific design task, the course introduced
methods and tools used. 
",None,"
Flemming Vestergaard,
Lotte Bjerregaard Jensen,
Jan Karlshøj"
,,,,,,,,,,,,
11050 , Super,English , 5 ECTS , 2016/2017 ,F4B (Fri 8-12),MSc,Department of Civil Engineering,"
Super-light structures and pearl-chain reinforcement are new
concrete structures invented at DTU Civil Engineering.

They open possibilities for new shapes of building structures and
for reducing the price and resource consumption to less than the
half of that of usual structures of concrete and steel.

The course aims to give the participants competences to understand,
design and calculate super-light structures and participate in the
development of their details, components and architectural
expressions.

In addition, the course gives competence in establishing
calculatiol models and identifying critical matters for a design,
which is important for engineering work at the early phases of a
building project. 
","comprehend the behaviour of a super-light structure assess the load-bearing capacity of a super-light
structure analyse structures in general by means of systems of
concentrated forces comprehend the behaviour of a pearl-chain reinforcement design a minimal super-light structure with pearl-chain
reinforcement establish calculational models and identifying critical matters
for a structure apply advanced materials in structural design understand how architecture can support minimal super-light
structures assess the price and resource consumption of a structure assess the constructability of a super-light structure present a design preferably by a movie or 3D pictures and a
brief report","
After a brief introduction, the participants define different tasks
for their project work.

It could be development of a prefabricated beam, column, a
connection detail, a bridge, a hall, an architectural expression of
a building or calculation tools, new combinations of materials etc.

The results are presented and visualised and thereby made
accessible for use by others. 
","11023,11744,11746,11311,11941","
Kristian Dahl Hertz"
,,,,,,,,,,,,
11066 , Building Renovation and Transformation,English , 5 ECTS , 2016/2017 ,F5A (Wed 8-12),MSc,Department of Civil Engineering,"
To give participants basic knowledge of structures and materials in
existing buildings, and with this background to enable them to
renovate and remodel using traditional as well as new building
techniques and building methods. 
","Understand the engineer's role in building renovation Find an appropriate methodology in different types of building
renovation Implement a building registration Propose methods for investigations of typical and critical
failures of the existing buildings Propose solutions for the renovation of typical elements in the
building envelope Propose solutions for the renovation of bathrooms in existing
buildings Implement advanced investigations/studies of moisture transport
in building elements Focus on current issues around the hazardous materials in
existing buildings like PCB, mercury, led, mould etc.","
The students in this course will deal with a number of important
engineering issues associated with building renovations.

The course will alternate between lectures and assignments. The
course includes current knowledge on building renovation - from the
general to the more detailed level.

The main part of the teaching days are affiliated with tasks that
are solved and delivered during the course. 
",,"
Søren Peter Bjarløv,Cristian Rønne"
,,,,,,,,,,,,
11067 , Building Renovation and Transformation ,English , 10 ECTS , 2016/2017 ,F5A (Wed 8-12) and June,MSc,Department of Civil Engineering,"
To give participants basic knowledge of structures and materials in
existing buildings, and with this background to enable them to
renovate and remodel using traditional as well as new building
techniques and building methods. 
","Understand the engineer's role in building renovation Find an appropriate methodology in different types of building
renovation Implement a building registration Propose methods for investigations of typical and critical
failures of the existing buildings Propose solutions for the renovation of typical elements in the
building envelope Propose solutions for the renovation of bathrooms in existing
buildings Implement advanced investigations/studies of moisture transport
in building elements Focus on current issues around the hazardous materials in
existing buildings like PCB, mercury, led, mould etc. Implement an actual renovation/​transformation project, based
upon a real case or Implement a scientific development work with the Rebuild
Platform at DTU Construction","
The students in this course will deal with a number of important
engineering issues associated with building renovations.

The 13-week period course will alternate between lectures and
assignments. The course includes current knowledge on building
renovation - from the general to the more detailed level. The main
part of the course days are affiliated with subtasks which are
solved and delivered during the course.

The 3-week period will include an open-ended, cross-disciplinary
design- or research oriented project assignment, including some of
the issues, the 13 week period has included. 
",,"
Søren Peter Bjarløv,
Christian Rønne,Cristian Rønne"
,,,,,,,,,,,,
11080 , Advanced Building Design,English , 10 ECTS , 2016/2017 ,E3A (Tues 8-12) and January,MSc,Department of Civil Engineering,"
To give participants knowledge of integrated building design, and
how specialised competences can be used in collaboration within
multidisciplinary project teams to create a design fulfilling many
functional requirements at the same time. In this course, you are
working with the additional competences it takes to construct
solutions to open ended problems compared with only being able to
analyse a given construction. The course is based on solving in
groups a realistic design job which is in line with the demands
given by the construction industry. In addition, you are working
with digital building design methods. 
","Collaborate with other specialists Analyse a client's requirements Participate in develop a design management scheme to enable the
project team to work to-gether towards common goals and
deadlines Use 3D object orientated building models and associated IT
tools to develop a detailed design solution Integrate various technical requirements into a functional
building design that satisfies the client brief Produce technical reports documenting the fulfillment of
specific functional re-quirements such as indoor climate, energy
performance, structural performance, fire and safety performance,
acoustic performance and constructability Justify and defend design decisions Develop an outline design and preliminary design Present the final design to the internal assessors Achieve recognition of the need for developing alternative
solutions and iterations in the design process Achieve knowledge about systems engineering","
This is a synthesis course to be taken late in an MSc study in
Civil Engineering or Architectural Engineering, where the students
have obtained advanced competences on specific topics. Each student
has the responsibility to on one hand to take active part in
creating a common design project, and on the other hand to
contributes with construction, analysis, and documentation within
his or hers own field of work. 
","11411,11030,11141,11115,11312,11120,11121,11203,11311,11126,11561,11993,11995,11994,11997","
Jan Karlshøj"
,,,,,,,,,,,,
11110 , Thermal Building Physics,Danish , 0 ECTS , 2016/2017 ,August,BSc,Department of Civil Engineering,"
The course gives an in-depth understanding of the heat transfer
mechanisms: Conduction, convection and radiation, as well as in
setting up heat balances. The course will give proficiency in
analysing the thermal conditions of whole buildings and building
components. The course enables the students to understand and use
calculation methods for steady-state, transient, one- and
multi-dimensional heat flows, including models for building
components. 
","discuss the heat transfer mechanisms which are relevant for
building thermal analysis: conduction, convection and
radiation carry out an analytical calculation of steady-state conduction,
convection and radiation heat transfer compose a heat balance for a zone within a whole building and
for a surface within a building component translate a problem concerning thermal conditions of a building
or building component into a physical/mathematical model carry out an analytical calculation of non-steady heat
conduction in a body explain about methods for numerical calculation of non-steady
heat flows in constructions carry out an analytical calculation of multidimensional heat
conduction in a body explain about numerical calculation of multidimensional heat
flow in building structures set up a model for calculation of multidimensional heat flow in
a building component judge what would be an appropriate design of the building
envelope with respect to achieving an optimal thermal function,
including minimization of thermal bridges carry out a complete thermal analysis of a building design
using the taught calculation methods, such that the thermal
function of the building will be optimized","
Analysis of heat transfer mechanisms: Conduction, convection and
radiation, and their application to heat transfer in buildings.
Calculation of heat transport under transient and multidimensional
conditions with introduction of appropriate thermal analysis
software.

Composition of the building envelope and the underlying principles.
Thermal properties of building components. Thermal analysis of
insulation for technical systems. 
","11937,11000,11738,11141","
Jørgen Erik Christensen,
Carsten Rode"
,,,,,,,,,,,,
