COURSE NUMBER,COURSE NAME,LANGUAGE OF INSTRUCTION,CREDIT LOAD,YEAR,SCHEDULE,COURSE TYPE,DEPARTMENT,GENERAL COURSE OBJECTIVES,LEARNING OBJECTIVES,CONTENT,RECOMMENDED PREREQUISITES,COURSE RESPONSIBLE
31385 , Autonomous Robot Systems,English , 5 ECTS , 2016/2017 ,January,MSc,Department of Electrical Engineering,"
To give the student an insight into the construction and
application of autonomous robotic systems. In addition, to give an
insight into and experience with the construction and testing of
hardware and software in computer based robot systems. 
","explain the uses of autonomous robots explain how sensors of mobile robots work perform a calibration of a mobile robot calculate the steady state of a feedback system program in SMR-CL document task solutions on the web debug and solve practical tasks in the laboratory analyze a task and plan the solution using a given mobile
robot program a mobile robot to solve a given task design and implement basic software for mobile robots","
A number of introductory exercises, lectures covering autonomous
robotic systems and a larger assignment. Major autonomous robotic
system components: software, computer systems and communication,
modeling and kinematics, dynamic control, sensors and actuators.
AUT's mobile robots are used in the final assignment. 
","02102,02101","
Ole Ravn,
Nils Axel Andersen"
,,,,,,,,,,,,
31388 , Advanced Autonomous Robots,English , 10 ECTS , 2016/2017 ,"F4 (Tues 13-17, Fri 8-12)",MSc,Department of Electrical Engineering,"
To enable the students to apply methods and tools within computer
and information technology and mathematics in order to specify,
design, use and maintain advanced robot systems as well as
understand and extend the algorithms and methods used. 
","Describe the development in the robotic field over the last 30
years Explain the different principles in mobile robot
locomotion Derive the equations of motion for a given wheel
configuration. Classify sensor for robots and derive their equations Suggest and implement algorithms for signal processing and
feature extraction for vision and laser scanners. Explain the different steps in mobile robot localization and
implement the related algorithms Explain and choose software architectures for mobile robot
planning and navigation Independently design, program and debug software for mobile
robots in the laboratory","
Introduction to C and Linux, program and system development tools,
software quality control, locomotion of mobile robots, mobile robot
kinematics, perception using camera and laser scanner, mobile robot
localization, planning and navigation.

The exercise part consists of introductory exercises and a project
solved in teams using a mobile robot. 
","31385,31373,31300","
Ole Ravn,
Nils Axel Andersen"
,,,,,,,,,,,,
31400 , Electromagnetics,English , 10 ECTS , 2016/2017 ,"E1 (Mon 8-12, Thurs 13-17)",BSc,Department of Electrical Engineering,"
The students must acquire a knowledge about the concepts and
mathematically formulated laws of electromagnetics, which enables
them to understand electromagnetic phenomena in nature and
technology as well as to solve simple technical problems. 
","Define and apply rectangular, cylindrical, and spherical
coordinate systems as well as vector analytical concepts -
gradient, divergence, and curl - to describe spatial
electromagnetic fields Define electric, magnetic, and electromagnetic field, as well
as other central concepts; e.g. charge density, current density,
flux density, scalar and vector potentials, and calculate these for
simple electromagnetic configurations Explain the interaction of materials with electromagnetic
fields via polarization, conduction, and magnetization; describe
this with permittivity, conductivity, and permeability, and
calculate capacitance, resistance, and inductance in simple
cases Explain and apply the general Maxwell's equations with
constitutive relations and boundary conditions, as well as reduce
and apply these for special materials and/or time variations such
as phasor-notation for time-harmonic fields Explain energy and power for electromagnetic fields Explain electromagnetic waves and define and apply parameters
like wave number, intrinsic impedance, polarization, and
propagation constant Explain reflection and transmission of plane electromagnetic
waves at plane boundaries and define concepts as e.g. TM- and
TE-polarization, reflection and transmission coefficients, standing
wave ratio, total reflection, and Brewster angle Calculate reflected and transmitted waves at plane
boundaries Explain propagation of electromagnetic fields along
transmission lines, and define and apply concepts such as voltage
and current, characteristic impedance, and propagation
constant Design transmission line circuits such as quarter wave
transformer and single-stub tuner by use of the Smith-chart Apply Danish as well as English electro-technical
terminology","
Resumé of vector analysis, static electric fields, steady electric
currents, static magnetic fields, time-varying fields,
Maxwell's equations, plane electromagnetic waves, and
transmission lines. 
","01005,31001,31003","
Samel Arslanagic"
,,,,,,,,,,,,
31405 , Wireless Communications,English , 5 ECTS , 2016/2017 ,F1A (Mon 8-12),BSc,Department of Electrical Engineering,"
The students acquire a knowledge about the physical layer in
wireless communications, which provides them with an understanding
of systems and elements and makes them capable of solving simple
technical problems. 
","Perform system analysis of the physical layer of a wireless
communication systems Calculate the signal level in the following elements of a
wireless communication system: RF transmitter, transmission lines,
transmitting and receiving antennas, radio wave propagation
channel, and RF receiver Perform calculation of noise in a complete receiver chain
consisting of, e.g., antenna, low-noise amplifier, transmission
line, filters, mixer, and demodulator Analyse basic RF transmitters and receivers structures Calculate power transfer on transmission lines Calculate directivity, gain, radiation efficiency,
polarisation, effective area, and effective length for simple
antennas Calculate path loss and fading for ideal and realistic
radiowave propagation channels Understand basic analogue and digital modulation forms and
analyse the associated modulators and demodulators Calculate bit error probability for basic digital modulation
forms","
Introduction to wireless communication systems, transmitters and
receivers, RF circuits and antennas, noise and power budget, radio
wave propagation, and analogue and digital modulation. 
","02405,02403,02402,31400,31035,10036,31038,31605,34120","
Vitaliy Zhurbenko"
,,,,,,,,,,,,
31412 , Antenna and Microwave Technology for Wireless Communications,English , 10 ECTS , 2016/2017 ,E5 (Wed 8-17),MSc,Department of Electrical Engineering,"
The aim of the course is to make the student able to understand the
theories, methods, physical mode of operation, and the technical
construction of the components that are used in wireless systems. 
","Apply Maxwell’s equations and Fresnel’s reflection coefficients
on materials with loss. Construct and evaluate transmission-line models including loss
by transmission line theory. Design transmission lines (rectangular waveguide, coaxial
cable, microstrip, and stripline) and demonstrate knowledge of TEM,
TE and TM waves, and group velocity calculation. Design and analyze microwave network by the use of scattering
and transmission parameters and demonstrate knowledge to
signal-flow graphs. Design impedance matching circuits (discrete components, single
and double stub, and quarter-wave transformer). Design of PIN-diode circuits. Calculate, apply and evaluate fundamental antenna parameters
and vector potential. Design wire and loop antennas for, e.g., wireless communication
systems. Design microstrip antennas and corner reflector antennas. Design linear, plane and circular antenna arrays. Demonstrate knowledge of wideband dipoles, frequency
independent antennas, antenna miniaturization, fractal antennas,
and aperture antennas. Demonstrate knowledge of integral equation and method of
moments, and calculation and application of mutual
impedance.","
Transmission lines, rectangular waveguide, S-parameters, impedance
matching, linear wire antennas, especially dipole and loop
antennas, aperture antennas, e.g., microstrip antennas, and arrays.

",31405,"
Kaj Bjarne Jakobsen"
,,,,,,,,,,,,
31415 , RF Communication Circuits,English , 10 ECTS , 2016/2017 ,"E2 (Mon 13-17, Thurs 8-12)",MSc,Department of Electrical Engineering,"
To introduce RF communication circuits, their design concepts in
discrete or integrated realizations, and the trade-off between
circuit technology and communication systems requirements. The
student will be able to design RF communication circuits or
subsystems based on component, circuit, and system data and
specifications. 
","Explain principles of the most common radio transmitter and
receiver systems Design frequency selective networks using narrow band
approximations and series-to-parallel conversions Construct RF impedance matching and transformation circuits
using discrete components Design stable small-signal RF amplifiers Calculate noise-figure and dynamic ranges of amplifiers from
component data Explain basic RF power amplifier principles and conduct simple
design calculations Design simple RF-oscillators using LC and crystal
resonators Explain mixer principles and conduct basic design
calculations","
RF signals in analog and digital modulations. RF circuits including
linear amplifiers, mixers, oscillators, detectors, limiters, and
power amplifiers. Transmitter and receiver structures. Design of RF
integrated circuits. Circuit concepts like stability, noise,
distortion, intermodulation, and dynamic range. System concepts
including signal to noise ratio, thresholds, and bit error rates. 
",31405,"
Vitaliy Zhurbenko"
,,,,,,,,,,,,
31418 , Microwave Engineering,English , 5 ECTS , 2016/2017 ,January,MSc,Department of Electrical Engineering,"
The aim of the course is to make the student able to understand the
theories, methods, physical mode of operation, and the technical
construction of the components that are used in wireless systems. 
","Design binomial, chebyshev and tapered impedance matching
circuits and their realization in, e.g., microstrip transmission
lines. Use the Bode-Fano criterion. Analyze microwave resonators and design transmission line
resonators. Calculate and evaluate the fundamental properties of power
dividers and couplers. Design T-Junction and Wilkinson power dividers in addition to
quadrature, Lange, and 180-degrees hybrid couplers Design microwave filters having maximally flat, equal-ripple,
and linear phase characteristic. Apply Richard’s transformation, Kuroda’s identities, and
impedance and admittance inverters. Design stepped-impedance, coupled line and coupled resonator
filters. Design stable microwave amplifiers maximum gain, specified
gain, or low noise. Design transistor and dielectric resonator oscillators. Demonstrate knowledge of mixers. Demonstrate knowledge of an elective microwave systems
documented in an ISI periodical such as, e.g., IEEE
Transactions.","
Analysis and synthesis of impedance matching circuits, power
dividers, directional couplers, microwave filters, microwave
amplifiers, microwave resonators, microwave oscillators, microwave
mixers, and microwave systems. 
",31412,"
Kaj Bjarne Jakobsen"
,,,,,,,,,,,,
31420 , Microwave Techniques,English , 10 ECTS , 2016/2017 ,"F2 (Mon 13-17, Thurs 8-12)",MSc,Department of Electrical Engineering,"
To enable the participants to analyze and design analog RF and
microwave circuits using waveguides, transmission lines, active and
passive components, microwave filters and resonators as well as
linear and nonlinear hybrid and monolithic integrated circuits. 
","Analyze microwave circuits containing transmission lines Use S-, Z-, Y-, ABCD parameters for the analysis of microwave
networks Design matching networks for microwave active and passive
circuits Understand the design of low-noise amplifiers Design microwave filters and couplers Use circuit analysis techniques for nonlinear microwave
circuits Design and analyze mixer and oscillator circuits Derive propagation modes in planar and hollow waveguides Use coupled-line theory of even-odd mode excitation Knowledge of Active Microwave Semiconductor Devices","
Repetition of electromagnetic theory, transmission line theory,
analysis and synthesis of transmission lines and hollow, dielectric
and planar waveguides. Circuit theory of waveguiding systems.
Impedance transformation and matching. Passive RF and microwave
components. Resonators and filters. Nonlinear circuit analysis.
Active microwave devices and circuits, noise, design of microwave
transistor amplifiers, mixers, and oscillators. 
","31400,31035,31405,31415","
Tom Keinicke Johansen"
,,,,,,,,,,,,
31428 , Advanced Electromagnetics,English , 5 ECTS , 2016/2017 ,F4A (Tues 13-17),MSc,Department of Electrical Engineering,"
The participants must acquire an understanding of advanced
electromagnetic concepts and methods, which enables them to analyze
complex technical problems and prepare them for research in the
broad range of applied electromagnetics. 
","Memorize Maxwell's equations and boundary conditions with
electrical as well as magnetic sources Define vector potentials, establish their differential
equations, and derive solutions in terms of integral
expressions Determine radidated fields from simple as well as complex
sources, and investigate their near- and far-fields Explain the interaction of materials with electromagnetic
fields through polarization, conduction and magnetization for
general as well as simple materials Explain the harmonic oscillator in relation to polarization of
materials, establish the governing differential equation, and solve
this for time-harmonic fields Explain double-negative materials and solve electromagnetic
problems involving these Explain and apply electromagnetic principles and theorems such
as uniqueness, duality, image principles, reciprocity theorem, and
equivalence principles Explain and apply sprectral expansions of fields in plane,
cylindrical, and spherical waves Explain and apply analytical computational techniques, and
assess their region of validity and accuracy Read and make use of research articles from scientific
journals","
The course concerns the radiation and propagation of
electromagnetic waves and their scattering from, and interaction
with, objects composed of complex geometries and/or complex
materials:

1. Maxwell's equations with magnetic sources and boundary
conditions.

2. Electromagnetic properties of materials.

3. Wave equation in rectangular, cylindrical, and spherical
coordinates.

4. Plane wave propagation and reflectrion/transmission at plane
boundaries.

5. Radiation from sources - vector potentials.

6. Electromagnetic principles and theorems.

7. Scattering from plane, cylindrical, and spherical structures.

8. Electromagnetic metamaterials. 
","31400,10036","
Olav Breinbjerg"
,,,,,,,,,,,,
31430 , Antennas,English , 10 ECTS , 2016/2017 ,E5 (Wed 8-17),MSc,Department of Electrical Engineering,"
The participants must achieve an understanding of antennas on basis
of the electromagnetic field theory. Furthermore, they must achieve
the skill to analyze and design advanced antennas and antenna
systems using numerical techniques. 
","Apply electromagnetic field theory to analyze antennas. Calculate numerically the radiation of antennas and related
antenna parameters from an arbitrary current distributions. Derive integral equations for current distributions on
antennas. Apply the method of moments to transform integral equations to
systems of equations. Analyze and design microstrip antennas. Analyze and design reflector antennas. Analyze and design antenna arrays - including phased
arrays. Develop simple computer codes for analysis of antennas. Apply commercial computer codes for analysis of antennas. Know about different methods for measurement of antennas. Understand and apply articles from scientific
journals.","
Radiation from current distributions. Numerical methods for
calculation of radiation from arbitrary current distributions and
the associated antenna parameters. Computational electromagnetics
(CEM), in particular integral equations and the method of moments
(MOM). Theoretical and numerical analysis of microstrip and
reflector antennas as well as antenna arrays. 
","31412,31428","
Olav Breinbjerg"
,,,,,,,,,,,,
31435 , Antenna Measurements in Radio Anechoic Chambers,English , 5 ECTS , 2016/2017 ,January,MSc,Department of Electrical Engineering,"
The students must acquire a knowledge about measurement of antenna
parameters in radio anechoic chambers, and a skill to conduct such
measurements. 
","Define and explain as well as compare and assess different
methods for measurement of antenna radiation - in particular
far-field measurements, planar near-field measurements, and
spherical near-field measurements Explain the theory for planar and spherical near-field
measurements Carry out mechanical and electrical alignment of different
antenna measurement systems Carry out measurements of antenna radiation with different
antenna measurement systems - in particular the system of the
DTU-ESA Spherical Near-Field Antenna Test Facility Carry out measurements of scattering parameters of antennas and
microwave components by use of network analyzer Calculate the radiation from several types of antennas and
determine parameters such as directivity, gain, and
polarization Analyse and assess calculated and measured results as well as
compare these and explain possible differences Give presentations of experimental and theoretical topics
regarding antennas and antenna measurements","
One or more topics within measurements of antenna radiation,
polarization and gain; in particular, near-field measurements and
near-field to far-field transformation. 
",31430,"
Olav Breinbjerg,
Jeppe Majlund Nielsen"
,,,,,,,,,,,,
31445 , Signal Integrity in High,English , 5 ECTS , 2016/2017 ,June,MSc,Department of Electrical Engineering,"
The aim of this course is to provide knowledge about and practical
experience in reduction and identification of signal integrity
problems related to integrated circuits, packaging, interconnects,
multilayer PCB layout, and power distribution networks. 
","Model interconnects as transmission lines Use electromagnetic models of vias and non-uniform
interconnects Analyse the transient behaviour due to reflections from
realistic loads Use S-parameters and their relation to time-domain behaviour of
1- and 2-ports Describe the trade-off between single-ended and differential
signalling Explain cross-coupling between interconnects and analyse
cross-coupling between PCB traces Model standard component types by including relevant parasitic
elements Explain strategies for power distribution networks and
grounding Use driver and receiver models, including IBIS models and
packaging parasitics Explain design rules for PCB layouts Describe PCB material properties, manufacturing processes, and
layout stacks","
Transmission line theory, reflections, transient behaviour of
realistic loads. S-parameters, TDR (Time Domain Reflectometry)
measurements and their relation. Modelling of vias and non-uniform
interconnects. Single-ended and differential signalling. Cross
coupling between PCB traces. Lumped circuits, component types and
component parasitics. Power distribution network, decoupling of
power supply, grounding and return currents. PCB layout design
rules for high-speed signal transmission. PCB materials and
processes. 
",,"
Kristian Lindberg-Poulsen,
Tom Keinicke Johansen"
,,,,,,,,,,,,
31470 , Advanced Microwave Integrated Devices and Circuits,English , 10 ECTS , 2016/2017 ,Fall,Ph.D.,Department of Electrical Engineering,"
The aim of the course is to present to participants recent advances
in the field of high-speed, microwave, and terahertz integrated
electronics. The course will enable the participants to evaluate
current limitations in high-frequency semiconductor devices and to
develop or refine large-signal and small-signal circuits operating
up to terahertz frequencies. The participants of the course will be
introduced to advanced design techniques for Monolithic Microwave
Integrated Circuits (MMICs) based on nonlinear circuit analysis and
electromagnetic simulations. Finally, the participants will improve
their scientific dissimination skills by giving presentations and
preparing scientic articles. 
","Analyze semiconductor device models in Si and III-V
technologies Extract small-signal model parameters of modern microwave
devices Develop and/or refine large-signal models incl. thermal
effects Develop equivalent circuit models for circuit discontinuities
using electromagnetic simulation Use de-embedding techniques for electromagnetic
simulations Analyze nonlinear circuits using harmonic-balance and
analytical techniques Design of MMIC power amplifiers, oscillators, multipliers, and
mixers Prepare articles of state-of-the-art in relevant scientific
areas","
The content of the course is covering the following areas: physical
structure and operation of high-frequency semiconductor devices,
large-signal and small-signal semiconductor device modelling,
nonlinear circuit analysis, passive and active integrated devices,
microwave monolithic integrated circuit design, large-signal
operation of amplifiers, oscillators, multipliers, and mixers for
millimeter-wave and terahertz systems. 
",31420,"
Tom Keinicke Johansen"
,,,,,,,,,,,,
31501 , Biomedical engineering 1,Danish , 5 ECTS , 2016/2017 ,E5A (Wed 8-12),BSc,Department of Electrical Engineering,"
Introduce new students to the content and structure of the
education and to develop skills for self governance.

Familiarize students with instrumentation for measuring
physiological signals, with focus on methods, equipment setup and
data acquisition.

Motivate students to be analytical and inquisitive through design
and implementation of Matlab programs for analysing acquired data.
Programming skills will be developed through small projects. 
","Knowledge: Explain the physical and technical principles behind
measurement and processing of EMG, ECG and ultrasound signals Knowledge: Explain the syntax, data structures, program
structures, terminology and programming environment of Matlab Knowledge: Explain potential applications for theories, models
and methods in each of the course project themes Skills: Collect, connect and adjust biomedical instrumentation
for acquisition of EMG, ECG and ultrasound signals Skills: Independently solve minor programming assignments using
the core components of the Matlab programming language Problem-solving: Analyse data acquisition problems formulated
with consistent and precise information, within known, simple
problem-sphere and plan, carry out and document procedures Problem-solving: Analyse programming assignments formulated
with consistent and precise information, within known, simple
problem-sphere Problem-solving: Divide programming assignments into smaller
components and implement, integrate and test these in a united
system Team work: Work in teams and plan task distribution, time
schedules and deliveries Communication: Produce oral presentations and written documents
in Danish, which are structured in accord with objective and
context and with correct grammar and punctuation Mindset: When encouraged, demonstrate beginning level skills in
taking initiatives, making decisions and taking responsibility for
individual and team-based work Self-instruction: When encouraged, demonstrate beginning level
skills in identifying needs for knowledge, collect information and
independently acquire the needed knowledge within introductory
level topics","
Study introduction:

DTU's Intranet, recommended study plans, design of individual
study plans.

Measurements:

The origin of EMG and ECG signals, the design and montage of
surface electrodes, unipolar and differential amplification,
highpass and lowpass filtering, analog-to-digital conversion,
simple signal processing algorithms for EMG and ECG signals.

Programming in Matlab:

Scalar, vector and matrix variables, strings, operations on
variables, input/output, logical and conditional statements, loops
and vector constructs, scripts and functions, plotting,
optimisation and profiling, commenting and documenting software. 
",None,"
Kaj-Åge Henneberg,
Matthias Bo Stuart,
Jørgen Arendt Jensen"
,,,,,,,,,,,,
