COURSE NUMBER,COURSE NAME,LANGUAGE OF INSTRUCTION,CREDIT LOAD,YEAR,SCHEDULE,COURSE TYPE,DEPARTMENT,GENERAL COURSE OBJECTIVES,LEARNING OBJECTIVES,CONTENT,RECOMMENDED PREREQUISITES,COURSE RESPONSIBLE
42872 , Basic course in traffic and roads,Danish , 5 ECTS , 2016/2017 ,E5A (Wed 8-12),BSc,DTU Management Engineering,"
The aim of the course is to provide an introductory knowledge to
topics relating to traffic engineering and road construction.
Hereby the course seeks to establish a basic understanding of
concepts and techniques, which can be applied for the analysis of
road traffic and issues that relate to the design and construction
of roads. This will be supported by the application of
case-calculations. 
","Describe the background and the premises behind the most common
types of calculations relating to traffic operational analysis and
proposed interventions and projects, among other things by making
use of data from traffic counts and accidents Analyse the capacity conditions relating to the traffic flow
process on open road sections, at intersections - including
intersections with signals - and at roundabouts and 2-level
junctions Conduct analytical calculations as background for assessing the
possible establishment of a signal system in an intersection Know the elements that determine the road alignment and to
calculate values for them dependent on the design speed Know how the road alignment is adapted to the landscape
conditions Know the elements used in a typical road cross section
according to traffic types and how to ensure drainage from the road
surface Conduct a structural design of road pavements according to
Danish road standards and evaluate basic requirements of pavement
materials properties Work out a satisfactory and adequate report/exercise test Explain the basic course concepts and techniques relating to
road traffic and be able to apply these as input to the road design
process","
Traffic operational analysis: Traffic counts, accident factors,
urban and inter-urban conditions.

Capacity calculations: Traffic intensity, maximum capacity, peak
hour values relating to different categories of roads, road
capacity design hours, speed-flow curves, free and queue traffic
operation description and measurement, level-of-service categories,
road design standards.

Traffic signals: Design and optimisation, flow dependent signals
and automatisation.

Excursion: Visit to the Danish Road Directorate to experience how
course concepts and techniques relate to state-of-the-art
operational flow analysis and introduction to traffic management.

Road geometry: Calculation and choice of elements for the
horizontal and vertical road alignment and for the cross section.
The drawing of the geometry and the typical cross section.

Pavement design: Structural design of layer thicknesses in the
pavement by means of Danish Road Standard design it-programme, in
proportion to exposed ESAL road wear and by taking into account the
properties of applicable asphalt mix. Pavement inspection and
repair works.

Earth mass calculation: Procedure for calculation of masses of soil
in the roads construction works, in relation to the vertical
alignment and cross section of the road and planning of earth
works, and soil movements in relation to cuts and fills in the
roads alignment. 
",None,"
Jacob Kronbak"
,,,,,,,,,,,,
42873 , Geometric Highway Design,Danish , 5 ECTS , 2016/2017 ,January,BSc,DTU Management Engineering,"
To enable the students to design different types of highways in
rural areas. 
","Create and evaluate a digital terrain model based on GIS
data Explain which elements to use in horisontal and vertical road
alignments Determine design parameters for horisontal and vertical road
alignments Choose an appropriate 3D road alignment Describe the elements of a road cross section Determine types and sizes of elements in a road cross
section Explain why, when and how to determine road cross slope and
superelevation Assess the placement of a road intersection and design a
priority junction in 2D Use a CAD-system to set up road project drawings using
CAD-standards Use a CAD-based road design system Visualise a 3D model of the road project","
The students will design a highway using the CAD-system
MicroStation and the application InRoads or Bentley PowerCivil.

The process includes creation of a digital terrain model based on
GIS data, design of a horisontal and a vertical road alignment,
definition of a typical cross section and creation of a 3D roadway
model. Based on the roadway model the students must create cross
sections, volumes and graphics for project drawings.

The course also includes preliminary design of a junction.

During the course the students will determine design parameters and
create project drawings that will be the basis of the assessment. 
","13500,42986,42872,13000,13510","
Marianne Rask,
Jacob Kronbak"
,,,,,,,,,,,,
42874 , Road traffic simulation,Danish , 5 ECTS , 2016/2017 ,January,BSc,DTU Management Engineering,"
The aim of the course is to provide the students with a basic
knowledge of road traffic modeling and micro simulation of road
transport as concerns behaviorual models for road transport, and to
make the students able to use, run, calibrate and validate an
existing software for the most common types of roads. 
","Explain the basic principles in Building a micro-simulation
model Use the basic tools in a micro simulation software Describe elements and parameters for the following node types:
Right away intersections, roundabouts, signalized intersections
(time controlled) and merging sections Code these intersections in a micro-simulation model Code public transport in a micro-simulation model Carry out an analysis of delays and queue lengths using the
tools in a micro-simulation model Analyse and validate the results of a simulation Produce presentation material including still pictures and
movies Create a presentation for the oral exam","
Theoretical background for road traffic engineering, simulation of
road transport, model integration in simulation programs and
evaluation of solutions. 
","13500,13000,13510","
Allan Larsen"
,,,,,,,,,,,,
42875 , Transport logistics and optimisation,Danish , 5 ECTS , 2016/2017 ,E5B (Wed 13-17),BSc,DTU Management Engineering,"
The objective of the course is to introduce students to the issues
experienced within transport logistics and freight transport. This
include planning problems for individual stakeholders such as
shippers and transport operators. Also, issues for the freight
transport sector as a whole are addressed. This includes problems
at the regional, national and international/global levels.
Furthermore, students will be introduced to mathematical modeling
as well as a mathematical modelling language which will be used for
solving transport optimisation problems. 
","Describe the various infrastructure elements in relation to a
freight transportation system Recall the most important terminology and key concepts met
within planning of freight transportation Describe the various elements in a supply chain and explain how
the transportation element relates to the other elements in the
chain Describe and relate the current trends within freight
transportation for the rail, road, sea and air modes Describe the most important problems met in planning and
management of freight transportation terminals Distinguish between and describe regional, national,
international and global freight transportation planning
problems Describe how technologies such as GPS, GIS and RFID can improve
the planning in freight transportation systems Explain and formulate simple mathematical models used for
solving transport optimisation problems Formulate, change and run mathematical models used for solving
transport optimisation problems Analyse the results from runs of mathematical models used for
solving transport optimisation problems","
The course is structured in two parallel parts which both runs
throughout the whole semester period. The first of the two parts
provides the students with a factual perspective to role of the
transport within the supply chain (transport logistics). Also,
problem settings experienced in operational contexts in freight
transport is being discussed. This will amongst others include the
EU's transport policy, company logistics issues, the
development of container transportation, the freight transportation
modes and their use. The second part of the course deals with a
number of mandatory mathematical modelling exercises originaton
from problem settings within the freight transport sector.
Consequently, a mathematical modelling tool which is used for
solving a number of simple transport optimisation problems will be
introduced. 
",42101,"
Allan Larsen"
,,,,,,,,,,,,
42876 , Traffic Safety,Danish , 5 ECTS , 2016/2017 ,F3A (Tues 8-12),BSc,DTU Management Engineering,"
The general purpose of the course is to provide an introduction to
the subject “traffic safety” in connection with the practical tasks
performed by planners, advisors etc. with respect to traffic
safety.

The specific purpose is to ensure that the students gain confidence
in actively using and discussing central concepts within the
subject “traffic safety” and understand the importance of traffic
safety issues. 
","Understand and read (traffic) accident statistics Mention various risk measures Understand and explain the concept ”risk” Distinguish between relevant and non-relevant factors’
importance for the traffic safety Explain the social relevance of traffic safety Describe different groups of road users and attached risk
factors Understand the importance of infrastructure for the traffic
safety Pinpoint localities/traffic situations with a particularly high
incidence of accidents, based on various criteria Explain how the behavioural component contributes to traffic
safety Explain the instruments that can be used in connection with the
traffic safety work Explain the different survey methods used in the work on
traffic safety as well as their strengths and weaknesses Analyse the importance of the various components and their
parameters (the road user, the vehicle, the infrastructure) for
traffic safety in different contexts","
- The principles of recollection, analysis and interpretation of
traffic accident data

- The concept ”risk” and various risk measures

- Different groups of road users and their risk profile in the
traffic

- Road users’ behaviour and instruments to change it

- Infrastructure and its importance for traffic safety

- Various survey designs and their meaningfulness and validity

- Criteria and methods to identify localities/traffic situations
with a particularly high incidence of accidents 
",None,"
Jacob Kronbak"
,,,,,,,,,,,,
42877 , Railway Design and Maintenance,English , 10 ECTS , 2016/2017 ,F5 (Wed 8-17),MSc,DTU Management Engineering,"
General course objectives: The purpose of the course is to achieve
competences within the field of design and maintenance of railways
– this includes track and traction current. 
","Describe the infrastructure elements of railways, the
affiliated standards, and the relation to their traffic
functionality Describe the horizontal and vertical elements of a railway.
Explain why and where cant is used and determine its size Explain the elements in a cross section; explain why cross
slope is applied to the sub ballast Describe the static and kinematic reference profiles, the
structure gauges and the track distance Use a CAD based railway design system to design a track
alignment Describe the differences of various traction power supply
systems and estimate the power demand Describe the principles for the function of overhead contact
line systems, determine the location of supporting structures along
track according to a given track geometry and be able to profile
overhead contact wires below bridges Carry out a realistic design project for track and overhead
contact line for a railway line Explain how a railway is constructed and maintained Describe the phases in a railway project Know the methodology for budgeting and cost estimating a
railway project","
An expansion of an electrified railway line, including increased
speed, is designed. Horizontal and vertical alignment, together
with the catenary system is designed by use of the CAD-system
MicroStation and the application Bentley Rail Track. All phases in
the project are carried out with respect to the safety standards
used for railways. Finally the maintenance of railways is
explained.

During the course there will be an excursion to a real railway
construction project.

Additionally, it will be possible to meet the experts within the
different contents of the course.

The course is taught in English, but is based on the applied Danish
railway norms and standards. 
","13525,13523,13111,13240,13524,13011,13125,13511","
Allan Larsen,
Marianne Rask"
,,,,,,,,,,,,
42878 , Rolling Stock Acquisition and Management,English , 5 ECTS , 2016/2017 ,June,MSc,DTU Management Engineering,"
Rolling stock are key assets that support the provision of
transport for both passengers and freight. In this course, students
learn to visualize the provision of transport service as a product,
and to specify the rolling stock assets that best support the
delivery of this product. Students also learn how to manage the
rolling stock over its product life cycle, including how to manage
the maintenance of rolling stock over various stages of the product
life cycle, and how to schedule or coordinate maintenance with the
necessary transport commitments. 
","Identify the various options in rolling stock and analyse how
they serve transport markets, both in passenger and freight
service Describe the procedure for certification of rolling stock and
explain which standards, requirements from authorities and
specifications for interoperability that exists for the
certification Compose and evaluate contracts for the acquisition of rolling
stock Explain the life cycle costs for trains Evaluate traffic demand and compose and recommend rolling stock
assignments to support that demand Monitor and measure reliability and quality of service in
traffic assignments Compose schedules for rolling stock maintenance compatible with
service assignments Design processes for rolling stock maintenance Measure productivity in rolling stock maintenance
operations Monitor and measure quality in rolling stock maintenance
operations","
The course includes mandatory visits to working railway facilities.
On these tours, students are required to dress in clothing suitable
for an industrial environment, including durable, close fitting
clothing and safety shoes. The course is taught in English 
","13125,13524,13525","
Steven Harrod"
,,,,,,,,,,,,
42879 , Decision Support and Risk Analysis,English , 5 ECTS , 2016/2017 ,E2B (Thurs 8-12),MSc,DTU Management Engineering,"
The aim of the course is to give the participants a theoretical and
practical basis for advanced socio-economic appraisal of transport
infrastructure projects including risk analysis and multi-criteria
decision analysis. The main issue in this respect will be to model
and establish adequate decision support within a specific appraisal
study context with a special emphasis on the risk and uncertainty
involved as well as strategic impacts, which contribute to a
comprehensive appraisal. In the modelling approach both
software-based applications of cost-benefit analysis, risk analysis
and multicriteria decision analysis will be applied when setting up
and designing the decision support model. 
","Apply the basic principles of socio-economic analysis based on
the use of cost-benefit analysis, risk analysis and multi-criteria
decision analysis Organise and assess accessible data material based on both a
quantitative and qualitative approach Analyse and determine suitable parameters and variables made
use of in the socio-economic analysis Implement and understand the basic methodology of the risk
analysis and the multi-criteria decision analysis Implement and understand the methodology behind a composite
analysis based upon cost-benefit analysis featuring risk analysis
and multi-criteria decision analysis Implement and explain the various aspects of risks within
transport appraisals Organise and estimate relevant impacts and criteria that have
been identified for a further socio-economic analysis Communicate the chosen analysis/solution methods for a given
problem area to others both orally and in writing","
The course treats the basic theory and methodology in
appraisal/evaluation of a transport infrastructure project. One
course issue is to apply cost-benefit analysis (CBA), risk analysis
and multi-criteria decision analysis (MCDA) and combine them to a
composite analysis for a particular infrastructure project. The
participants are introduced to customised decision support among
other things by the use of various software solutions. The
following topics will be treated in lectures and exercises, where
it is assumed that the student holds knowledge about the basic
concepts and principles behind CBA:

Risk analysis: Theory and methodology concerning uncertainty
calculations and Optimism Bias. A topic here is the determination
of various uncertain elements in the socio-economic analysis.

MCDA: Theory and methodology concerning the measurement of
non-quantifiable impacts, which often are of a strategic character
and hold the potential of improving the decision support. The
students will get acquainted with different assessment techniques
to be used depending on the decision situation, and how to combine
these with the results stemming from the risk analysis.

The course participants work in groups to achieve practical
knowledge about the analysis methods and concepts. It is expected
that the students are able to clarify/account for the chosen
impacts/criteria and the model solutions in connection with the
report work and the oral examination. The main course content
consists of lectures and group exercises with plenary discussions
and group presentations. 
",13150,"
Michael Bruhn Barfod"
,,,,,,,,,,,,
42880 , Railway Operations and Management,English , 5 ECTS , 2016/2017 ,E4A (Tues 13-17),MSc,DTU Management Engineering,"
This course surveys both the technical operations of railways and
their efficient operation in the transport market. The course
presents a balanced mix of topics drawn from technology,
management, and mathematical planning, and provides a broad
introduction to railways. 
","Explain the transport services provided by railways and the
benchmarks (measurements) used to evaluate them. Explain the fundamental railway technologies of track, rolling
stock, and signals. Summarize the planning methods, tools, and software used in
railways, and compare their strengths and weaknesses and
suitability to various areas of railway management. Calculate a train’s path, operating timetable, and public
timetable, and visualize the operating plan graphically. Calculate railway performance and capacity from a given train
and track configuration using Little's Law, queuing theory, and
parametric models. Analyze and compare alternative configurations
using both performance and cost measures. Measure robustness of train paths or timetables and evaluate
the interaction of train path density, travel time, and
robustness. Calculate the economic costs and revenues for a given railway
service, and explain the impact of management decisions. Assess future railway technologies and evaluate their potential
impact on transport services.","
Railway specific technology and management science, with emphasis
on how to select and manage technology to provide effective and
financially viable transport services. The concerns of engineers
and service managers are presented in an integrated manner. The
course leads to more specialised courses within railways and to
more advanced courses in scientific management. 
",None,"
Steven Harrod"
,,,,,,,,,,,,
42881 , Optimisation in public transport,English , 5 ECTS , 2016/2017 ,F1B (Thurs 13-17),MSc,DTU Management Engineering,"
The general objective of the course is to provide in-depth
knowledge regarding advanced optimisation methods for planning of
public transport. 
","Discuss and formulate the optimization problems of Line
Planning, Timetabling, Platforming, and Rolling Stock Circulation
arising in railway systems Discuss and formulate Vehicle Scheduling problems addressed in
the optimization of bus systems Discuss and formulate Aircraft and Crew Planning problems
encountered by airline companies Explain the basic concepts of Disruption Management applied to
railway and airline systems Explain the basic concepts of Revenue Management applied to the
public transport domain domain and to explain the basic concepts of
using dynamic programming based models for increasing the yield in
a public transport system Outline the basic principles of column generation Outline the basic principles of robust optimization Solve Crew Planning problems by column generation Implement, in a programming language, mathematical models of
public transport optimization problems Discuss the optimization models presented in the course and
classify these as solving either strategic, tactical or operational
planning problems","
The course focuses on teaching the students advanced mathematical
models for resource optimisation used within planning of public
transport systems. Topics covered in the course include: Line
planning, timetabling, platforming, rolling stock scheduling,
vehicle scheduling, aircraft scheduling, crew scheduling,
disruption/recovery management and revenue management. The course
will offer examples and assignments from urban bus transport,
railway transport and air transport. The main focus of the course
falls within tactical planning problems in public transport. 
","42115,42114,42112,42101","
Richard Martin Lusby,
Evelien van der Hurk,
Allan Larsen"
,,,,,,,,,,,,
42882 , Simulation in Transportation and Logistics,English , 5 ECTS , 2016/2017 ,F4A (Tues 13-17),MSc,DTU Management Engineering,"
Discrete event-based simulation is a powerful tool often used
within transportation and logistics for analysis of performance and
robustness. The course will enable the students to design,
implement and use discrete event-based simulation models. 
","Explain the concept of discrete event-based simulation Design a discrete event-based simulation model Implement a discrete event-based simulation model Validate the proposed simulation model Design a simulation experiment Formulate relevant performance indicators Carry out a simulation experiment Analyse and assess simulation results Explain how external optimisation algorithms can be integrated
with the simulation model Present and discuss the implemented simulation model and the
results obtained through the experiments","
The course focuses on teaching the students to use discrete
event-based simulation models for analyses of problems within
transportation and logistics. Based upon a wide range of specific
complex planning problems it will be discussed how simulation
models can be used to obtain knowledge on the system's
operating performance. The students are taught to analyse complex
systems within transportation and logistics and to define relevant
Performance Indicators. Furthermore, it will be discussed how
simulation models and optimisation models can compliment each
other. The students are given an introduction to the simulation
modelling language Arena through a number of small-scale practical
assignments. Hereafter, the students are given a larger project in
which a specific simulation problem is solved. 
","02403,02402","
Allan Larsen,
Rune Larsen"
,,,,,,,,,,,,
42883 , Programming and transport optimization,English , 5 ECTS , 2016/2017 ,January,MSc,DTU Management Engineering,"
The aim of the course is to convey the basic concepts of imperative
and object-oriented programming

and to enable the student to apply these concepts to solve
optimization problems arising within transport and logistics. 
","Describe an algorithm using pseudo-code Identify some hard combinatorial problems Describe the difference between enumeration, heuristics, and
local search Describe the basic components of a computer program Identify and use relevant resources, such as the Java
documentation Implement a simple file reading (writing) routine using
Jav Design a solution to simple transport optimization problems
using enumeration and local search Implement enumeration and local search procedures using
Java Implement a visualization procedure that represents the
solution of a transport optimization problem Write a clear and well-structured report documenting the
implemented algorithm","
The course uses Java as programming language and covers the
following topics:

- primitive types

- basic programming constructs (loops, branching statements, etc)

- basic input/output

- classes, objects,

- pseudo-code

- use of development tools

- enumeration and simple heuristics applied to transport
optimization.

- visualisation of solutions to transport optimization problems. 
","02102,02101,02693,02691,02631,02633","
Allan Larsen,
Dario Pacino"
,,,,,,,,,,,,
