COURSE NUMBER,COURSE NAME,LANGUAGE OF INSTRUCTION,CREDIT LOAD,YEAR,SCHEDULE,COURSE TYPE,DEPARTMENT,GENERAL COURSE OBJECTIVES,LEARNING OBJECTIVES,CONTENT,RECOMMENDED PREREQUISITES,COURSE RESPONSIBLE
42176 , Public Transport Planning,Danish , 10 ECTS , 2016/2017 ,F2A (Mon 13-17) and F2B (Thurs 8-12),BSc,DTU Management Engineering,"
The general course objective is to achieve knowledge about planning
and operation of public transport. The course aims at giving
theoretical and practical understanding of the methods and models
that are used for planning and operation of public transport. 
","Asses the different means of public transport and classify
their functions Define general problem definitions of transport and identify
the need for public transport Evaluate the demand for public transport and explain the
principles of station vicinity Determine and argue for alignments and stopping patterns of
public transport lines Estimate running times and plan timetables for public
transport Perform and Analyze traffic modeling of public transport and
interpret the results Calculate operating economy and socio-economics of public
transport lines and rate their usefulness Explain potential strategic impacts Complete and evaluate a large, realistic public transport
planning project Apply GIS-based solutions in the planning process Write a technical report, including references and citations
and present issues in public transport - both orally and in
writing","
Lectures on special issues concerning planning of public transport.
GIS-based analyses of accessibility, including regional
accessibility and vicinity to stations. Introduction to tools and
methods for timetable planning. Choice of stop locations, stopping
patterns and timetable. Correspondences. Traffic and route choice
models for public transport, including models based on stochastic
utility theory. GIS-based methods to handle public transportation
networks. Induced traffic for larger transport projects. Strategic
impacts. Operation economic and socio-economic appraisal of public
transport. The main focus in the course is to use the treated
methods to complete a specific public transport planning project as
part of the reporting. ArcGIS is used as the general software too. 
","13006,13506","
Otto Anker Nielsen,
Jonas Lohmann Elkjær Andersen"
,,,,,,,,,,,,
42177 , GIS and Road Traffic Planning for MSc students,English , 10 ECTS , 2016/2017 ,E2A (Mon 13-17) and E2B (Thurs 8-12),MSc,DTU Management Engineering,"
The purpose is to provide an overview of the functionality in
ArcGIS to be used as a tool in the advanced courses at DTU
Transport. Different modules in ArcGIS are introduced. Furthermore
the purpose is to learn the basic planning process for road project
assessments and use this to calculate impacts and evaluate a major
road project. 
","Carry out a need assessment for a road project and based on
that to specify the project Motivate and choose a suitable road alignment and its
design Estimate construction costs Code the project in a Geodatabase and validate the input
data Carry out a route choice and traffic assignment, explain,
validate and interpret the results Calculate induced traffic, validate the calculation steps and
interpret the results Calculate impacts, describe, validate and interpret the
results Carry out analysis of accessibility and mobility, illustrate
these in GIS-maps and discuss the results Complete a cost-benefit analysis of a road project and
interpret the results Write a professional technical report targeted at decision
makers Produce clear maps to illustrate and analyse data and
results Present own work/project orally and discuss it with the
audience","
Introduction to Geographical Information Systems (GIS) and ArcGIS.
Data modeling and design of geodatabases. Use of ArcMap and
ArcCatalog and Net Work Analyst. Editing in ArcMap and Access.

Coding and traffic impact assessments of a road project in the
Copenhagen Region after own choice. This includes specifying the
project, overall need assessments, choosing the road alignment and
estimating the construction costs, coding of the project, route
choice and traffic assignment and quality control of this,
calculating induced traffic, traffic impacts (pollution,
accidents), accessibility and mobility analysis and cost-benefit
analysis.

Guidance in technical report writing according to DTU
Transport's guidelines. 
",None,"
Otto Anker Nielsen,
Marie Karen Anderson"
,,,,,,,,,,,,
42178 , Introduction to Transport Models,English , 5 ECTS , 2016/2017 ,E3A (Tues 8-12),MSc,DTU Management Engineering,"
The purpose of the course is to transfer fundamental knowledge
concerning quantitative methods and tools applied to analyse
questions related to transportation. The methods are used within
infrastructure- and transport planning to support decisions
concerning transport systems. The course focuses on giving students
knowledge about and competences to apply statistics for analysis of
data and modelling of private transport. 
","Apply linear and generalised linear regression models on
transport data Explain the principles behind the four-stage model Discuss and model generation of travel Discuss and model distribution of travel Model travel mode choice using logit and nested logit
models Model route choice and assignment Interpret results from a statistical analysis Perform appropriate selection of variables and functional forms
in a transport model Validate a model using elasticities and other relevant
measures Produce a written statistical analysis, that describes data,
modelling, and results Use the SAS software for data management, data analysis and
model estimation","
The course covers quantitative methods that can be used to solve
problems within transport planning and transport modelling. The
course focuses on statistical methods, especially regression and
discrete choice models. Other methods that are covered are
iterative proportional fitting, gravitation models, and simulation.

","02323,13540,02403,02402,42101","
Stefan Lindhard Mabit,
Anders Fjendbo Jensen"
,,,,,,,,,,,,
42179 , Advanced Transport models,English , 5 ECTS , 2016/2017 ,E2A (Mon 13-17),MSc,DTU Management Engineering,"
The course will cover the advanced methods and tools that are being
developed, and are beginning to be used in transport modeling.
Specific focus will be on activity-based demand models of passenger
transport. The goal of these models is to construct better and more
detailed forecasts of transport demand in order to support mobility
and transport of people in cities and regions. There is a general
tendency to planners seeking transport models that are more
detailed in the sense that they must thus be able to handle
multiple choices, operating detailed in time and space and can be
used to describe a wide range of policies. This requires data,
estimation and a strategy for how to implement these models. The
course aims at providing the student knowledge about how these more
detailed models can be constructed and the dilemmas associated with
them. Another principal objective is to support the students'
ability to work independently and think analytically. The course
will therefore work with a case where we use simulation and a
demand model to design a parking system. It will give the students
an insight in how to use simulation and how this may be linked with
demand models. 
","Explain the basic principles of activity-based modelling and
the dilemmas associated with such models. Describe and explain the various mathematical and statistical
models behind the activity-based modelling. Estimate models for destination and mode choice for
activity-based modelling. Understand how non-linear utility functions affect the model
results and how these can be estimated. Understand how simulation is used in activity-based models of
transport demand. Be able to explain how simulation models can be designed,
calibrated and used to solve different problems. Use scenario analysis and cost-benefit calculations for
activity-based models by quantifying user benefits as a result of a
change of supply (eg. A change in the infrastructure or
taxation). Interpret and present results based on statistical analysis or
simulation. Interpret and present results from the literature.","
The course will contain element of statistics, econometrics and
simulation. This will include including theory related to the
estimation of models and theory related to model simulation. The
course will also be concerned with the design of dedicated
simulation models, which may be based on raw data input or model
output. Students are expected to acquire the theory and to use
these models in practice throughout the course by working and
solving a sequence of exercises. 
",13133,"
Jeppe Rich"
,,,,,,,,,,,,
42180 , Discrete choice models,English , 5 ECTS , 2016/2017 ,F3A (Tues 8-12),MSc,DTU Management Engineering,"
The purpose of the course is to make the student capable of using
discrete choice moels as a tool in transport modelling. In addition
the course provides an introduction to how the method is applied in
other fields, e.g. marketing. 
","Explain the basic principles behind discrete choice models Describe different discrete choice models concerning their
strengths and weaknesses Analyse data using the standard discrete choice models Use software to estimate standard discrete choice models Interpret and compared the results based on statistical
analysis Apply discrete choice models to computed the aggregate
demand Calculate valuation measures and elasticity Argue concerning the usefulness of a specific model (among the
sandard DCM) for a specific problem Write a methodologically sound report containing description of
the phenomenon using a descriptive analysis of the data, treatment
of data, model estimation and a critical discussion of the
results","
The course consists of a theoretical part that introduces the
microeconomic theory and random utility theory behind discrete
choice models. The focus will be on the standard DCM such as the
multinomial logit models, nested logit model, and the error
component mixed logit models. Knowledge on how to estimate models
using data obtained from different sources will also be given. The
empirical work consists in practically estimating the DCM discussed
in the lectures, using real sets of data. The software Biogeme will
be used for this purpose. The final part of the course focuses on
overall understanding of the methodology through reapot writing. 
","02403,02402,02409,13131,13130,13133,02423","
Stefan Lindhard Mabit,
Mikkel Thorhauge"
,,,,,,,,,,,,
42181 , Route Choice Models,English , 5 ECTS , 2016/2017 ,E4B (Fri 8-12),MSc,DTU Management Engineering,"
The course provides insights into the theoretical foundations of
route choice modelling and their impact on modelling results.
Learning these foundations should enable to select route choice
models that are relevant to specific modelling purposes, understand
the principles behind the implementation of the selected models,
and analyze and evaluate the results obtained from route choice
model estimation and application. 
","Describe the different equilibrium principles in route choice
modelling and the related solution algorithms. Describe the rationale and the functionality of error terms in
different types of route choice models. Describe the different approaches for choice set generation in
route choice modelling Describe advanced road transport models and argument about
advantages and disadvantages of different model specifications Describe advanced route choice models for public transport and
argument about advantages and disadvantages of different
methodological approaches Describe multimodal route choice models and explain advantages
and disadvantages of different methodological approaches Analyze route choice models used in the practice, evaluate
their quality, and recommend directions for their improvements Write technical notes about the formulation of different model
specifications and the evaluation of existing models Write technical notes about the analyses and the evaluations
needed to specify new models for a specific case Present own notes orally and discuss them in front of an
audience","
Equilibrium Analyses of Transportation. The assignment problem as a
mathematical program. Different optimisation algorithms. Solving
User Equilibrium, stochastic loading and stochastic user
equilibrium. The method of successive averages, and more advanced
approaches.

Impact of different Error Terms and stochastic elements - logit,
path size logit, network GEV (generalised extreme value
distribution model) and Probit. Incorporating advanced utility
functions with random coefficients (error components) into the
models.

Solution approaches - choice set generation versus simulation,
estimation versus modelling. Stated preference data versus Revealed
Preference data.

Advanced road traffic models; Dynamic transport assignment models.
Asymmetric cost functions and intersection modelling. Variability
of travel times.

Advanced models for public transport. The principle of frequency
aggregation for public transport assignment. Schedule-based models.
Path search in transit network - principles of event dominance,
granularity, penalties and other graph reduction principles.

Multi-modal assignment models. 
","13135,13131,13130,42113","
Otto Anker Nielsen,
Thomas Kjær Rasmussen"
,,,,,,,,,,,,
42182 , Road safety analysis and modelling,English , 5 ECTS , 2016/2017 ,E1A (Mon 8-12),MSc,DTU Management Engineering,"
The course provides insights into the theoretical and practical
approaches to modelling road safety from both a behavioural and a
modelling perspective. As current research shows that the two
aspects are intertwined, the course covers the importance of
learning the foundations of road safety research while focusing on
data management and collection, method development and application,
as well as policy implication. The course aims at providing
students with advanced knowledge in road safety, but also hands-on
opportunity with a pilot project on a topic of their choice. 
","Describe approaches to road safety analysis from the
behavioural perspective Describe approaches to road safety analysis from the modelling
perspective Explain and argument pros and cons of aggregate safety
models Estimate disaggregate models of accident frequency and
severity Identify and apply relevant literature Plan, design and execute a pilot research study in the area of
road safety Collect and manage data for road safety analysis Analyse qualitative and quantitative data for road safety
analysis Write a technical report about road safety analysis Present conclusions and possible policy implications from road
safety analysis","
Behavioural research in road safety, from the data collection via
survey to the data analysis via qualitative and quantitative
methods. Modelling research in road safety, from the aggregate
approaches to the disaggregate takes on frequency and severity. A
pilot project from existing and collected data about a road safety
topic chosen by the students under the supervision of the course
responsible. 
",None,"
Mette Møller,
Kira Hyldekær Janstrup"
,,,,,,,,,,,,
42183 , Innovation Projects for Mobility in the Smart City,English , 5 ECTS , 2016/2017 ,June,MSc,DTU Management Engineering,"
The course introduces modern transportation technologies for
monitoring, controlling and planning, as well as traveler side
tools, such as advanced traveler information systems, crowdsourced
apps and the internet, in the context of the “Smart City” vision.
Having these in mind, student groups will design projects that
contribute to the grand challenges of our cities today, in terms of
mobility, and its interactions with the environment, economy and
society. 
","Discuss how transportation systems may be enhanced by modern
communication/​vehicle/​computer/​sensor technologies Explain to decision makers how Intelligent Transport Systems
(ITS) technologies improve transportation performance Assess technical material pertaining to modern transportation
systems Investigate conventional systems and improve their functioning
through ITS and other new technologies Conduct research and design alternative solutions to important
problems within mobility Describe and use the technological and methodological tools for
prediction in transport systems Describe and use the technological and methodological tools for
optimisation of transport systems Present ITS research and/or development – both orally and in
writing","
Introduction to systems approach, where the inputs, outputs and the
”boundaries” of a system are clearly delineated, with specific
focus on decision variables (that effect the system) and system
evaluation. Enhancement of transportation through new technologies
including ITS, data sciences tools, autonomous vehicles, V2V
communication, smartphone apps, Mobility as a Service (MaaS), and
new sensors. The role of new and mature tools (e.g. from IBM, PTV
and Google) in the future of mobility. The concept of the “Smart
City” and the interactions between transport and other systems
(e.g. energy, environment) through new technologies. Current grand
challenges for mobility in our cities, how to approach them, assess
the potentials of solutions and design their implementation. 
","02403,02402,02102,02101,13544,13410,42101","
Francisco Camara Pereira"
,,,,,,,,,,,,
42195 , Transport economics,English , 5 ECTS , 2016/2017 ,F1A (Mon 8-12),MSc,DTU Management Engineering,"
The course is intended as an overview of transport economics. A
solid introduction to basic micro economic theory will be provided
as well. The course covers contemporary transportation issues such
as transport demand analysis, firm production and costs in
transportation, market behaviour, social costs, and impact and
welfare analysis. The course does not focus on a specific
transportation mode but uses the various modes to apply the
theoretical and analytical concepts presented in the lectures and
readings. We concentrate on both basic material and theory models
and on selected topics dealing with contemporary issues of
transportation policy such as pricing and regulation. Finally the
course provides an understanding of the economist's approach to
evaluating transport investments or transport programs, i.e. the
cost-benefit analysis (CBA). 
","Explain the fundamental principles behind the transport
economics Analyse transport demand Analyse transport costs structures Analyse transport policy reforms Analyse market power and efficiency in transportation Evaluate the effects on welfare of transport pricing Use models to welfare-analysis and cost-benefit analysis Argue concerning the usefulness of a specific model for a
specific problem Discuss a paper applying transport economics","
The course will include elements of micro economics and statistics.
The course introduces the microeconomic concepts central to
transportation systems. Topics covered include economic theory of
the firm, consumer choice behavior, cost models and production
function, market power in transportation, efficiency in
transportation, and cost-benefit analysis (CBA). 
",02402,"
Ismir Mulalic"
,,,,,,,,,,,,
42259 , Facilities Management,English , 5 ECTS , 2016/2017 ,E2B (Thurs 8-12),MSc,DTU Management Engineering,"
To enable the participants to include Facilities Management (FM) in
the design, production and management of building projects and in
property administration, by introducing a basic understanding of FM
themes and tools and give the opportunity to gain a deeper
knowledge about a particular aspect. 
","Explain FM as a management discipline with the responsibility
to take care over de physical surroundings of an organisation so
that they support the core activities in an optimal way Identify the most important themes and tools for FM and the
building process, including real estate strategies, briefing, user
involving, life cycle costing, learning and intelligent buildings,
sustainable and operational friendly buildings Identify the most important themes and tools within FM,
including organisation, service management, outsourcing, service
quality, cost management, benchmarking, building condition
evaluation, maintenance, space management and Computer Aided
FM Use knowledge from FM with particular focus on implementing
consideration for usage, operation and maintenance in the design,
construction and management of building projects and in property
administration Plan and carry out a company visit with interviews together
with other students Together with other students identify how a specific company
work with FM Organise and contribute actively to the work in a group with
other students Formulate a problem statement for an individual assignment
within FM Analyse a problem by introducing theoretical and empirical
knowledge and concluding the analyses from a FM perspective Produce a group report with individual assignments and present
analyses and conclusions in a clear and logical structure and
layout","
General introduction to Facilities Management teory and practice,
including usability of buildings during the whole life cycle,
integration of operational aspects in the planning of new buildings
as well as tasks and tools for management of a FM-organisation. 
",,"
Per Anker Jensen"
,,,,,,,,,,,,
42262 ," Climate Models, Observations of the Past and the Present, and Climate Change Projections including Sea Level Rise",English , 10 ECTS , 2016/2017 ,Outside schedule structure,MSc,DTU Management Engineering,"
The aim of this course is to enable students to use climate
projections from global and regional climate models in impact
analyses, while realizing the models' strengths and
limitations. Additionally, the course aims to to provide an
overview of observations of past and recent instrumental climate
variations and to give an overview of future climate changes as
projected with state-of-the-art climate models. 
","Understand the general structure, functionality and the
fundamental mathematical, physical, chemical and biological
components in a climate model Describe the observed changes in the climate in the past and at
present, and be able to attribute these variations to different
drivers and mechanisms in the climate system Know how ocean and ocean heat content and sea level have risen
over the recent past and what methods have been applied to obtain
these measures Analyze and discuss results and data from state-of-the-art
global and regional climate models and be able to use these in
analyses using e.g. detailed hydrological, ecological or
socio-economic models Evaluate and estimate the quantitative uncertainties on climate
model projections and to identify the limitations of climate
models Describe the general future climate changes (including sea
level rise) as simulated with state- of-the-art climate models Describe the differences between different downscaling
techniques: dynamical downscaling (regional climate models) and
empirical-statistical downscaling. Know how to downscale results
from global and regional climate models Extract and process climate model data from international
database, e.g. ENSEMBLES, CORDEX, CMIP3 and CMIP5, etc. Extract and process reanalysis data from e.g. ECMWF (e.g.
ERA-Interim) Use dedicated software to process and analyze climate model
data Use select statistical ensemble techniques","
Complex numerical experiments using coupled atmosphere-ocean global
circulation models (AOGCM), Earth System Models and regional
climate models (RCM) are important tools for understanding the
climate system. Climate models are also essential for evaluating
the impacts of climate change to human and natural systems and
often constitute the initial link in a detailed modeling chain,
involving physical, ecological or socio-economic models.

The course provides a comprehensive introduction to climate
modeling and climate model analysis, including their general
structure and functionality and the use of multi-model ensembles.
The course also provides an overview of observations of past
(proxy) as well as recent and present day instrumental climate
variations based on remote sensing techniques, ground observations,
etc. It is discussed how these variations may be attributed to
different climate drivers using, e.g. 20th century
""hindcasts"", and how future climate conditions are
simulated by state-of-the-art climate models. Lastly, the course
provides an extensive introduction and hands-on experience in using
climate model data for different kinds of analyses. 
","12205,30140,30750,02633","
Martin Drews,Jens Hesselbjerg Christensen"
,,,,,,,,,,,,
