COURSE NUMBER,COURSE NAME,LANGUAGE OF INSTRUCTION,CREDIT LOAD,YEAR,SCHEDULE,COURSE TYPE,DEPARTMENT,GENERAL COURSE OBJECTIVES,LEARNING OBJECTIVES,CONTENT,RECOMMENDED PREREQUISITES,COURSE RESPONSIBLE
,,,,,,,,,,,,
42002 , Modelling and Analysis of Sustainable Energy Systems using Operations Research,English , 5 ECTS , 2016/2017 ,E4B (Fri 8-12),MSc,DTU Management Engineering,"
The objective of this course is to introduce the students to the
fundamentals of energy system modelling. With focus on a
sustainable energy system, we consider various energy technologies;
with particular emphasis on renewable energy sources, such as wind
turbines. We aim to formulate simple models of power systems with
renewable energy sources. We aspire to analyse the operation and
design of the system in terms of sustainability, reliability and
economic efficiency. To address such challenges, an important part
of the course is devoted to theory and practice of modelling,
optimisation and simulation. The idea is that the students will
learn to carry out the whole process of identifying a problem,
formulating a model, preparing data, implementing the model and
analysing the results on their own (this will partly be achieved by
working in groups on a project which focuses on a specific design
issue at the end of the course). 
","List the technical challenges involved in reliable and
economically efficient operation and design of a sustainable energy
system. The degree of detail should be comparable to that of a
public seminar for industry Formulate a mathematical programming problem; identify
objectives, constraints, variables and parameters; characterise
feasibility, optimality and unboundedness; formulate and interpret
the dual problem, formulate an integer program Formulate economic dispatch and unit commitment of power
producing units, electricity storage operation and integration of
renewable energy in the mathematical programming framework Formulate a linear/an integer programming model for a specific
problem within energy system operation and investment, given a
qualitative description of the problem Implement a mathematical programming model in GAMS, given a
mathematical formulation of the problem Collect, prepare and format input data, e.g. time series data
for production and consumption, for the models of this course Verify the models and carry out model runs to such an extent
that the results can be used to analyse a given problem Analyse and present the model results. The level should be such
that both results and implications are readily understandable by
the other students in the course","
The course provides an overview of a sustainable energy system with
a view towards the challenges involved in operation and design
within short and long term planning, i.e. time scales of hours to
days. To address such challenges mathematical programming models
are used in energy. The basics of optimization by mathematical
programming, the application to energy system modelling, and
software implementation are introduced during the course. 
",01005,"
Ida Græsted Jensen,
Niels Framroze Møller"
,,,,,,,,,,,,
42003 ," Energy Economics, Markets and Policies",English , 10 ECTS , 2016/2017 ,"E2 (Mon 13-17, Thurs 8-12)",MSc,DTU Management Engineering,"
With the point of departure in economic theory the purpose is to
provide the students with a fundamental understanding of the
current situation and the dynamic challenges that lie ahead for the
energy sector both nationally and internationally. This includes an
understanding of energy economics, energy markets, politics,
regulation and resources. The theoretical basis of the course is
the economic theories relevant for those topics. Furthermore, the
students are expected to relate these elements to the term
sustainability. The environmental policy instruments will be
compared in relation to different policy objectives and
institutional settings in the energy sector. The students are
expected to develop competences in interpreting, explaining and
discussing the challenges of the energy sector, policy and
regulation from an economic perspective. 
","Explain and apply basic concepts of economic theory such as
profit maximisation, demand and supply Describe a country’s energy structure and apply relevant
indicators to compare it with other countries Identify the interaction between limited resources and
continuous economic growth Identify and explain the dynamic interactions between energy
markets, as well as describe the importance of institutional and
organisational relationships for the effectiveness of energy
markets Analyse power markets based on load duration curves, screening
curves and cost recovery of power plants Describe the relation between investments and generation
capacity, as well as the effects produced by capacity remunerations
models such as capacity markets. Describe different environmental valuation methods and compare
their applicability for energy projects Describe the link between energy economics and environmental
economics and how they can be used to understand economic aspects
and challenges in a sustainable energy system Analyse effects and interactions between different regulation
methods, such as taxes and tradable quotas (pros and cons of
different regulation methods under different assumptions) Analyse and compare consequences for renewable energy
technologies of different support schemes and other forms of direct
regulation Describe regulatory and policy choices, e.g. with regard to
energy savings measures or environmental policy, and assess their
consequences Present and discuss an academic paper or article within the
abovementioned fields","
This course takes the approach of microeconomics to analyse the
energy sector, how energy markets behave and the necessary
regulation of markets.

The course provides a general introduction to the energy sector
both at the national and at the international level. The main focus
will be on different types of energy markets (electricity, oil,
gas, emissions, etc.). This encompasses market design, market
interactions as well as potential market imperfections. These
subjects will be analysed and discussed under consideration of
externalities, environmental taxes, quantitative regulation and
market power. We discuss policy measures to address these aspects
under different conditions.

The teaching is partially based on an introductory textbook in
environmental economics. Further, book chapters as well as
scientific papers and articles dealing with the respective subject
will be introduced and discussed. 
",01005,"
Pablo Alejandro Hevia Koch,
Lise-Lotte Pade,
Henrik Klinge Jacobsen"
,,,,,,,,,,,,
42004 , Feasibility studies of energy projects,English , 5 ECTS , 2016/2017 ,E3A (Tues 8-12),MSc,DTU Management Engineering,"
Students learn to assess the feasibility of energy projects from
both a societal and a business perspective taking into account
economic, environmental, regulatory and financing issues. 
","Describe the contents and steps of a feasibility study of an
energy project including its economic, environmental, regulatory
and financial elements Explain the difference between a socio-economic and
business-economic feasibility study Apply project evaluation methods to calculate key economic and
financial indicators such as net present value, internal rate of
return, payback time, and debt service coverage ratio of a concrete
energy project Determine the environmental and regulatory feasibility of a
concrete energy project Search for and critically apply data from different
sources Assess the uncertainty and risks related to obtained
feasibility and bankability results by creating appropriate
scenarios and sensitivity analyses Formulate specific recommendations for decision makers based on
results from a feasibility study Reflect on advantages and limitations that a partial and more
or less isolated analysis of a single project has as compared to a
more comprehensive energy system analysis","
We introduce the concepts of basic economic valuation, investment
analysis, levelised costs of energy, assessment of environmental
impacts, sensitivity and risk analysis, and financing of projects.
In lectures, exercises and group work the students gradually learn
how to create project valuation models and perform feasibility
studies. Throughout the course, students work on a real life case
from the energy industry, for which they elaborate a comprehensive
feasibility report. The course shall prepare students towards the
end of their Master studies to navigate in a professional work
environment that demands skills in both engineering and economics,
e.g. as in project management. 
","42003,28870","
Lena Kitzing"
,,,,,,,,,,,,
42005 , Micro and macroeconomics,Danish , 5 ECTS , 2016/2017 ,E5A (Wed 8-12),BSc,DTU Management Engineering,"
The overall objective of the course is to give the student a basic
insight to national economics. The students will gain an
understanding of socio economic challenges and skills in using
economic theory to argue for solutions for socio economic
challenges.

Microeconomic theory covering the behaviour of the households and
the firms is presented and the basic assumptions are discussed. The
students gain an understanding of macroeconomic balances and how
balances occur in a closed as well as a small open economy in the
long term. Further, the students gain insight into the differences
between the effects of finance policy in the long term and short
term respectively. 
","Explain the behaviour of the consumers and firms Present and solve the problem of the consumers (utility
maximisation) Present and solve the problem of the firms (profit
maximisation) Evaluate the welfare consequences of different market
designs Evaluate the welfare consequences of market initiatives Apply models for welfare analysis Explain the links between the demand components and GDP Describe a macroeconomic model for a closed economy and perform
causal analysis of models Describe a macroeconomic model for a small open economy Evaluate economic policy tools in the long term Describe and explain what causes unemployment and categorise
it Illustrate and explain the difference between short term and
long term effects of finance policy","
The microeconomic part of the course introduces central
microeconomic concepts and gives a general and simple introduction
to the basic microeconomic theory. We present a range of
fundamental economic principles important for economic decision
making and understanding of how the economy works. This part of the
course is dealing with firms and households. Important topics are
consumption theory, theory of the firm and efficiency.

Within the macroeconomic part of the course macroeconomic models
for a closed economy as well as a small open economy is introduced.
We explain how balances in the long term occur in the closed and
the small open economy respectively and reasons for unemployment
are introduced. Finally, the difference between short term and long
term equilibrium is explained including the effect of finance
policy. 
","42415,02403","
Lise-Lotte Pade,
Ismir Mulalic"
,,,,,,,,,,,,
42006 , National energy system modelling with TIMES,English , 5 ECTS , 2016/2017 ,January,MSc,DTU Management Engineering,"
The main purpose of the course is for the students to learn how to
build a national energy system model and carry out relevant
analyses. 
","Collect and evaluate data critically e.g. by comparing
production costs of technologies Develop and analyse internally consistent future energy
scenarios Critically reflect on a tool functionalities as well as main
assumptions and limitations of that type of tool in general and
specifically for the applied tool Validate and explain results Use TIMES model generator for creating a national energy system
model and describe its structure Analyse national energy system scenarios applying a TIMES
model Apply constraints in TIMES to represent e.g., limited renewable
resource potentials Represent energy demand, transmission, conversion and resource
potentials for different sectors of an existing energy system in
TIMES Explain the modelling of specific technologies in a TIMES
energy system model and compare the system consequences of
implementing them Clarify sensitivities of main assumptions through sensitivity
analysis Synthesise the main conclusions and discuss results in relation
to results of other energy system analyses and current debate in
society Coordinate model development","
We introduce the concepts of national energy system modelling and
analysis as well as scenario building. In lectures, exercises and
group work the students gradually learn how to create national
energy system models with the TIMES model generator. Throughout the
course, students work on modelling existing energy systems of
different countries and analyse potential future scenarios. The
course shall prepare students to work with national energy system
modelling in an international environment, as the TIMES model
generator is applied for energy modelling worldwide e.g. by the
IEA. 
","42004,42003,42002","
Marie Münster,
Olexandr Balyk,
Kenneth Bernard Karlsson"
,,,,,,,,,,,,
42011 , Product Usability and Design,Danish , 5 ECTS , 2016/2017 ,E3A (Tues 8-12),BSc,DTU Management Engineering,"
The learning goal of this course is to provide a basic
understanding of technology in a user-centered and social
perspective and to illustrate through practical design work, how
this understanding qualify product development. The understanding
is achieved by addressing fundamental technical, psychological,
social, political, financial and ethical dimensions of a given
product. To exemplify how social and ethical dimensions may have
impact on the forming of products, it is a goal of that course
participants will become able to apply principles of universal
accessibility. 
","Understand the importance of users and stakeholders for how
products are developed and used Understand technology and products in a psychological and
social context Understand and apply universal design principles Identify and describe historical, business and service aspects
of a given product Identify and learn technical research literature of relevance
for a given product Explain about the user-segments, value propositions, channels
and relations of a given product Clarify and describe the user experience for an active use of a
given product Justify and apply principles for universal
accessability","
This course introduces general design concepts and common methods
for development of new technological products, including user
involvement, experimental prototype evaluation, iterative design,
literature research, plus business and service issues of new
product creation.

The following elements are addressed:

*a broad introduction to product-, technology- and user
understanding

* a survey of the most common principles of design

*an introduction to qualitative and quantitative methods to uncover
user -activities and -experiences

*an introduction to business and service issues of products

*practical design work based on a user and action understanding

*search and application of technical literature

*psychological and social processes in a design team

*Universal accessibility as a design fundamental

Litrature:

Lidwell, W.; Holden, K. & Butler, J.: Universal Principles of
Design. Rockport 2010.

Vianna, M; Vianna, Y; Adler, I.K.; Lucena, B. & Russo, B:
Design Thinking, MJV Press, 2012 
",None,"
John Paulin Hansen"
,,,,,,,,,,,,
42021 , Technology Analysis,Danish , 5 ECTS , 2016/2017 ,F1A (Mon 8-12),BSc,DTU Management Engineering,"
The aim of the course is to gain understanding and insight as well
as to attain practical competencies in the area of technology
analysis (theory and methods) with respect to the mutual process of
shaping between design and use of artifacts. The course introduces
an expanded repertoire of analytical tools from the new sociology
of technology as well as cultural studies, in relation to the
pre-requisite course 42011. The new analytical and methodological
approach is to facilitate the characterisation, problematisation
and analysis of artifacts as heterogeneous co-constructions.

The course's treatment includes a recognition of the
philosophical basis of such analysis and its relevance in the
context of analysing products and technology, drawing upon elements
from the Theory of Science in Engineering. The course will herby
also treat the interrelationships between codifiable and practical
knowledge, as well as qualifications vis-a-vis competences in the
knowledge practices of engineers. 
","Apply Actor-Network Theory (ANT) and pertinent methods in the
analysis of technologies and products. Characterise products and their attributes as heterogeneously
ordered, hybrid constructions, through a broad conception of
products and technology. Identify and unravel the hybrid dimensions of a product, in
concrete contexts, through the notions of distributed agency and
knowledge processes as relates to boundary objects. Describe how knowledge is structured and ordered in the
respective cases of specialised knowledge vis-a-vis in situ domains
of engineering work practices. Account for heterogenous engineering, and the role played by
framing, in engineering design thinking and practice. Address basic issues concerning engineering science and the
status of objects, as relates to the Thoery of Science in
Engineering. Undertake original empirical research with a problem
orientation that is pertinent for a range of interrelated
design-use issues. Analyse the visions, as well as work of boundary-drawing, which
have had bearing on a product's shaping and use. Identify concrete aspects of heterogeneous translation, which
may be problematised as being of consequence to the product's
use, meaning and potential for reconceptualisation. Apply the attained knowledge on technology analysis and design
processes as a basis for a synthesis-oriented, creative approach to
design.","
The course entails an introduction to Actor-Network Theory (ANT),
with emphasis on the mutual ordering of needs, functionality and
meaning. The course focuses on the process of technology's
shaping: which includes design visions, product materialisation,
market emergence and product usage. The course involves exemplary
studies of design-use relationships, in the cultural and historical
contexts which products are embedded, and which serve to constitute
the emergence of products, their continued sustenance, and possible
state of obsolescence.

The following topics are covered in the course:

• Translation processes, including simplifications/​juxtapositions
as well as network punctualisations.

• Network displacement and differentiation of network states,
through reversible black-boxing.

• The product script through inscription and de-scription processes
in design and use..

• Boundary objects as elements in networks of knowledge practices.

• Use contexts, use processes, and user configruations.

• Domestication and product life thinking in an ANT perspective.

• The localisation of products in time, space and everyday life.

• Path-dependency and path-creation in the early stages of design.

• Product-market relationships (including institutions) as
heterogeneously ordered co-constructions.

• Objects and science in engineering practie and design.

• Heterogeneous engineering. 
",42011,"
Yutaka Yoshinaka"
,,,,,,,,,,,,
42042 , Participatory Systems Design,Danish , 5 ECTS , 2016/2017 ,F4A (Tues 13-17),BSc,DTU Management Engineering,"
The general objective of the course is to enable the students to
plan, implement and reflect upon a participatory systems design
process. The target of the participatory design process is a
company or organization or part hereof. Companies and organizations
are viewed as systems including workspace, organization, technology
and finance. 
","Account for the participatory systems design principles. Apply a systems model for analysis of work processes in a
company or part hereof. Select and apply participatory design methods. Design and carry through design games with users in a
company. Apply models and prototypes as a basis for dialogue and
interaction with users in a company. Apply prototype interviews. Apply the master-apprentice model. Analyze user needs by using affinity diagrams. Evaluate a participatory design process. Account for knowledge types and interaction between knowledge
domains.","
The course encompasses an introduction to systems and systems
design: Background, application, methods and tools. A number of
methods and tools of participatory design are presented: Contextual
design, master-apprentice model, affinity diagrams, work models,
design games, story boards, prototypes and prototyping. The course
presents a theoretical understanding of knowledge and knowledge
types. Finally is given insight into how participatory design
processes can be planned in interaction between different knowledge
domains.

The students work i groups with exercises and the accomplish a
participatory design process in a company or organization. The goal
is to identify improvement potentials in the work system and
develop recommendations for systems re-design aimed at improved
performance. 
",42021,"
Ole Broberg"
,,,,,,,,,,,,
42062 , Arenas and Concepts,Danish , 5 ECTS , 2016/2017 ,F2B (Thurs 8-12),BSc,DTU Management Engineering,"
The aim of the course is to enable the students to analyse and
interpret developments in society (sub-culture, user groups,
technology etc.) and translate them into frames for developing new
products and technologies. The conceptual frame for this comprise
of the development arena which is described by actors and spaces.
The analysis of the development arena and the understanding of
existing path's of development/trajectories and actor worlds
form the basis for outlining possible scenarios that will act as
pointers in the analysis of the potential of the concept.

The conceptual framework for considering solutions is a concept
that should have its raison d´etre in a need- and market dimension
(idea with) as well as a technical realization dimension (idea in).
Furthermore, a concept must represent a new solution with a
significant and markedly improved content compared to the existing.

","analyse the basis for and create a development arena taking the
outset in a type of product identify temporary paths of development/trajectories and
explain what creates them analyse actor worlds and use them to configure development
arenas based on existing case describe a specific development arena
and its adjacent trajectories, acstor worlds and frictions identify the frictions taking place in the development arena
and that influence on choice of concept create and evaluate the value and realizeability of
concepts prepare a basis for deciding on the selection of
concept/concepts stage design work based on scope, complexity and the required
result outline translations on the arena as a consequence of concept
selection analyse conceptual vulnerability identify the most critical factors related to the concept's
implementation on the development arena","
The course contains an introduction to the development space – the
arena – where the examined development takes place. The development
arena is introduced as a method for describing the space of actors,
social relations, technologies, institutions and artifacts, in
which a development process takes place.

The course builds on the students’ insight and skills in creative
problem solving from previous projects in the education. The course
introduces methods for concept creation which involves user
understanding, the significance of interaction between the
different sides of a product; the expanded product concept and
description of technology choice and technological platforms. A
case will be introduced so as to draft its development arena.

The course is organized as two successive sub-themes, covering
development arenas, creation of concepts for new products and
systems. For each sub-theme we will go through the theories with
examples over several sessions, followed by exercises where the
students based on various examples on applications as well as on
own contributions will discuss the methods and present them to each
other and the teachers.

The course is organized with theory teaching in the first weeks.
After that the theory is worked up from examples and themes, where
the students through project work identify the actual and relevant
development arenas and create innovative and attractive concepts.
The first two assignments result in written reports while the third
will be based on a synopsis and be reported to the teachers and
other groups with an oral presentation based on posters and
physical models. 
",42042,"
Jason Li-Ying,
Sophie Nyborg,
Claus Thorp Hansen,
Frank Ulrich"
,,,,,,,,,,,,
