COURSE NUMBER,COURSE NAME,LANGUAGE OF INSTRUCTION,CREDIT LOAD,YEAR,SCHEDULE,COURSE TYPE,DEPARTMENT,GENERAL COURSE OBJECTIVES,LEARNING OBJECTIVES,CONTENT,RECOMMENDED PREREQUISITES,COURSE RESPONSIBLE
42378 ," Health, environmental and life cycle impacts in different assessment frameworks",English , 5 ECTS , 2016/2017 ,F3A (Tues 8-12),MSc,DTU Management Engineering,"
The objectives of this course are structured as follows:

• Knowledge to be developed during the course: Thorough
understanding of principles, mathematical modeling steps and
application fields of different impact assessment methods including
limitations, assumptions and uncertainty as basis for assessing and
evaluating health and environmental impacts in a life cycle
perspective from local to global scale.

• Skills/competences to be developed during the course:
Identification, application and interpretation of results of
assessment methods and tools for quantifying environmental, health
and life cycle impacts associated with chemical emissions and
resources consumption. Main focus areas are life cycle impact
assessment (LCIA) and chemical alternatives assessment (CAA) of
hazardous chemicals in contrast to regulatory risk assessment (RA).

• Presumed knowledge: Fundamentals in mathematical modeling and
environmental chemistry is required. Additional knowledge in life
cycle (impact) assessment and/or risk assessment and/or policy
analysis is helpful, but not required.

• Required expertise in follow-up education (as engineers):
Identify and apply approaches for evaluating chemical pollution
problems in different contexts. 
","Describe and analyze complex real-life questions and problems
in the fields of environmental and health impact assessment Explain principles of different impact assessment methods and
the underlying modeling frameworks Apply impact assessment methods and models to quantify
environmental and health impacts of chemical emissions Characterize chemical emissions and quantify impact factors on
the basis of existing data and assessment models Evaluate the relevance of different impact categories and
develop priority lists of chemicals Evaluate strengths and limitations of quantitative impact
assessment methods and determine and justify uncertainties Identify and answer research questions from the fields of
comparative impact and alternatives assessment Design and develop impact pathways that are aligned with
current impact quantification methods Communicate model results consistently and structured in oral
and written form","
The course will be divided into three main sections: (i) overview,
understanding and modeling steps of different impact assessment
methods and their application fields; (ii) introduction into
principles, analysis and development of impact pathways and
quantification of environmental fate, exposure and effects of life
cycle-based impacts; (e) rank and recommend best-in-class options
based on quantified impacts and communicating results in a
consistent, reliable and transparent way to decision makers and
stakeholders. 
",,"
Peter Fantke"
,,,,,,,,,,,,
42401 , Introduction to Management Science,English , 5 ECTS , 2016/2017 ,E1B (Thurs 13-17),MSc,DTU Management Engineering,"
Most companies and public institutions today operate under tight
resource constraints - production, service, distribution etc. must
be carried out as efficiently as possible. Planning is a central
concept in this context. Advanced IT-systems play an increasing
role both on the detailed and on the over-all level. The course
introduces the topics Operations Management (OM) and Operations
Research (OR), which based on quantitative analyses and
mathematical models offer methods and tools from the strategic to
the operational level of the planning process. 
","Apply mathematical modelling, integer linear programming and
multi-objective optimisation Analyse, formalise and solve real-world planning problems using
mathematical modelling Evaluate results from applying mathematical programming Configure networks of suppliers, manufactures, and distribution
centers Analyse and solve different inventory situations Design and analyse lean production and service systems Compare hierarchical planning frameworks Implement and solve mathematical models in a spreadsheet based
solver Present analyses and results in report form","
Supply Chain Management, hierarchical planning - MRP systems and
services, design and management of production systems, IT-systems
for OM, models for operations research, linear programming, the
Simplex algorithm, integer programming, multi-objective
optimisation, inventory control. 
",None,"
Richard Martin Lusby,
Martin Bonev"
,,,,,,,,,,,,
42406 , Introduction to Production,Danish , 5 ECTS , 2016/2017 ,E4A (Tues 13-17),BSc,DTU Management Engineering,"
It is the object of the course to give students a general
understanding of the management tasks related to planning and
execution of industrial production. Using examples from production
companies it is the aim of the course to enable students to
describe and analyse the production task of a company and to
develop a production system which can handle the production task of
the company. The course will focus partly on the physical
production, partly on the preparation of production by using
specifications for production.

The term “production” is in this connection to be understood in a
wide sense and comprises many kinds of production, e.g. the
production of electronics, IT, mechanics, chemistry and
construction. Therefore, this course is of relevance for all
programmes.

The course aims partly at giving students a basic understanding of
the development and preparation of production, including an
introductory knowledge of the management tasks related to
production in production companies, partly to give a professional
background for the further courses within the focus area of
operations management. 
","Explain the role of production for the overall business
strategy of the firm Identify and describe major interrelationships between the
production function and other functions of the firm Describe and analyse the manufacturing task for the design and
operation of a production system Develop production based on the manufacturing task Describe and analyse production processes and systems to
identify possibilities for improvement Explain the processes in preparation of production Explain the use of specifications in preparing production Analyse and understand the specification processes in a
manufacturing company, and how these may be supported by product
configuration systems","
During this course, a number of management tasks related to
development and execution of production will be examined, including
the interrelation of production with a number of other functions
within a company.

The course will cover the following subjects: Analysis of the
production task. Development of production concept. Analysis of
specification processes, and development of specification processes
and how these can be supported by production configuration systems.

Throughout the course, students will have to do an exercise where
they will have to analyse the production task of a case company,
develop a future production system, and analyse and develop the
specification processes of the company. 
",42415,"
Lars Hvam"
,,,,,,,,,,,,
42413 , Simulation in Production og Services,English , 5 ECTS , 2016/2017 ,June,MSc,DTU Management Engineering,"
Simulation is an important dynamic tool in design and optimization
of production and service systems. The purpose of the course is
therefore through development of a case to learn and understand the
advantages, possibilities and limitations of simulation. Teaching
the participants to construct a simulation model of a production
and service system and at the same time do it in a simple way.
Teaching the participants to define key parameters that
characterize the performance of a production system. 
","Identify neccessary parameters for building a simulation
model Design a simulation model of a given system Apply a simulation model Discover key parameters for a given system Test of different simulation scenarios Do a verification and validation of the simulation model Analyse output parameters Planning an optimised system Argue the designed system","
The course is build on exercises for learning the simulation
programme and a case. For the case, a report is prepared. Following
items is covered in the course,

* Simulation in relation to a production system

* Steps in carrying out a simulation

* Advantages and limitations in simulation

* Application areas

* Steps in carrying out a model

* Output analyze 
",None,"
Peter Jacobsen"
,,,,,,,,,,,,
42415 , Engineering Economy,Danish , 5 ECTS , 2016/2017 ,E3A (Tues 8-12)  or  F3A (Tues 8-12),BSc,DTU Management Engineering,"
The overall course objecive is to give the students an
understanding of the basic concepts and models within engineering
economy. This should enable the students to identify, analyze and
solve technical economic problems and to evaluate the solutions. 
","Optimize its use of inputs in the short term. Optimizing the combination of substitutable inputs. From the firms production to derive cost functions in both the
short and long term. General methods for describing / calculate its costs and
evaluate their development by expansion. Evaluate correlations between the sales price and quantity
sold. Evaluate the firms demand and applying sensitivity to relevant
parameters. Optimizing the firms value creation by combining information
about costs and marketing. Optimizing the firms value creation under different market
structures. Optimizing the firms value creation when selling to more than
one market Optimizing the firms value creation through multi-product
production. Optimizing the firms value creation taking into account limited
resources using linear programming.","
Basic engineering economy concepts and models in the areas of 1)
production theory (the possible or potential production methods),
2) theory of costs, 3) theory of markets (the relations between
enterprise and markets), 4) theory of optimisation (the selection
of plans for production by combining informations of cost and
market and 5) cost accounting/calculation (imputed costs, cost
distribution). In order to illustrate by example, the solution of
typical engineering economy problems is part of the lectures on the
topics 1 to 5. 
",None,"
Kourosh Marjani Rasmussen,
Victor Lund"
,,,,,,,,,,,,
42421 , Management and Organization,Danish , 5 ECTS , 2016/2017 ,E2A (Mon 13-17),BSc,DTU Management Engineering,"
To qualify the student to apply relevant basic elements in
designing, managing and changing organizations in situations of
relevance for engineers. Emphasis is on a rigorous application of
concepts from organizational theory. This course supplements the
engineering background of the students with an action-oriented
understanding of leadership in an industrial enterprise and of the
human and organizational aspects involved. 
","Recall and explain central concepts and theories within
organization theory Identify problem(s) in a given case Choose and justify relevant theoretical positions to be used in
analysing specific problems Analyse given problems from different theoretical
positions Outline consistent possible solutions And combine them into an overall strategy for handling the
problem. Be able to explain the relation between technological and
organizational problems Be able to conduct a critical analysis of proposals for
implementing technical systems","
The course starts with the working situation for the individual
through theories of individual behaviour (including motivation).
The relation between people in organizations is examined through
theories on groups, roles and team development, communication,
decision making, conflicts, power and participation, and
leadership. At organizational level subjects as efficiency,
structure, strategy and management, culture, the relation between
organizations and environment and organizational change is
illuminated. 
",42405,"
Signe Poulsen,
Christine Ipsen"
,,,,,,,,,,,,
42429 , Project Management,English , 5 ECTS , 2016/2017 ,August,BSc,DTU Management Engineering,"
The purpose of the course is to enable the student to participate
in projects and critically and appropriately apply project
management tools, concepts, models and theories in practice. 
","Appraise the relevance of projects to engineering
practices Understand and critically assess the nature of projects based
on four key perspectives (vision, complexity, uncertainty and
people) Identify and describe typical mistakes and good practices in
the management of projects Apply appropriate tools, concepts, models and theories to
analyze cases and real life projects Apply appropriate tools, concepts, models and theories to
explain project success and failure Apply appropriate tools, concepts, models and theories to make
practical recommendations Compare project management theory and practice and discuss its
strengths and weakness in general and in relation to cases and real
life projects Communicate clearly, concisely and based on evidence","
Projects are integral to engineering work. Indeed, we argue that
project management is the second most important skill of engineers.
Therefore, project management competences are fundamental to all
DTU students.

Through the course, the student develops unique insights into how
project management is practiced through the analysis of a
""real"" world project. Furthermore, each student will
experience the role of the project manager as each student will be
responsible for planning and executing at least one day of the
group work.

The course are organized around classical and online lectures,
reading material, group exercises/games and assignments,
peer-reviews and multiple-choice quizzes. As a large portion of the
learning activities take place in group’s, class participation is
fundamental!

Through the group work, the students will analyze a real life
project. Here they are expected to apply tools, concepts, models
and theories, both appropriately and critically, to understand the
reasons for the project ‘success’ or ‘failure’, identify challenges
and develop recommendations.

IMPORTANT (TO DO PRIOR TO THE BEGINNING OF THE COURSE): Every
student are expected to identify an exciting project and present it
to the class in the first day. The project should be completed or
close to completion, so it is possible to analyze its ‘success’.

The lectures will be in English and we strongly encourage the
students to write the final report in English. By far most Bachelor
courses are in Danish. However, courses at Master level are mostly
if not exclusively in English. In order to facilitate the
transition, DTU encourages use of English language in some Bachelor
courses. This course is one of them. If the student do not feel
comfortable with English, they are allowed to write the report in
Danish. 
",None,"
Christian Thuesen,
Joana Geraldi"
,,,,,,,,,,,,
42430 , Project Management,English , 5 ECTS , 2016/2017 ,F1A (Mon 8-12),BSc,DTU Management Engineering,"
The purpose of the course is to enable the student to participate
in projects and critically and appropriately apply project
management tools, concepts, models and theories in practice. 
","Appraise the relevance of projects to engineering
practices Understand and critically assess the nature of projects based
on four key perspectives (vision, complexity, uncertainty and
people) Identify and describe typical mistakes and good practices in
the management of projects Apply appropriate tools, concepts, models and theories to
analyze cases and real life projects Apply appropriate tools, concepts, models and theories to
explain project success and failure Apply appropriate tools, concepts, models and theories to make
practical recommendations Compare project management theory and practice and discuss its
strengths and weakness in general and in relation to cases and real
life projects Communicate clearly, concisely and based on evidence","
Projects are integral to engineering work. Indeed, we argue that
project management is the second most important skill of engineers.
Therefore, project management competences are fundamental to all
DTU students.

Through the course, the student develops unique insights into how
project management is practiced through the analysis of a
""real"" world project. Furthermore, each student will
experience the role of the project manager as each student will be
responsible for planning and executing at least one day of the
group work.

The course are organized around classical and online lectures,
reading material, group exercises/games and assignments,
peer-reviews and multiple-choice quizzes. As a large portion of the
learning activities take place in group’s, class participation is
fundamental!

Through the group work, the students will analyze a real life
project. Here they are expected to apply tools, concepts, models
and theories, both appropriately and critically, to understand the
reasons for the project ‘success’ or ‘failure’, identify challenges
and develop recommendations.

IMPORTANT (TO DO PRIOR TO THE BEGINNING OF THE COURSE): Every
student are expected to identify an exciting project and present it
to the class in the first day. The project should be completed or
close to completion, so it is possible to analyze its ‘success’.

The lectures will be in English and we strongly encourage the
students to write the final report in English. By far most Bachelor
courses are in Danish. However, courses at Master level are mostly
if not exclusively in English. In order to facilitate the
transition, DTU encourages use of English language in some Bachelor
courses. This course is one of them. If the student do not feel
comfortable with English, they are allowed to write the report in
Danish. 
",None,"
Christian Thuesen,
Joana Geraldi"
,,,,,,,,,,,,
42432 , Strategic Simulation of Dynamic Systems,English , 5 ECTS , 2016/2017 ,June and June,MSc,DTU Management Engineering,"
To teach how strategic simulation can improve the management of
change and development in production, services and innovation. 
","Explain the prerequisites for the scenario and the numeric
simulation Develop scenarios which are consistent to the
prerequisites Choose input and output variables for the simulation Use of narrative and numeric simulation for a bounded problem,
so the two methods supplement each other Design scenarios and simulation models, so they challenge the
present situation and are credible for the future situation Do a systematic verification and validation of the numeric
simulation model Give a clear, visual and logical statement of simulation models
and results Analyse and evluate their own simulation pracsis in relation to
the other learning targets in the course","
To teach the student how to combine narrative and numeric
simulation methods of relevans for strategic management in relation
to production, service and innovation. Scenario analysis is
combined with computer simulation models in a practical oriented
project within an empirically specified area. Examples are
knowledge management, lean and/or competence strategy development
and logistics.It is relevant for students applying jobs within the
fields of strategic management and consultancy in private or public
areas. 
","42421,42922,42422","
Mette Sanne Hansen"
,,,,,,,,,,,,
42433 ," Advanced Engineering Project, Program and Portfolio Management",English , 10 ECTS , 2016/2017 ,"E4 (Tues 13-17, Fri 8-12)",MSc,DTU Management Engineering,"
Project, program and portfolio management skills are vital
throughout the lifecycle of engineering systems. This course will
introduce the students to the state-of-the-art in project, program
and portfolio management throughout contracting, design, operation
and divestment. The focus will be on complex socio-technical
engineering systems with long life cycles, such as energy
generation and distribution, transportation infrastructure,
construction systems, aerospace and defense systems, maritime
systems, IT systems or product/service systems. The objective of
the course is to enable students to apply system-oriented, advanced
project, program and portfolio management techniques in this highly
interdisciplinary context and prepare them for future leadership
roles in industry or government agencies. 
","Identify and critical reflect upon key challenges in the
project, program and portfolio management of an engineering
system Apply system-oriented methods to identify root causes of
challenges Identify and prioritize best practices to address challenges
and improve project, program and portfolio performance Develop business cases and successfully argue for
organizational change initiatives Develop implementation plans for project, program and portfolio
management related changes Explain and discuss the similarities and differences between
the management of projects, programs and portfolios Understand the implications of interdisciplinary design
activities and business strategy and public policy on the
management of engineering systems In writing promote, explain and argue for the understanding and
analysis of a challenge in a wiki article and final report
(buisiness case) Orally present and argue for the analysis of the challenge of
and proposal for a solution Give constructive feedback upon the work of others Find relevant and supplementary information from external
sources necessary to solve the tasks","
The course will address three major areas that create challenges
for project, program and portfolio management: 1. Complexity, with
a particular focus on the relationship of technical and
organizational complexity. 2. Uncertainty, with a focus on
identifying and mitigating key risks and uncertainties throughout
the long life cycles of engineering systems. And 3. Human behavior,
addressing the social and organizational intricacies caused by
public opinion formation as well as inner- and intra-organizational
factors.

The course will also address to major operational interfaces of
project and program management, first, to the interdisciplinary
design processes (e.g. systems engineering) and secondly, to
business strategy and public policy.

The course is built around three major activities: 1. Lectures and
seminars, 2. Individual assignment resulting in a wiki entry on
current challenges and/or best practices. Students will review
their colleagues’ papers, and results will be presented. And 3. A
group assignment in the form of a business case for organizational
change is presented in class. 
","42286,42429,42421,42430,42922,42871,42490","
Josef Oehmen,
Christian Thuesen,
Joana Geraldi"
,,,,,,,,,,,,
42435 , Knowledge based Entrepreneurship,English , 5 ECTS , 2016/2017 ,E2A (Mon 13-17) and F2A (Mon 13-17),MSc,DTU Management Engineering,"
To enable students to identify a business opportunity, conceive a
value creating solution, design a business model and analyse and
plan a business formation, based on their engineering skills. 
","Identify business opportunities Develop business ideas (Opportunity driven creativity) Develop business models Analyse markets for technological products and services Identify and inverview customers and stakeholders Analyze customer value proposition Plan the establishment of a company (Business planning) Determine capital requirements Establish a cash flow projection for the first 2-6 years of
operations Calculate an equity capital investment process Discuss the most relevant legal issues of the specific business
formation Specify management competence profiles","
The video-lectures cover a wide array of subjects:

- Entrepreneurship

- Strategies for knowledge based start-up companies

- Product development

- Patents and licenses

- Business planning

- Sales and marketing

- Production/distribution

- Type of business (legal)

- Economic analysis

- Financing the company start-up

- Managing a high-tech venture

Lectures are available from LLAB podcast server (MP4) format.
access via the course video index.

In a parallel to the lectures,the students (in groups of 4-6) work
out a business plan for a specific product idea. At the end of the
course the business plan is presented orally to the examiner and
the censor. 
",,"
John Heebøll"
,,,,,,,,,,,,
