COURSE NUMBER,COURSE NAME,LANGUAGE OF INSTRUCTION,CREDIT LOAD,YEAR,SCHEDULE,COURSE TYPE,DEPARTMENT,GENERAL COURSE OBJECTIVES,LEARNING OBJECTIVES,CONTENT,RECOMMENDED PREREQUISITES,COURSE RESPONSIBLE
47507, Ph.D. Course in Introduction to Low,English , 3 ECTS , 2016/2017 ,Fall,Ph.D.,DTU,"
The student should learn how fuel cells work, be able to describe
theoretically some of the important features of especially
low-temperature fuel cells and low-temperature electrolysis cells,
be able to describe and interpret electrochemical properties of
fuel cells. The student will learn how they are made and for which
applications each fuel cell type is more appropriate and what is
required from a system point of view to operate it. The student
will also obtain a fair view on the difficulties that exist for the
individual types such as degradation mechanisms and demands for
fuel and air quality.

The student will learn the electrochemical and thermodynamical
basic principles of the operation of low-temperature fuel cells
(LTFC) and electrolysis cells (LTEC), will be able to describe the
requirements put forward on the materials, learn the principles of
the conduction mechanisms in the materials used for the main
components, will be able to describe theoretically and interpret
electrochemical processes occurring in LTFC and LTEC, will learn
about cell- and stack designs and manufacturing methods, will be
able to describe the main degradation mechanisms occurring in LTFC
and LTEC, and will understand critical issues in the selection of
materials and components for cells. Furthermore, the student will
come to know about the advantages and disadvantages of LTFC and
LTEC compared with other energy technologies, and will be
acquainted with various designs and their advantages and
disadvantages, as well as application areas. The student will gain
experience of characterization methods such as electrochemical
methods and structural analysis methods. In addition, the student
will in group work on own ideas on possible applications of LTFC
and/or LTEC. 
","Describe theoretically the electrochemical fundamentals of LTFC
and LTEC Describe theoretically the thermodynamical fundamentals of LTFC
and LTEC Explain the fundamental mechanisms of the electrochemical
reactions at the electrode/electrolyte interfaces of LTFC and
LTEC Explain the fundamental mechanisms of conduction of the
individual components of cells and stacks Explain the critical parameters in materials selection for LTFC
and LTEC Explain the critical parameters for the selection of operating
conditions Analyze data describing the electrochemical performance of LTFC
and LTEC Explain the main degradation mechanisms of the performance of
the LTFC and LTEC Describe advantages and disadvantages of LTFC and LTEC, also in
comparison with other energy technologies","
Fundamentals of alkaline fuel cells (AFC), phosphoric acid fuel
cells (PAFC), proton exchange membrane fuel cells (PEMFC),
high-temperature PEM fuel cells (HT-PEMFC) and direct methanol fuel
cells (DMFC). Materials used for the components (electrolytes,
catalysts, electrodes, bipolar plates, etc.) of the different
cells. Applications, stacking, system requirements, fuels and
degradation mechanisms will be treated and, finally, the main
development challenges and trends will be outlined. Theoretical
descriptions of the electrochemical and thermodynamical fundamental
properties of ceramic-based fuel cells. Materials properties,
conduction mechanisms, requirements for the individual components,
i.e. the electrolyte material, the anode material and the cathode
material, as well as challenges for the assembled cells.
Electrochemical characterization and evaluation of cell properties
by electrochemical impedance spectroscopy methods. Fabrication,
cell and stack design and market opportunities will be treated. 
",None,"
Jens Oluf Jensen,Robert Steinberger-Wilckens,Marcelo Carmo"
,,,,,,,,,,,,
47508 , Ph.D. Course in Introduction to Batteries,English , 3 ECTS , 2016/2017 ,Fall,Ph.D.,DTU,"
The student should learn how intercalation and conversion batteries
work, be able to describe the fundamental mechanisms and the most
important features of lithium-ion, metal-sulfur and metal-air
batteries, be able to describe and interpret the corresponding
electrochemical properties, discuss degradation mechanisms as a
function of various test conditions, and understand critical issues
in the selection of materials and components on the performance at
cell level. Furthermore, the student should be able to discuss
advantages and disadvantages of different battery concepts compared
with other energy storage technologies. 
","Describe theoretically the fundamentals of lithium-ion,
metal-sulfur and metal-air batteries Explain the fundamental mechanisms/​functionalities of the
individual components and their interaction Evaluate the critical parameters in the materials
selection Explain the critical parameters for the selection of operating
conditions Analyze data describing the electrochemical performance Explain possible degradation mechanisms Describe advantages and disadvantages in comparison with other
energy storage concepts Describe battery manufacturing methods","
Theoretical descriptions of the fundamental mechanisms and
properties of lithium-ion, metal-sulfur and metal-air batteries,
e.g. specific energies and over-voltages. Materials demands for the
individual components, i.e. the electrolyte material, the anode
material and the cathode material, as well as interface formation
(SEI) between electrolyte and electrodes. Electrochemical
characterization and evaluation of cell properties by
electrochemical impedance spectroscopy methods. Description/studies
of degradation mechanisms. Safety issues. Fabrication and cell
assembly will be treated briefly. 
",None,"
Tejs Vegge,
Juan Maria García Lastra"
,,,,,,,,,,,,
47509 , Ph.D. Course in Introduction to SOFC and SOEC,English , 3 ECTS , 2016/2017 ,Fall,Ph.D.,DTU,"
The student will learn about the electrochemical and
thermodynamical basic principles of the operation of solid oxide
fuel cells (SOFCs) and solid oxide electrolysis cells (SOECs), be
able to describe the requirements put forward on the materials,
learn the principles of the conduction mechanisms in the materials
used for the main components, will be able to describe
theoretically and interpret electrochemical processes occurring in
SOFC and SOEC, will learn about cell- and stack designs and
manufacturing methods, will be able to describe the main
degradation mechanisms occurring in SOFC and SOEC, and understand
critical issues in the selection of materials and components for
cells. Furthermore, the student will come to know about the
advantages and disadvantages of SOFC and SOEC compared with other
energy technologies and will be acquainted with various designs and
their advantages and disadvantages, as well as application areas.
The student will learn about characterization methods, such as
electrochemical methods and structural analysis methods. In
addition, the student will in group work on own ideas on possible
applications of SOFC and/or SOEC. 
","Describe theoretically the electrochemical fundamentals of SOFC
and SOEC Describe theoretically the thermodynamical fundamentals of SOFC
and SOEC Explain the fundamental mechanisms of the electrochemical
reactions at the electrode/electrolyte interfaces of SOFC and
SOEC Explain the fundamental mechanisms of conduction of the
individual components of cells and stacks Explain the critical parameters in materials selection for SOFC
and SOEC Explain the critical parameters for the selection of operating
conditions Analyse data describing the electrochemical performance of SOFC
and SOEC Explain the main degradation mechanisms of the performance of
the SOFC and SOEC Describe advantages and disadvantages of SOFC and SOEC, also in
comparison with other energy technologies","
Theoretical descriptions of the electrochemical and thermodynamical
fundamental properties of ceramic-based fuel cells. Materials
properties, conduction mechanisms, requirements for the individual
components, i.e. the electrolyte material, the anode material and
the cathode material, as well as challenges for the assembled
cells. Electrochemical characterization and evaluation of cell
properties by electrochemical impedance spectroscopy methods.
Description/studies of degradation mechanisms for state-of-the-art
SOFC and SOEC. Fabrication, cell and stack design and market
opportunities will be treated briefly. 
",None,"
Anke Hagen,Bert de Haart,Robert Steinberger-Wilckens"
