COURSE NUMBER,COURSE NAME,LANGUAGE OF INSTRUCTION,CREDIT LOAD,YEAR,SCHEDULE,COURSE TYPE,DEPARTMENT,GENERAL COURSE OBJECTIVES,LEARNING OBJECTIVES,CONTENT,RECOMMENDED PREREQUISITES,COURSE RESPONSIBLE
47317 , Exergy Analysis,English , 5 ECTS , 2016/2017 ,F2A (Mon 13-17),MSc,DTU,"
Efficient handling of energy becomes increasingly important whether
we choose to base the future energy system on renewable energy, or
we continue to consume the fossil reserves. The 1st law of
thermodynamics states that energy is conserved and can neither be
created, nor consumed, so why do we have problems with energy? It
is typically the usable part of the energy that is decisive and of
interest in energy analyses, so why not put it into system by the
term exergy. The student will understand the concept of exergy and
will be able to apply it to different subprocesses which can be
combined into more complex systems. The course will also provide a
better understanding of reversibility and sustainability in our
energy systems as well as in a broader sense. 
","Explain the concept of entropy as a practical abstraction Account for the difference between reversible and irreversible
processes Explain the term exergy as a measure of the quality of the
energy and its ability to perform work Account for the difference between energy efficiency and exergy
efficiency Calculate exergy consumption in common physical processes Calculate exergy consumption in chemical processes Carry out an exergy analysis on a system with some
complexity Identify the most irreversible steps in a process Assess exergy consumption in energy conversion processes Assess sustainability based on exergy views","
The 1st and the 2nd laws of thermodynamics. A more thorough
introduction to the concept of entropy than what is normally seen
at introductory courses on thermodynamics. Assessment of popular
descriptions of entropy as disorder, scattering, information and
the arrow of time. Exergy as a measure of energy quality. Exergy
consumption in physical processes. Exergy consumption in chemical
processes. Exergy analysis of selected systems such as cooling
machines, engines, fuel cells, chemical industry, electricity
production. Some model systems will be chosen in dialogue with the
students during the course. 
",None,"
Jens Oluf Jensen"
,,,,,,,,,,,,
47318 , Advanced Chemistry for Non,English , 5 ECTS , 2016/2017 ,E4A (Tues 13-17),MSc,DTU,"
Engineers need to understand technologies and materials.
Engineering requires applied science. Chemistry is a central link
between engineering and science and between technologies and
materials. This course is designed to present specialized topics of
modern chemistry for engineering students with non-chemistry
backgrounds. The topics cover major chemistry branches that will be
introduced and illustrated with selected processes and materials of
engineering importance. The objectives are to provide fundamental
tools of chemistry in order to help the students to understand
their own fields better. 
","Collect the appropriate data of material properties and
understand basic thermodynamics in terms of energy conversion and
material stability Explain acid-base and colloidal systems, adsorption and
surfactants as well as characterization techniques within the
fields Depict catalysis and catalysts for petroleum cracking and
synthesis gas Understand chemical and electrochemical energy conversion in
internal combustion, batteries and fuel cells Describe structure and properties of inorganic materials,
particularly metals and alloys Correlate structures and properties of carbons (graphite,
diamonds, carbon fibres, fullerene and nanostructures) Describe structures, functionalities and applications of
ceramics Outline organic chemistry and macromolecular chemistry Describe properties and applications of polymers and
rubbers","
The course covers the following 6 topics:

1) Introduction (chemistry and matters) and physical chemistry
(gas, liquid and solid; 1st and 2nd laws of thermodynamics)

2) Surface and analytic chemistry (acid-base and colloidal systems,
adsorption, surfactants, instrumental techniques)

3) Petro- and electrochemistry (catalysis and catalysts, petro
cracking and synthesis gas; chemical and electrochemical energy
conversion)

4) Inorganic chemistry (bonding, structures, periodicity; metals
and alloys)

5) Materials chemistry (structure, properties and applications of
carbons and ceramics)

6) Organic and polymer chemistry (intro, macromolecules; polymers;
rubbers) 
",None,"
Qingfeng Li,
David Aili"
,,,,,,,,,,,,
47319 , Functional Materials,English , 5 ECTS , 2016/2017 ,F1A (Mon 8-12),MSc,DTU,"
This course aims at providing graduate students with an
understanding of the description and application of functional
materials in selected existing and emerging energy conversion
devices such as solid oxide fuel cells, advanced Li-batteries and
thermoelectric generators. It is the ambition to broaden the
students' knowledge of materials and applied solid state
chemistry and physics and to train them in utilizing their
knowledge to describe the function of full devices and how to
improve them. 
","Describe the crystal structure of inorganic materials and the
concept of point defects Describe the most important types of defects in functional
oxides and their importance for charge transport and chemical
processes Explain the difference between insulators, semiconductors,
metals and ionic conductors Summarize the significance of nonstoichiometry in battery and
fuel cell materials Explain electrical, chemical and electrochemical transport and
how to measure diffusion coefficients Describe the CALPHAD method and its relevance to solid state
chemistry Explain thermoelectricity and piezoelectricity Relate performance measures of a thermoelectric device to the
underlying material properties Assess the importance of various material properties to the
design of a good piezoelectric device Formulate criteria for choosing functional materials for
particular fuel cell and battery applications","
The course focus is on the description of material properties of
crystalline inorganic solids. The description of crystal
structures, the concept of point defects as well as defect
chemistry will be thoroughly presented to be able to utilize these
concepts in describing the function of devices. Methods of
classifying materials from their electronic structures are
presented as are selected elements of thermodynamics important to
describe coupling phenomena such as thermoelectricity and
piezoelectricity. Examples of materials and preferred material
models will be based on our research and development in the areas
of fuel cells, advanced Li-ion batteries and thermoelectric
generators. The form of the course will be lectures combined with
problem solving. During the course, the students will work on their
own small projects, aiming to design an “on paper” complete
functional device belonging to one of the classes presented in the
course (thermoelectric generators, Li-ion batteries, solid oxide
fuel cells and piezoelectric energy harvesters). The students will
work individually or in groups on this. Supervision will be
provided. The purpose of these projects is to work actively with
the tools and descriptions presented in the lectures. 
",None,"
Peter Vang Hendriksen,
Nini Pryds"
,,,,,,,,,,,,
47320 , Organic Solar Cells – Theory and Practice,English , 2.5 ECTS , 2016/2017 ,Fall and Spring  or  January,MSc,DTU,"
The goal of the course is to give students insight into the largest
sustainable source of energy and how we can make use of it using
organic solar cells. The course focuses on the manufacture and
testing of organic solar cells in small and large scale. 
","Argue for advantages and disadvantages using solar energy, and
compare the differences between the three generations of solar
cells Compare embedded energy, energy payback factor and energy
payback Illustrate the different layers and their functions in a
polymer solar cell and calculate the efficiency and fill
factor Illustrate the different steps in the exciton theory Propose at least two criteria that a polymer material must meet
to be used in a polymer solar cell, and describe the connection
between the solar spectrum, the absorption spectrum, and the colour
of the polymer Name the three synthesis methods used to prepare polymers for
applications in polymer solar cells and argue for the
advantages/disadvantages of each synthetic method Evaluate different types of stability and name the different
degradation mechanisms Argue for advantages and disadvantages between different types
of encapsulation Distinguish between the different ISOS standards (International
Summit on Organic photovoltaic Summit) Compare different lab scale techniques for production and test
of polymer solar cells Critically evaluate speed limits for different processing
techniques such as coating and printing","
The course deals with organic solar cells as well as details of
materials degradation and small and large scale production of
organic solar cells. Videos and assignments provide students with
in-depth knowledge of organic solar cells. 
",,"
Eva Bundgaard,
Frederik C Krebs,
Morten Vesterager Madsen"
,,,,,,,,,,,,
47321 , Research Immersion – Department of Energy Conversion and Storage,English , 5 ECTS , 2016/2017 ,July,BSc,DTU,"
As a student you will take an active part in an ongoing research
project in which the supervising PhD
student/​postdoc/​scientist/​senior scientist/associate professor
is involved. The student will gain forefront research-based
knowledge of an area within energy conversion and storage
technologies, while gaining insight into the way the scientific
methods are put into practice in order to solve energy-related
challenges highly relevant to society. You will also gain and train
more generic engineering skills, such as the ability to participate
in a constructive mentor-mentee relationship, perform thorough
analyses of obtained experimental data, compare obtained results
with results reported in literature and train the ability to
communicate this in a well-structured way – both orally and in
writing. 
","Critically read literature and extract information of relevance
to the given scientific project/task Give a description of the purpose of the experimental
(modelling/simulation) work Give a description of the experimental set-up (or applied
models/simulations tools) used Evaluate advantages/disadvantages related to the applied
experimental set-up (model/simulations) Perform the experimental (modelling/simulation) work and
explain the various methods of analysis applied during the
experimental (modelling/simulation) work Analyze the obtained experimental (modelling/simulation)
results Assess the quality of the obtained results Write a report of the conducted work and the obtained
results","
You will work with a PhD student/​postdoc/​scientist/​senior
scientist/associate professor on experimental work in an ongoing
research project in which the supervising PhD
student/​postdoc/​scientist/​senior scientist/associate professor
is involved.

The specific topic for the course will depend on the ongoing
projects in the department and will be related to one of key
technologies that we are working with in DTU Energy. The
technologies are (read more here:
http:/​/​www.energy.dtu.dk/​english/​Research):

• Fuel cells

• Electrolysis

• Solar cells

• Batteries

• Membranes for gas separation

• Magnetic refrigeration

• Thermoelectrical components

• Flue gas purification

• Superconducting components

Shortly after the deadline for sign-up via CampusNet, you will be
asked to send an overview of the courses you have taken during your
study at DTU (or another university). We wil hereafter match
students with an appropriate supervisor and research project. 
",None,"
Anne Hauch,
Ming Chen,
Jean-Claude Grivel"
,,,,,,,,,,,,
47322 , Research Immersion – Department of Energy Conversion and Storage,English , 5 ECTS , 2016/2017 ,July,MSc,DTU,"
As a student taking our Research Immersion course, you will take an
active part in an ongoing research project in which your supervisor
in DTU Energy is involved. The student will gain forefront
research-based knowledge of an area within energy conversion and
storage technologies, while gaining insight into the way scientific
methods are put into practice in order to solve energy-related
challenges highly relevant to society. Moreover, the student will
be trained in/expected to read and comprehend scientific journal
articles. The student will also gain more generic engineering
skills and researcher competences, such as the ability to
participate in a constructive mentor-mentee relationship, perform
thorough analyses of obtained experimental data, compare obtained
results with results reported in literature and train the ability
to communicate this in a concise and well-structured way – both
orally and in writing. 
","Critically read scientific literature/articles and extract
information of relevance to the given scientific project/task Give a description of the purpose of the experimental
(modelling/simulation) work Give a description of the experimental set-up (or applied
models) used and critically evaluate advantages/disadvantages and
limitations related to the applied experimental set-up
(modelling/simulations) Plan and perform the experimental (modelling/simulation) work
and explain the various methods of analysis applied during the
experimental (modelling/simulation) work Analyze the obtained experimental (modelling/simulation)
results Assess the quality of the obtained results including errors and
uncertainties Compare and critically relate the results obtained with similar
results reported in literature Write a report (structured like a scientific article) of the
experimental work and the obtained results","
You will work with a postdoc/scientist/senior scientist/associate
professor on experimental work in an ongoing research project in
which the supervising postdoc/scientist/senior scientist/associate
professor is involved.

The specific topic for the course will depend on the ongoing
projects in the department and will be related to one of key
technologies that we are working with in DTU Energy. The
technologies are (read more here:
http:/​/​www.energy.dtu.dk/​english/​Research):

• Fuel cells

• Electrolysis

• Solar cells

• Batteries

• Membranes for gas separation

• Magnetic refrigeration

• Thermoelectrical components

• Flue gas purification

• Superconducting components

Shortly after the deadline for sign-up via CampusNet, you will be
asked to send an overview of the courses you have taken during your
study at DTU (or another university). We will hereafter match
students with an appropriate supervisor and research project. 
",,"
Anne Hauch,
Ming Chen,
Jean-Claude Grivel"
,,,,,,,,,,,,
47323 , Advanced Plasma Processes for Tailoring Materials and Nanostructures,English , 5 ECTS , 2016/2017 ,June,MSc,DTU,"
The course objective is to provide the students with general
knowledge about plasma physics with main emphasis on plasma
sources, plasma diagnostics and applications for materials (thin
film deposition, ion implantation, functionalization and etching)
and nanostructures (growth and shaping of nanostructures,
nanoparticle synthesis). 
","Operate four types of plasma sources (RF, microwave, DC and
atmospheric pressure) Describe the main plasma parameters that can be used in
applications Present the main plasma processes used for growth of
nanoparticles and nanostructures Compare electrical and optical methods used for plasma
diagnostics Use magnetron sputtering for deposition of nanostructured thin
films Perform nanopatterning using a microwave plasma source Tailor surface properties by plasma immersion ion
implantation Functionalize a surface by atmospheric pressure plasma Analyze the reactive species during plasma etching by mass
spectrometry Measure plasma parameters during magnetron sputtering","
The course will offer a general understanding of plasma
applications for materials and nanostructures including: definition
of plasma, ionization degree, Debye length, plasma frequency,
velocity distribution function and space charge formation.
Elementary processes in plasma and transport phenomena. DC,
microwave and radiofrequency driven plasma sources, atmospheric
plasma sources. Plasma diagnostics by electrical probes and
absorption and emission spectroscopy. Thin film deposition by
reactive magnetron sputtering. Growth mechanism of thin films and
nanostructures. Principles of nanopatterning by reactive ion
etching. Surface modification by plasma immersion ion implantation.
Role of radicals in plasma-assisted nanoprocesses such as oxide and
nitride thin films, reactive etching, molecular beam epitaxy,
synthesis and coating of nanoparticles. 
","10400,10467,10031,33250","
Eugen Stamate"
,,,,,,,,,,,,
47324 , Hands,English , 5 ECTS , 2016/2017 ,January,MSc,DTU,"
The course gives an overview in bird-eye perceptive of how raw
materials are synthesized and processed into functional energy
conversion devices. 
","Choose from different synthesis methods and follow directions
to synthesize inorganic compounds by different synthesis
methods Compare different synthesis methods and discuss and explain
their advantages and disadvantages Apply different characterization methods and interpret the
results to classify product purity and structure Reproduce and modify an experimental procedure from the
chemical literature Determine and evaluate experimental data (lab journal on a
research level) and validate and explain the quality of the
produced electrochemical device Process powders into mixtures that can be used for shaping Perform a basic characterization of rheology parameters Perform a basic characterization of energy conversion
devices Present synthetic/practical work orally in original
report/presentation Acquire information about and understand the safety hazards and
potential risks for a given synthesis","
The main objective of the course is to synthesize different
materials and process them into fully functional energy conversion
devices such as electrolyzer cells, oxygen membranes or batteries;
will be tested at the end of the course. The materials do not only
include state-of-the-art materials, but also new materials
suggested and developed by the students. These materials will be
evaluated against existing materials. Training includes practical
and theoretical fundamentals of inorganic synthesis, ceramic
processing, material characterization and evaluation of the final
energy conversion device. 
",,"
Andreas Kaiser,
Wolff-Ragnar Kiebach,
Bhaskar Reddy Sudireddy"
,,,,,,,,,,,,
47325 , Large,English , 5 ECTS , 2016/2017 ,F1A (Mon 8-12),MSc,DTU,"
To provide the student with a qualitative understanding of
large-scale and applied energy-related superconductor technology:
superconductor concepts and theory, fabrication and
characterization, technical utilization and cost of energy in
relation to energy technologies. 
","Argue for the most relevant superconductor hallmarks Describe the Ginzburg-Landau theory of superconductors and
derive key parameters Explain the concepts of magnetic flux pinning and loss
mechanisms in superconductors and relate them to energy
technologies Describe superconductor fabrication techniques Select a specific relevant characterization method for
superconductors Evaluate and select thermo-mechanical and electromagnetic
models to superconductor systems and relate to the physical system
constraints Argue for what type of superconductor is best suited for
specific large-scale and energy technologies Apply a comparative key parameter methodology for
superconductor large-scale and energy technologies Describe a general energy system evaluation including a cost of
energy analysis to various energy technologies","
An introduction to key concepts of superconductivity is given with
a focus on critical parameters, magnetic penetration and
quantization, type I and II superconductors (London and
Ginzburg-Landau theory), magnetic flux pinning and loss mechanisms.
Fabrication and characterization techniques are introduced in
relation to relevant critical properties and technical system
operation for various technologies ranging from fusion power to
smart-grid transport cables. Thermo-mechanical and electromagnetic
material and system constraints are specifically described from a
superconducting wind turbine perspective.

The course also includes an introduction to a system energy
evaluation methodology and subsequent critical assessment of the
“cost of energy” between various types of present energy
Technologies. 
",10303,"
Anders Christian Wulff,
Asger Bech Abrahamsen"
,,,,,,,,,,,,
47326 , Applied Superconductor Projects and Experiments,English , 5 ECTS , 2016/2017 ,June,MSc,DTU,"
To provide the student with an experimental project-based insight
into applied superconductor technologies, project management and
scientific communication. 
","Explain the superconductor properties and key parameters Formulate a project plan with specific objectives, goals and
methodologies Find and critically assess relevant scientific literature and
communications Plan and methodic conduct an experimential project in a
team Analyze and critically evaluate project results in relation to
relevant theory and scientific litterature Argue for uncertainties and sources of errors in relation to
results Evaluate and document the obtained project results in a
well-structured scientific article/report Present and explain project results using a conference-like
presentation structure","
An introduction to key concepts of superconductivity is given with
focus on critical parameters. Project part; project planning,
literature study, conduct an experimential project, write a
scientific article/report and project presentation technique. The
experimential project content is chosen with a focus on either
simulation or hands-on. The project report is constructed as a
scientific article and the content is presented at the examination.

",47325,"
Anders Christian Wulff,
Asger Bech Abrahamsen"
,,,,,,,,,,,,
47327 , Design Different Functional Nanomaterials by Spark Plasma Sintering for Energy Applications,English , 5 ECTS , 2016/2017 ,June,MSc,DTU,"
To design functionally graded materials,
nanomaterials/​nanocomposites, and thermoelectric materials for
energy conversion and storage, it requires advanced sintering
methods. Spark Plasma Sintering (SPS) is a new technique where it
only only a few minutes to complete a sintering process compared
with conventional sintering which may take hours or even days for
the same. Using SPS, near theoretical density can be obtained at
lower sintering temperature and in a shorter period of time than
other sintering processes. Importantly, with SPS nanostructures can
be maintained in a bulk form which has excellent mechanical
properties such as high strength, high hardness etc. Therefore, SPS
emerges as a key technology for a new generation of materials. This
course aims at providing students with insight into knowing how the
SPS sintering happens from the basic principles and mechanism to
the practical working experience. 
","List the sintering methods and their applications Define the problems of conventional sintering methods and the
advantages of SPS Describe the basic configuration and process of spark plasma
sintering Make a sintering profile for typical materials Analyse the data obtained after sintering and calculate the
density of the SPS sintered sample Design a new sintering profile for new material Interpret the observed sintering parameters during the SPS
process Evaluate the effect of sintering conditions on the quality of
the final sintered product","
The course will start with lectures to introduce the principles and
mechanism of the SPS process as well as the basic configuration of
the SPS. The lectures also include a short review of recent
successful applications of SPS in functionally graded materials,
nanomaterials/​nanocomposites, and thermoelectric materials. The
course will then provide practical knowledge of the SPS 515S system
at DTU Energy and its sintering conditions. The experimental work
will be conducted through the following small projects under the
supervision of main teacher and assistant.

Project 1: Designing bulk nanostructured materials from
nano-powders of metals, e.g. Cu, Ni for energy devices.

Project 2: Designing dense bulk ceramic materials for energy
application such as thermoelectric power generation. 
",None,"
Nini Pryds,
Ngo Van Nong,
Thanh Hung Le"
,,,,,,,,,,,,
