COURSE NUMBER,COURSE NAME,LANGUAGE OF INSTRUCTION,CREDIT LOAD,YEAR,SCHEDULE,COURSE TYPE,DEPARTMENT,GENERAL COURSE OBJECTIVES,LEARNING OBJECTIVES,CONTENT,RECOMMENDED PREREQUISITES,COURSE RESPONSIBLE
,,,,,,,,,,,,
47301 , Hydrogen Energy and Fuel Cells,English , 5 ECTS , 2016/2017 ,F1B (Thurs 13-17),MSc,DTU,"
Fossil fuels are depleting. Carbon dioxide is accumulating in the
atmosphere. Global warming is accelerating at an increasing rate.
These ever growing concerns stimulate worldwide research activities
within technologies of high fuel efficiency, low air emissions, and
renewable energy for the 21st century. Hydrogen and fuel cells are
expected to play central roles in this context. The course presents
a comprehensive and up-to-date understanding of the hydrogen energy
and fuel cell technologies in order to provide (1) an introductory
overview to students that are new in the field, (2) a detailed
explanation and further understanding to those familiar with the
subject, and (3) a discussion platform for the newest innovations
and future improvements to those involved or to be involved in the
development. 
","Present the idea of applying hydrogen as an energy carrier Describe the mode of operation of a fuel cell as well as the
function of the individual components Understand and present the differences in function and
application of different types of fuel cells Explain the shape of a polarization curve and calculate ohmic
resistance and conversion efficiency on that background Present the most important techniques for production of
hydrogen Distinguish between different techniques for reforming Present the three most important types of electrolyzer
cells Assess advantages and limitations of different techniques for
hydrogen storage Discuss safety issues in connection with hydrogen Discuss the problems with implementation of the hydrogen
society and keep a critical attitude to popular descriptions of
hydrogen as an energy carrier","
Hydrogen as an energy carrier, fundamentals of fuel cells,
electrochemical principles, thermodynamics, ion conductors,
catalysts and electrodes, types of fuel cells (proton exchange
membrane fuel cell, alkaline fuel cell, phosphoric acid fuel cell,
molten carbonate fuel cell, solid oxide fuel cell), hydrogen
storage, metal hydrides, fuel processing, hydrogen production
(reforming and electrolysis), system integration, balance of plant,
applications. Optional lab tours will be arranged. 
",47302,"
Qingfeng Li,
Jens Oluf Jensen"
,,,,,,,,,,,,
47302 , Hydrogen and Fuel Cell Chemistry ,English , 5 ECTS , 2016/2017 ,January,MSc,DTU,"
To give practical experience in hydrogen energy systems. Selected
components from the whole hydrogen chain are addressed (hydrogen
production by methanol reforming and water electrolysis, advanced
hydrogen storage, conversion in PEM fuel cells). Moreover, a number
of relevant special laboratory techniques with wider applicability
are part of the course (e.g. spectroscopy and glove boxes). In this
way the course is meant to address a broader range of knowledge
from fundamental materials to hydrogen energy technologies. The
theoretical grounds for the techniques are established through a
series of short introductory lectures. 
","Prepare catalyst, membrane and electrodes for a PEM fuel
cell Assemble and test a PEM fuel cell Synthesize reforming catalyst and construct a methanol
reformer Test a PEM electrolyzer for water splitting Apply spectroscopy (IR and XRD) Construct laboratory furnaces and measure/control
temperature Apply different electrochemical techniques Integrate fuel cell with methanol reformer","
Preparation and characterization of platinum catalyst, ion
conducting membrane, electrodes and a PEM fuel cell. Preparation
and test of reformer catalyst and methanol reformer. Integration
and operation of fuel cells and reformer. Operation of
electrolyzer. Spectroscopic investigations (IR and XRD).
Construction of laboratory furnace, measurement of temperature,
electrochemical techniques (e.g. cyclic voltammetry and Tafel plot)
and glove box work. 
",None,"
Qingfeng Li,
Jens Oluf Jensen"
,,,,,,,,,,,,
47303 , Applied Inorganic Chemistry,English , 5 ECTS , 2016/2017 ,F2A (Mon 13-17),MSc,DTU,"
To extend the knowledge of the nature of inorganic chemical
materials with a view to practical applications. 
","Illustrate extraction and purification of metals Describe the production of ammonia, ammonium nitrate, urea and
other components of nitrogen-containing fertilizers Illustrate the production of sulphuric acid and products made
from sulphuric acid, such as gypsum and superphosphate Outline the development of chemicals on the basis of mineral
salts including chlorine and sodium hydroxide (chloralkali
electrolyses), soda and potassium salts for fertilizers Describe the production of construction materials including
lime, mortar cement, glass, ceramics and silicate products Describe the production and the mode of operation of electrical
energy sources, primary and secondary batteries, accumulators and
fuel cells including the catalysts used Describe the production of pure water including ion
exchanges Illustrate treatment of chemical waste Describe the production and the properties of semiconductors
for electronic equipment Explain the chemical technology behind solar cells, displays
and optical fibres","
Metal extraction and refining. Manufacture of artificial
fertilizers including ammonia, ammonium nitrate, urea, etc.
Manufacture of sulphuric acid for superphosphate production.
Manufacture of potassium salts, etc. Halogen and chloralkali
industries including production of sodium hydroxide and chlorine.
Construction materials including quicklime, cement and gypsum.
Primary and secondary energy sources; manufacture of electrical
batteries for various uses, accumulators and fuel cells; ceramics
and silicate products. Inorganic solid state chemistry, including
the production and properties of catalysts; water; inorganic ion
exchangers; chemical waste treatment; glass; photochemical
processes. Semiconductor technology, solar cells, light fibres and
displays. 
",None,"
Niels J. Bjerrum"
,,,,,,,,,,,,
47304 , Ceramic Science and Engineering,English , 10 ECTS , 2016/2017 ,"F2 (Mon 13-17, Thurs 8-12)",MSc,DTU,"
To give the students an overview of traditional and advanced
ceramic materials, their properties, production methods and
characterization. 
","Explain the crystal structure of ceramic materials Find and analyze the phase diagrams of ceramic materials Explain the properties of ceramic materials (e.g. thermal,
mechanical and piezoelectric properties) Select a ceramic material for an industrial application Explain different methods for processing, forming and sintering
of ceramics Select and analyze ceramic processing methods and design a
fabrication process for producing a ceramic engineering
component Use and analyze scanning electron microscopy (SEM),
differential thermal analysis (DTA) and differential scanning
calorimetry (DSC) in R&D of new ceramic materials Use the sol-gel technique to produce the ceramic
nanopowders","
Properties of ceramic materials: physical, thermal, mechanical,
electric, magnetic, chemical. Phase diagrams (binary and ternary),
crystal structures.

Treatment of ceramic powders and glass production. Shaping of
ceramics: pressing, casting, plastic forming. Drying and sintering
of ceramic bodies, glass production.

Characterization of ceramics: X-ray diffraction, differential
thermal analysis, thermal expansion (dilatometer), particle size
and particle size distribution, measurement of strength, toughness
and hardness, surface area (BET), porosimetry, optic microscopy,
electron microscopy, Raman spectroscopy.

Toughening of ceramics. Design of ceramics. 
","42110,26027,26000,26026","
Irina Petrushina,
Andreas Kaiser"
,,,,,,,,,,,,
47305 , Electrochemistry,English , 5 ECTS , 2016/2017 ,F3A (Tues 8-12),MSc,DTU,"
To give the students knowledge of advanced electrochemistry with
emphasis on modern electrochemical techniques. 
","Explain the nature of the electrochemical terms and
concepts Understand the nature of electrochemical reactions Understand the kinetics of electrochemical reactions Plan and perform electrochemical experiments Design an electrochemical cell Perform cyclic voltammetry measurements and explain the
mechanism and kinetics of the studied electrochemical reaction from
the experimental data Use the modern electrochemical techniques (chronoamperometry,
chronopotentiometry, pulse voltammetry, square-wave voltammetry),
as well as treat and analyze the experimental data Perform an electrochemical impedance experiment and obtain the
equivalent electric circuit for the studied electrochemical
reaction Critically assess achieved experimental data, including sources
of error and uncertainties","
The course helps the student to understand the nature of the
electrochemical reactions and the peculiarities of electrochemical
kinetics. The course also gives knowledge of modern electrochemical
instrumental methods: steady state voltammetry, chronoamperometry,
chronopotentiometry, rotating disk electrode voltammetry, cyclic
voltammetry, microelectrode voltammetry, impedance spectroscopy,
pulse and square-wave voltammetry. This knowledge includes
mathematical description of the mentioned techniques with an
explanation of how to use them to solve different problems of the
electrochemical kinetics. The course includes practical exercises
that illustrate some of the electrochemical techniques, and it
gives a survey of electrochemical instrumentation. 
","28220,26271,26233,26220,26222,26225","
Irina Petrushina"
,,,,,,,,,,,,
47309 , Materials for Hydrogen Production and Storage,English , 5 ECTS , 2016/2017 ,January,MSc,DTU,"
Hydrogen is one of the candidates to replace oil as a future energy
carrier. Through lectures, group work and experimental techniques
used in the research on hydrogen production, storage and conversion
into energy, the students will learn about aspects of the life
cycle of hydrogen:

1) Materials for electrolysis and photocatalytic production of
hydrogen from water

2) Reversible ab- and desorption of hydrogen from solid materials
for storage and distribution

After the course, the students should be able to identify potential
show stoppers and materials challenges that currently limit the
commercial use of hydrogen as an energy carrier. They will also
obtain a hands-on understanding of underlying physical processes
and materials requirements. 
","Describe the environmental advantages and disadvantages of
using hydrogen as an energy carrier Account for the major technological challenges in connection
with commercial use of hydrogen as an energy carrier Describe the principles of hydrogen production from
electrolysis Explain the role of the semiconductor band gap in
photocatalytic hydrogen production Calculate the enthalpy of formation and entropy of a metal
hydride from the correlation between temperature and plateau
pressure Characterize a crystal structure using X-ray diffraction Determine the equilibrium pressure as a function of temperature
for a metal hydride Relate the commercial viability of a low-temperature fuel cell
to the performance of its catalysts","
Potential gains, materials and technical challenges in using
hydrogen as an energy carrier. Current and future energy resources.
Energy efficiency. Materials for hydrogen storage. Phase diagrams.
Ab-/desorption kinetics. X-ray diffraction. Semiconductor
electro-/​photoelectrochemistry.

The course consists of two topics (see general course objectives
above), each of which consists of two days with lectures and group
exercises, five days with experimental activities and one day for
writing of the report. 
","10033,10333,10303,10030,47301","
Didier Blanchard,
Ifan Stephens"
,,,,,,,,,,,,
47310 , Battery Materials and Chemistries: from Fundamental Mechanisms to Battery Cells,English , 5 ECTS , 2016/2017 ,E5B (Wed 13-17),MSc,DTU,"
Through a series of lectures, group work, computational and
laboratory exercises, the students will learn about the basic
principles of batteries, and be able to describe the fundamental
mechanisms and components of batteries. They will also be able to
model, analyze and interpret electrochemical properties and
degradation mechanisms for different battery chemistries subject to
various operating conditions, and to understand critical issues in
the selection of materials and components for cells. Furthermore,
the students will know the advantages/disadvantages of batteries
compared with other energy storage technologies and will be
acquainted with various designs and their advantages/disadvantages
as well as application areas. 
","Describe the fundamentals of a battery cell Explain the similarities and differences between types of
batteries and battery chemistries Explain the mechanisms and functionalities of the individual
components of batteries Apply the critical parameters in the selection of
materials Assess the critical parameters in the selection of operating
conditions Analyze data describing the electrochemical performance of
batteries Calculate the energy efficiency Explain possible degradation mechanisms leading to decrease in
cell performance Describe advantages and disadvantages of different types of
batteries in comparison with other energy storage technologies Apply computational modelling to describe battery materials and
mechanisms","
The principles of various battery types and chemistries. Methods
for a theoretical description of the fundamental properties of
battery cells and battery materials. Materials demands and
limitations of the individual components, i.e. electrolyte, anode
and cathode materials. Challenges for the assembled cells related
to materials and interfaces will be discussed in a chemical and
structural context. Characterization and evaluation of cell
properties by, e.g., electrochemical impedance spectroscopy and
cyclic voltammetry. Structural and microstructural description of
battery materials. Description/studies of degradation mechanisms
for state-of-the-art Li-ion and Li-air batteries. Discussions of
future (beyond lithium-ion) batteries. 
","47305,10302,26000","
Poul Norby,
Tejs Vegge,
Johan Hjelm"
,,,,,,,,,,,,
47311 , Analytical Imaging of Energy Materials by Electron Micrsocopy,English , 5 ECTS , 2016/2017 ,E5A (Wed 8-12),MSc,DTU,"
In renewable energy materials research and development, functional
materials have played and will continue to play an essential role
in the creation of tomorrow's energy devices. By their crystal
structure and elemental composition, functional materials e.g.
allow to convert sunlight to electricity, or to store electrical
energy as chemical energy in the form of hydrogen or other types of
fuels. The complicated physical and chemical processes are often
dependent on the local nano- and microstructure of the functional
components within energy devices. It is therefore essential to be
able to analyze these materials with advanced imaging techniques
that both give high resolution quantitative and qualitative data,
e.g. scanning electron microscopy (SEM), transmission electron
microscopy (TEM), energy dispersive X-ray spectroscopy (EDS) and
focused ion beam microscopy (FIB). The aim of the course is that
students will be able to understand and judge the usefulness of a
wide variety of SEM and TEM analysis techniques that are used by
industry and in research, and to be able to suggest suitable
imaging techniques to solve specific problems related to the
properties of functional energy materials. 
","Interpret electron interactions with materials relevant to
scanning electron microscopy (SEM) and transmission electron
microscopy (TEM) operating conditions for example by using
simulation software Prepare specimens for electron microscopy analysis and justify
optimum sample preparation and microscopy techniques Describe interactions that electrons experience in relation to
SEM and TEM components incl. detectors Qualitatively compare, contrast and justify the information
available from the range of available electron detectors and their
limitations Perform quantitative elemental analysis of EDS data using
analysis software Determine crystallographic parameters from electron
diffraction Apply quantitative measurement methods and extract
statistically valid microstructural parameters from electron
microscopy images Predict and implement optimum microscope operating conditions /
microscopy technique based on microscope and detector theory by
operating at least one type of SEM or TEM Account for error sources associated with the choice of sample
preparation and SEM/TEM analysis techniques Plan and execute an energy material electron microscopy study
integrating the results of various techniques to conclude, report
and communicate results Compare and contrast advantages/disadvantages of 2D versus 3D
and ex-situ versus in-situ electron microscopy investigations Perform a literature search to select a relevant scientific
article on the use of electron microscopy in the analysis of an
energy material and analyse, criticize and present the main
findings","
The course is based on a combination of theoretical lectures,
numerical and image-based exercises and case studies performed in
small project groups. The lectures provide the physical mechanisms
describing the interactions between electrons and solid state
energy materials and the foundations of microscopy-based analysis
techniques. The exercises will provide understanding of the
practised analysis techniques, and the case studies are based on
actual problems encountered in renewable energy materials. The
course provides students with the skills to analyze, explain and
conclude, with respect to state-of-the-art analysis techniques, and
with methodologies to solve specific problems within energy
materials. Reports based on the case studies will provide students
with feedback in the form of continuous assessment throughout the
course. 
",,"
Jacob R. Bowen,
Søren Bredmose Simonsen"
,,,,,,,,,,,,
47312 , Experimental Electrochemistry,English , 5 ECTS , 2016/2017 ,E3A (Tues 8-12),MSc,DTU,"
Theoretical and practical understanding of relevant basic and
advanced instrumental electrochemical methods;

Ability to describe and interpret different sets of electrochemical
data;

Ability to describe and interpret experimental limitations;

Knowledge of how the different electrochemical methods can be used
to solve a specific problem or advance an investigation in various
fields of application. 
","Describe the purpose and relevance of the different
experimental electrochemical methods Describe the experimental details and equipment(s)/setup(s)
used Describe “good practices” and experimental limitations Explain the fundamentals of the methods and their respective
data analysis Analyze the obtained experimental data Assess the quality of the experimental results Critically compare and select a particular method to a given
problem or need Plan an electrochemical experiment based on the selected
method Write a journal-article-type-report about the work
performed Evaluate scientific reporting in the form of critical
reviews Evaluate the laboratory safety and take necessary precautions
in the planning of experiments","
• Introduction to experimental electrochemistry

• Fundamentals of electrochemistry

• Direct current methods, e.g. steady-state and cyclic voltammetry,
chronoamperometry, chronopotentiometry, rotating disc electrode

• Pulse methods, e.g. pulse voltammetry, differential pulse
voltammetry, square-wave voltammetry

• Alternating current methods, e.g. electrochemical impedance
spectroscopy, AC voltammetry 
",47305,"
Lars Nilausen Cleemann"
,,,,,,,,,,,,
47313 , Solid,English , 5 ECTS , 2016/2017 ,June,MSc,DTU,"
To describe and understand the use of solid state electrochemical
devices for a cleaner environment, achieved through lectures and
practical exercises. To give an understanding of how the chemical
properties of defect solids can be used to design solid-state
electrochemical devices, for example sensors, batteries and fuel
cells. 
","Explain and apply the defect chemistry of solids to design
solid electrochemical devices Explain the principles behind and the construction of a solid
oxide fuel cell Explain the use of a solid oxide cell to electrolysis of water
and carbon dioxide Use cyclic voltammetry to analyze and evaluate solid
electrochemical systems Use electrochemical impedance spectroscopy for the analysis and
evaluation of solid electrochemical systems Explain the principles behind and the use of a solid
electrochemical cell for cleaning flue gases Apply the principles of electron microscopy for the analysis
and evaluation of solid electrochemical systems Apply the principles behind the X-ray diffraction for analysis
and evaluation of ceramic powders Explain the use of a solid oxide fuel cell for direct
conversion of carbon-based materials for the production of
electricity Explain the principles of lithium-based batteries","
Defect chemistry. Solid oxide cells. Direct carbon fuel cell.
Microscopy. Electrochemical impedance spectroscopy. Cyclic
voltammetry. X-ray diffraction. Batteries. 
",26222,"
Kent Kammer Hansen"
,,,,,,,,,,,,
47314 , Thermal Analysis ,English , 5 ECTS , 2016/2017 ,June,MSc,DTU,"
The course will introduce techniques of thermal analysis, and the
participants will be able to apply thermal analysis to measure
materials properties and progress of chemical reactions. The course
covers principles of instrument calibration as well as general
aspects for selection of crucible materials, atmosphere composition
and sample stages.

The course content will be very useful for further work within the
field of materials science where characterization of materials and
processes are relevant; all the way from synthesis through
corrosion and degradation. 
","Explain which properties can be measured by each thermal
analysis (TA) technique Choose the proper TA-technique to evaluate and assess selected
materials properties at temperatures between -150°C and 1600°C Choose and use the proper TA-technique to evaluate and assess
chemical reactions and their kinetic properties at temperatures
between -150°C and 1600°C Design and undertake experiments and validate results for a
minimum of two TA-methods. Preferably use own materials from
research, where results in principle are not known beforehand Explain and use calibration routines and be able to select
sample stages, sample containers, etc. Use group-based work effectively, e.g. to distribute the
workload and better manage the work Present and discuss acquired results of the course
exercises Extract information from MSDS and other literature sources to
assess the reactivity and stability of materials","
General introduction to TA-techniques and concepts.

Practical experiments with the chosen analysis to measure materials
properties.

Practical experiments on reactivity and reaction kinetics.

The problem/subject for the final work may be chosen freely and
should be reported, including choice of crucible, sample stage,
method and analysis results as well as calibration if needed.

Report results from both assignments and the final project work.

Necessary safety routines are included. 
","41657,26231","
Karsten Agersted"
,,,,,,,,,,,,
47316 , Advanced Computational Tools for Energy Materials,English , 5 ECTS , 2016/2017 ,E5A (Wed 8-12),MSc,DTU,"
To give the student insight into the computational tools currently
used to study basic processes in materials related to energy
conversion (batteries, nanocatalysts, fuel cells, photovoltaics,
etc.), with the goal of designing new and more efficient processes
in these materials. 
","Describe the basics of DFT and the quantities that can be
obtained through a DFT calculation Describe the different possible mechanisms of charge transport
in solids Apply the transition state theory and the nudged elastic band
method to study rates of chemical processes Describe scaling relationships and volcano plots in
heterogeneous catalysis Perform simple Metropolis and kinetic Montecarlo
simulations Describe the physics behind dye synthesized solar cells Apply genetic algorithms to search for new materials with
improved properties Analyze problems in materials for energy applications, and
select and apply the appropriate models Interpret computer scripts for electronic structure
calculations Perform simulations on systems related to energy conversion
processes using different codes Write a report in English on the basis of the results obtained
in the project and explain its details orally","
Basics of density functional theory (DFT). Transition state theory
to study adsorption and surface diffusion. Scaling relations in
catalysis and volcano plots. Computational electrochemistry.
Genetic algorithms for computational screening of materials. Band
alignments in solar cells. Electron transport in batteries:
polarons and electron tunneling. Kinetic Monte Carlo to study ionic
transport. 
","10034,26222,10303,26201","
Juan Maria García Lastra,
Heine Anton Hansen"
,,,,,,,,,,,,
