COURSE NUMBER,COURSE NAME,LANGUAGE OF INSTRUCTION,CREDIT LOAD,YEAR,SCHEDULE,COURSE TYPE,DEPARTMENT,GENERAL COURSE OBJECTIVES,LEARNING OBJECTIVES,CONTENT,RECOMMENDED PREREQUISITES,COURSE RESPONSIBLE
23561 , Advanced methods for quality analysis of food and bio,Danish , 5 ECTS , 2016/2017 ,January,BSc,National Food Institute,"
To attain state-of the art knowledge on some instrumental, sensory,
biochemical, microbiological and mathematical methods useful in the
study of quality-related properties of food and other bio-products.

","Describe the mechanisms of formation of volatile oxidation
products during storage of specific food or other bio-products Discuss quantitative and qualitative aspects of collection of
volatile compounds by dynamic head-space technique Identify a couple of volatile compounds by gas chromatography
with mass spectrometric detection Explain the principle behind two-dimensional gel
electrophoresis (2DE) of proteins and point-out the critical
aspects of the method Describe the structure of 2DE data and propose a relevant way
of analysing data State the principle behind low-field nucelar magnetic resonance
(NMR) and what types of information the signal contain Explain the principles of a mathematical treatment of low-field
NMR data Expound the special features in near-infrared (NIR)
spectrometry and make an educated choice of data analysis Describe the main groups of sensory analyses and design a
sensory profiling study Describe the principle and use of multispectral image
analysis","
The course is based on current research results and implementation
of advanced methods in muscle-based food research. Some of the
methods are also directed to other food types like omega-3 oils,
milk, dressing and fitnessbar. The topics taught are within the
fields of head-space analysis, gas chromatography/mass
spectrometry, two-dimensional gel electrophoresis and other
protein-related methods, low-field NMR, near-infrared spectrometry,
multispectral image analysis and sensory science. 
",,"
Bo Munk Jørgensen"
,,,,,,,,,,,,
23564 , Integrated product development in the food industry,English , 10 ECTS , 2016/2017 ,E5 (Wed 8-17),MSc,National Food Institute,"
To give the students competences in the part of food product
development, which is concerned with food product design and the
food product technology associated with that. This would typically
be the tasks that product developers would be assigned in a product
development laboratory in the food industry. 
","Analyse a complex task assignment and plan its completion and
deliverables. Develop and design a plausible product concept, including
relevant alternatives. Describe advantages and disadvantages of relevant packaging
materials and packaging design in relation to transport, storage
and sales. Investigate and acquire relevant business and market
information, including the end-user (consumer). Calculate variable and fixed costs associated with a new
product. Identify important technological challenges and suggest
solutions. Identify suitable analytical procedures for production
control. Demonstrate and report overview and in-depth solutions to the
task assignment with respect to both technological and commercial
challenges.","
The course is carried out as group work in teams of 3 students
(optional 2 or 4 students). Each team will work on a specific
development task, partly of own choice. The overall conditions for
the product are defined from the beginning by the team of teachers,
representing the different competences in an industry (marketing,
product development laboratory, and production). The task is to
develop a food product concept with variations. The course will
focus on market analyses, formulation of recipes, technological
challenges during development and production, and selection of
suitable packaging and distribution technology. The production
process must be drafted, and cost calculations are demanded. 
",,"
Bo Munk Jørgensen,
Egon Bech Hansen"
,,,,,,,,,,,,
23661 , A Taste of Toxicology! Chemicals and Health,English , 5 ECTS , 2016/2017 ,January,MSc,National Food Institute,"
Toxicology is the science of poisons. The course aims to give the
students an understanding of how chemicals in our food, consumer
products and environment can affect our health and how this is
investigated. 
","Explain fundamental aspects of toxicology Describe specific toxicological effects Analyse design of toxicological experiments Explain the principles for use of alternative approaches to
animal experiments, including cellular and computer-based
methods Apply knowledge of cancer development in toxicological
evaluations Apply knowledge of reproductive toxicity in toxicological
evaluations Explain the principles of chemical risk assessment Synthesize a brief report and a presentation that demonstrates
the above learning objectives about a toxicological
problem","
Our food, consumer products and environment contain chemical
compounds to a large extent. Is it safe that we are exposed to all
these chemicals, for example, in food supplements, grilled food or
cosmetics? How can chemicals harm our health and how do we study
these effects? Learn more about these and similar questions in this
course. The course will review the types of tests used: cell
experiments, animal studies, epidemiological studies and computer
models based on chemical structures. For example, it will be
discussed how we investigate whether a chemical substance may harm
our ability to have healthy children or develop cancer. The course
will include interactive lectures and presentations by students.
The course will also include project work on a specific
toxicological problem. Each group writes and presents a report. 
",None,"
Anoop Kumar Sharma"
,,,,,,,,,,,,
23711 , Food Technology,English , 15 ECTS , 2016/2017 ,"E4 (Tues 13-17, Fri 8-12) and E5 (Wed 8-17)","BSc,,MSc",National Food Institute,"
The course shall give the students a substantial theoretical
knowledge of food science technology with

emphasis on theories and basic calculating tools within process and
product technology. Furthermore, the

course shall make the students acquainted with essential problems
within industrial food production.

After completing this course (and the Food Production Course
27710), the students should be able to

make the calculations necessary for process evaluations
(preservation, shelf-life, energy consumption,

dimensioning of equipment and similarly). The students should be
able to evaluate different types of unit

operations in connection with treatment of different types of
foods. The practical exercises should enable

the students to use and understand important equipment,
instruments, methods, processes and theories

that are essential elements within industrial food production. 
","Calculate heat transfer under stationary and non-stationary
conditions in simplified situations. Apply reaction and inactivation kinetics for calculating the
effect of thermal processes on product quality, safety and shelf
life, both batch-wise and continuous heat treatment of liquid,
newtonian and non-newtonian products. Calculate mass balances and process rates in different
separation processes, including membrane separation. Calculate energy and mass transfer and process rates in drying,
freezing and curing. Describe the most important process variables for net process
time concerning freezing, cooling, drying, separation and heating
processes. Design simple process lines. Describe the sensitivity of the most important process
variables where the process time can be validated according to
process time for freezing, cooling, drying, separation and
heating Analyse simple process lines with respect to identification of
and solutions to possible problems of product safety and product
quality. Plan and execute quantitative experiments in process
technology, including validation and statistical data
treatment. Write, in English, an exhaustive technical-scientific report in
compliance with usual formal requirements to format and
content.","
The course will among other things deal with the following
subjects: Non-stationary heat transfer,

continuous and batch heat processing, membrane processes, salting,

freezing and drying. Microbial ecology in foods, food preservation,
and product quality. The topics are illustrated by application of
examples in form of exercises and casestudies. The experimental
part covers practical exercises in process technology with relevant
theory.

Remarks:

NB! Evaluation of exam assignments. The technical group report
(counts 1/3) consisting of theoretical and experimental work. The
individual written exam (counts 2/3) has main focus on calculations
and validation. The grade obtained in the group report is
transferred to later examinations in the course if any. The
language of the exam and report is English. 
",,"
Bo Munk Jørgensen,
Brais Martinez Lopez"
,,,,,,,,,,,,
23732 , Human Nutrition,Danish , 5 ECTS , 2016/2017 ,E3A (Tues 8-12),BSc,National Food Institute,"
To provide the student with a basic knowledge in human nutrition
based on a biochemical and physiologiical basis and relate
nutrition to health. 
","Describe the structure of the digestive system and functions of
each organ. Define the 6 classes of nutrients. Describe the digestion, absorption, systemic transport, storage
and elimination of each class of nutrients. Evaluate the body’s energy balance under different conditions
and solve simple problems in relation to energy intake and
expenditure. Assess the effect of deficiency of selected nutrients within
each class of nutrients. Relate the different nutrients to deficiency symptoms and
chronic diseases. Assess nutrition related problems and suggest relations between
symptoms and life style. Relate a specific physiologic condition (e.g. pregnancy,
lactation, childhood, infancy, adulthood, ageing) with particular
nutritional needs.","
Digestion and absorption of the individual components of the diet
in the gastro-intestinal tract. Metabolism and utilization of
carbohydrates, proteins, and lipids, including essential nutrients,
dietary fibre and the biological value of proteins. Energy
metabolism, including issues related to overweight and obesity and
methods to estimate energy expenditure. Fluids, electrolytes and
acid-base equilibrium. Nutrient deficiencies, including deficiency
of proteins, energy, minerals, and vitamins. Nutrient requirements
during the lifecycle (pregnancy, lactation, infancy, childhood,
adolescence, adulthood, adulthood and old age). Nutrition and
lifestyle diseases including coronary heart diseases, diabetes type
2, and cancer. Food allergy. Diseases related to nutrition in the
developing countries versus the industrialized world. 
",27022,"
Inge Tetens,Lars I Hellgren"
,,,,,,,,,,,,
23733 , Dietary assessment methods,Danish , 5 ECTS , 2016/2017 ,August,"BSc,,MSc",National Food Institute,"
To provide the student with a basic knowledge about dietay intake
assessment methodologies to allow s/he to select the most suited
method in any situation and to calculate and evaluate the dietary
intake data. 
","Know the different dietary assessment methods Assess the strenghts and weakneses inherent in the individual
dietary assessment methods Know the measurement errors in general, incl. those related to
underreporting Know biomarkers for energy and nutrient intake Select the right dietary assessment methods in different
situations Know the different tools available in relation to the various
methodologies Know the most frequent errors in relation to the various
methodologies Evaluate how the data from obtained from the various dietary
assessment methods can be used for Evaluate data from different dietary assessment methodologies
in relation to requirements and recommendations","
Dietary assessment methodologies at national and household levels

Dietary assessment methodologies at individual level

Aspects regarding dietary assessment methodologies, including
prospective and retrospective measurements, weighted and estimated,
and habitual and actual

Dietary assessment methodologies, advantages and disadvantages

Toolboxes in relation to dietary assessment, incl food composition
database, recipe collections, portion sizes, paper versus web-based
methods, app-based methods, etc

Sources of errors and reproducibility

Validation and calibration of dietary assessment methodologies,
incl. biomarkers

Evaluation of different dietary assessment methodologies for
various purposes

Evaluation of dietary assessment results in relation to under- and
over-reporting

Evaluation of results of dietary assessment in relation to
requirements and official recommendations 
",None,"
Inge Tetens"
,,,,,,,,,,,,
23734 , Dietary assessment methods,Danish , 2.5 ECTS , 2016/2017 ,Outside schedule structure,"BSc,,MSc",National Food Institute,"
To provide the student a possibility to apply and extend the
theoretical knowledge from course 23733 to solve actual problems in
a group-based exercise. 
","Apply different dietary assessment methods Assess the strenghts and weakneses inherent in the individual
dietary assessment methods Assess measurement errors in general, incl. those related to
underreporting Apply biomarkers for energy and nutrient intake Select the right dietary assessment methods in different
situations Apply different tools available in relation to the various
methodologies Calculate most frequent errors in relation to the various
methodologies Evaluate how the data from obtained from the various dietary
assessment methods can be used for Evaluate data from different dietary assessment methodologies
in relation to requirements and recommendations","
To be decided individually between student and advisor 
",None,"
Inge Tetens"
,,,,,,,,,,,,
23832 ," Lipid Biochemistry, Technology, Applications and Analysis",English , 4 ECTS , 2016/2017 ,Outside schedule structure,Ph.D.,National Food Institute,"
The objective of the course is to introduce the participants to
practical applications in lipid biochemistry, lipid nutrition,
biotechnology and advanced lipid analytical methods through
lectures and laboratory experiments. The following areas will be
covered: modification of lipids and lipid processing, lipid
metabolism, lipid oxidation and antioxidants, and different lipid
analytical methods including methods for analysis of lipophilic
contaminants 
","Perform experiments in one of the four themes (1) lipid
metabolism, 2) lipid modification, 3) lipid applications and
oxidation and 4) lipid contaminants) Understand the reading materials for an experiment and perform
the experiment in accordance herewith Evaluate and interprete the experimental findings Present the experimental findings in an understandable way Describe the enzymatic process of the production of structured
lipids Describe how fatty acids are incorporated into different
tissues Select the critical techniques for the analysis of lipids Describe the challenges related to applications of omega-3
fatty acids in foods and how the challenges can be overcome Describe the analysis of lipophilic contaminants Understand the process of risk assessment of novel fats Organize collaboration in a heterogenous group","
The course will include 2 ½ days seminar covering advanced lipid
biochemistry, technology, applications and analysis as well as an
introduction to lipid related chemical contaminants and compounds
introduced during processing. Principles for risk-assessment and
setting of maximum residue-levels will also be introduced. The
presentations will be given by the course organisers as well as
invited guest speakers from universities and industry. The course
will also include experimental work in 4 modules on 1) lipid
metabolism, 2) lipid modification, 3) lipid applications and
oxidation and 4) lipid contaminants. For the lipid modification
module, enzymatic processing of structured lipids in enzyme
reactors will be conducted. For the lipid application and oxidation
module, the possibilities of using omega-3 PUFA in selected food
systems will be exemplified including evaluation of oxidative
stability. Head-space GC/MS will be conducted to evaluate the
volatiles. For the lipid metabolism exercise you will get some
hands on experience in sample preparation and an opportunity to try
data analysis of data from LC-MS analysis of the lipotoxic
intermediates ceramide and DAG in fatty livers, using LF-qTOF MS.
For the analysis of lipid contaminants, principles on extraction
(e.g. PLE) and detection (e.g. GC-MS) techniques will be
illustrated.

Each participant will be asked to select one experimental module
among the four topics mentioned above. Moreover, the participants
will have to solve a theoretical problem related to the
experimental module. The solution to the problem will be presented
to the rest of the participants on the last day of the course.
Finally, the course will also include a seminar from the
participants, who will present their own PhD studies. 
",None,"
Charlotte Jacobsen,
Lars Hellgren,
Lene Duedahl-Olesen"
,,,,,,,,,,,,
23836 , Quantitative Microbiological Risk Assessment,English , 5 ECTS , 2016/2017 ,June,Ph.D.,National Food Institute,"
The course provides an introduction and “how to do it” approach to
quantitative microbiological risk assessment in the context of food
safety. The risk analysis process consists of the elements: risk
assessment, risk management and risk communication. The student
will be presented for the whole concept, but major efforts will be
put on risk assessment.

 The aim is to introduce the students to the concept of
quantitative microbiological risk assessment as applied in national
and international food safety. The students will gain detailed
insight in structured risk assessment and will be able to
understand the use of quantitative risk assessment, as well as
interpret its results.

 After the course, the students will have knowledge about how to
read, interpret and evaluate risk assessment papers and reports.
They will also be able to participate in risk assessment work and
apply risk assessment modeling techniques in their own research. 
","Describe the meaning of the word “risk” in the context of risk
analysis Identify ""hazards"" and “risks” in food production
chains Outline elements in a risk analysis: risk assessment, risk
communication and risk management Discuss the content of the elements in risk assessment and
associate these elements with each other Construct risk pathways Differentiate between qualitative and quantitative mathematical
risk assessment Compute the risk using a quantitative mathematical model -
using both a deterministic and a stochastic approach Explain the difference between deterministic and stochastic
models, and why they are used Explain the difference between variability and uncertainty, and
why that is relevant and understand why the variability in a
stochastic model dissolves in the mean population risk estimate,
and the uncertainty does not Apply the separation of uncertainty and variability in a
stochastic risk assessment model and explain why it is
relevant. Apply uncertainty assessment by scenario analysis in stochastic
models Interpret and criticise the output from risk
assessment","
The students will select a case (e.g. Listeria in smoked salmon) on
which they will construct both a deterministic and a stochastic
quantitative risk assessment model and identify the required data.
Models will be made in Excel with the add on @Risk. Some predefined
case study description are available, but (PhD-) students are
encouraged to propose their own case study and to discuss its
suitability with the teachers. Students can work on the case
studies individually or in pairs. By the ”hands on” process, the
student will gain an understanding of the different elements in a
risk assessment. 
",None,"
Maarten Nauta"
,,,,,,,,,,,,
23837 , Introduction to scientific methodologies and philosophies used in food research,English , 2.5 ECTS , 2016/2017 ,Spring,Ph.D.,National Food Institute,"
The aim of the course is to give the PhD-students a holistic
overview of food science in general, and especially to the research
disciplines at DTU FOOD, including biotechnology, nutrition, food
quality, food safety, food technology and environment & health,
and how research is conducted in the different disciplines. The
participants will also be presented with some of the general
challenges they may face during their PhD study. 
","Explain the different research disciplines related to food
science Briefly outline the different research methodologies used in
the different research disciplines Discuss their own research hypothesis in the context of the
different disciplines in food science Outline the definitions and general working flow of natural
science: hypothesis generation – data collection – data analysis -
conclusion Discuss who is deciding what needs to be researched in relation
to food, and how Discuss who is using the output from research performed at
DTU-FOOD, and how Be familiar with the Danish Code of Conduct for research
integrity Outline different career opportunities for a researcher Outline the expectations DTU has on enrolled PhD students Knowledge about different types of problems in a PhD study Discuss the relationship between research and
innovation","
Building up a general knowledge within the food sciences: The
course will include lectures representing each division within the
institute, where the different disciplines are introduced by
leading researchers. Participants are subsequently encouraged to
relate their own research projects and hypotheses into a broader
perspective within the food sciences. The output from this exercise
will be presented individually during a poster session.

Basic concepts of research in food science: We will discuss how
scientific hypotheses are formulated, how research questions are
addressed, how to describe methodology, putting your research into
a larger context and who the stakeholders are. The participants
will subsequently discuss their own research in this context,
describe and discuss what they want to measure in their research,
and which methods they will use. The participants will also be
introduced to different driving forces for research and types of
research projects with focus on researchers (assessors) and the
decision makers (managers). Finally the Danish Code of Conduct for
Research Integrity will be presented and discussed.

Daily life and challenges during a PhD project at the institute:
The participants will be introduced to the administration of a PhD
project, and what is expected of them in accordance to this. Newly
educated PhD fellows will tell “their story” including ups and
downs during the project and how the transition has been to their
new jobs. Different possibilities to seek help during the PhD study
will be outlined. Discussions on expectations from supervisors,
institute and from themselves. Discussions on what they can expect
from the supervisor and institute.

To pass the course, the participants must hand-in a report
following a predesigned template, where they discuss their own
project including research hypothesis in different contexts. 
",None,"
Martin Iain Bahl,
Christine Nellemann"
,,,,,,,,,,,,
23901 , Basic Food analysis,Danish , 12.5 ECTS , 2016/2017 ,"E5A (Wed 8-12) ,  E5B (Wed 13-17) and January",BEng,National Food Institute,"The students should measure and understand production processes. Based on this knowledge, students should be able to select methods for measuring the most important Parameters The selected food and based on results obtained relate to these processes impact on food safety and food quality. Students also learn to judge and present the results achieved.","A student who has met the objectives of the course will be able to:
Get on in laboratories
Keep a laboratory journal for use for report writing
Describe and analyze an issue involving measurements / analysis
Discuss and validate the data obtained, so that they can lie to grunlag for solutions
Selecting analytical methods for measuring the desired parameters
Understand the analytical principles of the measurements made
Report its results (written and oral) and interpreters as well as methods used results to target groups with different skill levels
Cooperation in small groups to solve project-based assignments
Understand and interpret chemical, physical and microbiological processes that underlie results","Taught in the first semester of diploma in Food Analysis and is built based on the principles CDIO (Conceive (Understand), Design, Implement (Introduce) and Operate (Perform)). In this course, students must therefore design and understand analysis processes related to food production. Based on a combination of group work in small groups with professional supportive classroom and any company visits, students must implement processes in an engineering way, as well as designing measurement systems that can shed light on the physical / chemical processes that occur during the production of the selected food. In addition, students must be able to choose the measurement methods necessary to obtain knowledge about the processes and report results in both oral and written form. It is envisaged that the students must produce wheat bread and beer, with the first production will form the basis for an evaluation and feedback to the student, then under greater autonomy to plan and carry out the subsequent analytical examination of the production of beer.",None,"
Lars Bogø Jensen,
Flemming Jessen"
,,,,,,,,,,,,
