COURSE NUMBER,COURSE NAME,LANGUAGE OF INSTRUCTION,CREDIT LOAD,YEAR,SCHEDULE,COURSE TYPE,DEPARTMENT,GENERAL COURSE OBJECTIVES,LEARNING OBJECTIVES,CONTENT,RECOMMENDED PREREQUISITES,COURSE RESPONSIBLE
,,,,,,,,,,,,
23101 , Introduction to food production chains,English , 10 ECTS , 2016/2017 ,"E1 (Mon 8-12, Thurs 13-17)",MSc,National Food Institute,"
To enable the students to analyse and understand food production
chains and the interdependence of the parts of these. The focus is
on understanding the interactions between production, quality, raw
material properties and rheology as well as mass and energy
balance, process design, production planning and innovation aspects
on a basic level. 
","Analyse a food production chain and identify safety, quality
and planning issues, and the interactions between these and process
operations. Apply mass and energy balance related to the unit
operations. Apply process analysis to overview a production chain from raw
material to consumer. Define innovation and explain different innovation models. Describe the elements of an innovation process in a food
company. Describe the major parameters that influence the quality of
food. Evaluate where in the value chain optimisation in relation to
quality can be addressed. Validate solutions to practical problems using quantitative and
qualitative methods. Identify raw material properties of importance to the final
product. Make a concise oral presentation of a technical matter. Give constructive feedback to contribution from other course
participants. Write (as team-work) a technical report suitable for decision
making in a company.","
The course aims to teach the student how to understand and analyse
the basic interactions along food production chains. The
interactions concern quality and production planning all of which
must be considered as integral in order to make proper production
planning and design. Problems will be analysed and solutions
suggested by teams. Team work is central in the course, and the
teams will study cases that exemplify a wide range of common issues
in various steps associated to food production. Furthermore,
separate elements are included such as process technology,
bottlenecks and other challenges for the food industry as well as
innovation and presentation techniques. If possible, excursions
will be arranged to relevant actors in the food sector. Guest
lectures are an important part of the course. 
","23511,23711","
Susan Løvstad Holdt,
Pedro Jesús García Moreno,
Bo Munk Jørgensen"
,,,,,,,,,,,,
23102 , Food Safety in Production Chains,English , 10 ECTS , 2016/2017 ,"F2 (Mon 13-17, Thurs 8-12)",MSc,National Food Institute,"
The course will enable the student to evaluate relevant
microbiological and chemical hazards in food production chains.The
student will relate important microorganisms to their possible
roles in spoilage and diseases that can be transmitted through the
food chain to humans. Furthermore the student will calculate and
evaluate the occurrence of toxicological and chemical hazards in
foods. Through a project assignment, the student will assemble a
risk assessment and fomulate a HACCP plan, which covers the raw
materials, production methodologies and unit operations for a given
food product. 
","Describe and analyze a food production chain with regards to
potential issues of food safety and spoilage Identify relevant microbiological and chemical hazards for a
given food production Identify steps in the production chain that are critical with
regard to the hazards including current food safety
legislation Establish measures that will control the safety of the product
(apply HACCP principles) Identify and apply the key elements of chemical and
microbiological risk analysis Explain and apply the concept ADME (absorption, distribution,
metabolism and excretion) Design the risk evaluation of microbiological and chemical
hazards in the food production chain from farm to fork Assemble a concise written report and oral presentation that
covers the formulation of a risk assessment and design of a HACCP
plan for a given food product Develop competences in project based learning and group/team
work including the collective responsibility for the quality of the
final project report","
The course will provide in depth coverage of current and relevant
food safety issues with regards to microbiology, chemical hazards
and toxicology. The course will enable the students to evaluate
relevant hazards in specific food production chains, to identify
critical steps in the production, and to construct a plan to
control or mitigate these hazards. The course presents relevant
hazards in the entire food production chain from farm to fork and
includes microbiological, chemical and toxicological aspects of the
risk assessment. The various elements of risk assessment are
examined: hazard identification, exposure assessment, hazard
characterisation and risk characterisation. The student will work
through the topics through lectures, assignments, and group/project
work. 
",23101,"
Kit Granby,
Lisbeth Truelstrup Hansen"
,,,,,,,,,,,,
23151 , Aquatic Food Primary Production: Fishery and Aquaculture,English , 7.5 ECTS , 2016/2017 ,Fall,MSc,National Food Institute,"
The requirement for fish and seafood in the word is increasing.
This can either be harvest from the sea, traditionally fishery or
it can be produces trough aquaculture. These are complex systems
and productions that may interfere to each other and on to the
surrounding environment. The overall aim with the course is to give
the students the necessary basic information about fishery and
aquaculture. This should be set in overall view so the students are
able to critically evaluate the factors which are important for a
sustainable growth in the industry. 
","Describe advantages and disadvantages with the two aquatic food
primary production systems, fishery and aquaculture Determine factors for performing a sustainable fishery and a
sustainable aquaculture Analyse choice of fishing vessels and fishing gears Discuss fish welfare issues and important factors affecting
fish welfare Describe production cycles for important aquaculture
species Describe how handling of live fish affects quality after
slaughtering/harvesting Review and analyse data in a synthetic report with oral
presentation Critically analyse ""hot topics""related to aquaculture
and fisheries practices","
The students following this course will gain an overview of the
fishery and aquaculture industry in the word and more detailed in
the Nordic countries.

Within fishery topics will include overview over relevant species,
nutrient chains; fishing seasons; fishing gears function, optimal
use, affect fish quality on quality; fishing vessels; initial fish
processing, on shore or at sea; by catch/by product handling;
regulations, quotas and international agreements; structural
changes in the fish industry and sustainable fishery.

Within the aquaculture topic overview lectures will include
relevant species, anatomy and physiology, different production
systems and production cycles, water quality requirements, fish
feeding, fish breeding, fish health and diseases in aquaculture,
fish welfare, harvesting and slaughtering of fish, sustainable
aquaculture.

A project thesis should be performed where fishery and aquaculture
objects should be discussed in an overall sustainability context. 
",None,"
Charlotte Jacobsen,Odd-Ivar Lekang"
,,,,,,,,,,,,
23152 , Aquatic Food Processing and Technology,English , 7.5 ECTS , 2016/2017 ,Fall,MSc,National Food Institute,"
The objective of the course is to give the student an overview of
how processing and storage conditions influence the quality and
shelf life of aquatic food. It focuses on traditional as well as
emerging ressources. 
","Describe the muscle structure and biochemistry of fish Describe the most common processing methods for aquatic
foods Analyse how different processing technologies will influence
the quality and shelf life of aquatic foods. Discuss how storage conditions and packaging methods affect
aquatic food quality Analyse the potential of the utilisation of by-products and the
production of new ressources Describe post-mortem biochemical processes in aquatic
foods Review and analyse data about aquatic food production
processing and technology in a synthetic report with oral
presentation Critically analyse ""hot topics""related to aquatic
food production","
Students will gain an overview of how processing and storage
conditions influence the quality and shelf life of aquatic food.
The students will be given an introduction to fish muscle as a raw
material for different processing procedures. Muscle structure,
muscle biochemistry, and biochemical processes after death (rigor)
in relation to quality and processability will be reviewed. The
composition and use of by-products will also be reviewed. An
overview of different prosessing methods, both traditional and
novel, will be given. Finally packaging of fish and fish products
will be reviewed. 
",None,"
Charlotte Jacobsen,Turid Rustad"
,,,,,,,,,,,,
23153 ," Aquatic Food Supply Chain Management, Environment and Resources",English , 7.5 ECTS , 2016/2017 ,Fall,MSc,National Food Institute,"
The objective of the course is to give an introduction to the
concept sustainable development in the context of the aquatic value
chain. The concept sustainable development is introduced, dissected
and operationalised through practical examples. Principles of
transportation, logistics and supply management will be introduced
in the typical aquatic food chain to provide understanding of how
the flow of material, exchange activities, and related information
are organized, managed and controlled within and between firms.
Different objectives of supply chain management are discussed and
the value of minimizing environmental impact of the operation.
Various tools used in environmental and resource decision-making
are critically examined, such as formal decision analysis,
cost-benefit and cost-effectiveness analysis, life cycle
assessment, life cycle costing, environmental impact assessment,
green SCOR (Supply Chain Operations Reference) assessment,
environmental risk assessment and multi-criteria analysis. 
","describe basic and advanced ideas, theories and concepts of
sustainable development. compose, organize and present sustainability indicators. explain, evaluate and apply common methods used in
environmental and resource analysis as it relates to sustainable
development. Can present interpret, analyze and explain
results. critically synthesize literature, and formulate practical and
theoretical solutions to environment and resource issues as they
relate to sustainable development. describe the processes, functions, flows and players in a
logistics system, the supply chain objectives and performance
indicators. describe and analyse the environmental issues related to
transportation and logistics apply the SCOR model for processes, functions, and flow
descriptions in a logistics system. describe SCM (supply chain management) issues that are
important such as collaboration, use of information technology and
information systems","
The course is linked to recent research on sustainable development
theory and practice and on implementation of novel technologies in
the fish supply chain and presents advanced methods used for real
time monitoring and indicators of quality, safety and traceability.

The topics are: a) sustainability analysis of value chain; b)
Logistics and mapping of activities using the SCOR model; c)
traceability and monitoring of indicators for quality and safety of
products; c) Application of ICT (Information and Communication
Technology) and RFID (Radio frequency identification) technology
for real time monitoring to enhance transparency of the supply
chain; d) Tools for assessment of environmental impacts of
processing and logistics will be examined like Life Cycle Analysis
(LCA) and various indicators like carbon footprint and food miles
for the aquatic food supply chain will be discussed; e) Tools for
assessment of economic and social aspects of processing and
logistics will be examined like cost benefit analysis and decision
analysis; f) tools for assessing simultaneously environmental,
economic and social aspects such as multi-criteria assessment. 
",None,"Guðrún Ólafsdóttir,Charlotte Jacobsen,Gunnar Stefánsson,Brynhildur Davíðsdóttir,Tómas Hafliðason"
,,,,,,,,,,,,
23154 , Safety and Health Effects of Aquatic Food,English , 7.5 ECTS , 2016/2017 ,Fall,MSc,National Food Institute,"
The objective of the course is to provide the students with an
overview of both the potential hazards and the human health
benefits of aquatic food consumption. This course provides students
with key information for risk assessment, risk management (HACCP)
and risk-benefit analysis in relation to aquatic food processing,
packaging, distribution and consumption. 
","Describe basic concepts of aquatic food risk analysis. Apply the HACCP system for safety management of aquatic
food. Describe human health benefits of aquatic food
consumption. Evaluate and compare risks and human health benefits of aquatic
food consumption. Explain human health benefits of specific functional aquatic
food components. Analyse data from databases about aquatic food-borne diseases
outbreaks. Apply predictive microbiology software to evaluate microbiaal
hazards in aquatic foods. Review, analyse and present data in a synthetic
report.","
The course includes e-learning with webinars and it is important
that students have access to Internet and can be reached by e-mail.
The course will allow student to identify hazards and to discuss
how processing, distribution and consumption will influence safety
and health effects of aquatic food. Relevant biological and
chemical hazards in aquatic food are presented including pathogenic
bacteria, viruses, parasites, aquatic biotoxins, histamine/biogenic
amines and industrial and environmental contaminants. Quantitative
microbial ecology, mathematical modelling and software are included
for evaluation and management of hazards during processing and
distribution of aquatic food to the end-consumers. Functional
aquatic food components (omega-3 fatty acids, vitamin D,
proteins/peptides, taurine, selenium, iodine, chitosan,
antioxidants, polysaccharides, macro algae) and their beneficial
human health effects are presented and evaluated in relation to
regulations, health claims and risk benefit analysis. 
",None,"
Paw Dalgaard,Charlotte Jacobsen"
,,,,,,,,,,,,
23205 , Fighting Infectious Diseases,English , 5 ECTS , 2016/2017 ,E4B (Fri 8-12),MSc,National Food Institute,"
Infectious diseases are still one of the leading causes of
morbidity and mortality around the world and cause a significant
economical burden to society. Conventional strategies to fight
infectious diseases, such as the use of antibiotics, are only
partly effective and promote the spread of antibiotic resistance.
Hence, novel approaches for the prevention and treatment of
infectious disease are urgently needed.

In this course you will compare current and novel strategies to
fight infectious diseases. You will gain insight about microbial
adaptation mechanisms and how these can be identified and targeted
using traditional and cutting-edge biomedical approaches. You will
be provided with training in the critical assessment of related
scientific literature, and obtain an understanding of the
individual steps of the scientific research process. You will learn
to design new innovative solutions to fight infectious diseases.

See topics of the course content below. 
","Formulate strategies that contribute to the prevention and
control of infectious diseases Interpret results from selected experiments in the biomedical
area Assess the benefits and risks of contemporary antimicrobial
strategies on human health Evaluate state-of-the-art pathogen and antimicrobial resistance
surveillance Discuss the benefits and risks of recently proposed novel
approaches to fight infectious diseases Present and discuss scientific articles from the biomedical
area Demonstrate critical thinking, as well as give and receive
constructive feedback Propose new research questions and experiments whose findings
could facilitate the development of novel and more sustainable
strategies to fight infectious diseases","
Pathogens, Antibiotics, Antimicrobial resistance, Microbiome in
health and disease, Hygiene, MRSA, Vaccines, Effect of
antimicrobials and other interventions on the microbiome, Drug
discovery, Pathogen and antimicrobial resistance surveillance,
Next-generation sequencing and bioinformatics, Genomics (whole
genome sequencing, metagenomics, 16S rDNA community profiling),
Creativity, Microbial ecology, Biofilms, Antimicrobial treatment,
Probiotics, Bacteriophages, Antimicrobial peptides 
","27322,27026,23258,27022","
Sünje Johanna Pamp,
Frank Møller Aarestrup"
,,,,,,,,,,,,
23258 , General Medical Microbiology,English , 5 ECTS , 2016/2017 ,F1B (Thurs 13-17),MSc,National Food Institute,"
To obtain a basic knowledge of common infectious diseases caused by
bacteria, fungi, vira and parasites allowing the student to
understand pathogenic organisms, the damages they cause, and the
possibilities to treat the infections. During the course, the
student will achieve a terminology and a knowledge, which qualifies
the student to participate in medical microbiology related research
and development. 
","Indicate the connection between pathogenic microorganisms and
their symptoms. Diagnose simple infections. Give an overview of the taxonomy of pathogenic
microorganisms. Explain the virulence factors of pathogenic
microorganisms. Differentiate the action of virulence factors. Propose treatment of simple cases of infection. Propose preventive measures in simple cases of infection. Describe types of antibiotics and how they work. Describe ways of transmission of infections diseases. Develop Scientific and clinical thinking relative to microbial
pathogenesis using a practical approach. Develop innovative thinking by looking into future perspectives
of using microorganisms for biotechnological purposes.","
History of medical microbiology, Epidemiology, the normal flora;
what is an infection? mechanisms of infection. Treating infections:
The immune system, chemotherapy, prophylaxis, antibiotics,
immunization.

The most common infectious diseases (respiratory infections,
gastrointestinal, urinary tract, sexual transmitted disease
infections, etc.), the organisms that cause them (bacteria, fungi,
virus and parasites), transmission of pathogens. Diagnostics.
Bio-terrorism and biological warfare. 
","27051,27002,27008","
Lina Cavaco,
Frank Møller Aarestrup"
,,,,,,,,,,,,
23271 , Risk analysis in food safety,English , 7.5 ECTS , 2016/2017 ,Outside schedule structure,MSc,National Food Institute,"
The course provides a multi-disciplinary approach to risk analysis,
focusing on risk assessment, in food safety.

Course participant will upon completion of the course i) have broad
knowledge of how to perform chemical and microbiological risk
assessment, ii) be able to assess how different data sources can be
used to assess the risk for the consumer, iii) be able to identify
the sources of uncertainties and how these uncertainties are
integrated into or handled in risk assessments, and iv) be able to
interpret results from risk assessments with the purpose of
deciding how risks should be managed. 
","use methods for prioritizing microbiological and chemical
hazards in food construct models describing the path of hazards in the farm to
consumer chain construct mathematical models to estimate the quantitative
change of a hazard in the farm to consumer chain using mathematical models and data to estimate consumers
quantitative exposure to a microorganism when consuming a specific
food item using models and data to estimate consumers quantitative
exposure to a specific chemical substance when consuming a specific
food item utilizing dosis response curves to assess the probability that
consumers become sick given the quantitative exposure to a
foodborne hazard describe the biological mechanisms for how different
microorganisms and chemicals cause adverse health effects in
humans outline different sources of uncertainty in knowledge and how
these uncertainties is integrated in the risk assessment utilise knowledge from animal experiments in the assessment of
human health risk given expsoure to chemicals integrating the effect of natural variation in risk
assessments describe the interrelation between risk assessment and risk
management","
The course provides a multi-disciplinary approach to risk analysis
in food safety, which is widely recognised as the fundamental
methodology that should support the development of food safety
standards. It is a structured, systematic process that examines the
potential adverse health effects consequential to a hazard or
condition of a food and develops options for mitigating that risk.

Risk assessment cases from microbial and chemical food safety will
be the main focus, but risk management and decision making, risk
communication.

The students will select a case (e.g. Listeria in smoked salmon or
lead in fish) on which they will perform a (simple) risk assessment
model and identify the required data. On the basis of the risk
assessment, they will be asked to provide proposals for prevention
and control strategies including. 
",None,"
Håkan Vigre"
,,,,,,,,,,,,
23281 , Preclinical drug development,English , 5 ECTS , 2016/2017 ,Fall and E5A (Wed 8-12),MSc,National Food Institute,"
The overall purpose of this course is to provide the student with a
broad overview of and the ability to understand the various stages
of the preclinical development process. The stages from discovery
to the stage where a drug candidate is selected for clinical trials
will be covered with a main focus on the development phase. The
course will illustrate the process of developing the optimal drug
candidate by combining knowledge on pharmacological, toxicological,
translational issues, biomodelling as well as drug delivery. Focus
will be on development of small molecules as well as
biopharmaceuticals and on many cases from ‘real life’. Such
knowledge is mandatory for the candidate’s ability to interact with
other professionals in multidisciplinary project teams within
pharmaceutical companies. 
","Explain fundamental aspects of preclinical drug
development Understand requirements for entering into clinical trials Understand the principles of selected cases of pharmacological
drug screening and testing Understand the importance of early toxicity testing and the
overall requirements for preclinical toxicological testing Understand the importance and principles of translational
medicine Characterize the differential approaches and challenges of
developing small molecules as opposed to biopharmaceuticals Analyze and present a scientific paper related to drug
development Synthesize a brief report and a presentation about a specific
drug development challenge that demonstrates the above learning
objectives and act as opponent at presentations by other
students","
Drug development is a complex process requiring disciplines ranging
from early target identification and validation through safety and
efficacy testing to market launch. This course will provide the
student with an understanding of the most basic and important
aspects of this process with a focus on preclinical drug
development. Emphasis is put on pharmacology, toxicology,
translational medicine, drug delivery, biostatistical modelling
etc. The course will cover development of small molecules as well
as biopharmaceuticals and will also cover animal-free alternative
ways to predict efficacy and toxicity. Several lectures by
experienced experts from the pharmaceutical industry (Novo,
Lundbeck, LEO Pharma, Genmap) will be given covering
'real-world’ challenges in drug development. The course will
include interactive lectures, presentations by students as well as
team work on a specific drug development challenge. This work will
be presented by each group who will also act as opponent for
another group. 
",None,"
Anne Marie Vinggaard"
,,,,,,,,,,,,
