COURSE NUMBER,COURSE NAME,LANGUAGE OF INSTRUCTION,CREDIT LOAD,YEAR,SCHEDULE,COURSE TYPE,DEPARTMENT,GENERAL COURSE OBJECTIVES,LEARNING OBJECTIVES,CONTENT,RECOMMENDED PREREQUISITES,COURSE RESPONSIBLE
23902 , Introduction to Food,Danish , 5 ECTS , 2016/2017 ,E2B (Thurs 8-12),BEng,National Food Institute,"
The purpose of the course is to make the student acquire:

 - an general knowledge of the Danish food industry

 - a basic knowledge of raw materials used in food production

 - an understanding of various concepts of food quality

 - a basic knowledge of food law.

The student will conduct assessments of open ended food problems
after problem identification and analysis. Both of which should be
carried out based on thorough studies/surveys of literature and
evaluation of sources. 
","describe overall aspects of the Danish food industry describe various aspects of food quality understand food law perform an identification of ill or undefined problems and
conduct literature surveys identify and prioritize problems of general social importance
relating to foods present the results of a survey in written and oral
presentations the student will through participation in own projects acquire
several of the overall learning goals the student will through project presentations and active
discussions acquire all the overall learning goals","
Based on recent food related problems the students are introduced
to constraining, analysing and identifying problems. After
literature studies the social relevance of the problems are
evaluated. Results are presented in reports and orally. Students
are obliged to give critique of the analysis to other groups
participating. The tasks are solved in groups og 3 - 5 students.
Problems can be exemplified by: analysis of the Danish food sector,
labeling and appraisal, food functionality, shelf life and expiry
date, GMO, analysis of outbreaks. 
",None,"
Egon Bech Hansen"
,,,,,,,,,,,,
23921 , Risk analysis and modeling,Danish , 10 ECTS , 2016/2017 ,F1B (Thurs 13-17) and June,BEng,National Food Institute,"
Overall, the student acquires knowledge so they can identify
chemical and microbiological hazards in a food item and assess
where in the production chain it is relevant to intervene against
the risk for the consumer. In addition they should be able to
assess and interpret results from chemical and microbiological risk
assessment conducted in food production and use the results as
support for decision making to improve the safety of a food item.
Especially, they should be able to assess the uncertainties in the
data used for risk assessment.

After the course the participants will be able to use the concept
of risk assessment to design simple models to assess chemical and
microbiological risks in a food item and to conduct simple risk
assessments. 
","analyze food safety related issues in food production and
formulate the questions to be answered by the use of risk
analysis describe the elements of risk analysis and risk assessment identify chemical and microbiological hazards in foods , as
well as how to compare the health impact of different hazards analyze a food product safety based on the concept
farm-to-table-to-consumer conduct a systematic assessment of how different steps in a
production line affects the amount of chemical and microbiological
hazard in food designing sampling so that the results can form the basis for
risk assessment evaluate data from different parts of the production line and
conduct qualitative and quantitative estimates of how much
consumers are exposed to combine data from exposure and hazard's character to assess
the health consequences for consumers - risk characterization analyze uncertainties in the data and how this uncertainty can
be integrated in risk assessment analyze how the uncertainties involved in the decision making
process (risk management) synthesize a written and an oral report of risk analysis discuss the similarities and differences between toxicological
and microbiological risk analysis","
The course will be taught at 6 semester of Diploma in Food Analysis
and is constructed based on CDIO principles (Conceive ( Understand
) , Design , Implement ( Introduce ) and Operate ( Perform ) ) . In
this course, the students work with food safety issues and learn
how to use the various elements within the risk analysis. Based on
a combination of working in small groups, peer-supportive classroom
and industry visits, students must carry out simple risk
assessments in accordance with international guidelines. In the
three week period, students must carry out risk assessments of
simple concrete problems. These risk assessments are reported both
orally and in writing. In addition, students must be able to
identify which data that must be collected in order to assess the
risk for the consumers. The students will work with theoretical
case studies that will be based on food produced in the food
industry, such as smoked salmon and salami. Based on the knowledge
of ingredients and production processes, students must perform an
assessment of food safety for consumers, as well as take an
informed decision about whether and how the product can be made
safer. 
","01907,23961,02593","
Håkan Vigre"
,,,,,,,,,,,,
23923 , Interdisciplinary microbiology,Danish , 12.5 ECTS , 2016/2017 ,E5 (Wed 8-17) and January,BEng,National Food Institute,"General course: The goal of the course is to provide students with a broad knowledge of food-related microorganisms including pathogens (pathogens), those who are corrupting and those used for the fermentation of food. Moreover, the students could use both classical and molecular methods for the characterization of bacteria and gain an understanding of their importance in food and production systems.","A student who has met the objectives of the course will be able to:
Explain the most relevant pathogens and fordærvelses bacteria in food
Selecting lactic acid bacteria for fermentation, and to describe the principles behind the fermentation of various food
Knowledge of mold growth and characterization of these
Low dilutions of the bacterial cultures, plating, and calculate the number of bacteria
Formulate procedures for sterile and safely laboratory work
Report its results and disseminating the results,
ComBase use the computer program to calculate the lag-phase of bacteria and growth rate
Explain the principles of classical microbial detection
Explain the principles of selected molecular biological detection
Explain the different preservation methods for microbial growth
Select and apply microbiological methods for identification of microorganisms in food","In this 3rd semester course is taught in relevant microorganisms with a focus on food. The spectrum of different microorganisms covers: 1) pathogenic bacteria, 2) spoilage bacteria, 3) used microorganisms such as lactic acid bacteria, 4) non-bacterial organisms such as fungi, human viruses and bacteriophages and their impact on food production. The course will provide a basic knowledge of microorganisms in general and make the students capable of safely handling pathogens associated with laboratory work and food. Identification of microorganisms is fundamentally and the course will provide a thorough knowledge of both classical microbial and molecular detection methods, where the principles behind the method is to be understood in order to make it / the right analysis. In addition, the use of, for example, lactic acid bacteria for fermentation is illuminated and the associated principles and metabolisms. During the course the students themselves produce fermented foods and make relevant microbiological analysis and physical measurements. Reports are prepared on selected laboratory tests containing relevant literature and background, as well as trained in oral communication. Since this course is interdisciplinary there will also be no cooperation with the other courses in the 3rd semester.",None,"
Tina Birk,
Lars Bogø Jensen"
,,,,,,,,,,,,
23932 , Biological Chemistry,Danish , 7.5 ECTS , 2016/2017 ,"E3A (Tues 8-12) and E4A (Tues 13-17)  or  F4 (Tues 13-17, Fri 8-12)",BEng,National Food Institute,"
The students should based on the cell acquire a basic understanding
of biological processes. Consequently, the students will acquire
knowledge about the cell structure, their biological functions,
biochemical, molecular and biotechnological processes. With this
background the students should be able to discuss present
biotechnological problems. Through a practical/theoretical
assignment the students are introduced to working in a laboratory,
and to the basic techniques in microbiology, molecular biology and
biochemistry. The practical/theoretical assignment also aims to
teach the students more about linkages between theory and practice
and should enable the students to convey and communicate a
biological issue. 
","Describe the spatial, logistic, and structural organization of
the living cell as well as the overall mechanisms and chemical
structures behind its function. Describe the overall structure, function and regulation of
enzymes, and explain how several enzymes together can form a
metabolic pathway. Explain how carbohydrates can be broken down by living cells,
and the chemical energy transformed into ATP bound energy during
both respiration and fermentation. Describe the antiparallel double helical structure of DNA; its
replication and chromosomal organization in pro- and eukaryotes; as
well as the bacterial cell division and eukaryotic meiosis and
mitosis. Explain the initiation, elongation, and termination processes
during transcription and translation in pro- and eukaryotes. Describe mechanisms for regulation of gene expression. Explain the mechanisms for prokaryotic transfer of genetic
material and how a virus reproduces itself by the use of the host
reproductive system. Describe the basal terms in Mendelian genetics. Describe how recombinant DNA technology can be utilized to
manipulate living cells. Perform the most basic techniques and working procedures within
microbiology, biochemistry and molecular biology, and explain the
principles of these techniques. Convey and communicate about biological issues and understand
the relationship between theory and practice of simple biological
issues.","
The cell as basic biological unit: structure, function, metabolism,
growth, reproduction, heredity and biodiversity. The theory covers:
structure of amino acids and proteins, nucleotides and nucleic
acids, carbohydrates and lipids. Enzymes: structure, reactions,
inhibition. Dynamic biochemistry: cata- and anabolism together with
regulation of metabolism, redox processes and energy metabolism.
Synthesis of macromolecules of information: DNA and RNA, protein.
Regulation of activities in the cell e.g. synthesis of
macromolecules, responses to external stimuli. Mutation and
mutagenesis. Genetic processes in pro- and eukaryotes. Gene
technology. Examples will be given where basic biological
definitions are used in present and future biotechnology.
Laboratory exercises supporting the theoretical content. By working
with a theoretical and practical assignment, presentation and
communication within this technical field is trained. 
","26171,26173","
Peter Ruhdal Jensen,
Christian Solem"
,,,,,,,,,,,,
23935 , Food Chemistry and chemical analysis,Danish , 15 ECTS , 2016/2017 ,F5 (Wed 8-17) and June,BEng,National Food Institute,"One of course is meant to give students knowledge of food main components including macro- and micro-nutrients and food contaminants and their impact on food quality and safety. At the same time, the course aims to provide participants with a basic knowledge of analytical chemistry used in the food area. The course focuses on qualitative and quantitative techniques based on chromatography. Principles of quality assurance for chemical analysis introduced both in theory and practice. The students' ability to report its results and relate chemical analysis results to problems in the food industry developed both in writing and in speech.","A student who has met the objectives of the course will be able to:
Describe the food main chemical constituents and typical contaminants.
Understand the main components influence each food structure and quality.
Explain the principles of the most common sample preparation methods.
Explain the principles of separation of fluid (LC) and gas chromatography (GC)
Describe the general principles behind the common detection methods including optical spectroscopy, mass spectrometry, atomspektroskopi and IR spectrometry.
Explain the importance of the various steps in trace analysis
Perform calculations for quantitative determinations
Evaluate analysis results and report them briefly, clearly and unambiguously (in writing).
Applying tools from quality assurance of analytical methods
Explain technical chemical issues orally","Many important decisions in society, including in the food industry, will be taken in light of analytical data, both in terms of quality, safety and health. Analytical data may contain information about the contaminants in food, process monitoring or nutrient declarations. This course will through lectures and group work with case studies introduce food chemical and analytical issues that make the student able to evaluate analytical methods and use data produced. Work on the different tasks and report shall briefly clarify the outcome of the analytical problem. The course introduces food main components ie solids / water, carbohydrates, proteins, fats, vitamins and minerals as well as selected food components important for food security. The lectures are supplemented with task bills to provide an overview of analytical methods such as sample preparation, extraction, chromatography, and the various detection methods and quality assurance. The course emphasizes data processing via examples and supporting exercises. General principles for assessing the quality of a food would also be affected. 
In 3-week period created a practical laboratory project where a report based on the latest technical analysis and data processing, supplemented by a small literature study. Oral presentation of the report conducted on the last course day in the 3-week period.","26171,23932","
Lene Duedahl-Olesen,
Jørn Smedsgaard"
,,,,,,,,,,,,
23951 , Applied statistical process control and quality management,Danish , 5 ECTS , 2016/2017 ,F2B (Thurs 8-12),BEng,National Food Institute,The course aims to provide students with high-level proficiency in data driven methods and systems for process and quality control in relation to both food production as food analysis.,"A student who has met the objectives of the course will be able to:
Explain GxP concepts
Establish an uncertainty budget and calculate the individual contribution
Assess possibilities for optimization based on uncertainty budgets
Explain why the sampling gives rise to an error and to identify sources of this
Plan an effective method for sampling in a given situation
Outline a method for the prediction of uncertainty in sampling
Recommending suitable on-line and at-line monitoring methods (justified)
Construct a multivariate calibration model
Explain the idea of ​​and the use of process control cards
Deciding a system for statistical process control
",GxP principles. Setting Up and Using uncertainty budget for analyzes and processes. Uncertainty caused by sampling and handling of such uncertainty. On-line and at-line measuring methodology. Multivariate methods for use in measuring methodology and statistical process control. Statistical process control and process control systems.,"23961,02593","
Bo Munk Jørgensen"
,,,,,,,,,,,,
23962 ," Food Production, Raw Materials and Hygiene",Danish , 5 ECTS , 2016/2017 ,E2B (Thurs 8-12),BEng,National Food Institute,"
Teaching only in Danish 
",Teaching mainly in Danish Teaching mainly in Danish Teaching mainly in Danish Teaching mainly in Danish Teaching mainly in Danish Teaching mainly in Danish Teaching mainly in Danish Teaching mainly in Danish Teaching mainly in Danish Teaching mainly in Danish,"
Teaching only in Danish 
",,"
Jens Kirk Andersen"
,,,,,,,,,,,,
23981 , Toxicology,Danish , 5 ECTS , 2016/2017 ,E1B (Thurs 13-17),BEng,National Food Institute,"
Toxicology is the science of poisons. The purpose of the course is
to give students an understanding of how chemicals in foods affect
the body. In this course, students will work with the various
toxicological requirements for assessment of different groups of
substances (additives, pesticides, veterinary drugs, process
contaminants, both natural and anthropogenic contaminants). 
","Display mechanism for the development of cancer Analyse health effects of different chemical substances Select the data (animal experiments, epidemiological studies,
in vitro experiments and alternatives to animal testing) that can
be used to examine the health effects of chemical substances Analyse different types of uncertainties in toxicological
data Derive ethical considerations in the use of animal testing Analyse how reproductive damage can be induced by chemical
agents Apply the importance of different routes of exposure to
substances Select information and compile a summary","
Our food contains chemicals on a large scale. Chemical substances
in food may come from different sources. Either as added
(intentional and unintentional) substances or contaminants (natural
and anthropogenic). In addition, we take supplements where there is
insufficient knowledge about the health effects. Ethical
considerations will be included, especially in relation to the use
of animals for testing of chemicals. The importance of different
routes of exposure will be illustrated. The students will work with
different types of toxicological studies. A tour of the
department's animal facility will be included where the
students will have the opportunity to see the various organs of a
rat. There will be assignments on different toxicological issues. 
",None,"
Max Hansen,
Anoop Kumar Sharma"
