COURSE NUMBER,COURSE NAME,LANGUAGE OF INSTRUCTION,CREDIT LOAD,YEAR,SCHEDULE,COURSE TYPE,DEPARTMENT,GENERAL COURSE OBJECTIVES,LEARNING OBJECTIVES,CONTENT,RECOMMENDED PREREQUISITES,COURSE RESPONSIBLE
23301 , Practical Chemical Food Safety,English , 5 ECTS , 2016/2017 ,January,MSc,National Food Institute,"
The objective is to give the students an introduction to assess
chemical food safety by introducing the different contaminants and
their sources, detection of contaminants, chemical risk assessment
and legislation. The course provides the basis for evaluation of
analytical data by applying quality control parameters, analytical
chemistry and statistical analysis on own data. Laboratory work for
assignment and report writing are required. 
","Apply approaches to food contaminant legislation in chemical
analysis Apply principles of risk based control Describe and consider strategies of sampling Explain the general principles and application areas of applied
analytical techniques (LC, GC, MS) Construct and apply own data for riskanalysis Discuss and apply requirements for quality assurance in
chemical food control Apply statistical analysis to chemical analytical data and
evaluate the statistical analysis as a point of food safety Discuss data from analytical reports and their use in quality
assurance Construct a report on own data that demonstrate attainment of
the learning objectives above Present and explain selected results and subjects from the
report orally","
For both, research, control and food production good valid
analytical results are very important. Practical chemical food
safety includes aspects of chemical analysis and control of
unwanted chemicals in food and add skills to e.g. food production
staff to be able to evaluate the validity of analytical data from
third parties. Sample preparation includes fat soluble as well as
water soluble components and the techniques applied. Before
analysis of food samples separation from other food components are
often necessary and include extraction (e.g. PLE, sonication,
ultra-thurrax) and clean-up (e.g. GPC, SPE). Application of
statistic approachs for sampling and method optimisation are
likewise important skills for engineers and will be applied on own
data. For detection of chemical contaminants many analytical
techniques (e.g. GC-ECD, GC-MS, LC-MS, ICP-MS) are applied for
detection of both organic and inorganic food contaminants.
Principles and examples of the analytical techniques will be
presented together with risk based sampling and food control
programs. Also, legislation and requirement of chemical control,
including method validation and basic requirement of accredited
analysis are important skills to obtain to be able to evaluate
data. 
",23102,"
Lene Duedahl-Olesen,
Rie Romme Rasmussen"
,,,,,,,,,,,,
23302 , Food Chemistry,English , 5 ECTS , 2016/2017 ,F3A (Tues 8-12),MSc,National Food Institute,"
The course will give the student the ability to evaluate the
composition of basic food items from a food quality perspective.
They should also be able to describe chemical reactions of food
component and their importance for food quality i.e. fat, protein
and carbohydrate. The course enable the students to evaluate
selected food matrices (e.g. meat, fish, cereals, vegetables)
chemical stability and effects of processing and storage on these
matrices. 
","Identify the components present in basic food items and
classify them Describe chemical reactions of importance for food quality Relate selected processing and preservation techniques to
chemical reactions in food Evaluate chemical deterioration of food items Discuss the chemical aspects of food quality Identify important chemical reactions for the food quality of
selected food items Make a concise written scientific report on a selected food
item Present and extract the most important results from the report
orally","
The course will consist of some general description of fat
(omega-3, omega-6, trans fat, saturated fat), carbohydrate
(monosaccharide, polysaccharide) and protein (amino acids,
peptides, proteins)and their reactions (e.g. Maillard reaction) in
relation to food quality and food quality deterioration. In
addition, classical preservation techniques including
sterilisation, pasteurisation, freezing, cooling, curing and
antioxidant strategies will be presented. Their advantages and
their disadvantages will be presented and how they impact food
quality. The most common chemical and physical process in food
leading to quality deterioration will be introduced. Presentation
of scientific data will be tried when presenting scientific
manuscripts. A short introduction to nutrition and sensory
evaluation will be included. 
","27002,23932","
Lene Duedahl-Olesen"
,,,,,,,,,,,,
23511 , Food Production Engineering Basics,English , 10 ECTS , 2016/2017 ,"E4 (Tues 13-17, Fri 8-12) and E5 (Wed 8-17)",MSc,National Food Institute,"
The course gives the students a substantial theoretical knowledge
of food technology with basis in asessing physical properties of
food products including their rheology and texture. Particular
emphasis is on theories and basic engineering calculations for
assessing composition and processing times for central unit
processes in food production, including heating and cooling of
solid food, freezing, salting and drying. Furthermore, the course
gives the students sufficient knowledge about food microbiology and
food safety to be able to integrate this knowledge in evaluating
the results of calculations of food processes. 
","Analyse a description of a food production process, set up the
flow sheet and estimate mass and energy balances. Calculate the composition and physical properties of food
products relevant to their processing. Understand different modes of heat and mass transfer, calculate
and use relevant dimensionless numbers for heat transfer
calculations in the stirred vessel and in solids heated/cooled by
convection. Calculate heating and cooling times. Apply knowledge about food microbiology, food safety, and
microbial inactivation kinetics in calculation of food preservation
processes. Understand freezing processes for foods and calculate freezing
times. Understand and calculate drying and salting processes for
foods. Describe standard equipment for key operations in food
processing and calculate their critical dimensions and process
variables. Calculate parameters for separation methods like membrane
filtration. Understand the difference between Newtonian and Non-Newtonian
flow properties and understand principles of basic
viscosimetry. Understand visco-elastic behaviour of foods and apply texture
measurements on solid food.","
Flow sheets, calculation of composition and physical properties of
foods, Newtonian and Non-Newtonian fluid dynamics, steady-state
heat transfer, unsteady-state heat transfer in the stirred vessel
and in solids heated by convection, basic microbial ecology and
safety of foods, calculation of microbial inactivation and
F-values, calculation of freezing times and of salting and drying
processes, calculation of separation parameters. 
",None,"
Bo Munk Jørgensen,
Brais Martinez Lopez"
,,,,,,,,,,,,
23512 , Food Production Engineering Basics (condensed),English , 5 ECTS , 2016/2017 ,July,MSc,National Food Institute,"
The course gives the students a substantial theoretical knowledge
of food technology with basis in asessing physical properties of
food products. Particular emphasis is on theories and basic
engineering calculations for assessing composition, mass balances
and processing times for central unit processes in food production,
including heating and cooling of solid food, freezing, and drying.
Furthermore, the course gives the students sufficient knowledge
about food microbiology and food safety to be able to integrate
this knowledge in evaluating the results of calculations on food
processes. 
","Analyse a description of a food production process, set up the
flow sheet and estimate mass and energy balances. Calculate the composition and physical properties of food
products relevant to their processing. Understand different modes of heat and mass transfer,
calculation and use of relevant dimensionless numbers for heat
transfer calculations in a stirred vessel and in solids
heated/cooled by convection. Calculate heating and cooling times. Apply knowledge about food microbiology, food safety, and
microbial inactivation kinetics in calculation of food preservation
processes. Understand freezing processes and calculate freezing times for
food products. Understand and calculate drying and salting processes for
foods. Calculate parameters for separation processes like membrane
filtration.","
Flow sheets, calculation of composition and physical properties of
foods, steady-state heat transfer, unsteady-state heat transfer in
the stirred vessel and in solids heated by convection, basic
microbial safety of foods, calculation of microbial inactivation
and F-values, calculation of freezing times and drying processes,
calculation of separation parameters. 
",None,"
Bo Munk Jørgensen,
Brais Martinez Lopez"
,,,,,,,,,,,,
23520 , Food Process Design,English , 10 ECTS , 2016/2017 ,F4A (Tues 13-17) and F4B (Fri 8-12),MSc,National Food Institute,"
To enable the students to dimension and plan food processing
plants. The focus is on the understanding and modelling of the
interaction between resources (inclusive the raw material) and the
process, and the influence of processing on end product quality. 
","Apply flow-sheeting tools to gain an overview over material and
energy streams through a production plant. Analyse a complex production plant and identify its basic unit
operations and other process steps. Identify interactions between product attributes and process
parameters to gain knowledge on process operation and product
quality. Understand and identify quality parameters. Apply and evaluate different tools for process control and
optimization of process / production. Perform process calculations including economical
considerations concerning capital and running costs. Validate calculations and assumptions in relation to food
production. Dimensioning of equipment for use in industrial food
production. Design and evaluate a food processing plant. Write a technical report in groups based on a case related to
the food industry. Present and discuss the process design considerations
orally.","
The course focuses on the production of both solid and liquid
foods. The course will apply knowledge of process technology (mass
and heat transfer, fluid mechanics, and unit operations) in the
calculations, process simulation, dimensioning and modeling of food
processing plants. The curriculum focuses on planning of food
production systems, identification of key interactions between
manufacturing processes and product characteristics, requirements
of the food industry, interactions in process systems, process
optimization and application of quality control. The individual
topics are illustrated with examples in the form of tasks - both
practical and theoretical - as well as case studies. There will be
guest lectures and company visits will be arranged. 
","23011,23710,23711","
Aberham Hailu Feyissa"
,,,,,,,,,,,,
23521 , Hygienic design in the food industry,English , 5 ECTS , 2016/2017 ,E2B (Thurs 8-12),MSc,National Food Institute,"
Enable the students to evaluate and design processing facilities
and equipment for food production and preparation, which meet
legislative requirements as well as standards and guidelines for
hygienic design. 
","Understand and apply legislation, standards, guidelines incl.
certifications concerning hygienic design and food contact
materials in EU Evaluate hygienic design aspects of construction materials,
surface characteristics and equipment design details in regards to
cleanability Analyze hygienic design of processing equipment in both open
and closed systems Apply criteria of hygienic design to identify cases where the
relevant legislation has been violated Examine hygienic design of processing plants, the rooms where
the processing takes place and placement of equipment Develop conceptual re-designs of process equipment and
processing lines based on information about construction materials,
maintenance and cleaning procedures Select suitable materials (stainless steel and polymers) and
post treatments of materials to implement hygienic design Identify potential corrosive environments in the food industry
and recognize corrosion failures commonly seen in the food
industry Design proper cleaning and disinfection procedures for specific
soils and process types and explain the effect of basic types of
detergents and sanitizers Apply procedures in employee personal hygiene and pest
control","
The objective of hygienic design of processing equipment and unit
operations is to ensure high quality and safe food products,
optimal processing times and total runtime of a process line.

The course will deal with design of processing equipment and
process lines from the hygienic design point of view with respect
to material choices and structures based on existing laws, rules,
norms and guidelines. The following are examples of topics which
will be covered in the course:

• Legislation and guidelines for hygienic design,

• Good and inappropriate equipment designs in both open and closed
processing systems,

• Methods to characterize surface structures (topology) and to test
equipment cleanability,

• The impact of construction materials and structures on the
hygienic quality, e.g., cleanability of surfaces (stainless steel,
weldings, polymers and elastomers),

• Corrosion types seen in the food industry and overview of
material types most commonly used,

• Efficiency of cleaning agents and cleaning methods including
fluid flows,

• Hygienic considerations in the construction of a food processing
plant including site selection, product flow and hygiene in
processing. 
",None,"
Lisbeth Truelstrup Hansen,
Ioannis S. Chronakis"
,,,,,,,,,,,,
23522 , Rheology of food and biological materials,English , 5 ECTS , 2016/2017 ,January,MSc,National Food Institute,"
To enable the students to understand the theoretical background for
structure and rheology of liquid and solid materials. Furthermore
the students shall be able to apply a wide range og experimental
techniques to determine physical attributes of foods and
biomaterials. 
","explain the theoretcial backround for rheology and structure of
liquid, semi-solids and solids explain the application of rheological models make quantitative calculations to determine rheological models
and utilse the associated theory use common rheological measuring techniques and understand the
applicability of these explain rheological data utilising relevant theory plan and conduct relevant rheological experiments to uncover
rheological and structural attributes analyse and qualify experimental data from relevant rheological
measuring methods explain similarities and differences in products using
rheological data and theory","
Theory: flow properties of non-newtonian liquids, elasticity of
liquids, semi-solid and solid materials, physical foundation and
rheological matematical models.

Measuring techniques: rotational rheometers,capillary rheometers,
texture analyser, mikroskopi, extrusion rheology, measurement of
particle size and related simpler methods.

Planning and condution of experiments to explain differences and
similarities between a range of comparable products.

Intrepretaion of data and presentation of condensed conclusions. 
",None,"
Ioannis S. Chronakis,
Peter Szabo"
,,,,,,,,,,,,
23531 , Entrepreneurship in Food,English , 5 ECTS , 2016/2017 ,August,MSc,National Food Institute,"
The aim of the course is for students to develop their
entrepreneurial skills and competences by working with a defined
idea (case story) and by identifying the right business case with
clear market share and finally develop a ready-to-go business plan.
All case stories will be related to the food sector but can be
based on ingredients, equipment design, raw material, or new values
in food production. 
","Understand the special entrepreneurial challenges in the food
sector Identify business opportunities Develop business models Analyze markets for knowledge based products and services Set up questionnaires and interview customers Analyze customer value proposition Plan the establishment of a company (Business planning) Determine capital requirements Establish cash flow projection Establish budgets on profit/loss, assets/liabilities Specify management competence profiles Prepare a business plan","
The course will consist of lectures on entrepreneurship and
presentation of cases throughout the course. Simultaneously,
Students will work in groups (e.g. containing a student from each
of the participating universities and/or an international student
to maximize competences within business, engineering and science,
and thereby utilize knowledge from this diverse group of students)
on a project about how to make the case story, the group has been
assigned, into a new business opportunity. The product of the group
is a report including a (in the form of a) business plan based on
the case story. Students will be introduced to the basic concepts
of entrepreneurship and business development with emphasis on the
distinctive features of the food industry, market shares and
possible use of food technologies. Guest lecturers from industry
and academia will provide inspiration for the project work
developing the business plan on the case stories. Moreover, for
initiating the project work a general introduction to the nature
and basis behind the assigned case story will be provided to each
group, enabling you to fully understand the aspects of your case.
Finally, case owners and teachers will be available for discussing
the relevant technical and business issues of the case. 
",,"
Dorte Wiene,
Timothy John Hobley,Nanna Viereck"
,,,,,,,,,,,,
23532 , Beer brewing and quality control course,English , 5 ECTS , 2016/2017 ,June,MSc,National Food Institute,"
The aim of the course is to give students basic practical
competencies in beer brewing and in producing beer in accordance
with the EU and Danish HACCP based regulations for safe food
production. After this course you should be able to brew beer and
to construct the HACCP based documentation portfolio necessary to
apply for approval to start food production in Denmark and the EU.
Training in team work and giving presentations. 
","Explain the purpose of the different parts of a brewing
process Prepare beer wort and ferment it to beer Perform standard analyses during beer production Explain the different parts of a HACCP based quality control
programme in a microbrewery Be conversant with the EU and Danish rules and regulations on
safe food production Use and modify a simple HACCP based quality control programme
for a microbrewery Create a HACCP based quality control programme for a
microbrewery Identify deficiencies in a quality control programme and
suggest solutions Defend their work practices and quality control programme in an
oral presentation","
In the course, you will be introduced to the basic concepts of beer
brewing and then conduct experiments in the lab and / or pilot
plant microbrewery. You will work in small groups practically with
the whole beer brewing process from milling the grain, mashing,
lautering and boiling of the wort followed by fermentation and
maturation, you will document this and the relevant analyses and
write this up as the first report. As you progress through the
different aspects of the beer brewing process, you will be
introduced to the EU and Danish rules on HACCP based safe food
production. You will work with the HACCP based quality control
procedures (egenkontrol) that are in force in the DTU-microbrewery,
which is approved for beer production by the Danish authorities and
has a Danish ‘smiley’. Subsequently you will be given the task of
constructing a HACCP based quality control document set suitable
for submitting to the authorities for starting beer production,
which will be the second report. The course will be completed by an
oral presentation and exam. Guest lecturers from industry and
academia will be used to provide examples and inspiration. 
",None,"
Timothy John Hobley"
,,,,,,,,,,,,
23551 , Predictive Food Microbiology,English , 5 ECTS , 2016/2017 ,January,MSc,National Food Institute,"
The course provides the students with an overview of the
quantitative microbial ecology of food and detailed insight in the
development and validation of predictive food microbiology models.
The aim is to enable students to understand the potential and the
limitations of predictive food microbiology models and their use in
assessment and management of microbiological quality and safety of
food. 
","Describe environmental parameters in food and their
quantitative effect on microbial responses. Obtain relevant information from databases and literature on
microbial responses in food. Characterise microbial kinetics in food by appropriate
mathematical models. Select appropriate deterministic or stochastic models for
microbial responses in food. Develop a predictive microbiology model of relevant complexity
for a specific food. Evaluate the performance of predictive microbiology models for
specific microorganism/food combinations. Understand the use of predictive microbiology models in
quantitative microbiological risk assessment and in risk and
quality management. Review, analyse and present predictive food microbiology data
in a synthetic report.","
The course is based on lectures and computer exercises to explain
the development of predictive food microbiology models. The
students use this information in their project work to develop
and/or evaluate a predictive microbiology model for a selected
microorganism/food combination. The course will allow student to
predict microbial responses in food including effects of
processing, product characteristics and conditions of storage and
distribution to the consumer. Mathematical models to predict growth
or inactivation and the effect of constant or dynamic product
characteristics and storage conditions are presented. Predictive
models for the growth boundary of human pathogens are described
together with their application for development of new food
products and recipes. Data and methods to evaluate predictive
models and criteria for their validation are important and part of
the course. Software for development and application of
deterministic and stochastic predictive models are presented in
relation to assessment and management of microbial food quality and
safety. 
",,"
Paw Dalgaard,
Ole Mejlholm"
,,,,,,,,,,,,
23552 , Development of innovative future food: Ecotrophelia and Blue Dot course,English , 5 ECTS , 2016/2017 ,F1A (Mon 8-12),MSc,National Food Institute,"
The students should develop an innovative sustainable food or drink
product in groups of 3 to 6 students. The innovative part can be
the concept, the technology, the recipe and/or the packaging. This
product should then be entered in the Danish Ecotrophelia
competition. 
","Develop their own innovative sustainable food or drinks product
by systematic idea generation and to make the product in small
pilot scale Evaluate and report the characteristics of the product and the
shelf life with regards to safety and quality of the product and
nutritional properties Implement creative processes where new food products will be
developed and to report on the development process Design the large scale production of the developed product Conceive the implementation of the developed product in the
existing food production industry Develop strategies for implementation and launching of new food
products Conceive and design suitable packaging material for new food
products with regards to chemical, biological and sensory
qualities Analyse the market potential for new developed products and
furthermore to decide about customer segment Develop a simple business plan for the product","
This is a practical, hands-on course in which you build on
competences obtained in other courses in order to invent a new and
innovative sustainable food or drinks product in a small group (3-6
students) and produce it in small pilot scale and use it to take
part in the Danish Ecotrophelia competition. The product should
therefore fulfill the formal requirements as set out by
Ecotrophelia
(https:/​/​www.ecotrophelia.eu/​).
The course may contain significant extra-curricular work and effort
and to be rewarded for this, successfull completion of the course
will elicit a DTU-Blue Dot diploma. There will be limited formal
teaching and the course will be run with the teachers acting in a
supervisory and mentoring role. It is thus highly reccomended that
you have had course 23101, 23564, 23531 and 23532, but if in doubt
about your qualifications, contact the course responsible. The
product development is based on the team’s own idea, but you are
encouraged to work further on product concepts developed in other
courses, such as 23564 ór 23101.The students will prepare a
launching strategy for the product based on a market survey and
make a business plan for the production, implementation and
marketing of the developed product. The project will lead to a
product description and a report including description of
production, implementation and sale of the product. 
","23532,23564,23101,23531","
Timothy John Hobley"
,,,,,,,,,,,,
